source,feed_url,headline,summary,url,published_date,topics
Phys.org,https://phys.org/rss-feed/,ShadowCam search casts doubt on abundant lunar ice,"New observations by a team of US astronomers have cast fresh doubt on whether the lunar surface could host abundant water ice. Publishing their results in Science Advances, a team led by Shuai Li at the University of Hawaii at Manoa has shown that relatively pure ice (making up more than about 20–30% of the surface material) is likely absent from the moon's permanently shadowed regions.",https://phys.org/news/2026-03-shadowcam-abundant-lunar-ice.html,2026-03-20 19:20:03+00:00,Other
TechCrunch,https://techcrunch.com/feed/,"Amid legal turmoil, Kalshi is temporarily banned in Nevada",It's the latest escalation in a regulatory battle over the future of prediction markets.,https://techcrunch.com/2026/03/20/amidst-legal-turmoil-kalshi-is-temporarily-banned-in-nevada/,2026-03-20 19:15:55+00:00,Other
Phys.org,https://phys.org/rss-feed/,What 'Project Hail Mary' gets right—and wrong—about astrophysics,"""Project Hail Mary,"" the Ryan Gosling-led adaptation of the best-selling sci-fi novel from Andy Weir, is being praised for putting the science in science fiction. Although aliens, sun-draining microorganisms and galaxy-spanning spaceflight are all a part of the story of a scientist sent on a suicide mission to save Earth, the film and its source material are not afraid to delve into the kind of astrophysics that would make most people's heads spin.",https://phys.org/news/2026-03-hail-mary-wrong-astrophysics.html,2026-03-20 19:10:07+00:00,Science
TechCrunch,https://techcrunch.com/feed/,Pinterest CEO calls on governments to ban social media for users under 16,"Pinterest’s chief compares social media to tobacco and alcohol, saying children need similar protections.",https://techcrunch.com/2026/03/20/pinterest-ceo-calls-on-governments-to-ban-social-media-for-users-under-16/,2026-03-20 19:01:54+00:00,Other
Phys.org,https://phys.org/rss-feed/,"Microbes make microplastics more likely to form ice in clouds, research reveals","Tiny pieces of plastic, called microplastics, are showing up everywhere, even in the water in clouds, rain, and snow—and they may be affecting our weather and temperatures. A study published in Environmental Science & Technology and led by Hosein Foroutan, associate professor of civil and environmental engineering, found that microbes living on microplastics dramatically boost their ability to trigger ice formation in clouds.",https://phys.org/news/2026-03-microbes-microplastics-ice-clouds-reveals.html,2026-03-20 19:00:01+00:00,Science
Defense News,https://www.defensenews.com/arc/outboundfeeds/rss/,Two suspected Iranian spies reportedly arrested near UK submarine base,"Two suspected Iranian spies have been arrested after attempting to enter Britain’s nuclear submarine base in Scotland, the Sun newspaper reported.",https://www.defensenews.com/global/europe/2026/03/20/two-suspected-iranian-spies-reportedly-arrested-near-uk-submarine-base/,2026-03-20 18:51:42+00:00,Other
Phys.org,https://phys.org/rss-feed/,"Rivers and tidal currents keep 80% of microfibers from reaching oceans, study suggests","Every time we do a load of laundry, tiny fibers of polyester escape from our clothes and slip down the drain. These microfibers, so small they can be invisible to the naked eye, are among the most common forms of microplastic in the ocean. Yet, new research published in Journal of Geophysical Research: Oceans shows that most of them may not make it that far.",https://phys.org/news/2026-03-rivers-tidal-currents-microfibers-oceans.html,2026-03-20 18:40:01+00:00,Science
SpaceNews,https://spacenews.com/feed/,OHB Sweden wins €248 million contract to build EPS-Sterna constellation,OHB Sweden has won a record contract for Sweden’s space sector to build 20 satellites to boost Europe’s weather forecasting and climate monitoring capabilities. The post OHB Sweden wins €248 million contract to build EPS-Sterna constellation appeared first on SpaceNews .,https://spacenews.com/ohb-sweden-wins-e248-million-contract-to-build-eps-sterna-constellation/,2026-03-20 18:28:40+00:00,Space
TechCrunch,https://techcrunch.com/feed/,Why scientists can’t get a laugh,"Humor is hard to pull off in front of a cold audience, full stop.",https://techcrunch.com/2026/03/20/why-scientists-cant-get-a-laugh/,2026-03-20 17:39:06+00:00,Science
C4ISRNET,https://www.c4isrnet.com/arc/outboundfeeds/rss/,Ukraine deploys units to 5 Middle East countries to intercept drones,"Zelenskyy has said Kyiv wants money and tech in return for its help in the Middle East, adding that the U.S. was among the nations that sought Kyiv’s help.",https://www.c4isrnet.com/global/mideast-africa/2026/03/20/ukraine-deploys-units-to-5-middle-east-countries-to-intercept-drones/,2026-03-20 17:37:48+00:00,Other
TechCrunch,https://techcrunch.com/feed/,A French Navy officer accidentally leaked the location of an aircraft carrier by logging his run on Strava,"A French naval officer went on a run around the deck of the Charles de Gaulle aircraft carrier, inadvertently leaking the warship's location when he uploaded the workout to Strava.",https://techcrunch.com/2026/03/20/a-french-navy-officer-accidentally-leaked-the-location-of-an-aircraft-carrier-by-logging-his-run-on-strava/,2026-03-20 17:21:18+00:00,Defense
Breaking Defense,https://breakingdefense.com/feed/,Space Force shifts GPS III launch from ULA to SpaceX,The shift follows Vulcan&#8217;s February grounding under the National Security Space Launch program to resolve persistent problems with its solid rocket boosters.,https://breakingdefense.com/2026/03/space-force-shifts-gps-iii-launch-from-ula-to-spacex/,2026-03-20 17:05:00+00:00,Defense
TechCrunch,https://techcrunch.com/feed/,"WordPress.com now lets AI agents write and publish posts, and more",New AI agents on WordPress.com could lower barriers to publishing while increasing machine-generated content across the web.,https://techcrunch.com/2026/03/20/wordpress-com-now-lets-ai-agents-write-and-publish-posts-and-more/,2026-03-20 16:43:09+00:00,Other
Breaking Defense,https://breakingdefense.com/feed/,"Answering the demand signal to move faster, field sooner, iterate continuously","[Sponsored] As threats rapidly evolve, digital engineering, manufacturing capacity and robust supply chains are critical to meeting challenges.",https://breakingdefense.com/2026/03/answering-the-demand-signal-to-move-faster-field-sooner-iterate-continuously/,2026-03-20 16:31:42+00:00,Other
TechCrunch,https://techcrunch.com/feed/,Jeff Bezos’ Blue Origin enters the space data center game,"""Project Sunrise"" would include more than 50,000 satellites performing high-energy compute on orbit.",https://techcrunch.com/2026/03/20/jeff-bezos-blue-origin-enters-the-space-data-center-game/,2026-03-20 16:27:43+00:00,Space
TechCrunch,https://techcrunch.com/feed/,US accuses Iran’s government of operating hacktivist group that hacked Stryker,"The U.S. Justice Department said an Iranian security ministry operates the fake activist persona known as Handala, which claimed responsibility for the destructive hack targeting medical tech giant Stryker.",https://techcrunch.com/2026/03/20/u-s-accuses-irans-government-of-operating-hacktivist-group-that-hacked-stryker/,2026-03-20 16:18:57+00:00,Other
TechCrunch,https://techcrunch.com/feed/,"Trump’s AI framework targets state laws, shifts child safety burden to parents","Trump’s AI framework pushes federal preemption of state laws, emphasizes innovation, and shifts responsibility for child safety toward parents while laying out lighter-touch rules for tech companies.",https://techcrunch.com/2026/03/20/trumps-ai-framework-targets-state-laws-shifts-child-safety-burden-to-parents/,2026-03-20 16:14:04+00:00,Other
EU-Startups,https://www.eu-startups.com/feed/,Weekly funding round-up! All of the European startup funding rounds we tracked this week (Mar.16-20),"This article is visible for CLUB members only. If you are already a member but don’t see the content of this article, please login here. If you’re not a CLUB member yet, but you’d like to read members-only content like this one, have unrestricted access to the site and benefit from many additional perks, you [&#8230;] The post Weekly funding round-up! All of the European startup funding rounds we tracked this week (Mar.16-20) appeared first on EU-Startups .",https://www.eu-startups.com/2026/03/weekly-funding-round-up-all-of-the-european-startup-funding-rounds-we-tracked-this-week-mar-16-20/,2026-03-20 16:05:40+00:00,"Startups, Funding"
TechCrunch,https://techcrunch.com/feed/,"AI startups are eating the venture industry and the returns, so far, are good",AI startups accounted for 41% of the $128 billion in venture dollars raised by companies on Carta last year — a record-high annual share.,https://techcrunch.com/2026/03/20/ai-startups-are-eating-the-venture-industry-and-the-returns-so-far-are-good/,2026-03-20 15:41:21+00:00,"Startups, Funding"
Breaking Defense,https://breakingdefense.com/feed/,Israel’s Elbit reveals military contract to put high-powered laser weapon on aircraft,"CEO Bezhalel Machlis revealed the 2025 contract during an investor meeting, while acknowledging the challenges of putting such precise tech in the sky.",https://breakingdefense.com/2026/03/israels-elbit-reveals-military-contract-to-put-high-powered-laser-weapon-on-aircraft/,2026-03-20 15:32:00+00:00,"Defense, Funding"
TechCrunch,https://techcrunch.com/feed/,Cyberattack on vehicle breathalyzer company leaves drivers stranded across the US,A cyberattack on a U.S. car breathalyzer company has left drivers across the United States reportedly stranded and unable to start their vehicles.,https://techcrunch.com/2026/03/20/cyberattack-on-vehicle-breathalyzer-company-leaves-drivers-stranded-across-the-us/,2026-03-20 15:01:39+00:00,Other
TechCrunch,https://techcrunch.com/feed/,"Amazon working on new smartphone with Alexa at its core, report says","The device is being developed by the company's Devices and Services division, and it would feature personalized features aimed at making it easier to use Amazon's suite of apps, including Amazon shopping, Prime Video, and Prime Music, according to Reuters.",https://techcrunch.com/2026/03/20/amazon-working-on-new-smartphone-with-alexa-at-its-core-report-says/,2026-03-20 14:51:30+00:00,Other
Defense News,https://www.defensenews.com/arc/outboundfeeds/rss/,"Texelis, Scata team up on medium-heavy vehicle that can do drone defense","The 18-ton vehicle, named the MK1, was developed in less than a year and is envisioned as a multirole platform incorporating lessons from the Ukraine war.",https://www.defensenews.com/global/europe/2026/03/20/texelis-scata-team-up-on-medium-heavy-vehicle-that-can-do-drone-defense/,2026-03-20 14:35:17+00:00,Defense
War on the Rocks,https://warontherocks.com/feed/,Conflict and Consequences,"Welcome to The Adversarial.&#160;Every other week, we&#8217;ll provide you with expert analysis on America&#8217;s greatest challengers: China, Russia, Iran, North Korea, and jihadists. Read more below.***IranOn March 17, Israel announced &#8212; and Tehran later confirmed &#8212; the killing of Ali Larijani, the secretary of Iran&#8217;s Supreme National Security Council. If eliminating Ali Khamenei on the opening day of the U.S.-Israeli offensive struck down the regime&#8217;s supreme leader, Larijani&#8217;s death removes its supreme coordinator. A longtime fixture in the regime, Larijani appears to have been serving as the regime&#8217;s majordomo in recent months &#8212; and especially since Khamenei&#8217;s death on Feb. The post Conflict and Consequences appeared first on War on the Rocks .",https://warontherocks.com/2026/03/conflict-and-consequences/,2026-03-20 14:00:04+00:00,Defense
Labiotech,https://www.labiotech.eu/feed/,"After the drought, biotech IPO activity begins to pick up in 2026","After several years of IPO drought in the biotech industry, the public market is picking up again. Will the trend keep going in 2026? The post After the drought, biotech IPO activity begins to pick up in 2026 appeared first on Labiotech.eu . © Labiotech UG and Labiotech.eu. Unauthorized use and/or duplication of this material without express and written permission from this site’s author and/or owner is strictly prohibited. Excerpts and links may be used, provided that full and clear credit is given to Labiotech UG and Labiotech.eu with appropriate and specific direction to the original content.",https://www.labiotech.eu/trends-news/biotech-ipo-2026/,2026-03-20 14:00:00+00:00,Biotech
Breaking Defense,https://breakingdefense.com/feed/,India seeking to join European sixth-generation fighter program: Reports,"One defense analyst said that at this stage, it may be difficult for either the GCAP or FCAS teams to take on new development partners.",https://breakingdefense.com/2026/03/india-seeking-to-join-european-sixth-generation-fighter-program-reports/,2026-03-20 13:52:18+00:00,Defense
C4ISRNET,https://www.c4isrnet.com/arc/outboundfeeds/rss/,Marines test ‘cruise control’ swim feature on amphibious vehicle prototype,The vehicles vying to replace the Marine Corps’ aging light armored vehicle fleet swam for the first time earlier this year.,https://www.c4isrnet.com/news/your-military/2026/03/20/marines-test-cruise-control-swim-feature-on-amphibious-vehicle-prototype/,2026-03-20 13:51:08+00:00,Other
C4ISRNET,https://www.c4isrnet.com/arc/outboundfeeds/rss/,"Marine lance corporal develops $10 solution to $5,600 antenna problem","The junior Marine's innovation has so far saved an estimated $600,000 and eliminated years of supply delays. Motivation intensifies.",https://www.c4isrnet.com/news/your-military/2026/03/20/marine-lance-corporal-develops-10-solution-to-5600-antenna-problem/,2026-03-20 13:32:21+00:00,Other
Breaking Defense,https://breakingdefense.com/feed/,"What is the Pentagon’s ‘Space Data Network,’ and why does it matter for Golden Dome?",The SDN will provide the communications pathways for integrating and moving data from missile warning/tracking sensors to interceptors in near-real time under the Golden Dome construct.,https://breakingdefense.com/2026/03/what-is-the-pentagons-space-data-network-and-why-does-it-matter-for-golden-dome/,2026-03-20 13:26:31+00:00,Defense
MIT Technology Review,https://www.technologyreview.com/feed/,"The Download: OpenAI is building a fully automated researcher, and a psychedelic trial blind spot","This is today&#8217;s edition of The Download, our weekday newsletter that provides a daily dose of what&#8217;s going on in the world of technology. OpenAI is throwing everything into building a fully automated researcher&#160; OpenAI has a new grand challenge: building an AI researcher—a fully automated agent-based system capable of tackling large, complex problems by&#8230;",https://www.technologyreview.com/2026/03/20/1134448/the-download-openai-building-fully-automated-researcher-psychedelic-drug-trial/,2026-03-20 13:15:45+00:00,AI
SpaceNews,https://spacenews.com/feed/,Holistic space observation: the shift from SSA to SDA,"Recent reporting on SpaceX’s proposal to deploy up to one million satellites in low Earth orbit — paired with a vision of AI-enabled, autonomous orbital infrastructure — marks a decisive moment for the space community. Regardless of whether these numbers ultimately materialize, the direction is unmistakable: space is moving toward unprecedented scale, autonomy and strategic [&#8230;] The post Holistic space observation: the shift from SSA to SDA appeared first on SpaceNews .",https://spacenews.com/holistic-space-observation-the-shift-from-ssa-to-sda/,2026-03-20 13:00:00+00:00,Space
EU-Startups,https://www.eu-startups.com/feed/,LemFi Co-founder and CEO Ridwan Olalere joins the EU-Startups Summit 2026 in Malta!,"We are pleased to announce that Ridwan Olalere, Co-founder and CEO of LemFi, a fintech company building a financial services platform that enables immigrants to send, spend, and manage money seamlessly across borders, will join the speaker line-up at the EU-Startups Summit 2026 on May 7-8 in sunny Malta. Under Ridwan&#8217;s leadership, LemFi has grown [&#8230;] The post LemFi Co-founder and CEO Ridwan Olalere joins the EU-Startups Summit 2026 in Malta! appeared first on EU-Startups .",https://www.eu-startups.com/2026/03/lemfi-co-founder-and-ceo-ridwan-olalere-joins-the-eu-startups-summit-2026-in-malta/,2026-03-20 12:59:53+00:00,Startups
Payload Space,https://payloadspace.com/feed/,Kayhan Space Launches Satcat Terminal,Business and liberal arts majors rejoice! The post Kayhan Space Launches Satcat Terminal appeared first on Payload .,https://payloadspace.com/kayhan-space-launches-satcat-terminal/,2026-03-20 12:59:41+00:00,Other
SpaceNews,https://spacenews.com/feed/,ESA to fly dedicated Crew Dragon mission to ISS,The European Space Agency plans to charter a SpaceX Crew Dragon mission to the International Space Station to give more flight opportunities for its astronauts. The post ESA to fly dedicated Crew Dragon mission to ISS appeared first on SpaceNews .,https://spacenews.com/esa-to-fly-dedicated-crew-dragon-mission-to-iss/,2026-03-20 12:18:38+00:00,Other
Science,https://www.science.org/rss/news_current.xml,Microscopic spikes on snakeskin block bacterial buildup,Structures on python scales could inspire chemical-free antimicrobial designs,https://www.science.org/content/article/microscopic-spikes-snakeskin-block-bacterial-buildup,2026-03-20 12:15:00+00:00,Other
Defense News,https://www.defensenews.com/arc/outboundfeeds/rss/,"Oil prices, fear of Trump? China mysteriously reduced warplane activity near Taiwan",Analysts are puzzled by a recent decrease in Chinese warplane sorties toward Taiwan.,https://www.defensenews.com/global/asia-pacific/2026/03/20/oil-prices-fear-of-trump-china-mysteriously-reduced-warplane-activity-near-taiwan/,2026-03-20 12:00:18+00:00,Other
TechCrunch,https://techcrunch.com/feed/,The best AI investment might be in energy tech,Power has become one of the biggest bottlenecks in rolling out new AI data centers. That's creating an opening for investors.,https://techcrunch.com/2026/03/20/the-best-ai-investment-might-be-in-energy-tech/,2026-03-20 12:00:00+00:00,Funding
MIT Technology Review,https://www.technologyreview.com/feed/,OpenAI is throwing everything into building a fully automated researcher,"OpenAI is refocusing its research efforts and throwing its resources into a new grand challenge. The San Francisco firm has set its sights on building what it calls an AI researcher, a fully automated agent-based system that will be able to go off and tackle large, complex problems by itself. ​​OpenAI says that this new&#8230;",https://www.technologyreview.com/2026/03/20/1134438/openai-is-throwing-everything-into-building-a-fully-automated-researcher/,2026-03-20 11:57:16+00:00,"AI, Science"
EU-Startups,https://www.eu-startups.com/feed/,"EU Inc. under the microscope: founders, VCs and lawyers weigh in","Two days ago, the European Commission unveiled one of its most anticipated initiatives for the startup ecosystem: EU Inc., a unified corporate framework designed to simplify how companies are created, operated, and scaled across the bloc. Positioned as the foundation of a broader “28th regime”, the proposal aims to tackle one of Europe’s most persistent [&#8230;] The post EU Inc. under the microscope: founders, VCs and lawyers weigh in appeared first on EU-Startups .",https://www.eu-startups.com/2026/03/eu-inc-under-the-microscope-founders-vcs-and-lawyers-weigh-in/,2026-03-20 11:50:46+00:00,Startups
Science,https://www.science.org/rss/news_current.xml,First science from private Moon lander challenges lunar divide,Blue Ghost data suggest NASA’s growing commercial Moon program can deliver results,https://www.science.org/content/article/first-science-private-moon-lander-challenges-lunar-divide,2026-03-20 11:45:00+00:00,Other
EU-Startups,https://www.eu-startups.com/feed/,UK’s Flexzo AI raises €10.3 million to transform healthcare workforce management with agentic AI,"Flexzo AI, a UK-based startup providing an agentic AI workforce system for healthcare providers, today announced the completion of a €10.3 million ($12 million) Series A funding round to support ongoing adoption across NHS Trusts and accelerate growth in the United States. The round was led by Octopus Ventures, with participation from Fuel Ventures. Uthish [&#8230;] The post UK’s Flexzo AI raises €10.3 million to transform healthcare workforce management with agentic AI appeared first on EU-Startups .",https://www.eu-startups.com/2026/03/uks-flexzo-ai-raises-e10-3-million-to-transform-healthcare-workforce-management-with-agentic-ai/,2026-03-20 11:40:44+00:00,"Funding, Startups"
TechCrunch,https://techcrunch.com/feed/,These AI notetaking devices can help you record and transcribe your meetings,These physical notetakers transcribe audio and give users summaries and action items of meetings using AI. Some even offer live translation.,https://techcrunch.com/2026/03/20/ai-notetaker-hardware-devices-pins-pendants-record-transcribe/,2026-03-20 11:31:38+00:00,Other
Breaking Defense,https://breakingdefense.com/feed/,Air Force counter-drone lab requests ideas to track and kill small UAS,Two new Air Force RFIs seek information on systems to detect drones and defeat them with hard-kill systems as the service looks to shore up base defense.,https://breakingdefense.com/2026/03/air-force-counter-drone-lab-requests-ideas-to-track-and-kill-small-uas/,2026-03-20 11:29:00+00:00,Defense
Science,https://www.science.org/rss/news_current.xml,"Energy Department merges nuclear and particle physics programs, unsettling researchers","In spite of synergies, physicists worry both fields are being sidelined in favor of AI",https://www.science.org/content/article/energy-department-merges-nuclear-and-particle-physics-programs-unsettling-researchers,2026-03-20 11:25:00+00:00,Science
SpaceNews,https://spacenews.com/feed/,"Kayhan targets investors, insurers with expanded orbital intelligence platform","Kayhan Space is branching out from providing orbital intelligence used to coordinate satellite fleets with a new software platform that turns that data into business insights for investors and insurers. The post Kayhan targets investors, insurers with expanded orbital intelligence platform appeared first on SpaceNews .",https://spacenews.com/kayhan-targets-investors-insurers-with-expanded-orbital-intelligence-platform/,2026-03-20 11:00:00+00:00,"Space, Funding"
EU-Startups,https://www.eu-startups.com/feed/,Why “Maybe” is killing your startup,"It feels good to have a lot of open options, right? That’s why we don’t fully commit to our decisions. We hire someone that we think is OK, but not fully what we were looking for, because maybe it’ll work out. Maybe that investor will be the one who gets our company off the ground. [&#8230;] The post Why “Maybe” is killing your startup appeared first on EU-Startups .",https://www.eu-startups.com/2026/03/why-maybe-is-killing-your-startup/,2026-03-20 10:53:13+00:00,"Startups, Funding"
Defense News,https://www.defensenews.com/arc/outboundfeeds/rss/,Japan’s new ‘ugly duckling’ electronic-warfare aircraft takes to the sky,"With Japan ramping up its electronic-warfare spending, the question is how many of the planes the nation will ultimately want.",https://www.defensenews.com/global/asia-pacific/2026/03/20/japans-new-ugly-duckling-electronic-warfare-aircraft-takes-to-the-sky/,2026-03-20 10:26:37+00:00,Defense
EU-Startups,https://www.eu-startups.com/feed/,Dutch AgTech startup BBLeap secures €5 million to scale precision spraying technology globally,"BBLeap, a Netherlands-based AgTech startup specialising in high-precision spraying technology, has closed a €5 million investment round. The round was led by new investors ESquare Capital and Yield Lab Europe, alongside existing shareholders, including the founders and early investors Brabant Development Agency (BOM) and Beheermaatschappij Vriend. “I have always said that BBLeap will become a [&#8230;] The post Dutch AgTech startup BBLeap secures €5 million to scale precision spraying technology globally appeared first on EU-Startups .",https://www.eu-startups.com/2026/03/dutch-agtech-startup-bbleap-secures-e5-million-to-scale-precision-spraying-technology-globally/,2026-03-20 09:22:22+00:00,"Startups, Funding"
Labiotech,https://www.labiotech.eu/feed/,How Leyden Labs is revolutionizing flu protection with its intranasal antibody spray,"Today we welcome Koenraad Wiedhaup, Co-Founder and CEO of Leyden Labs, and Clarissa Koch, the company's Chief Scientific Officer. The post How Leyden Labs is revolutionizing flu protection with its intranasal antibody spray appeared first on Labiotech.eu . © Labiotech UG and Labiotech.eu. Unauthorized use and/or duplication of this material without express and written permission from this site’s author and/or owner is strictly prohibited. Excerpts and links may be used, provided that full and clear credit is given to Labiotech UG and Labiotech.eu with appropriate and specific direction to the original content.",https://www.labiotech.eu/podcast/how-leyden-labs-is-revolutionizing-flu-protection-with-its-intranasal-antibody-spray/,2026-03-20 09:00:00+00:00,"Biotech, Startups"
