source,feed_url,headline,summary,url,published_date,topics
Defense News,https://www.defensenews.com/arc/outboundfeeds/rss/,A-10 Warthogs target Iranian fast-attack craft in Strait of Hormuz,The A-10’s deployment in Operation Epic Fury comes as Congress has moved to protect it from Air Force divestment efforts.,https://www.defensenews.com/news/your-air-force/2026/03/19/a-10-warthogs-target-iranian-fast-attack-craft-in-strait-of-hormuz/,2026-03-19 15:32:43+00:00,Defense
Satellite Today,https://www.satellitetoday.com/feed/,Ukraine Ambassador to UK Talks Future Warfare,"At a recent event at Chatham House in the U.K, the Ukrainian ambassador to the U.K. spoke four years after Russia’s invasion talking about the future of warfare. Valerii Zaluzhnyi... The post Ukraine Ambassador to UK Talks Future Warfare appeared first on Via Satellite .",https://www.satellitetoday.com/government-military/2026/03/19/ukraine-ambassador-to-uk-talks-future-warfare/,2026-03-19 14:28:31+00:00,Defense
Breaking Defense,https://breakingdefense.com/feed/,"Hegseth confirms potential $200 billion request for Iran operations, but figure ‘could move’","“Obviously it takes … money to kill bad guys so we&#8217;re going back to Congress and folks there to ensure that we&#8217;re properly funded for what&#8217;s been done, for what we may have to do in the future,” said US Defense Secretary Pete Hegseth.",https://breakingdefense.com/2026/03/hegseth-confirms-potential-200-billion-request-for-iran-operations-but-figure-could-move/,2026-03-19 14:16:37+00:00,Defense
Defense News,https://www.defensenews.com/arc/outboundfeeds/rss/,German navy wants stock frigates from TKMS as fallback for troubled F126 warship,Defense officials in Berlin are worried about coming up empty-handed when NATO submarine-hunting capability commitments come due later this decade.,https://www.defensenews.com/global/europe/2026/03/19/german-navy-wants-stock-frigates-from-tkms-as-fallback-for-troubled-f126-warship/,2026-03-19 13:59:10+00:00,Defense
Breaking Defense,https://breakingdefense.com/feed/,Italy’s Leonardo closes on $1.9B Iveco land vehicle acquisition,"Leonardo said “available cash resources” will finance the acquisition, which is also planned to leverage “the complementary nature of the two companies’ sales networks.&#8221;",https://breakingdefense.com/2026/03/italys-leonardo-closes-on-1-9b-iveco-land-vehicle-acquisition/,2026-03-19 13:55:24+00:00,Other
Breaking Defense,https://breakingdefense.com/feed/,Building partnerships as part of Saudi Arabia’s Vision 2030,[Sponsored] The kingdom&#8217;s aggressive growth strategy will rely in part on outside investment.,https://breakingdefense.com/2026/03/building-partnerships-as-part-of-saudi-arabias-vision-2030/,2026-03-19 13:51:18+00:00,Funding
EU-Startups,https://www.eu-startups.com/feed/,French startup Cleavr raises €1 million to automate accounts receivable workflows with AI,"Paris-based Cleavr, an AI collaborator capable of assisting finance teams across the entire collection cycle, has raised €1 million to accelerate deployment in France and prepare for European expansion starting in 2026. The round was supported by investments from Kima Ventures, Better Angle, Raphaël Nahum (CFO of Pennylane), Régis Samuel (CEO of MyUnisoft), and Olivier [&#8230;] The post French startup Cleavr raises €1 million to automate accounts receivable workflows with AI appeared first on EU-Startups .",https://www.eu-startups.com/2026/03/french-startup-cleavr-raises-e1-million-to-automate-accounts-receivable-workflows-with-ai/,2026-03-19 13:01:00+00:00,"Startups, Funding"
MIT Technology Review,https://www.technologyreview.com/feed/,"The Download: Quantum computing for health, and why the world doesn’t recycle more nuclear waste","This is today&#8217;s edition of The Download, our weekday newsletter that provides a daily dose of what&#8217;s going on in the world of technology. A $5 million prize awaits proof that quantum computers can solve health care problems&#160; In a laboratory on the outskirts of Oxford, a quantum computer built from atoms and light awaits&#8230;",https://www.technologyreview.com/2026/03/19/1134413/the-download-quantum-computing-health-recycling-nuclear-waste/,2026-03-19 12:17:02+00:00,Science
SpaceNews,https://spacenews.com/feed/,NASA considering sharp increase in robotic lunar landings,"NASA is proposing a sharp increase in the rate of robotic lunar lander missions, a move that has excited but also puzzled the space community. The post NASA considering sharp increase in robotic lunar landings appeared first on SpaceNews .",https://spacenews.com/nasa-considering-sharp-increase-in-robotic-lunar-landings/,2026-03-19 12:10:34+00:00,Other
SpaceNews,https://spacenews.com/feed/,ReOrbit sells two small GEO satellites to SLI,Finnish satellite manufacturer ReOrbit has signed a contract with asset-financing company SLI for two small geostationary orbit communications satellites. The post ReOrbit sells two small GEO satellites to SLI appeared first on SpaceNews .,https://spacenews.com/reorbit-sells-two-small-geo-satellites-to-sli/,2026-03-19 12:00:00+00:00,"Space, Funding"
