source,feed_url,headline,summary,url,published_date,topics
MIT Technology Review,https://www.technologyreview.com/feed/,Mind-altering substances are (still) falling short in clinical trials,"This week I want to look at where we are with psychedelics, the mind-altering substances that have somehow made the leap from counterculture to major focus of clinical research. Compounds like psilocybin—which is found in magic mushrooms—are being explored for all sorts of health applications, including treatments for depression, PTSD, addiction, and even obesity. Over&#8230;",https://www.technologyreview.com/2026/03/20/1134419/psychedelics-overhyped-psilocybin-depression-placebo/,2026-03-20 09:00:00+00:00,"Biotech, Science"
EU-Startups,https://www.eu-startups.com/feed/,EIC Accelerator company SunOyster Systems signs deal with Galp for the installation of lightweight PV modules,"The EIC Corporate Partnership Programme connects Europe’s most innovative startups with leading corporations to turn breakthrough technologies into concrete business collaborations. Within this framework, EIC-backed company SunOyster Systems, a pioneering SME in advanced solar technologies based in Germany, partnered with Galp, Portugal’s leading energy company. After a rigorous selection and dedicated preparation, they participated in the [&#8230;] The post EIC Accelerator company SunOyster Systems signs deal with Galp for the installation of lightweight PV modules appeared first on EU-Startups .",https://www.eu-startups.com/2026/03/eic-accelerator-company-sunoyster-systems-signs-deal-with-galp-for-the-installation-of-lightweight-pv-modules/,2026-03-20 08:14:07+00:00,"Startups, Science"
War on the Rocks,https://warontherocks.com/feed/,What It Was Like to Be Under Incoming Fire from the War on Terror to Today,"On this special, crossover episode of our members-only armed services podcasts, some of our hosts sat down to discuss their experiences with indirect fire and bombardment. With the ongoing conflict in the Middle East, they rehash some of their own personal stories, provide context on today&#8217;s threat environment, and share some advice for troops both downrange and at home.Image: Sgt. Albert Juarez via DVIDS The post What It Was Like to Be Under Incoming Fire from the War on Terror to Today appeared first on War on the Rocks .",https://warontherocks.com/2026/03/indirect-fire-in-the-global-war-on-terror-and-today/,2026-03-20 08:00:59+00:00,Other
War on the Rocks,https://warontherocks.com/feed/,Why Did the United States Lift Sanctions on Assad’s Chemical Weapons Scientists?,"On June 30, 2025, as part of the process of normalizing relations with Damascus following the overthrow of Syrian President Bashar al-Assad, the Trump administration overhauled the sanctions imposed on Syria to facilitate the rebuilding of that war-ravaged country. In the course of revising these sanctions, however, 266 employees of the Scientific Studies and Research Center, the heart of the Assad regime&#8217;s chemical weapons complex, were removed without explanation from the U.S. Department of the Treasury&#8217;s Specially Designated Nationals List. This list is a compilation of human rights abusers, proliferators, terrorists, drug lords, and others deemed a threat to U.S. The post Why Did the United States Lift Sanctions on Assad’s Chemical Weapons Scientists? appeared first on War on the Rocks .",https://warontherocks.com/2026/03/why-did-the-united-states-lift-sanctions-on-assads-chemical-weapons-scientists/,2026-03-20 07:30:51+00:00,Science
War on the Rocks,https://warontherocks.com/feed/,What the Donroe Doctrine Could Mean for China’s Economic Statecraft,"In the first few months of 2026, the Trump administration has embarked on military interventions in Iran and Venezuela and threatened possible annexation of Greenland. Meanwhile, German Chancellor Friedrich Merz&#8217;s February trip to Beijing followed on the heels of the first state visit to China by a British leader in eight years. As the United States and China prepare for their much-touted summit in late March, Beijing is weighing its options in the face of recent American actions and the new &#8220;Donroe Doctrine.&#8221;Chinese foreign policy remains driven by the core priorities of preserving regime security and consolidating influence in its The post What the Donroe Doctrine Could Mean for China’s Economic Statecraft appeared first on War on the Rocks .",https://warontherocks.com/2026/03/what-the-donroe-doctrine-could-mean-for-chinas-economic-statecraft/,2026-03-20 07:15:59+00:00,Defense
EU-Startups,https://www.eu-startups.com/feed/,Warsaw’s Montis VC hits €50 million first close for new fund focused on AI-driven energy and industrial innovation,"Warsaw-based investment firm Montis VC has launched a new venture capital fund, securing €50 million at first close to back Europe’s next generation of energy and IndustrialTech startups. The fund is backed by a mix of public and private investors supporting technological development across Europe. One of the key limited partners is the European Investment [&#8230;] The post Warsaw’s Montis VC hits €50 million first close for new fund focused on AI-driven energy and industrial innovation appeared first on EU-Startups .",https://www.eu-startups.com/2026/03/warsaws-montis-vc-hits-e50-million-first-close-for-new-fund-focused-on-ai-driven-energy-and-industrial-innovation/,2026-03-20 07:00:36+00:00,"Funding, Startups"
EU-Startups,https://www.eu-startups.com/feed/,"Amazon acquires Zurich-based Rivr, developer of stair-climbing robots for doorstep delivery","Rivr, a Zurich-based robotics startup developing autonomous stair-climbing legged robots for doorstep delivery, has been acquired by Amazon. The terms of this deal have not been disclosed. Marko Bjelonic, CEO and co-founder of RIVR, shared this news through his LinkedIn post. “This step will accelerate our vision of building General Physical AI through doorstep delivery, [&#8230;] The post Amazon acquires Zurich-based Rivr, developer of stair-climbing robots for doorstep delivery appeared first on EU-Startups .",https://www.eu-startups.com/2026/03/amazon-acquires-zurich-based-rivr-developer-of-stair-climbing-robots-for-doorstep-delivery/,2026-03-20 06:21:02+00:00,Startups
Payload Space,https://payloadspace.com/feed/,Inside Austria’s Small But Mighty Space Ecosystem,"Austria's space industry is in the midst of a renaissance, with bigger funding deals and more startup activity. The post Inside Austria’s Small But Mighty Space Ecosystem appeared first on Payload .",https://payloadspace.com/inside-austrias-small-but-mighty-space-ecosystem/,2026-03-20 05:40:00+00:00,"Startups, Funding"
Science,https://www.science.org/rss/news_current.xml,Hormone linked to morning sickness may help reduce alcohol intake,"GDF15, which is thought to contribute to nausea during pregnancy, may keep our drinking in check, researchers propose",https://www.science.org/content/article/hormone-linked-morning-sickness-may-help-reduce-alcohol-intake,2026-03-20 02:15:00+00:00,Science
Nature,https://www.nature.com/subjects/medical-research.rss,Macrophages recruited by implanted fibrin gels promote regeneration of injured lymphatic vessels,,https://www.nature.com/articles/s41598-026-39167-2,2026-03-20 00:00:00+00:00,Other
Nature,https://www.nature.com/subjects/medical-research.rss,Macroscopic polarimetric discrimination and quantification of antiangiogenic effect of AGRO aptamer and GK1 peptide in a preclinical melanoma model,,https://www.nature.com/articles/s41598-026-44959-7,2026-03-20 00:00:00+00:00,Other
Nature,https://www.nature.com/subjects/medical-research.rss,Trends in over- and under-screening for cervical cancer after EMR implementation in rural China,,https://www.nature.com/articles/s41746-026-02504-w,2026-03-20 00:00:00+00:00,Other
Nature,https://www.nature.com/subjects/medical-research.rss,"Hospital follow-up adherence among screen-positive lung cancer utilizing a mobile LDCT in community in Hainan, China: a prospective cohort study",,https://www.nature.com/articles/s41533-026-00481-x,2026-03-20 00:00:00+00:00,Science
Nature,https://www.nature.com/subjects/medical-research.rss,Author Correction: Wiskott–Aldrich syndrome protein (WASP) is a tumor suppressor in T cell lymphoma,,https://www.nature.com/articles/s41591-026-04339-0,2026-03-20 00:00:00+00:00,Other
Nature,https://www.nature.com/subjects/medical-research.rss,Pacemaker implantation is associated with post-ablation atrial fibrillation recurrence mediated by plasma CILP1,,https://www.nature.com/articles/s41598-026-44907-5,2026-03-20 00:00:00+00:00,Other
Nature,https://www.nature.com/subjects/medical-research.rss,Diagnostic and prognostic value of serum miR-155 in chronic obstructive pulmonary disease,,https://www.nature.com/articles/s41598-026-44741-9,2026-03-20 00:00:00+00:00,MedTech
Nature,https://www.nature.com/subjects/medical-research.rss,Fixel-based analysis reveals whole-brain white matter microstructural alterations in axial spondyloarthritis,,https://www.nature.com/articles/s41598-026-45157-1,2026-03-20 00:00:00+00:00,Other
Nature,https://www.nature.com/subjects/medical-research.rss,Exploration of the usage of dental composite resin and the perception of its potential implications in forensic odontology among Lebanese dentists,,https://www.nature.com/articles/s41598-026-44975-7,2026-03-20 00:00:00+00:00,Other
Nature,https://www.nature.com/subjects/medical-research.rss,Lipid alterations and endothelial dysfunction are associated with multiple sclerosis pathophysiology,,https://www.nature.com/articles/s41598-026-44767-z,2026-03-20 00:00:00+00:00,Other
Nature,https://www.nature.com/subjects/medical-research.rss,Long-term dynamic effect of body mass index on adverse cardiovascular outcomes with targeted maximum likelihood estimation method: result from the KNOW-CKD study,,https://www.nature.com/articles/s41598-026-45135-7,2026-03-20 00:00:00+00:00,Science
Nature,https://www.nature.com/subjects/medical-research.rss,Near work affects ocular higher order aberrations in children—a longitudinal study before and after COVID-19: The Tokyo Myopia Study,,https://www.nature.com/articles/s41598-026-44635-w,2026-03-20 00:00:00+00:00,Science
Nature,https://www.nature.com/subjects/medical-research.rss,Collagen-specific molecular chaperone Hsp47 in inguinal white adipose tissue promotes high-fat diet-induced inflammatory gene expression in male mice,,https://www.nature.com/articles/s41598-026-45003-4,2026-03-20 00:00:00+00:00,Other
Nature,https://www.nature.com/subjects/medical-research.rss,"Modified letrozole vs GnRH antagonist protocols in ovarian aging women for IVF: an open-label, multicenter, randomized controlled trial",,https://www.nature.com/articles/s41467-026-70964-5,2026-03-20 00:00:00+00:00,Other
Nature,https://www.nature.com/subjects/medical-research.rss,The DAG/PKC/CREB1/TGF-β1 axis drives shear-wave elastography stiffness and malignant progression in triple-negative breast cancer via lipid metabolic reprogramming,,https://www.nature.com/articles/s41419-026-08625-0,2026-03-20 00:00:00+00:00,Other
Defense News,https://www.defensenews.com/arc/outboundfeeds/rss/,The case for the US Army to procure the KNDS RCH 155 howitzer,The U.S. Army faces a critical modernization crossroads in field artillery. The KNDS RCH 155 offers a transformative answer.,https://www.defensenews.com/opinion/2026/03/20/the-case-for-the-us-army-to-procure-the-knds-rch-155-howitzer/,2026-03-20 00:00:00+00:00,Defense
Nature,https://www.nature.com/subjects/medical-research.rss,"Disease burden and associated factors among caregivers of children with congenital heart disease at tertiary hospitals in Addis Ababa, Ethiopia",,https://www.nature.com/articles/s41598-026-44249-2,2026-03-20 00:00:00+00:00,Other
Nature,https://www.nature.com/subjects/medical-research.rss,Finite element analysis of sacral fixation strategies for fragility fractures of the pelvis,,https://www.nature.com/articles/s41598-026-45149-1,2026-03-20 00:00:00+00:00,Other
Defense News,https://www.defensenews.com/arc/outboundfeeds/rss/,High-speed combat drone production starts at new US Anduril plant in days,Anduril Industries will begin building its new loyal wingman drones in the coming days at a new facility in Ohio.,https://www.defensenews.com/unmanned/2026/03/19/high-speed-combat-drone-production-starts-at-new-us-anduril-plant-in-days/,2026-03-19 23:46:00+00:00,Defense
SpaceNews,https://spacenews.com/feed/,Blue Origin joins the orbital data center race,"Blue Origin is the latest company to propose an orbital data center system, filing plans for a constellation of up to 51,600 satellites. The post Blue Origin joins the orbital data center race appeared first on SpaceNews .",https://spacenews.com/blue-origin-joins-the-orbital-data-center-race/,2026-03-19 23:30:09+00:00,Space
TechCrunch,https://techcrunch.com/feed/,"Amazon acquires Rivr, maker of a stair-climbing delivery robot",Amazon and Jeff Bezos had previously invested in the startup. The deal signals the e-commerce giant's interest in doorstep delivery.,https://techcrunch.com/2026/03/19/amazon-acquires-rivr-maker-of-a-stair-climbing-delivery-robot/,2026-03-19 23:28:37+00:00,Startups
C4ISRNET,https://www.c4isrnet.com/arc/outboundfeeds/rss/,Apache helicopter shoots down drones in Europe for first time in combat exercise,U.S. soldiers used Apache helicopters to pursue and attack drones in an air-to-air combat training exercise this week.,https://www.c4isrnet.com/news/your-military/2026/03/19/apache-helicopter-shoots-down-drones-in-europe-for-first-time-in-combat-exercise/,2026-03-19 22:43:19+00:00,Other
Defense News,https://www.defensenews.com/arc/outboundfeeds/rss/,"Two US counter-mine ships based in the Middle East are now in Singapore, Navy says","The USS Santa Barbara and USS Tulsa, which are homeported in Bahrain, arrived in Singapore this week.",https://www.defensenews.com/news/your-navy/2026/03/19/two-us-counter-mine-ships-based-in-the-middle-east-are-now-in-singapore-navy-says/,2026-03-19 22:34:57+00:00,Defense
TechCrunch,https://techcrunch.com/feed/,Jeff Bezos reportedly wants $100 billion to buy and transform old manufacturing firms with AI,The Amazon magnate has a new project centered around acquiring industrial firms and revamping them with AI technology.,https://techcrunch.com/2026/03/19/jeff-bezos-reportedly-wants-100-billion-to-buy-and-transform-old-manufacturing-firms-with-ai/,2026-03-19 22:09:24+00:00,Other
TechCrunch,https://techcrunch.com/feed/,Employees had to restrain a dancing humanoid robot after it went wild at a California restaurant,A dancing robot in a Haidilao hot pot restaurant boogied down a little too hard.,https://techcrunch.com/2026/03/19/restaurant-dancing-robot-went-wild-hot-pot-cupertino-haidilao-agibot/,2026-03-19 21:13:50+00:00,Other
Defense News,https://www.defensenews.com/arc/outboundfeeds/rss/,Israel forges ahead on ground incursion against Hezbollah in Lebanon,"The operation is separate from the joint U.S.-Israel war on Iran, but the dynamics of each conflict zone will inevitably intersect with each other.",https://www.defensenews.com/global/mideast-africa/2026/03/19/israel-forges-ahead-on-ground-incursion-against-hezbollah-in-lebanon/,2026-03-19 20:59:54+00:00,Other
Defense News,https://www.defensenews.com/arc/outboundfeeds/rss/,US moves to approve more than $16 billion in air defense sales to Middle East,"The packages include systems for the United Arab Emirates, Kuwait and Jordan, and range from counter-drone technology to aircraft munitions.",https://www.defensenews.com/global/mideast-africa/2026/03/19/us-moves-to-approve-more-than-16-billion-in-air-defense-sales-to-middle-east/,2026-03-19 20:47:26+00:00,Defense
Satellite Today,https://www.satellitetoday.com/feed/,Spire Targets 50% Growth in 2026 After Adjustments in 2025,"After divesting its maritime business and paying down its debt in 2025, Spire Global has set a large revenue growth target for 2026 of 50%, CEO Theresa Condor told investors... The post Spire Targets 50% Growth in 2026 After Adjustments in 2025 appeared first on Via Satellite .",https://www.satellitetoday.com/finance/2026/03/19/spire-targets-50-growth-in-2026-after-adjustments-in-2025/,2026-03-19 19:45:44+00:00,Funding
Satellite Today,https://www.satellitetoday.com/feed/,"Eutelsat CEO Fallacher Talks OneWeb Gen 2, Global Competition, and Sovereign Demand","Eutelsat Group CEO Jean-François Fallacher has been in the job almost a year now. He has joined Eutelsat at an interesting time in its history as it looks to transform... The post Eutelsat CEO Fallacher Talks OneWeb Gen 2, Global Competition, and Sovereign Demand appeared first on Via Satellite .",https://www.satellitetoday.com/connectivity/2026/03/19/eutelsat-ceo-fallacher-talks-oneweb-gen-2-global-competition-and-sovereign-demand/,2026-03-19 19:38:35+00:00,Other
Satellite Today,https://www.satellitetoday.com/feed/,Portal Space Systems and Paladin Space Plan Repeatable Debris Removal Missions,"Portal Space Systems and Paladin Space are teaming up to offer regular, commercial debris removal missions. The partners are pitching what&#8217;s called Debris Removal as a Service (DRAAS), a recurring... The post Portal Space Systems and Paladin Space Plan Repeatable Debris Removal Missions appeared first on Via Satellite .",https://www.satellitetoday.com/technology/2026/03/19/portal-space-systems-and-paladin-space-plan-repeatable-debris-removal-missions/,2026-03-19 19:28:24+00:00,Other
Defense News,https://www.defensenews.com/arc/outboundfeeds/rss/,"US strikes Iranian underground missile storage with 5,000-pound penetrator",The newest bunker-buster bomb made its combat debut against Iran earlier this week.,https://www.defensenews.com/news/your-air-force/2026/03/19/us-strikes-iranian-underground-missile-storage-with-5000-pound-penetrator/,2026-03-19 18:53:17+00:00,Defense
SpaceNews,https://spacenews.com/feed/,Register now: The energy imperative driving the push toward orbital data centers,"Join us on March 31 for a virtual event, sponsored by Star Catcher and in partnership with the Commercial Space Federation The post Register now: The energy imperative driving the push toward orbital data centers appeared first on SpaceNews .",https://spacenews.com/the-energy-imperative-orbital-data-centers-virtual-event/,2026-03-19 18:37:29+00:00,Other
Breaking Defense,https://breakingdefense.com/feed/,"EXCLUSIVE: US poised to accept new F-35s without radars, sources say","Rep. Rob Wittman told Breaking Defense that while he expected issues with the new APG-85 radar to eventually be resolved, in the interim the US military will be left with “lots of aircraft out there, but not ones that are ready to go to the fight.”",https://breakingdefense.com/2026/03/exclusive-us-poised-to-accept-new-f-35s-without-radars-sources-say/,2026-03-19 18:32:23+00:00,Defense
SpaceNews,https://spacenews.com/feed/,Kratos wins $446 million Space Force contract for missile-tracking ground systems,The agreement is for ground management and integration for the Resilient Missile Warning and Tracking satellite program The post Kratos wins $446 million Space Force contract for missile-tracking ground systems appeared first on SpaceNews .,https://spacenews.com/kratos-wins-446-million-space-force-contract-for-missile-tracking-ground-systems/,2026-03-19 18:03:01+00:00,Defense
Breaking Defense,https://breakingdefense.com/feed/,"Pentagon comptroller says a ‘generational investment’ is coming, but when?","With a potential $1.5 trillion budget expected soon, Aaron Mehta asks the questions we&#8217;re all thinking.",https://breakingdefense.com/2026/03/pentagon-comptroller-says-a-generational-investment-is-coming-but-when/,2026-03-19 18:00:00+00:00,"Defense, Funding"
Breaking Defense,https://breakingdefense.com/feed/,US greenlights over $16B in ’emergency’ radar and missile sales to Middle East,The proposed deals include $8 billion-worth of radars for Kuwait and $8.4 billion in various air defense equipment for the United Arab Emirates.,https://breakingdefense.com/2026/03/us-greenlights-over-16b-in-emergency-radar-and-missile-sales-to-middle-east/,2026-03-19 17:36:37+00:00,Defense
Breaking Defense,https://breakingdefense.com/feed/,Germany marks April deadline to rescue FCAS fighter project from collapse: Reports,"Amid an intense row between Airbus and Dassault over New Generation Fighter leadership and workshare, it remains to be seen how a compromise could unfold.",https://breakingdefense.com/2026/03/germany-marks-april-deadline-to-rescue-fcas-fighter-project-from-collapse-reports/,2026-03-19 17:03:56+00:00,Other
Satellite Today,https://www.satellitetoday.com/feed/,SLI Purchases Two Small GEO Satellites From ReOrbit,"SLI is set to purchase two small Geostationary Orbit (GEO) communication satellites from manufacturer ReOrbit for 150 million euros ($172.8 million), the companies announced in a joint statement on Thursday.... The post SLI Purchases Two Small GEO Satellites From ReOrbit appeared first on Via Satellite .",https://www.satellitetoday.com/manufacturing/2026/03/19/sli-purchases-two-small-geo-satellites-from-reorbit/,2026-03-19 17:02:18+00:00,Space
Satellite Today,https://www.satellitetoday.com/feed/,Comtech Delivers First Set of Digital Modems to US Army,"Comtech delivered the first round of Enterprise Digital Intermediate Frequency Multi-Carrier (EDIM) modems to the U.S. Army in a $48.6 million contract signed in 2023, the company said on Thursday.... The post Comtech Delivers First Set of Digital Modems to US Army appeared first on Via Satellite .",https://www.satellitetoday.com/government-military/2026/03/19/comtech-delivers-first-set-of-digital-modems-to-us-army/,2026-03-19 17:00:50+00:00,Defense
Payload Space,https://payloadspace.com/feed/,"Portal, Paladin Team On Debris Removal Service","“This is about making debris removal operational, not experimental,” Portal CEO Jeff Thornburg said in a statement. “Satellite data underpins communications, navigation, weather forecasting, and national security. Maintaining that infrastructure requires active debris management.” The post Portal, Paladin Team On Debris Removal Service appeared first on Payload .",https://payloadspace.com/portal-paladin-team-on-debris-removal-service/,2026-03-19 17:00:00+00:00,"Space, Defense"
SpaceNews,https://spacenews.com/feed/,Portal Space Systems and Paladin Space plan debris removal service,"Portal Space Systems, a company developing maneuverable spacecraft, is partnering with an Australian startup to offer a commercial orbital debris removal service. The post Portal Space Systems and Paladin Space plan debris removal service appeared first on SpaceNews .",https://spacenews.com/portal-space-systems-and-paladin-space-plan-debris-removal-service/,2026-03-19 17:00:00+00:00,"Space, Startups"
Satellite Today,https://www.satellitetoday.com/feed/,"Latest White House Cybersecurity Strategy Talks Crypto, AI, Quantum","The White House released President Trump’s Cyber Strategy for America in mid-March with six policy pillars, including securing critical infrastructure and maintaining superiority in emerging technologies. While there may not... The post Latest White House Cybersecurity Strategy Talks Crypto, AI, Quantum appeared first on Via Satellite .",https://www.satellitetoday.com/cybersecurity/2026/03/19/latest-white-house-cybersecurity-strategy-talks-crypto-ai-quantum/,2026-03-19 15:55:20+00:00,Other
Satellite Today,https://www.satellitetoday.com/feed/,Getting Better Outcomes In Space: How Will the UK Embrace the Challenge?,In a panel titled ‘Securing Space Assets and Strategic Stability’ at Space-Comm in London speakers from both a government and industry perspective talked about the security of space assets in... The post Getting Better Outcomes In Space: How Will the UK Embrace the Challenge? appeared first on Via Satellite .,https://www.satellitetoday.com/cybersecurity/2026/03/19/getting-better-outcomes-in-space-how-will-the-uk-embrace-the-challenge/,2026-03-19 15:43:21+00:00,Other
Satellite Today,https://www.satellitetoday.com/feed/,SpiderOak Wins New UAS Systems Contract,SpiderOak has won a new contract from the U.S. Army Unmanned Aircraft Systems (PMO UAS) that will see it perform supply chain analysis and cybersecurity assessments for multiple vendors participating... The post SpiderOak Wins New UAS Systems Contract appeared first on Via Satellite .,https://www.satellitetoday.com/cybersecurity/2026/03/19/spideroak-wins-new-uas-systems-contract/,2026-03-19 15:41:42+00:00,Defense
SpaceNews,https://spacenews.com/feed/,Eileen Collins on what it takes to become Space Shuttle Commander,"In this episode of the Space Minds podcast, host David Ariosto speaks with Eileen Collins, retired NASA astronaut, Air Force colonel and the first woman to pilot the Space Shuttle [&#8230;] The post Eileen Collins on what it takes to become Space Shuttle Commander appeared first on SpaceNews .",https://spacenews.com/eileen-collins-on-what-it-takes-to-become-space-shuttle-commander/,2026-03-19 15:38:28+00:00,Defense
Breaking Defense,https://breakingdefense.com/feed/,Gulf nations ‘trying to reach out’ for Ukrainian counter-drone capability,"Kyiv’s forces have unique experience in defending against Iranian-made drones, making Ukrainian industry and expertise a hot commodity.",https://breakingdefense.com/2026/03/gulf-nations-trying-to-reach-out-for-ukrainian-counter-drone-capability/,2026-03-19 15:35:00+00:00,Defense
