source,feed_url,headline,summary,url,published_date,topics
Phys.org,https://phys.org/rss-feed/,How a repurposed medical device is helping us investigate ancient climate tipping points,"Imagine being tasked with counting every blade of grass in a field, noting every single species as you go. This is not far from the challenge many scientists face when analyzing microscopic samples packed with thousands of tiny particles.",https://phys.org/news/2026-05-repurposed-medical-device-ancient-climate.html,2026-05-09 01:40:01+00:00,"MedTech, Science"
Phys.org,https://phys.org/rss-feed/,"Why climate action stalls, despite widespread popular support",What's the link between the global economy and the climate? Consumption drives extraction and carbon emissions. But there is more. The inequalities of the global economy don't just shape what goes into the atmosphere. They affect our understanding of the climate and our perspectives when it comes to possible solutions.,https://phys.org/news/2026-05-climate-action-stalls-widespread-popular.html,2026-05-09 00:00:01+00:00,Other
MIT Technology Review,https://www.technologyreview.com/feed/,"Musk v. Altman week 2: OpenAI fires back, and Shivon Zilis reveals that Musk tried to poach Sam Altman","In the second week of the landmark trial between Elon Musk and OpenAI, Musk’s motivations for bringing the suit were under scrutiny. Last week, Musk took the stand, alleging that OpenAI CEO Sam Altman and president Greg Brockman had deceived him into donating $38 million to the company. He claimed that they’d promised to maintain&#8230;",https://www.technologyreview.com/2026/05/08/1137008/musk-v-altman-week-2-openai-fires-back-and-shivon-zilis-reveals-that-musk-tried-to-poach-sam-altman/,2026-05-08 23:59:19+00:00,AI
TechCrunch,https://techcrunch.com/feed/,Laid-off Oracle workers tried to negotiate better severance. Oracle said no.,Some found out they didn't qualify for WARN Act protections like two-months notice because the company had classified them as remote workers.,https://techcrunch.com/2026/05/08/laid-off-oracle-workers-tried-to-negotiate-better-severance-oracle-said-no/,2026-05-08 22:59:05+00:00,Other
Phys.org,https://phys.org/rss-feed/,Cyclone Gabrielle exposed the risks of forestry slash: New research suggests little has changed,"When Cyclone Gabrielle tore through New Zealand's Tairāwhiti region in 2023, it left behind more than silt and floodwaters.",https://phys.org/news/2026-05-cyclone-gabrielle-exposed-forestry-slash.html,2026-05-08 22:40:03+00:00,Science
TechCrunch,https://techcrunch.com/feed/,San Francisco’s housing market has lost its mind,"The invisible force behind all of this is no mystery to anyone paying attention to the city's tech economy. San Francisco is home to some of the most valuable private companies in the world, and their employees have been quietly accumulating — and, increasingly, cashing out — fortunes.",https://techcrunch.com/2026/05/08/san-franciscos-housing-market-has-lost-its-mind/,2026-05-08 22:32:31+00:00,Other
Phys.org,https://phys.org/rss-feed/,Northern Sri Lanka's oldest confirmed settlement reshapes what archaeologists thought about early island life,"A study published in the Journal of Island and Coastal Archaeology has identified the earliest evidence of prehistoric occupation by island dwellers of northern Sri Lanka. Long thought to be unsuitable for human occupation due to its scarce stone resources and semi-arid landscape, the findings at Velanai Island challenge this long-held belief and offer insights into early raw-material exploitation, seafaring capabilities, and subsistence behavior.",https://phys.org/news/2026-05-northern-sri-lanka-oldest-settlement.html,2026-05-08 22:20:02+00:00,Science
Defense News,https://www.defensenews.com/arc/outboundfeeds/rss/,"Ukraine ramps up ground robot production to spare soldiers, haul ammo — and rescue grandma",The same unmanned ground systems Ukraine uses to haul ammunition and evacuate wounded soldiers are now pulling civilians out of contested ground.,https://www.defensenews.com/unmanned/2026/05/08/ukraine-ramps-up-ground-robot-production-to-spare-soldiers-haul-ammo-and-rescue-grandma/,2026-05-08 21:39:50+00:00,Other
Phys.org,https://phys.org/rss-feed/,"Asteroid Apophis will skim past Earth in 2029, and a new joint mission plans to watch every change","The European Space Agency (ESA) and the Japan Aerospace Exploration Agency (JAXA) have signed a Memorandum of Cooperation to deepen collaboration in planetary defense, alongside a dedicated agreement for collaboration on the Rapid Apophis Mission for Space Safety (Ramses) to the near-Earth asteroid Apophis.",https://phys.org/news/2026-05-asteroid-apophis-skim-earth-joint.html,2026-05-08 21:00:03+00:00,Defense
TechCrunch,https://techcrunch.com/feed/,Prime Video follows Netflix and Disney by adding a TikTok-like ‘Clips’ feed in its app,The Clips feed aims to enable discovery by offering users a scrollable feed with short snippets of shows and movies.,https://techcrunch.com/2026/05/08/prime-video-follows-netflix-and-disney-by-adding-a-tiktok-like-clips-feed-in-its-app/,2026-05-08 20:50:03+00:00,Science
Defense News,https://www.defensenews.com/arc/outboundfeeds/rss/,"Russia, Ukraine to enter temporary ceasefire with prisoner exchange, Trump says",President Donald Trump said Friday that Russia and Ukraine would temporarily halt fighting for three days beginning Saturday.,https://www.defensenews.com/flashpoints/ukraine/2026/05/08/russia-ukraine-to-enter-temporary-ceasefire-with-prisoner-exchange-trump-says/,2026-05-08 20:42:03+00:00,Other
Phys.org,https://phys.org/rss-feed/,Anion swap unlocks sevenfold CO₂ capture in polyionic liquids,"A joint research team from Nitto Boseki Co., Ltd. (Nittobo) and Tohoku University has revealed that polyionic liquids (PILs) can achieve high carbon dioxide (CO₂) adsorption when their counter anions are exchanged. This discovery provides a critical new design guideline for the development of high-performance CO2 recovery devices and gas separation membranes.",https://phys.org/news/2026-05-anion-swap-sevenfold-capture-polyionic.html,2026-05-08 20:20:02+00:00,Science
TechCrunch,https://techcrunch.com/feed/,Intel’s comeback story is even wilder than it seems,"Intel's stock has risen a stunning 490% over the past year, a bet by Wall Street that may be running well ahead of the company's actual turnaround.",https://techcrunch.com/2026/05/08/intels-comeback-story-is-even-wilder-than-it-seems/,2026-05-08 20:02:52+00:00,Other
Satellite Today,https://www.satellitetoday.com/feed/,Greek Government Taps Planet for New Satellite Data Deal,"Planet Labs Germany has won a significant new contract with a major government in Europe. The Greek government has signed a 2-year, 7-figure agreement with Planet that will include numerous [&#8230;] The post Greek Government Taps Planet for New Satellite Data Deal appeared first on Via Satellite .",https://www.satellitetoday.com/imagery-and-sensing/2026/05/08/greek-government-taps-planet-for-new-satellite-data-deal/,2026-05-08 19:46:37+00:00,Other
Satellite Today,https://www.satellitetoday.com/feed/,Operational AI is Hitting the Limits of Earth Observation Data,"AI is entering a different phase in Earth Observation. What began as experimentation on curated datasets is now moving into operational use, where models are expected to keep working across [&#8230;] The post Operational AI is Hitting the Limits of Earth Observation Data appeared first on Via Satellite .",https://www.satellitetoday.com/opinion/2026/05/08/operational-ai-is-hitting-the-limits-of-earth-observation-data/,2026-05-08 19:20:25+00:00,Space
Defense News,https://www.defensenews.com/arc/outboundfeeds/rss/,Hegseth aims to cut through the bureaucracy with ‘Deal Team Six’,The Pentagon is utilizing a crew of private sector businessmen to renovate how the department negotiates with defense companies.,https://www.defensenews.com/news/pentagon-congress/2026/05/08/hegseth-aims-to-cut-through-the-bureaucracy-with-deal-team-six/,2026-05-08 19:17:59+00:00,Defense
Satellite Today,https://www.satellitetoday.com/feed/,Globalstar Grows Revenue 17% in Q1 Amid Amazon Acquisition Process,"Globalstar grew revenue 17% year-over-year in the first quarter of 2026, which Globalstar reported as the operator is now in a process to be acquired by Amazon. Globalstar provided a [&#8230;] The post Globalstar Grows Revenue 17% in Q1 Amid Amazon Acquisition Process appeared first on Via Satellite .",https://www.satellitetoday.com/finance/2026/05/08/globalstar-grows-revenue-17-in-q1-amid-amazon-acquisition-process/,2026-05-08 19:07:30+00:00,Other
Satellite Today,https://www.satellitetoday.com/feed/,"Rocket Lab Q1 Takeaways: Neutron Momentum, SBI Deal and Robotics Acquisition","Rocket Lab hit record quarterly revenue in the first quarter of 2026 and shared momentum for the upcoming Neutron launch vehicle as well as a robotics acquisition and work on [&#8230;] The post Rocket Lab Q1 Takeaways: Neutron Momentum, SBI Deal and Robotics Acquisition appeared first on Via Satellite .",https://www.satellitetoday.com/finance/2026/05/08/rocket-lab-q1-takeaways-neutron-momentum-sbi-deal-and-robotics-acquisition/,2026-05-08 19:04:34+00:00,Space
Breaking Defense,https://breakingdefense.com/feed/,"Poland becomes first nation to sign EU SAFE loans, expects billions for defense","Poland is now on track to receive over $51 billion in EU loans for its military, after overcoming domestic political hurdles.",https://breakingdefense.com/2026/05/poland-becomes-first-nation-to-sign-eu-safe-loans-expects-billions-for-defense/,2026-05-08 18:56:15+00:00,Defense
TechCrunch,https://techcrunch.com/feed/,"Cloudflare says AI made 1,100 jobs obsolete, even as revenue hit a record high","Cloudflare announced its first large-scale layoff. CEO Matthew Prince says because of AI efficiency gains, the company doesn't need as many support roles.",https://techcrunch.com/2026/05/08/cloudflare-says-ai-made-1100-jobs-obsolete-even-as-revenue-hit-a-record-high/,2026-05-08 18:33:21+00:00,Other
TechCrunch,https://techcrunch.com/feed/,"Porsche shutters e-bike, battery, software subsidiaries as part of company overhaul","More than 500 people will be affected by the closures. “We must refocus on our core business,” Porsche CEO and executive chair Michael Leiters said in a statement. ""This is the indispensable foundation for a successful strategic realignment. This forces us to make painful cuts — including our subsidiaries.""",https://techcrunch.com/2026/05/08/porsche-shutters-e-bike-battery-software-subsidiaries-as-part-of-company-overhaul/,2026-05-08 18:25:29+00:00,Other
Phys.org,https://phys.org/rss-feed/,"Myanmar says giant 11,000-carat ruby found in Mogok could rank among most valuable","A huge 11,000-carat ruby has been discovered in Myanmar, state media reported Friday, one of the largest ever found in the country renowned for its precious gemstones.",https://phys.org/news/2026-05-myanmar-giant-carat-ruby-mogok.html,2026-05-08 18:00:10+00:00,Other
Phys.org,https://phys.org/rss-feed/,"Plants evolved distinct functions for two forms of a fundamental signaling molecule, study shows","The molecule cAMP, which plays essential roles in mammalian cells, is less well understood in plants. In a new Science Advances paper, researchers from the Institute of Science and Technology Austria (ISTA) and international collaborators demonstrate that plants use two forms of cAMP in parallel to regulate normal cellular processes and respond to stress, while maintaining crosstalk between them.",https://phys.org/news/2026-05-evolved-distinct-functions-fundamental-molecule.html,2026-05-08 18:00:08+00:00,Science
Phys.org,https://phys.org/rss-feed/,"Antarctica sea ice collapse driven by triple whammy of climate chaos, scientists find","Antarctica is being ravaged by a triple-whammy of climate chaos that has melted sea ice to record lows, a new study has revealed. For decades, the frozen wilderness at the bottom of the world defied global warming trends, with ice levels actually growing—until 2015 when it suddenly reversed.",https://phys.org/news/2026-05-antarctica-sea-ice-collapse-driven.html,2026-05-08 18:00:02+00:00,Science
Phys.org,https://phys.org/rss-feed/,The moon's largest impact crater scattered something priceless—and Artemis may be heading straight into it,"A new study, published in Science Advances, has refined some important details about the moon's largest and oldest impact crater, which stretches more than 1,200 miles (2,000 km) on the far side of the moon. The new details can help guide some of the planning for NASA's upcoming Artemis mission to the moon, which is planned for 2028.",https://phys.org/news/2026-05-moon-largest-impact-crater-priceless.html,2026-05-08 17:50:01+00:00,Science
TechCrunch,https://techcrunch.com/feed/,Mother Ventures is looking at moms as the ‘economic engine’,"The VC firm, which focuses on mothers as consumers, raised a $10 million debut fund.",https://techcrunch.com/2026/05/08/mother-ventures-is-looking-at-moms-as-the-economic-engine/,2026-05-08 17:46:08+00:00,Funding
Phys.org,https://phys.org/rss-feed/,"Metamorphosis in newts proves costly, with one sex paying a heavier price","Metamorphosis, that profound transformation enabling certain animals to shift between habitats such as from an aquatic to a terrestrial environment, is generally viewed in terms of its benefits. A team of researchers from the University of Liège has now demonstrated that it also entails a direct and immediate cost for the individuals undergoing it, a cost that varies by sex and could influence long-term evolutionary trade-offs. The study is published in the journal BMC Biology.",https://phys.org/news/2026-05-metamorphosis-newts-sex-paying-heavier.html,2026-05-08 17:40:07+00:00,Science
Phys.org,https://phys.org/rss-feed/,"Spaceflight leaves astronauts' joints unchanged after 18 days on ISS, early data suggest","Researchers at National Jewish Health have published new findings demonstrating that short-duration spaceflight may not significantly impact lower extremity joint structures, while also identifying a promising, noninvasive tool to monitor astronaut musculoskeletal health on future long-duration missions.",https://phys.org/news/2026-05-spaceflight-astronauts-joints-unchanged-days.html,2026-05-08 17:40:05+00:00,Science
Phys.org,https://phys.org/rss-feed/,"From flying discs to glowing orbs, these newly opened Pentagon files point somewhere stranger than expected",The Pentagon on Friday released a first batch of secret files documenting reported sightings of unidentified flying objects—some dating back to the 1940s—fanning speculation over whether alien life exists.,https://phys.org/news/2026-05-flying-discs-orbs-newly-pentagon.html,2026-05-08 17:36:47+00:00,Defense
Phys.org,https://phys.org/rss-feed/,Spiral galaxy's brilliant heart shines bright in a new picture from NASA's Webb telescope,A spiral galaxy's brilliant heart outshines everything within sight in a new picture from NASA's Webb Space Telescope.,https://phys.org/news/2026-05-spiral-galaxy-brilliant-heart-bright.html,2026-05-08 17:36:04+00:00,Other
TechCrunch,https://techcrunch.com/feed/,Uber partner Avride is under investigation for self-driving crashes,The National Highway Traffic Safety Administration has opened an investigation into Avride after identifying more than a dozen crashes and one minor injury.,https://techcrunch.com/2026/05/08/uber-partner-avride-is-under-investigation-for-self-driving-crashes/,2026-05-08 17:33:46+00:00,Other
TechCrunch,https://techcrunch.com/feed/,"Poland says hackers breached water treatment plants, and the US is facing the same threat",A report by Poland’s top intelligence agency accused Russia of sabotage and hacking activities against the country’s military and civilian infrastructure.,https://techcrunch.com/2026/05/08/poland-says-hackers-breached-water-treatment-plants-and-the-u-s-is-facing-the-same-threat/,2026-05-08 17:20:37+00:00,Defense
Phys.org,https://phys.org/rss-feed/,Vast atmospheric waves on Venus are caused by largest known 'hydraulic jump',"The mysterious origin of an impressive cloud disturbance on Venus has now been revealed by a team including the University of Tokyo. Researchers used numerical models to show that an enormous 6,000-kilometer-wide atmospheric wave front, which circumnavigates the planet for days at a time, is caused by a large ""hydraulic jump."" This is when a fluid abruptly slows down, changing from shallow and fast to deep and slow.",https://phys.org/news/2026-05-vast-atmospheric-venus-largest-hydraulic.html,2026-05-08 17:20:01+00:00,Science
Phys.org,https://phys.org/rss-feed/,"Scientists split gentoo penguins into four species, one totally new to science","The four-foot-tall Emperor penguin of Antarctica may be the most iconic member of this unique family of birds, but 17 other species of penguins populate the Southern Hemisphere, many of them confined to isolated islands that make them hard to study.",https://phys.org/news/2026-05-scientists-gentoo-penguins-species-totally.html,2026-05-08 17:00:01+00:00,Science
TechCrunch,https://techcrunch.com/feed/,US defense contractor who sold hacking tools to Russian broker ordered to pay $10M to former employers,Former cybersecurity executive Peter Williams stole several surveillance and hacking tools and sold them for $1.3 million to a Russian broker that works with Putin’s government.,https://techcrunch.com/2026/05/08/u-s-defense-contractor-who-sold-hacking-tools-to-russian-broker-ordered-to-pay-10-million-to-former-employers/,2026-05-08 16:43:19+00:00,Defense
Phys.org,https://phys.org/rss-feed/,Old bottles and battery acid can drive production of valuable industrial chemicals,"Battery acid from old cars, with a little help from a catalyst, can give plastic waste a new purpose, using it to drive the production of useful chemicals, powered by sunlight alone. A recent study by researchers at the University of Cambridge found a way to turn everyday plastics such as PET from water bottles, nylon, and polyurethane into useful chemical feedstocks.",https://phys.org/news/2026-05-bottles-battery-acid-production-valuable.html,2026-05-08 16:40:01+00:00,Science
Breaking Defense,https://breakingdefense.com/feed/,Turkish air force contracts its first batch of indigenous KAAN jets,"“The initial sale was made for the first batch of 20 Block 10 aircraft. This is the first order. Over time, we expect the numbers to increase,” Turkish Aerospace CEO Mehmet Demiroglu told Breaking Defense.",https://breakingdefense.com/2026/05/turkish-air-force-contracts-its-first-batch-of-indigenous-kaan-jets/,2026-05-08 16:34:53+00:00,Defense
Defense News,https://www.defensenews.com/arc/outboundfeeds/rss/,US forces disable Iranian-flagged tankers trying to cross blockade,"This week, U.S. forces around the Strait of Hormuz have launched strikes against Iranian military facilities and disabled missiles launched by the IRGC.",https://www.defensenews.com/news/your-navy/2026/05/08/us-forces-disable-iranian-flagged-tankers-trying-to-cross-blockade/,2026-05-08 16:28:20+00:00,Defense
Phys.org,https://phys.org/rss-feed/,Why infected stink bugs lift their wings: Hidden parasite escape caught on camera,"Male strepsipterans develop inside a host insect during their larval stage and, upon reaching the adult stage, emerge from the host body to begin a free-living phase. In a new study, researchers at University of Tsukuba directly observed the emergence behavior of male strepsipterans parasitizing stink bugs, where emergence sites are concealed beneath the host's wings, and found that, during emergence, the host exhibits a characteristic wing-raising behavior.",https://phys.org/news/2026-05-infected-bugs-wings-hidden-parasite.html,2026-05-08 16:20:05+00:00,Science
MIT Technology Review,https://www.technologyreview.com/feed/,Here’s what you need to know about the cruise ship hantavirus outbreak,"MIT Technology Review Explains: Let our writers untangle the complex, messy world of technology to help you understand what’s coming next. You can read more from the series here. Eight passengers aboard a Dutch-flagged cruise ship have contracted a type of hantavirus, a rare virus transmitted by rats. Three of them have died. As the ship&#8230;",https://www.technologyreview.com/2026/05/08/1136988/heres-what-you-need-to-know-about-the-cruise-ship-hantavirus-outbreak/,2026-05-08 16:19:40+00:00,Other
Phys.org,https://phys.org/rss-feed/,"Lab-evolved cyanobacteria survive minute-by-minute light swings, offering clues to hardier crops","Plant scientist Dario Leister and his team are investigating how cyanobacteria adapt to rapidly changing light intensities. This could help optimize photosynthesis in crops. Photosynthesis is one of the most complex processes in nature. However, plants use only a fraction of the available light spectrum and are highly sensitive to environmental stressors such as changing light intensities, heat and drought. As climate change intensifies these stresses, safeguarding crop productivity is becoming an increasingly urgent challenge.",https://phys.org/news/2026-05-lab-evolved-cyanobacteria-survive-minute.html,2026-05-08 16:00:06+00:00,Science
Phys.org,https://phys.org/rss-feed/,Understanding Japan's complex religious landscape,"On New Year's Day, millions of people in Japan visit Shinto shrines to pray for good fortune. In summer, many return to their hometowns to honor ancestors in Buddhist rituals. Families often maintain household altars, and seasonal festivals remain a central part of community life. Though this may look like a religious practice, many of them may identify themselves as nonreligious.",https://phys.org/news/2026-05-japan-complex-religious-landscape.html,2026-05-08 16:00:01+00:00,Other
TechCrunch,https://techcrunch.com/feed/,Pentagon releases UFO files on new website,"The initial set of files housed on the site will include those containing unidentified anomalous phenomena (UAP) videos, photos, and original source documents from across the entire U.S. government. The materials have been reviewed for security purposes, but many have ""not yet been analyzed for resolution of any anomalies,"" the Department's statement read.",https://techcrunch.com/2026/05/08/pentagon-releases-ufo-files-on-new-website/,2026-05-08 15:56:36+00:00,Defense
Phys.org,https://phys.org/rss-feed/,Dinosaur dental fossils reveal bird-like parental care bonds,"Baby dinosaurs were likely fed more nutritious food than their adult counterparts, a finding that could offer insights into their social evolution, suggests a new study. Paleontologists uncovered this finding by studying wear on the fossilized teeth of Maiasaura peeblesorum, a duck-billed dinosaur species that lived about 75 to 80 million years ago during the Late Cretaceous. First discovered in Montana, these large, herbivorous dinosaurs lived in herds and were thought to have been highly social creatures, especially in contrast to those that may have had different reproductive strategies.",https://phys.org/news/2026-05-dinosaur-dental-fossils-reveal-bird.html,2026-05-08 15:40:03+00:00,Science
Breaking Defense,https://breakingdefense.com/feed/,First-of-its-kind electromagnetic spectrum exercise tests senior leaders in Arctic conditions,Aurora Pulse focused top operational and planning staffs of combatant commands on how to fight in a degraded spectrum environment in the Arctic.,https://breakingdefense.com/2026/05/first-of-its-kind-electromagnetic-spectrum-exercise-tests-senior-leaders-in-arctic-conditions/,2026-05-08 15:36:10+00:00,Other
Defense News,https://www.defensenews.com/arc/outboundfeeds/rss/,Marines to phase out F/A-18 maintenance jobs as Hornet era ends,"Enlisted Marines with Hornet specialties will be offered retraining, reassignment or career dead ends.",https://www.defensenews.com/news/your-marine-corps/2026/05/08/marines-to-phase-out-fa-18-maintenance-jobs-as-hornet-era-ends/,2026-05-08 15:28:50+00:00,Other
Phys.org,https://phys.org/rss-feed/,Nanoparticles overcome drug-resistant cancer via sequential drug release and photothermal therapy,"Cancer cells frequently develop the ability to expel anticancer drugs before they can work—a phenomenon called multidrug resistance (MDR)—which is one of the leading reasons why chemotherapy fails in patients. Research published in the Journal of Controlled Release addresses that problem with a fundamentally new strategy: instead of simply increasing drug doses or switching drugs, researchers engineered nanoparticles that first disable the cancer cell's drug-expulsion mechanism, and only then release the anticancer drug.",https://phys.org/news/2026-05-nanoparticles-drug-resistant-cancer-sequential.html,2026-05-08 15:20:05+00:00,Science
Phys.org,https://phys.org/rss-feed/,"Plants survived the dinosaur-killing asteroid by duplicating genomes, study suggests","When an asteroid as big as Mount Everest struck Earth 66 million years ago, it wiped out all non-avian dinosaurs and roughly a third of life on the planet. But many plants survived the devastation. In a new study published in Cell, researchers reveal that the accidental duplications of genomes—a natural phenomenon—might have helped many flowering plants survive some of the most extreme environmental upheavals in Earth's history.",https://phys.org/news/2026-05-survived-dinosaur-asteroid-duplicating-genomes.html,2026-05-08 15:00:03+00:00,Science
