source,feed_url,headline,summary,url,published_date,topics
TechCrunch,https://techcrunch.com/feed/,X says it’s reducing payments to clickbait accounts,"X is cutting back on payments to accounts that are “flooding the timeline” with clickbait and rapid-fire news aggregation, according to its head of product Nikita Bier",https://techcrunch.com/2026/04/12/x-says-its-reducing-payments-to-clickbait-accounts/,2026-04-12 17:02:20+00:00,Other
Phys.org,https://phys.org/rss-feed/,Astronomers find the strongest evidence yet for the universe's first stars,"For decades, astronomers were only able to study the universe's very first stars using theoretical models. Now, observations from the James Webb Space Telescope (JWST) have revealed what may be the most compelling evidence to date for these ancient ""Population III"" stars, finding them clustered around a small companion object that formed just 400 million years after the Big Bang.",https://phys.org/news/2026-04-astronomers-strongest-evidence-universe-stars.html,2026-04-12 17:00:04+00:00,Science
Phys.org,https://phys.org/rss-feed/,A matter of taste: Did Neanderthals really like sapiens women?,"Going by the headlines, the matter seems to be settled. El País announces that Neanderthal men ""chose"" sapiens women. Science journal speaks of a ""partner preference."" National Geographic is already imagining the ""Romeos"" of prehistory. The Telegraph suggests that Neanderthals ""had designs on"" sapiens women.",https://phys.org/news/2026-04-neanderthals-sapiens-women.html,2026-04-12 16:30:03+00:00,Science
TechCrunch,https://techcrunch.com/feed/,TechCrunch Mobility: Who is poaching all the self-driving vehicle talent?,"Welcome back to TechCrunch Mobility, your hub for the future of transportation and now, more than ever, how AI is playing a part.",https://techcrunch.com/2026/04/12/techcrunch-mobility-who-is-poaching-all-the-self-driving-vehicle-talent/,2026-04-12 16:06:00+00:00,Other
Phys.org,https://phys.org/rss-feed/,Ancient Korean DNA reveals marriages between closely related individuals,"DNA studies of 1,500-year-old skeletons have revealed that ancient Koreans lived in tightly knit family networks where marrying close relatives was common in some cases, from powerful elites to individuals chosen for human sacrifice.",https://phys.org/news/2026-04-ancient-korean-dna-reveals-marriages.html,2026-04-12 16:00:01+00:00,Other
Phys.org,https://phys.org/rss-feed/,AI can design and run thousands of lab experiments without human hands. Humanity isn't ready,"Artificial intelligence is rapidly learning to autonomously design and run biological experiments, but the systems intended to govern those capabilities are struggling to keep pace.",https://phys.org/news/2026-04-ai-thousands-lab-human-humanity.html,2026-04-12 15:30:02+00:00,AI
TechCrunch,https://techcrunch.com/feed/,"From LLMs to hallucinations, here’s a simple guide to common AI terms",The rise of AI has brought an avalanche of new terms and slang. Here is a glossary with definitions of some of the most important words and phrases you might encounter.,https://techcrunch.com/2026/04/12/artificial-intelligence-definition-glossary-hallucinations-guide-to-common-ai-terms/,2026-04-12 15:07:08+00:00,AI
Phys.org,https://phys.org/rss-feed/,Electrode technology achieves 86% efficiency for converting CO₂ into plastic precursors,"In the process of converting carbon dioxide into useful chemicals such as ethylene—a key precursor for plastics—a major challenge has been the flooding of electrodes, where electrolyte penetrates the electrode structure and reduces performance. KAIST researchers have developed a new electrode design that blocks water while maintaining efficient electrical conduction and catalytic reactions, thereby improving both efficiency and stability.",https://phys.org/news/2026-04-electrode-technology-efficiency-plastic-precursors.html,2026-04-12 15:00:04+00:00,Science
TechCrunch,https://techcrunch.com/feed/,"At the HumanX conference, everyone was talking about Claude",Anthropic was the star of the show at San Francisco's AI-centric conference.,https://techcrunch.com/2026/04/12/at-the-humanx-conference-everyone-was-talking-about-claude/,2026-04-12 15:00:00+00:00,AI
Defense News,https://www.defensenews.com/arc/outboundfeeds/rss/,"US Navy to blockade Strait of Hormuz ‘effective immediately,’ Trump says","“Any Iranian who fires at us, or at peaceful vessels, will be BLOWN TO HELL!” the president wrote on Sunday.",https://www.defensenews.com/news/pentagon-congress/2026/04/12/us-navy-to-blockade-strait-of-hormuz-effective-immediately-trump-says/,2026-04-12 14:58:14+00:00,Defense
Phys.org,https://phys.org/rss-feed/,Unlocking how dogs' fungal ear infections evade treatment,"Mutations in a key protein make a yeast found in dogs with common outer ear infections more resistant to the topical antifungals used to treat it, veterinarians and pathobiologists at the University of Illinois Urbana-Champaign found in a new study. The work is published in the journal Veterinary Dermatology.",https://phys.org/news/2026-04-dogs-fungal-ear-infections-evade.html,2026-04-12 14:30:02+00:00,Science
TechCrunch,https://techcrunch.com/feed/,Slate Auto: Everything you need to know about the Bezos-backed EV startup,"Slate auto burst onto the scene in April 2025. Here is a timeline that covers its origins, backers, product, and other new details.",https://techcrunch.com/2026/04/12/slate-auto-everything-you-need-to-know-about-the-bezos-backed-ev-startup/,2026-04-12 14:00:00+00:00,Startups
Phys.org,https://phys.org/rss-feed/,Meet Orpheus—A hopper mission built to hunt for life in Martian volcanoes,"We've spent decades scratching the surface of Mars trying to uncover life there. But we've been searching a barren wasteland bombarded by radiation and bathed in toxic perchlorates. The entire time, it's likely that it's been too hostile to harbor extant life. So if we want a better shot at finding currently living life on Mars, we need to go underground. That is exactly the purpose of Orpheus, a proposed Mars vertical takeoff and landing (VTOL) hopper mission put forth in a paper presented by Connor Bunn and Pascal Lee of the SETI Institute at the 57th Lunar and Planetary Science Conference (LPSC).",https://phys.org/news/2026-04-orpheus-hopper-mission-built-life.html,2026-04-12 13:30:01+00:00,Science
Defense News,https://www.defensenews.com/arc/outboundfeeds/rss/,US-Iran peace talks end without deal as delegations leave Pakistan,Each side blamed the other for the failure of the 21-hour negotiations to end fighting that has killed thousands and roiled the global economy.,https://www.defensenews.com/news/pentagon-congress/2026/04/12/us-iran-peace-talks-end-without-deal-as-delegations-leave-pakistan/,2026-04-12 13:27:21+00:00,Other
Phys.org,https://phys.org/rss-feed/,Space telescopes track nearby quasar's dramatic X-ray state transition,"By analyzing the data from various space observatories, Chinese astronomers have inspected a nearby quasar designated SDSS J000532.84+200717.4. Results of the new study, published April 1 on the arXiv preprint server, shed more light on the X-ray variability of this object.",https://phys.org/news/2026-04-space-telescopes-track-nearby-quasar.html,2026-04-12 13:00:01+00:00,Science
Phys.org,https://phys.org/rss-feed/,New study targets cost hurdles in forest restoration,"As the West faces increasingly destructive wildfires, land managers rely on mechanical thinning to reduce hazardous fuels and restore forest health. But one obstacle continues to slow this work down: Thinning costs are notoriously difficult to estimate from one project to the next. Uncertainty around those numbers raises concerns that outdated cost estimates may be holding critical restoration projects back.",https://phys.org/news/2026-04-hurdles-forest.html,2026-04-12 12:00:04+00:00,"Science, Funding"
SpaceNews,https://spacenews.com/feed/,Rocket Lab wins contract for three more iQPS launches,Rocket Lab has won a contract from Japanese radar satellite company iQPS for three additional Electron launches. The post Rocket Lab wins contract for three more iQPS launches appeared first on SpaceNews .,https://spacenews.com/rocket-lab-wins-contract-for-three-more-iqps-launches/,2026-04-12 11:43:00+00:00,Space
Phys.org,https://phys.org/rss-feed/,Artemis crew urges unity on 'lifeboat' Earth,"Artemis II astronauts expressed awe on Saturday over their record-setting lunar flyby mission, urging unity on Earth after witnessing the planet's isolation like a ""lifeboat"" in space.",https://phys.org/news/2026-04-artemis-crew-urges-unity-lifeboat.html,2026-04-12 08:22:05+00:00,Other
TechCrunch,https://techcrunch.com/feed/,"Walmart-owned Flipkart, Amazon are squeezing India’s quick commerce startups","Flipkart's ongoing expansion beyond major cities and heavy discounting is raising risks for India's quick commerce startups, analysts say.",https://techcrunch.com/2026/04/11/walmart-owned-flipkart-amazon-are-squeezing-indias-quick-commerce-startups/,2026-04-12 03:00:00+00:00,Startups
Nature,https://www.nature.com/subjects/medical-research.rss,Physicochemical properties of gutta-percha cones before and after a rapid disinfection protocol and its clinical relevance,,https://www.nature.com/articles/s41598-026-48573-5,2026-04-12 00:00:00+00:00,Other
Nature,https://www.nature.com/subjects/medical-research.rss,Patient characteristics modify the effects of education plus exercise on patellofemoral joint loading: a secondary effect-modifier analysis of a randomized controlled trial,,https://www.nature.com/articles/s41598-026-48631-y,2026-04-12 00:00:00+00:00,Other
Nature,https://www.nature.com/subjects/medical-research.rss,A diagnostic stewardship bundle approach to facilitate same-day optimal antimicrobial therapy in gram-negative sepsis: a quasi-experimental study,,https://www.nature.com/articles/s41598-026-46677-6,2026-04-12 00:00:00+00:00,"MedTech, Science"
Nature,https://www.nature.com/subjects/medical-research.rss,Circadian disruption of brain temperature and heart rate in two periods after intracerebral hemorrhage surgery: a retrospective study,,https://www.nature.com/articles/s41598-026-47437-2,2026-04-12 00:00:00+00:00,Science
Nature,https://www.nature.com/subjects/medical-research.rss,Associations between antihypertensive drug-related gene polymorphisms and cardiovascular outcomes in hypertensive patients: a gene-drug interaction study,,https://www.nature.com/articles/s41598-026-48528-w,2026-04-12 00:00:00+00:00,Science
Nature,https://www.nature.com/subjects/medical-research.rss,"Visceral fat rating, but not glycemic variability, is strongly associated with arterial stiffness in non-obese adults with type 1 diabetes",,https://www.nature.com/articles/s41598-026-47105-5,2026-04-12 00:00:00+00:00,Other
Nature,https://www.nature.com/subjects/medical-research.rss,Interactive AI assisted pediatric burn assessment based on smartphone images,,https://www.nature.com/articles/s41598-026-48169-z,2026-04-12 00:00:00+00:00,Other
Nature,https://www.nature.com/subjects/medical-research.rss,"The impact of e-cigarette use on cognitive function, emotional intelligence, and dementia risk in adolescents and young adults",,https://www.nature.com/articles/s41598-026-48579-z,2026-04-12 00:00:00+00:00,Other
Nature,https://www.nature.com/subjects/medical-research.rss,Protective role of sodium propionate against glycerol or fractionated doses of gamma rays-induced acute kidney injury via ATF5-induced mitophagy in rats,,https://www.nature.com/articles/s41598-026-46553-3,2026-04-12 00:00:00+00:00,Other
Phys.org,https://phys.org/rss-feed/,Inquiry-based biomimicry course inspires students to design solutions by learning from nature,"Research and innovation in Texas A&amp;M University's biomedical engineering department often centers around clinical impact on patients. Beyond the lab, however, some faculty are finding breakthroughs in the classroom.",https://phys.org/news/2026-04-inquiry-based-biomimicry-students-solutions.html,2026-04-11 23:30:01+00:00,Science
Phys.org,https://phys.org/rss-feed/,AI pragmatists: How language teachers are navigating AI with nuance,"A pervasive narrative has taken hold in education: generative AI (genAI) is an unstoppable force, and educators must adapt or be left behind.",https://phys.org/news/2026-04-ai-pragmatists-language-teachers-nuance.html,2026-04-11 22:00:01+00:00,AI
TechCrunch,https://techcrunch.com/feed/,Kalshi wins temporary pause in Arizona criminal case,The Commodity Futures Trading Commission announced Friday that it has won a temporary restraining order preventing Arizona from pursuing its criminal case against Kalshi.,https://techcrunch.com/2026/04/11/kalshi-wins-temporary-pause-in-arizona-criminal-case/,2026-04-11 21:20:24+00:00,Other
Phys.org,https://phys.org/rss-feed/,Flux pathway reveals why mussel-like liquid phase separation can happen in seconds,"Have you ever wondered how mussels instantly glue themselves to rocks, allowing them to survive the crushing force of ocean waves? They complete this process in under 30 seconds. Yet, in a laboratory, replicating this process of molecular self-assembly, known as liquid-liquid phase separation (LLPS), typically takes dozens of minutes, if not hours. A research team of The Hong Kong University of Science and Technology (HKUST) has recently solved this long-standing puzzle using large-scale molecular dynamics simulation and theoretical analysis, revealing the secret to nature's incredible speed and providing implications for instant biocompatible surgical glues.",https://phys.org/news/2026-04-flux-pathway-reveals-mussel-liquid.html,2026-04-11 21:00:03+00:00,Science
TechCrunch,https://techcrunch.com/feed/,AMC will stream ‘The Audacity’ premiere in 21 parts on TikTok,"Is this a smart way to build buzz, or just an odd attempt to recreate Quibi?",https://techcrunch.com/2026/04/11/amc-will-stream-the-audacity-premiere-in-21-parts-on-tiktok/,2026-04-11 20:32:23+00:00,Other
TechCrunch,https://techcrunch.com/feed/,Sam Altman responds to ‘incendiary’ New Yorker article after attack on his home,The OpenAI CEO's new blog post responds to both an apparent attack on his home and an in-depth New Yorker profile raising questions about his trustworthiness.,https://techcrunch.com/2026/04/11/sam-altman-responds-to-incendiary-new-yorker-article-after-attack-on-his-home/,2026-04-11 17:18:22+00:00,AI
SpaceNews,https://spacenews.com/feed/,Falcon 9 launches Cygnus cargo spacecraft to the ISS,A Falcon 9 launched a Cygnus cargo spacecraft April 11 as Northrop Grumman continues its dependence on a competitor to fly resupply missions to the International Space Station. The post Falcon 9 launches Cygnus cargo spacecraft to the ISS appeared first on SpaceNews .,https://spacenews.com/falcon-9-launches-cygnus-cargo-spacecraft-to-the-iss/,2026-04-11 16:28:21+00:00,Space
Defense News,https://www.defensenews.com/arc/outboundfeeds/rss/,"US military begins clearing Strait of Hormuz, Trump says",Reports emerged Saturday about the presence of U.S. Navy ships in the strait.,https://www.defensenews.com/news/pentagon-congress/2026/04/11/us-military-begins-clearing-strait-of-hormuz-trump-says/,2026-04-11 15:59:52+00:00,Defense
TechCrunch,https://techcrunch.com/feed/,Nvidia-backed SiFive hits $3.65 billion valuation for open AI chips,"The deal is interesting for a number of reasons, including that SiFive's chip designs are based on RISC-V, not x86 or ARM.",https://techcrunch.com/2026/04/11/nvidia-backed-sifive-hits-3-65-billion-valuation-for-open-ai-chips/,2026-04-11 14:03:00+00:00,Funding
