source,feed_url,headline,summary,url,published_date,topics
Science,https://www.science.org/rss/news_current.xml,Big Ebola outbreak puts spotlight on little-known virus,"The Bundibugyo virus only emerged twice before. Now, scientists see a chance to get to know it better",https://www.science.org/content/article/big-ebola-outbreak-puts-spotlight-little-known-virus,2026-06-17 11:15:00+00:00,Science
Science,https://www.science.org/rss/news_current.xml,The earliest plague epidemics may have been caused by marmots,Ancient hunter-gatherers may have contracted the pathogen from marmots,https://www.science.org/content/article/earliest-plague-epidemics-may-have-been-caused-marmots,2026-06-17 11:00:00+00:00,Other
EU-Startups,https://www.eu-startups.com/feed/,Bolzano-based Soource raises €3 million to help procurement evolve from “copilot” to “autopilot” model,"Soource, a Bolzano-based startup offering procurement solutions focused on sourcing and supplier selection, has announced the close of a €3 million Seed funding round to consolidate its position in Italy’s procurement intelligence market and support its European expansion. The round was led by Vertis through the “Vertis Venture 5 Scaleup” fund and included participation from [&#8230;] The post Bolzano-based Soource raises €3 million to help procurement evolve from &#8220;copilot” to &#8220;autopilot” model appeared first on EU-Startups .",https://www.eu-startups.com/2026/06/bolzano-based-soource-raises-e3-million-to-help-procurement-evolve-from-copilot-to-autopilot-model/,2026-06-17 10:51:57+00:00,"Startups, Funding"
Defense News,https://www.defensenews.com/arc/outboundfeeds/rss/,US Army’s ‘Tropic Lightning’ Division ponders transformation lessons from Philippine war games,"Because of HIMARS, Maj. Gen. Bartholomees pointed out his “division artillery is really what transformed the most.”",https://www.defensenews.com/global/asia-pacific/2026/06/17/us-armys-tropic-lightning-division-ponders-transformation-lessons-from-philippine-war-games/,2026-06-17 09:34:23+00:00,Defense
EU-Startups,https://www.eu-startups.com/feed/,Drone warfare startup PDKINEMATICS raises €2 million for precision-guidance systems out of Lithuania,"PDKINEMATICS, a Lithuanian defence engineering company, announced the close of a €2 million Seed round to scale manufacturing and expand deployments of the company’s precision guidance systems for UAVs across Europe and Ukraine. The round was co-led by Coinvest Capital, Lithuania&#8217;s sovereign investment fund, and Iron Wolf Capital, an active defence investors in Europe &#8211; [&#8230;] The post Drone warfare startup PDKINEMATICS raises €2 million for precision-guidance systems out of Lithuania appeared first on EU-Startups .",https://www.eu-startups.com/2026/06/drone-warfare-startup-pdkinematics-raises-e2-million-for-precision-guidance-systems-out-of-lithuania/,2026-06-17 09:13:59+00:00,"Funding, Defense"
MIT Technology Review,https://www.technologyreview.com/feed/,Hacking the atmosphere: Geoengineering gets a reality check,"Jim Franke pulls away the cover page of a presentation on the wraparound desk in his office, revealing an illustration of an odd-­looking aircraft with massive wings stretching out from a stubby fuselage. The uncrewed plane is soaring thousands of meters higher than commercial jets fly—so high you can see the curvature of the Earth.&#8230;",https://www.technologyreview.com/2026/06/17/1138743/hacking-atmosphere-geoengineering-reality-check/,2026-06-17 09:00:00+00:00,Other
MIT Technology Review,https://www.technologyreview.com/feed/,Entrepreneurs in Nairobi make the case for going solar,"Most of Kenya’s power grid runs on renewables. But with 25% of communities lacking centralized electricity, the nation is looking to off-grid solar to hit its goal of delivering universal electricity access by 2030 without driving up emissions. The ever-­improving economics of solar technology have helped. A couple of years ago, a panel cost about&#8230;",https://www.technologyreview.com/2026/06/17/1138600/entrepreneurs-nairobi-case-for-going-solar/,2026-06-17 09:00:00+00:00,Other
EU-Startups,https://www.eu-startups.com/feed/,Barcelona-based NeuralTrust raises €17.2 million to secure and govern enterprise AI agents,"NeuralTrust, a Barcelona-based startup that secures and scales AI agents, today announced a €17.2 million ($20 million) Seed round, which the company describes as the largest cybersecurity Seed financing raised by an EU company to date. The round was led by Alstin Capital, with participation from VentureFriends, Seaya, Kibo Ventures, Banc Sabadell, EA Ventures Plug [&#8230;] The post Barcelona-based NeuralTrust raises €17.2 million to secure and govern enterprise AI agents appeared first on EU-Startups .",https://www.eu-startups.com/2026/06/barcelona-based-neuraltrust-raises-e17-2-million-to-secure-and-govern-enterprise-ai-agents/,2026-06-17 08:34:13+00:00,"Funding, Startups"
War on the Rocks,https://warontherocks.com/feed/,Macron’s Nuclear Gamble: Building a European Deterrent Faster Than French Politics Can Tear Down,"In early March, French President Emmanuel Macron stood at a windswept submarine base on the Breton coast and quietly buried four decades of French nuclear orthodoxy. The arsenal would grow. The numbers would be hidden. And for the first time, nuclear weapons that France built to defend Paris might one day be deployed to protect Berlin.Three simultaneous shifts &#8212; an increase of nuclear warheads; an end to transparency over the size of the force de frappe; and the launch of &#8220;advanced deterrence,&#8221; a framework offering European partners strategic dialogues, invitations to French nuclear exercises, and the potential forward basing of The post Macron’s Nuclear Gamble: Building a European Deterrent Faster Than French Politics Can Tear Down appeared first on War on the Rocks .",https://warontherocks.com/macrons-nuclear-gamble-building-a-european-deterrent-faster-than-french-politics-can-tear-down/,2026-06-17 07:30:35+00:00,Other
War on the Rocks,https://warontherocks.com/feed/,Three Short Tales on War Brad Carson Wants You to Read,"Editor&#8217;s Note: This is a new occasional series brought to you by War on the Rocks. If you would like to pitch your own version, please refer to the contact information and guidance on our submissions page.Every war, it seems, produces its famous novel, a book that captures not merely the tactics and the terrain but the moral weather of its time. The American Civil War gave us The Red Badge of Courage. World War I gave us All Quiet on the Western Front. World War II offered more competitors, as if the scale of the catastrophe demanded more witnesses; The post Three Short Tales on War Brad Carson Wants You to Read appeared first on War on the Rocks .",https://warontherocks.com/three-short-tales-on-war-brad-carson-wants-you-to-read/,2026-06-17 07:15:51+00:00,Other
Defense News,https://www.defensenews.com/arc/outboundfeeds/rss/,Size matters: KNDS pitches long-barreled artillery for 60-kilometer base range,"The 155mm howitzer is equipped with a girthy 58 caliber gun tube, about 12% longer than the 52 caliber barrels common in Europe.",https://www.defensenews.com/global/europe/2026/06/17/size-matters-knds-pitches-long-barreled-artillery-for-60-kilometer-base-range/,2026-06-17 06:59:38+00:00,Defense
Science,https://www.science.org/rss/news_current.xml,New space telescope will map galaxies’ ghostly halos and streams,European Space Agency mission will trace the relics of ancient mergers and probe the dark matter shaping galaxy growth,https://www.science.org/content/article/new-space-telescope-will-map-galaxies-ghostly-halos-and-streams,2026-06-17 04:00:00+00:00,Other
SpaceNews,https://spacenews.com/feed/,June 25: Golden Dome: How Could Sensors Protect the United States?,"Join us as we explore the technologies behind Golden Dome, what’s necessary to make them operate at a high level and what possibilities could be in the works for the satellites involved. The post June 25: Golden Dome: How Could Sensors Protect the United States? appeared first on SpaceNews .",https://spacenews.com/golden-dome-sensors-event-june-25/,2026-06-17 01:10:41+00:00,Other
Science,https://www.science.org/rss/news_current.xml,Do animals perceive time differently from humans?,Science chats with a researcher whose team is using “timescapes” to understand how nonhumans experience the world,https://www.science.org/content/article/do-animals-perceive-time-differently-humans,2026-06-17 01:00:00+00:00,Other
Nature,https://www.nature.com/nature.rss,Should nicotine be regulated like a narcotic? A Pacific nation makes the case,"Nature, Published online: 17 June 2026; doi:10.1038/d41586-026-01903-z Existing global efforts to reduce harms caused by smoking have targeted tobacco smoking, but vapes containing nicotine are also harmful.",https://www.nature.com/articles/d41586-026-01903-z,2026-06-17 00:00:00+00:00,Science
Nature,https://www.nature.com/nature.rss,The EU needs to back its ambition to end animal testing with cash,"Nature, Published online: 17 June 2026; doi:10.1038/d41586-026-01882-1 The European Union has declared that it wants to stop using animals in chemical safety testing. Its goal will need a timeline and a serious funding commitment.",https://www.nature.com/articles/d41586-026-01882-1,2026-06-17 00:00:00+00:00,"Science, Funding"
Nature,https://www.nature.com/nature.rss,Navigating a crowded developing brain leaves neurons with broken DNA,"Nature, Published online: 17 June 2026; doi:10.1038/d41586-026-01705-3 As neurons migrate to their final destinations in the forming brain, their DNA gets damaged. The brain has evolved a fix, but there can be lasting consequences if repair fails.",https://www.nature.com/articles/d41586-026-01705-3,2026-06-17 00:00:00+00:00,Science
Nature,https://www.nature.com/nature.rss,"Analysis of 173,303 exomes and genomes in the Pakistan Genome Resource","Nature, Published online: 17 June 2026; doi:10.1038/s41586-026-10667-5 The Pakistan Genome Resource compiles biobank data from 173,303 individuals with high familial relatedness, broadening the catalogue of human genetic variation and establishing a population-specific genomic reference for Pakistan.",https://www.nature.com/articles/s41586-026-10667-5,2026-06-17 00:00:00+00:00,Science
Nature,https://www.nature.com/nature.rss,Reconfigurable quantum computer juggles 98 qubits,"Nature, Published online: 17 June 2026; doi:10.1038/d41586-026-01702-6 A quantum computer based on trapped ions can connect any two quantum bits, reaching performance levels that conventional computers cannot match.",https://www.nature.com/articles/d41586-026-01702-6,2026-06-17 00:00:00+00:00,Science
Nature,https://www.nature.com/nature.rss,Wah-ult in the vault,"Nature, Published online: 17 June 2026; doi:10.1038/d41586-026-01719-x Relics of wonder.",https://www.nature.com/articles/d41586-026-01719-x,2026-06-17 00:00:00+00:00,Science
Nature,https://www.nature.com/nature.rss,Oceans in Asia smash heat records — what it means for extreme weather,"Nature, Published online: 17 June 2026; doi:10.1038/d41586-026-01938-2 Report shows region is particularly vulnerable to the effects of climate change.",https://www.nature.com/articles/d41586-026-01938-2,2026-06-17 00:00:00+00:00,Science
Nature,https://www.nature.com/nature.rss,Freezing brain damage in its tracks: cooling drugs limit stroke injury in mice,"Nature, Published online: 17 June 2026; doi:10.1038/d41586-026-01923-9 A two-drug combination induces hypothermia in mice by lowering metabolism and dilating blood vessels.",https://www.nature.com/articles/d41586-026-01923-9,2026-06-17 00:00:00+00:00,Science
Nature,https://www.nature.com/nature.rss,Spatial distribution of the proteome in the human body and in cancers,"Nature, Published online: 17 June 2026; doi:10.1038/s41586-026-10660-y A spatially resolved map of the human proteome across a variety of healthy tissues and cancers provides wide-ranging insights in developmental biology and oncology, and could aid the identification of therapeutic targets and development of treatments for cancer.",https://www.nature.com/articles/s41586-026-10660-y,2026-06-17 00:00:00+00:00,"Biotech, Science"
Nature,https://www.nature.com/nature.rss,Cucurbituril-based anion-conducting membranes with supramolecular nanopores,"Nature, Published online: 17 June 2026; doi:10.1038/s41586-026-10666-6 A supramolecular strategy, in which uniform, dynamic nanopores are constructed, overcomes the limitations of limited structural control, mechanical fragility or demanding synthesis in nanoporous anion-conducting membranes, providing a versatile tool for molecularly engineering transport pathways.",https://www.nature.com/articles/s41586-026-10666-6,2026-06-17 00:00:00+00:00,Science
Nature,https://www.nature.com/nature.rss,Visualizing the impact of quenched disorder on 2D electron Wigner solids,"Nature, Published online: 17 June 2026; doi:10.1038/s41586-026-10654-w A technique combining atomically resolved scanning tunnelling microscopy with neural-quantum-state quantum Monte Carlo simulation of disordered 2D electron Wigner solids establishes a powerful framework to enable the clear identification of two distinct defect-induced disorder regimes.",https://www.nature.com/articles/s41586-026-10654-w,2026-06-17 00:00:00+00:00,Science
Nature,https://www.nature.com/nature.rss,Optical metasurfaces for general vision processing on the edge,"Nature, Published online: 17 June 2026; doi:10.1038/s41586-026-10635-z By embedding core computer vision principles into a large-scale optical metasurface, an efficient vision processing system using far fewer parameters is demonstrated to outperform many digital models and enables deployment on edge devices.",https://www.nature.com/articles/s41586-026-10635-z,2026-06-17 00:00:00+00:00,"Science, AI"
Nature,https://www.nature.com/nature.rss,CHPO coordinates chilling recovery and nitrogen use in rice,"Nature, Published online: 17 June 2026; doi:10.1038/s41586-026-10682-6 A rice gene, CHPO, links chilling resilience with nitrogen-use efficiency, revealing a domestication-shaped regulatory mechanism that could guide breeding of climate-resilient, sustainable rice varieties.",https://www.nature.com/articles/s41586-026-10682-6,2026-06-17 00:00:00+00:00,Science
Nature,https://www.nature.com/nature.rss,Towards autonomous medical artificial intelligence agents,"Nature, Published online: 17 June 2026; doi:10.1038/s41586-026-10675-5 A large language model artificial intelligence agent operating in a sandboxed electronic health record system can autonomously take patient histories, order tests, interpret findings, diagnose conditions and propose treatments, outperforming experienced clinicians while adhering to safety standards and clinical guidelines.",https://www.nature.com/articles/s41586-026-10675-5,2026-06-17 00:00:00+00:00,"AI, Science"
Nature,https://www.nature.com/nature.rss,How the zebrafish brain weaves recent experiences into future decisions,"Nature, Published online: 17 June 2026; doi:10.1038/d41586-026-01756-6 Animals often use recent experience to guide future choices. Whole-brain imaging in larval zebrafish (Danio rerio) reveals a dedicated neural circuit that governs history-biased decisions: the thalamus maintains the most recent event as a stable pattern of neuronal activity, and the brainstem integrates recent experiences into a continuous signal that biases future action.",https://www.nature.com/articles/d41586-026-01756-6,2026-06-17 00:00:00+00:00,"MedTech, Science"
Nature,https://www.nature.com/nature.rss,Mapping the neuronal building blocks of human language with language models,"Nature, Published online: 17 June 2026; doi:10.1038/s41586-026-10691-5 Wide-scale recordings reveal neurons in the human brain that encode fundamental components of language such as the grammatical relationships between words, their parts of speech and the higher-order syntactic structure of phrases and sentences.",https://www.nature.com/articles/s41586-026-10691-5,2026-06-17 00:00:00+00:00,Science
Nature,https://www.nature.com/nature.rss,A mosaic of whole-body representations on the human precentral gyrus,"Nature, Published online: 17 June 2026; doi:10.1038/s41586-026-10653-x A comprehensive map of the human motor cortex at single-neuron resolution is described.",https://www.nature.com/articles/s41586-026-10653-x,2026-06-17 00:00:00+00:00,Science
Nature,https://www.nature.com/nature.rss,Confined migration induces non-lethal DNA damage in developing neurons,"Nature, Published online: 17 June 2026; doi:10.1038/s41586-026-10648-8 The migration of neurons in developing cerebral and cerebellar cortices is accompanied by massive DNA double-strand breaks due to mechanostress during passage through narrow interstitial spaces.",https://www.nature.com/articles/s41586-026-10648-8,2026-06-17 00:00:00+00:00,Science
Nature,https://www.nature.com/nature.rss,"Lethal plague outbreaks in Lake Baikal hunter-gatherers 5,500 years ago","Nature, Published online: 17 June 2026; doi:10.1038/s41586-026-10540-5 Analyses of ancient DNA from hunter-gatherers near Lake Baikal in southeast Siberia around 5,500 years ago indicate that highly virulent Yersinia pestis emerged earlier than previously estimated, far from the next known cases of infection in Late Neolithic Europe.",https://www.nature.com/articles/s41586-026-10540-5,2026-06-17 00:00:00+00:00,Science
Nature,https://www.nature.com/nature.rss,Reimagining machine vision with optical computing,"Nature, Published online: 17 June 2026; doi:10.1038/d41586-026-01891-0 A general-purpose artificial-intelligence vision system for use in image-sensing devices has been developed by embedding fundamentals of core computer-vision operations into a light-manipulating planar material called an optical metasurface. A prototype enables accurate, real-time perception and processing across diverse tasks, suggesting that this could be a solution for rapid, low-energy, on-device vision intelligence.",https://www.nature.com/articles/d41586-026-01891-0,2026-06-17 00:00:00+00:00,Science
Nature,https://www.nature.com/nature.rss,Molecular basis of polyadenylated RNA fate determination in the nucleus,"Nature, Published online: 17 June 2026; doi:10.1038/s41586-026-10650-0 Biochemical, structural and cell biological analyses reveal that UAP56 (DDX39B) assembles with a TREX-2–like module that redirects non-functional polyadenylated RNAs from export to degradation.",https://www.nature.com/articles/s41586-026-10650-0,2026-06-17 00:00:00+00:00,Science
Nature,https://www.nature.com/nature.rss,Probing picometre-scale interlayer deformations via hyperbolic polaritons,"Nature, Published online: 17 June 2026; doi:10.1038/s41586-026-10638-w A new polaritonic optical method that uses the mid-infrared out-of-plane hyperbolic polaritons mode is described and experimentally validated to allow the examination of picometre-scale interlayer deformations, providing a bridge between nanomechanics and photonics.",https://www.nature.com/articles/s41586-026-10638-w,2026-06-17 00:00:00+00:00,Science
Nature,https://www.nature.com/nature.rss,"How the brain builds sentences, neuron by neuron","Nature, Published online: 17 June 2026; doi:10.1038/d41586-026-01922-w Neural maps reveal the specialized cells that produce speech.",https://www.nature.com/articles/d41586-026-01922-w,2026-06-17 00:00:00+00:00,Science
Nature,https://www.nature.com/nature.rss,A prototype differential atom interferometer for fundamental physics,"Nature, Published online: 17 June 2026; doi:10.1038/s41586-026-10617-1 A prototype differential atom interferometer operates at the standard quantum limit with no excess noise beyond atom shot noise, achieving performance in line with the specifications for future long-baseline atom interferometers.",https://www.nature.com/articles/s41586-026-10617-1,2026-06-17 00:00:00+00:00,Science
Nature,https://www.nature.com/nature.rss,Rock weathering can counteract river CO 2 emissions induced by permafrost thaw,"Nature, Published online: 17 June 2026; doi:10.1038/s41586-026-10664-8 Permafrost thaw on the Qinghai–Tibet Plateau increases rock-weathering rates while reducing river CO2 emissions, suggesting geological carbon fluxes may eventually outpace thaw-driven emissions.",https://www.nature.com/articles/s41586-026-10664-8,2026-06-17 00:00:00+00:00,Science
Nature,https://www.nature.com/nature.rss,Light-controlled microgripper punches above its weight,"Nature, Published online: 17 June 2026; doi:10.1038/d41586-026-01703-5 A microscale gripper that can be opened and closed using light can fit into tight spaces and perform tasks linked to clinical applications.",https://www.nature.com/articles/d41586-026-01703-5,2026-06-17 00:00:00+00:00,Science
Nature,https://www.nature.com/nature.rss,Revealing competitive interfacial reactions in high-energy Li–S batteries,"Nature, Published online: 17 June 2026; doi:10.1038/s41586-025-09473-2 Visualization of concentration-driven phase segregation within high-concentration interfacial layers in the context of high-energy lithium–sulfur batteries using liquid-cell electrochemical transmission electron microscopy reveals competitive interfacial reactions under lean electrolyte conditions at different phase boundaries.",https://www.nature.com/articles/s41586-025-09473-2,2026-06-17 00:00:00+00:00,Science
Nature,https://www.nature.com/nature.rss,Fast formation to reinforce lithium-rich cathodes,"Nature, Published online: 17 June 2026; doi:10.1038/s41586-025-09553-3 Fast formation in lithium-ion batteries outperforms conventional slow formation, lowering costs and improving battery capacity, stability and cycle life, offering broader application to electrode systems.",https://www.nature.com/articles/s41586-025-09553-3,2026-06-17 00:00:00+00:00,Science
Nature,https://www.nature.com/nature.rss,A 98-qubit trapped-ion quantum computer with all-to-all connectivity,"Nature, Published online: 17 June 2026; doi:10.1038/s41586-026-10676-4 A new quantum computer, Quantinuum Helios, which is a 98-qubit trapped-ion quantum processor built on the QCCD architecture, demonstrates performance well beyond classical capabilities and provides a path for scaling up quantum computing.",https://www.nature.com/articles/s41586-026-10676-4,2026-06-17 00:00:00+00:00,Science
Nature,https://www.nature.com/nature.rss,Cortical development dynamics across autism spectrum disorder mouse models,"Nature, Published online: 17 June 2026; doi:10.1038/s41586-026-10679-1 Using single-nucleus multi-omic sequencing, diverse autism spectrum disorder-linked gene mutations converge on transient, stage-specific disruptions in early brain development, and highlight sex-specific gene expression alterations.",https://www.nature.com/articles/s41586-026-10679-1,2026-06-17 00:00:00+00:00,Science
Nature,https://www.nature.com/nature.rss,Structure of the pre-initiation complex explains CMGE biogenesis,"Nature, Published online: 17 June 2026; doi:10.1038/s41586-026-10657-7 Cryo-electron microscopy and biochemical reconstitution experiments in yeast provide insight into the assembly of the CMGE complex, a helicase that establishes bidirectional DNA replication in eukaryotic cells, and elucidate the role of the firing factor Sld2.",https://www.nature.com/articles/s41586-026-10657-7,2026-06-17 00:00:00+00:00,Science
Nature,https://www.nature.com/nature.rss,Optical fibre gripper for high-performance 3D micromanipulation,"Nature, Published online: 17 June 2026; doi:10.1038/s41586-026-10673-7 A miniature three-dimensional optical fibre gripper enables powerful, precise micromanipulation of particles and single cells in confined spaces, bridging the gap between optical and mechanical tweezers.",https://www.nature.com/articles/s41586-026-10673-7,2026-06-17 00:00:00+00:00,Science
Nature,https://www.nature.com/nature.rss,A blastoporal organizer in a ctenophore,"Nature, Published online: 17 June 2026; doi:10.1038/s41586-026-10643-z Experiments using the comb jelly Mnemiopsis leidyi and the sea anemone Nematostella vectensis reveal that the emergence of a core signalling pathway may have been a key innovation enabling the transition to multicellularity in animals.",https://www.nature.com/articles/s41586-026-10643-z,2026-06-17 00:00:00+00:00,Science
Nature,https://www.nature.com/nature.rss,A distant brown dwarf coplanar to a warm Jupiter and a hot super-Earth,"Nature, Published online: 17 June 2026; doi:10.1038/s41586-026-10586-5 Analysis of long-term radial velocity data and transit time variations, induced by a super-Earth, a warm Jupiter and a brown dwarf in a coplanar orbit around the relatively young star TOI201.",https://www.nature.com/articles/s41586-026-10586-5,2026-06-17 00:00:00+00:00,Science
Nature,https://www.nature.com/nature.rss,Emergent decadal predictability in Antarctic contribution to sea-level rise,"Nature, Published online: 17 June 2026; doi:10.1038/s41586-026-10614-4 Although Antarctic ice loss projections diverge widely by 2100, this Perspective shows that present-day rates robustly predict mid-century sea level rise, providing a firm basis for near-term planning, while highlighting priorities for model development aimed at resolving longer-term sea level rise uncertainty.",https://www.nature.com/articles/s41586-026-10614-4,2026-06-17 00:00:00+00:00,Science
Nature,https://www.nature.com/nature.rss,DNA from hunter-gatherer teeth reveals secrets of ancient plague,"Nature, Published online: 17 June 2026; doi:10.1038/d41586-026-01941-7 Analysis shows evidence of deadly outbreaks 5,500 years ago — plus, a prototype dark-matter detector.",https://www.nature.com/articles/d41586-026-01941-7,2026-06-17 00:00:00+00:00,Science
