source,feed_url,headline,summary,url,published_date,topics
War on the Rocks,https://warontherocks.com/feed/,The Next Transformation of U.S. Shipbuilding,"This exclusive Cogs of War interview is with Eric Chewning, the executive vice president of maritime systems and corporate strategy at HII. As HII is America&#8217;s largest and one of its oldest military shipbuilders, we asked him to share his thoughts on maritime startups, reindustrialization policy, and more.Shipbuilding has been slow to adopt AI and other automated tools in comparison to other manufacturing industries. What cultural shifts inside a century-old yard are the hardest to drive when adopting new design/manufacturing tools?While HII has been using advanced automation to accelerate production in our shipyards for years, shipbuilding use cases have been The post The Next Transformation of U.S. Shipbuilding appeared first on War on the Rocks .",https://warontherocks.com/2026/03/the-next-transformation-of-u-s-shipbuilding/,2026-03-24 08:00:38+00:00,"Defense, Startups"
Phys.org,https://phys.org/rss-feed/,"XRISM identifies gamma Cas X-ray origin, solving a 50-year-old stellar mystery","Visible to the naked eye in the constellation Cassiopeia, the star γ Cas has puzzled astrophysicists for half a century. It emits X-rays of an intensity and temperature incompatible with what one would expect from an ordinary massive star. Observations, carried out using the Resolve instrument aboard the Japanese XRISM telescope, now allow us to attribute this emission to the white dwarf orbiting γ Cas. This also confirms the existence of a family of binary systems long predicted to exist but never identified.",https://phys.org/news/2026-03-xrism-gamma-cas-ray-year.html,2026-03-24 08:00:03+00:00,Other
Phys.org,https://phys.org/rss-feed/,Nanoparticles enable large-scale production of advanced cell therapies,"Researchers from Xi'an Jiaotong-Liverpool University (XJTLU) in China have developed a streamlined process that makes it easier to produce tiny therapeutic particles released by cells, called exosomes, which are being explored as a new type of medical treatment. Using a nanoparticle-based system, the researchers were able to overcome a major barrier that has slowed the medical and industrial deployment of these therapies. Their findings were published in the journal Advanced Science.",https://phys.org/news/2026-03-nanoparticles-enable-large-scale-production.html,2026-03-24 08:00:01+00:00,"Science, Biotech"
War on the Rocks,https://warontherocks.com/feed/,Converting History into Hard Power: A Polish-German Reckoning,"Beneath the surface of Polish-German alignment within NATO lies an unresolved problem with growing strategic weight: Almost 70 percent of the Polish public believes that Germany has not made amends for the destruction it wrought on Poland during World War II. As a U.S.-Chinese great power rivalry intensifies, American engagement in Europe becomes less assured, and Berlin aspires to lead on European security, this unfinished ledger is no longer a purely historical or legal matter. It increasingly conditions how German leadership is perceived in Warsaw and across the region. If German rearmament proceeds without a corresponding architecture of trust, doubts The post Converting History into Hard Power: A Polish-German Reckoning appeared first on War on the Rocks .",https://warontherocks.com/2026/03/converting-history-into-hard-power-a-polish-german-reckoning/,2026-03-24 07:30:21+00:00,Defense
TechCrunch,https://techcrunch.com/feed/,"Delve halts demos, Insight Partners scrubs investment post amid ‘fake compliance’ allegations","After a whistleblower alleged that the startup fabricated audit evidence, its prominent Series A investor removed an article detailing why it led the deal.",https://techcrunch.com/2026/03/23/delve-halts-demos-insight-partners-scrubs-investment-post-amid-fake-compliance-allegations/,2026-03-24 05:26:20+00:00,"Funding, Startups"
Phys.org,https://phys.org/rss-feed/,Agricultural soils exposed to controversial weedkiller may be unexpected breeding ground for hospital 'superbugs',"Each year, antimicrobial resistance (AMR) is responsible for an estimated 1.1 to 1.4 million deaths worldwide. Now, scientists have found evidence that the spread of AMR isn't always driven by bacteria evolving to resist the antibiotics themselves: rather, certain weedkillers can have the same effect.",https://phys.org/news/2026-03-agricultural-soils-exposed-controversial-weedkiller.html,2026-03-24 05:00:01+00:00,Science
Phys.org,https://phys.org/rss-feed/,"When NASA's experimental technology detects a tsunami, it may help save lives","A new data visualization illustrates how an experimental NASA technology can provide extra lead time to communities in the path of a tsunami. Called GUARDIAN (GNSS Upper Atmospheric Real-time Disaster Information and Alert Network), the software detects slight distortions in satellite navigation signals to spot hazards on the move.",https://phys.org/news/2026-03-nasa-experimental-technology-tsunami.html,2026-03-24 02:40:01+00:00,Other
Payload Space,https://payloadspace.com/feed/,Beyond the Rocket: The Digital Infrastructure of the Artemis II Mission,"When Artemis II lifts off, the world will see a rocket. What it won’t see is the digital architecture that makes the mission possible. “It [Artemis] may look similar up there on the pad, but it’s completely different from Apollo,” said Karen Fields, vice president and NASA account lead at Booz Allen. “The vehicle is… The post Beyond the Rocket: The Digital Infrastructure of the Artemis II Mission appeared first on Payload .",https://payloadspace.com/beyond-the-rocket-the-digital-infrastructure-of-the-artemis-ii-mission/,2026-03-24 02:34:07+00:00,Space
Phys.org,https://phys.org/rss-feed/,"Yes, AI could boost productivity, but work is about more than maximizing output","Worries about the British economy have long been dominated by one persistent concern—weak productivity. Since the financial crisis of 2008, growth has stagnated, leaving the UK trailing well behind the US, France and Germany across that whole period.",https://phys.org/news/2026-03-ai-boost-productivity-maximizing-output.html,2026-03-24 02:00:04+00:00,Other
Satellite Today,https://www.satellitetoday.com/feed/,Amazon Leo Readies 200+ Satellites for Orbit as It Ramps Up Launch Schedule,"More than 200 Amazon Leo satellites are loaded onto six dispensers at Cape Canaveral, ready to be launched into orbit in the coming months as Amazon prepares to ramp up... The post Amazon Leo Readies 200+ Satellites for Orbit as It Ramps Up Launch Schedule appeared first on Via Satellite .",https://www.satellitetoday.com/connectivity/2026/03/23/amazon-leo-readies-200-satellites-for-orbit-as-it-ramps-up-launch-schedule/,2026-03-24 01:52:23+00:00,Space
Satellite Today,https://www.satellitetoday.com/feed/,"Space Force, Industry Leaders Warn of Critical Gaps in Orbital Intelligence","With a kaleidoscope of ground radars, electro-optical telescopes, and Geostationary (GEO) spy satellites, the U.S. Space Force can closely track space objects as they hurtle through orbit. But in terms... The post Space Force, Industry Leaders Warn of Critical Gaps in Orbital Intelligence appeared first on Via Satellite .",https://www.satellitetoday.com/government-military/2026/03/23/space-force-industry-leaders-warn-of-critical-gaps-in-orbital-intelligence/,2026-03-24 01:51:09+00:00,Space
Phys.org,https://phys.org/rss-feed/,Why a canceled meeting feels so liberating,"Unless your employer is Lumon Industries, where the ""Severance"" workday never ends, a canceled meeting can feel like a gift of limitless time. A Rutgers University study published in the Journal of the Association for Consumer Research explains why: Unexpectedly gaining time alters our perception of how that time passes, which in turn affects how we spend it.",https://phys.org/news/2026-03-canceled-liberating.html,2026-03-24 01:30:01+00:00,Science
Phys.org,https://phys.org/rss-feed/,"In Hollywood, teams don't stick together long enough to learn from failure, data reveal","Hollywood loves a comeback story: a director who flopped and then returned with a masterpiece or the producer who went bust and bounced back with a winner. It's a narrative rooted in the business belief that failure is a great teacher. But what if, for certain teams, failure teaches nothing at all?",https://phys.org/news/2026-03-hollywood-teams-dont-failure-reveal.html,2026-03-24 01:00:04+00:00,Other
Satellite Today,https://www.satellitetoday.com/feed/,Interview With TE Connectivity Principal Engineer Bruce Conway at SATShow Week,"In this interview to kick off SATShow Week, TE Connectivity Principal Engineer Bruce Conway talks about the company&#8217;s interconnects for satellites and solar panels and its deep space heritage on... The post Interview With TE Connectivity Principal Engineer Bruce Conway at SATShow Week appeared first on Via Satellite .",https://www.satellitetoday.com/partner-content/2026/03/23/interview-with-te-connectivity-principal-engineer-bruce-conway-at-satshow-week/,2026-03-24 00:55:45+00:00,Space
Phys.org,https://phys.org/rss-feed/,"Research suggests negative emotions at work can help, depending on leaders' empathy","During a widespread crisis, negative emotions don't simply go away once the workday begins. Organizational scholars who study how emotions affect employees tend to assume that negative emotions equal negative outcomes. That isn't always the case, according to new research from David Lebel, associate professor of business administration in the School of Business and director of the Berg Center for Ethics & Leadership.",https://phys.org/news/2026-03-negative-emotions-leaders-empathy.html,2026-03-24 00:20:01+00:00,Science
Nature,https://www.nature.com/subjects/medical-research.rss,The utility of aqueous and serum apolipoprotein E and galectin-3 as biomarkers of neuroinflammation in glaucoma,,https://www.nature.com/articles/s41598-026-45007-0,2026-03-24 00:00:00+00:00,Other
Nature,https://www.nature.com/subjects/medical-research.rss,Effects of multisensory stimulation based on immersive virtual reality in postoperative neuropsychiatric recovery after gynecological laparoscopy,,https://www.nature.com/articles/s41746-026-02515-7,2026-03-24 00:00:00+00:00,Other
Nature,https://www.nature.com/subjects/medical-research.rss,Clinical feasibility of intratracheal tracheostomy sealing using a novel sealing disc prototype,,https://www.nature.com/articles/s41598-026-41209-8,2026-03-24 00:00:00+00:00,Other
Phys.org,https://phys.org/rss-feed/,"Adding 1,000 immigrants tied to 142 more health workers, fewer elderly deaths","New research finds the addition of a thousand new immigrants in a metropolitan area reduces elderly mortality by about 10 deaths than would be typical. Why? Because among the newcomers are foreign-born health care workers who are arriving amid a critical nationwide shortage, according to the study's authors, who hail from Harvard Medical School, the Massachusetts Institute of Technology, and the University of Rochester.",https://phys.org/news/2026-03-adding-immigrants-health-workers-elderly.html,2026-03-23 23:50:01+00:00,Science
TechCrunch,https://techcrunch.com/feed/,"Emil Michael, now a senior Pentagon official, says he’ll never forgive Uber investors who ousted him and Kalanick","When asked whether he was still ""salty"" about about being shown the door at Uber, alongside co-founder Travis Kalanick, Michael didn't equivocate. ""I'll never forget that, nor forgive,"" he said.",https://techcrunch.com/2026/03/23/emil-michael-now-a-senior-pentagon-official-says-hell-never-forgive-uber-investors-who-ousted-him-and-kalanick/,2026-03-23 23:49:10+00:00,"Startups, Funding"
Phys.org,https://phys.org/rss-feed/,Drought spurs rise in antibiotic-resistant soil microbes,"A new Caltech study indicates that drought increases the abundances of antibiotic-resistant microorganisms in soils, which directly correlates with an increase in antibiotic-resistant infections in hospitals. In other words, regions experiencing high aridity—hotter, drier regions—also experience higher levels of antibiotic-resistant infections. The work demonstrates the interconnectedness of climate, environment, and human health.",https://phys.org/news/2026-03-drought-spurs-antibiotic-resistant-soil.html,2026-03-23 23:40:02+00:00,Science
TechCrunch,https://techcrunch.com/feed/,"Bengaluru food delivery startup Swish raises $38M, its third round in 18 months","Swish has more than doubled its valuation in a year as its full-stack, hyperlocal model positions ultra-fast food delivery as a high-frequency habit.",https://techcrunch.com/2026/03/23/bengaluru-food-startup-swish-raises-38m-in-its-third-round-in-18-months/,2026-03-23 23:30:00+00:00,"Funding, Startups"
Phys.org,https://phys.org/rss-feed/,"Male bats sing in the rotor-swept zone of wind turbines, potentially raising collision risk","A research team led by the Museum für Naturkunde presents the first evidence that several bat species produce courtship songs in the immediate rotor-swept zone of wind turbines while circling around the nacelle. Data from over 80,000 audio recordings at nacelle height from six German sites, together with stereo-thermal 3D reconstructions of bat flight trajectories, document both bat song and elevated bat density in the rotor-swept zone. Both lines of evidence suggest that, under certain circumstances, bats actively approach wind turbines and provide an explanation for why collision risk may increase during the mating season.",https://phys.org/news/2026-03-male-rotor-swept-zone-turbines.html,2026-03-23 23:20:03+00:00,Science
Phys.org,https://phys.org/rss-feed/,"Biosensor detects early fungal outbreaks, advances plant biotechnology","A new biosensor developed at the Department of Energy's Oak Ridge National Laboratory detects the emerging presence of fungus on plants at the molecular level, paving the way for next-generation crop protection and the development of stress-tolerant plants. The innovation advances technology for the U.S. agricultural and biomanufacturing sectors.",https://phys.org/news/2026-03-biosensor-early-fungal-outbreaks-advances.html,2026-03-23 23:10:07+00:00,"Biotech, Science"
Phys.org,https://phys.org/rss-feed/,Shift in key cosmic inflation measurement could be a statistical artifact,"For the last few decades, researchers have been studying what the universe looked like in its first seconds. It is generally accepted that the universe expanded exponentially in the first fraction of a second after the Big Bang. Researchers use ns, the scalar spectral index, to characterize how primordial density fluctuations were distributed across different length scales in the early universe. The value of ns is a central observable in inflationary cosmology, since different inflationary scenarios predict distinct values for this quantity, making it a powerful discriminator between models.",https://phys.org/news/2026-03-shift-key-cosmic-inflation-statistical.html,2026-03-23 23:00:03+00:00,Science
TechCrunch,https://techcrunch.com/feed/,"Despite bitter rivalry, Kalshi, Polymarket CEOs back $35M predictions markets VC fund","As prediction markets explode, the new firm called 5(c) Capital, will back startups supporting the burgeoning category.",https://techcrunch.com/2026/03/23/despite-bitter-rivalry-kalshi-polymarket-ceos-back-35m-predictions-markets-vc-fund/,2026-03-23 22:57:53+00:00,Startups
Phys.org,https://phys.org/rss-feed/,Euthanasia rates for stray dogs triple as more animals enter UK shelters,"A stark rise in the number of stray dogs being euthanized across the UK and the Republic of Ireland, with rates more than tripling over a three-year period, are revealed in a new collaborative study. The research is published in Animals.",https://phys.org/news/2026-03-euthanasia-stray-dogs-triple-animals.html,2026-03-23 22:40:04+00:00,Science
Phys.org,https://phys.org/rss-feed/,"Gran Dolina site at Atapuerca reveals almost exclusive use of local chert 400,000 years ago","A paper published in the journal Quaternary International reveals a distinctive technological behavior at level TD10.2-BB of Gran Dolina (Atapuerca, Burgos), characterized by the almost exclusive use of local chert and linked to one of the earliest pieces of evidence of communal hunting in the human evolutionary record, dated to around 400,000 years ago.",https://phys.org/news/2026-03-gran-dolina-site-atapuerca-reveals.html,2026-03-23 22:40:01+00:00,Science
TechCrunch,https://techcrunch.com/feed/,Air Street becomes one of the largest solo VCs in Europe with $232M fund,London’s Air Street Capital has raised a large Fund III with eyes locked on backing early-stage European and North American AI companies.,https://techcrunch.com/2026/03/23/air-street-becomes-one-of-the-largest-solo-vcs-in-europe-with-232m-fund/,2026-03-23 22:36:39+00:00,"Startups, Funding"
TechCrunch,https://techcrunch.com/feed/,Apple Maps may be about to get ads,"Apple Maps may soon serve ads in top results when users search on terms like ""restaurants.""",https://techcrunch.com/2026/03/23/apple-maps-may-be-about-to-get-ads/,2026-03-23 22:33:03+00:00,Other
Phys.org,https://phys.org/rss-feed/,New findings on the first steps in protein synthesis,"In the earliest phase of creating human proteins, the protein complex NAC performs an essential task by starting the first steps toward folding proteins into their correct three-dimensional structures. An international research team led by scientists from the Center for Molecular Biology of Heidelberg University has found that the NAC complex binds to the nascent protein building blocks formed by the ribosome, i.e., the amino acid chains, and initiates the folding that is essential for functional proteins.",https://phys.org/news/2026-03-protein-synthesis.html,2026-03-23 22:30:02+00:00,Science
Phys.org,https://phys.org/rss-feed/,Single-cell sequencing reveals unexpected protist diversity,"Researchers from the Earlham Institute, in collaboration with the Department of Biology at the University of Oxford, have discovered three previously unrecognized lineages of the protist Bodo, each with its own bacterial endosymbiont (a symbiotic organism living within the body of its host).",https://phys.org/news/2026-03-cell-sequencing-reveals-unexpected-protist.html,2026-03-23 22:20:05+00:00,Science
Phys.org,https://phys.org/rss-feed/,Why cultivating drought-resistant plants disappoints: Soil physics may be the real bottleneck,"Plants need water, light, and air to thrive. But when they transport water from the soil up to their leaves, they defy gravity. Scientists describe this astonishing phenomenon as ""negative water potential,"" a form of negative tension that enables herbs, shrubs, and trees to draw water from the soil. Nevertheless, plants do not constantly extract water from the soil. For decades, researchers have sought to understand what limits a plant's water uptake.",https://phys.org/news/2026-03-cultivating-drought-resistant-disappoints-soil.html,2026-03-23 22:20:03+00:00,Science
Phys.org,https://phys.org/rss-feed/,A sudden surge in luminosity: Stacked dyes hint at brighter organic semiconductors,"In nature, a certain size is often a prerequisite for biomolecules to perform their specific functions. For example, for proteins or DNA to fulfill their vital tasks, they must be folded in a precise manner—and this requires a certain minimum length.",https://phys.org/news/2026-03-sudden-surge-luminosity-stacked-dyes.html,2026-03-23 22:10:02+00:00,Other
Phys.org,https://phys.org/rss-feed/,Chaos as a matter of direction: Researchers build layered material where order and disorder coexist,"Some materials behave unexpectedly. They crack differently than expected, or react in ways that are hard to explain. The answer often lies in their atomic structure. Is it neatly arranged, as in a crystal, or disordered, as in glass? Researchers at the University of Twente have now created a material that is both simultaneously. In two directions it is disordered; in the third, perfectly ordered. Their findings have been published in Nature Communications.",https://phys.org/news/2026-03-chaos-layered-material-disorder-coexist.html,2026-03-23 22:00:07+00:00,Science
Phys.org,https://phys.org/rss-feed/,From slices to whole bodies: How 3D cell atlases could reshape pathology research,"In conventional pathology and physiology research, two-dimensional (2D) analysis—observing thinly sliced tissue sections—has been mainstream, making it difficult to comprehensively understand the distribution of cells across entire organs or throughout the whole organism. Therefore, a new analytical platform has been needed to quantitatively elucidate developmental processes of the organism, drug efficacy and adverse effects, and disease-related changes at the whole-organ or whole-body level.",https://phys.org/news/2026-03-slices-bodies-3d-cell-atlases.html,2026-03-23 22:00:03+00:00,Science
Phys.org,https://phys.org/rss-feed/,Is the biggest march in English history a myth? My research shows King Harold sailed down to the battle of Hastings,"In 1066, England was invaded by multiple foreign powers. A northern force led by King Harald Hardrada of Norway advanced on York via the River Humber, while a southern force, led by Duke William of Normandy (later William I the Conqueror) crossed the Channel with forces from Normandy, France, Brittany and Ponthieu, and took up position at Hastings.",https://phys.org/news/2026-03-biggest-english-history-myth-king.html,2026-03-23 21:50:05+00:00,Science
Phys.org,https://phys.org/rss-feed/,Study reshapes understanding of interaction between organelles in animal cells,"Findings from a new University of Cincinnati study have reshaped the fundamental understanding of how a certain cell organelle prepares its environment for cellular digestion. The study, led by UC's Jiajie Diao, Ph.D. and published in Cell Reports, focused on the lysosome, an organelle within animal cells that contributes to a number of cellular functions. This includes helping to break down materials into more useful energy sources, similar to how the intestines digest food into usable nutrients on the whole-body level.",https://phys.org/news/2026-03-reshapes-interaction-organelles-animal-cells.html,2026-03-23 21:50:03+00:00,Science
Phys.org,https://phys.org/rss-feed/,"High-pressure freezing boosts cell survival with less cryoprotectant, study shows","A high-pressure method of instantaneously freezing cells has proven to be effective in the first empirical validation of its kind. Through further development, the method holds promise in finding broad applications in regenerative medicine research. The results are published in the journal PNAS Nexus.",https://phys.org/news/2026-03-high-pressure-boosts-cell-survival.html,2026-03-23 21:40:11+00:00,Science
Phys.org,https://phys.org/rss-feed/,First quantum oscillations observed in gallium nitride holes,"Gallium nitride, a semiconductor that can operate at high voltages, temperatures, and frequencies, has enabled technologies from LED lighting to high-power electronics. Now Cornell researchers have observed a quantum property of the material for the first time, an advance that could expand its technological reach.",https://phys.org/news/2026-03-quantum-oscillations-gallium-nitride-holes.html,2026-03-23 21:40:01+00:00,Science
SpaceNews,https://spacenews.com/feed/,Space Force adds cyber units to guard rocket launches,&#8216;Cyber defense&#8217; squadrons at Cape Canaveral and Vandenberg reflect growing concern over malicious hacks The post Space Force adds cyber units to guard rocket launches appeared first on SpaceNews .,https://spacenews.com/space-force-adds-cyber-units-to-guard-rocket-launches/,2026-03-23 21:37:35+00:00,Defense
Phys.org,https://phys.org/rss-feed/,"Engineered E. coli can monitor arsenic, offering a cheap biosensor","Cornell scientists have engineered E. coli to act as a sensitive biosensor for monitoring environmental arsenic, a toxic pollutant most notably found in rice paddies in Southeast Asia. Their new study provides a proof of principle for a potentially cheap living sensor that can record even transient arsenic exposure under anaerobic conditions, preserve this information in the genome and allow delayed readout later in the open air of the lab.",https://phys.org/news/2026-03-coli-arsenic-cheap-biosensor.html,2026-03-23 21:30:04+00:00,Science
Phys.org,https://phys.org/rss-feed/,Record-smashing heat continues: 'Basically the entire U.S. is going to be hot',"After smashing March heat records in 14 states and the U.S. as a whole, the gigantic heat dome that's baked the Southwest is creeping eastward and may end up being one of the most expansive heat waves in American history, meteorologists and weather historians said.",https://phys.org/news/2026-03-basically-entire-hot.html,2026-03-23 21:30:03+00:00,Other
Phys.org,https://phys.org/rss-feed/,CryoPRISM: A new tool for observing cellular machinery in a more natural environment,"The blobfish, once considered the ugliest animal in the world, has since had quite the redemption arc. Years after it was first discovered, scientists realized that the deep-sea creature appeared so unnervingly blobby only because it went through an extreme change in pressure when it was brought up to the surface. In its natural environment, 4,000 feet underwater, the fish looks perfectly handsome.",https://phys.org/news/2026-03-cryoprism-tool-cellular-machinery-natural.html,2026-03-23 21:20:04+00:00,Science
