source,feed_url,headline,summary,url,published_date,topics
Phys.org,https://phys.org/rss-feed/,"Raft of targeted conservation efforts may help boost leopard numbers in sub-Saharan Africa, study suggests","There could be fewer leopards living across sub-Saharan Africa than previously believed, according to a new study that has analyzed suitable habitat and conditions. It is hoped that the research, led by conservation scientists at Nottingham Trent University, could be used to help plan vital recovery efforts and focus conservation where it is most needed.",https://phys.org/news/2026-07-raft-efforts-boost-leopard-saharan.html,2026-07-06 23:00:07+00:00,Science
Phys.org,https://phys.org/rss-feed/,Hummingbirds speed up pineapple family's evolution,"Hummingbirds make bromeliad plants split into new species twice as fast as other pollinators do, scientists at the University of Reading have found. The research team gathered records of which animals pollinate 403 types of bromeliad, which include pineapples and more than 3,700 species, and found three in four of these plants are visited by hummingbirds.",https://phys.org/news/2026-07-hummingbirds-pineapple-family-evolution.html,2026-07-06 23:00:03+00:00,Science
Phys.org,https://phys.org/rss-feed/,Heat waves: Expert tips on redesigning UK homes to cope with hotter temperatures,"As the UK prepares for the third heat wave of 2026, most people will be hoping to keep cool at home. Building regulations to protect homes from overheating were introduced in 2022. These require all new homes to be checked at the design stage to see if they might be at risk of overheating. If the overheating risk is high, the architect has to make changes to the design.",https://phys.org/news/2026-07-expert-redesigning-uk-homes-cope.html,2026-07-06 22:40:03+00:00,Other
Phys.org,https://phys.org/rss-feed/,"Climate change means an earlier spring, which can be disorienting and threatening for migrating birds","Spring migration has taken flight, but with rising temperatures and shifting seasons, birds are adjusting when and how they migrate to keep up with a rapidly warming climate. Morgan Tingley, a professor of ecology and evolutionary biology at the University of California, Los Angeles, studies the effects of climate change on birds.",https://phys.org/news/2026-07-climate-earlier-disorienting-threatening-migrating.html,2026-07-06 22:20:01+00:00,Other
Phys.org,https://phys.org/rss-feed/,'Outed' by the algorithm—how social media is revealing queer identity ahead of self-disclosure,"Social media algorithms are increasingly revealing users' sexual orientation or gender identity before they have consciously come out to themselves or others, according to new research. The new study published in Gender, Place & Culture coins the term ""algorithmic outing""—when digital platforms infer and surface a user's LGBTQ+ identity through personalized content and recommendations based on engagement signals such as liking a video, following a creator or lingering on certain posts.",https://phys.org/news/2026-07-outed-algorithm-social-media-revealing.html,2026-07-06 22:00:03+00:00,Science
Phys.org,https://phys.org/rss-feed/,Africa's wildlife laws follow a colonial model that separates people and animals: Why it's not working,"Africa is home to many iconic national parks and marine reserves, such as Virunga in the Democratic Republic of the Congo, Niokolo-Koba in Senegal, Kruger National Park in South Africa and Serengeti National Park in Tanzania. Many of them were established during the colonial era, and nearly half are still managed by government agencies.",https://phys.org/news/2026-07-africa-wildlife-laws-colonial-people.html,2026-07-06 21:40:06+00:00,Other
Phys.org,https://phys.org/rss-feed/,Storms impact the architecture of webs and the survival of spiders,"In the dense forests of the Ecuadorian Andes, the survival of a spider relies not only on its ability to prey on insects but also on its capacity to resist a threat coming from the skies. A new study revealed that the heavy rainfall that hits the region acts as an ""ecological filter,"" bombarding spider webs and, in the process, determining which species and silk architectures are able to master each environment.",https://phys.org/news/2026-07-storms-impact-architecture-webs-survival.html,2026-07-06 21:40:01+00:00,Science
Phys.org,https://phys.org/rss-feed/,Sea stars offer rare view of how embryonic tubes become complex organs,"Biologists have long puzzled over how organs develop into their final shapes, and the nearly transparent bodies of young sea stars may offer a unique window into the organ development process.",https://phys.org/news/2026-07-sea-stars-rare-view-embryonic.html,2026-07-06 21:20:08+00:00,Other
Phys.org,https://phys.org/rss-feed/,Bringing rice back to Hawaiʻi: Japanese cultivars yield high-quality grains in just three months,"In a major step toward enhancing food security and exploring the potential to bring rice farming back to Hawaiʻi, an international research team has successfully cultivated premium Japanese rice varieties on Kauaʻi using a water-saving, upland cultivation method. The rice matured approximately one month earlier than it typically does in Japan, yet produced yields comparable to those of upland rice grown in Japan, with superior grain appearance and quality.",https://phys.org/news/2026-07-rice-hawaii-japanese-cultivars-yield.html,2026-07-06 21:20:04+00:00,Science
Breaking Defense,https://breakingdefense.com/feed/,What to expect from the US at the 2026 NATO summit,Here are a few things we&#8217;re monitoring during this week&#8217;s alliance summit in Turkey.,https://breakingdefense.com/2026/07/what-the-pentagon-wants-from-the-2026-nato-summit/,2026-07-06 20:48:30+00:00,Defense
Breaking Defense,https://breakingdefense.com/feed/,Thales acquires Exail Technologies stake as it expands undersea warfare footprint,Italian shipbuilding company Fincantieri also announced today an agreement to acquire four underwater technology firms.,https://breakingdefense.com/2026/07/thales-acquires-exail-technologies-stake-as-it-expands-undersea-warfare-footprint/,2026-07-06 20:42:12+00:00,Defense
Satellite Today,https://www.satellitetoday.com/feed/,An Expedition Across the Arctic-Space Connection With David Marsh,What can the hostile environment of the Arctic teach us about space? David Marsh recently returned from a first-hand journey to find out. He joins On Orbit this week after [&#8230;] The post An Expedition Across the Arctic-Space Connection With David Marsh appeared first on Via Satellite .,https://www.satellitetoday.com/podcast/2026/07/06/an-expedition-across-the-arctic-space-connection-with-david-marsh/,2026-07-06 20:36:52+00:00,Space
Breaking Defense,https://breakingdefense.com/feed/,Canada selects Germany’s ThyssenKrupp to build new submarine fleet,"The planned purchase will be groundbreaking for Canada’s naval capabilities, as the country has not acquired newly built submarines in over 60 years.",https://breakingdefense.com/2026/07/canada-selects-germanys-thyssenkrupp-to-build-new-submarine-fleet/,2026-07-06 20:28:15+00:00,Other
SpaceNews,https://spacenews.com/feed/,Blue Origin continues work on lunar landers during recovery from New Glenn explosion,"Blue Origin is continuing to develop its Blue Moon lunar landers, with seven vehicles in production, while recovering from the New Glenn pad explosion more than a month ago. The post Blue Origin continues work on lunar landers during recovery from New Glenn explosion appeared first on SpaceNews .",https://spacenews.com/blue-origin-continues-work-on-lunar-landers-during-recovery-from-new-glenn-explosion/,2026-07-06 20:09:47+00:00,Other
Satellite Today,https://www.satellitetoday.com/feed/,Neo Space and Hughes Deploy 3 Ground Gateways to Support IFC,Neo Space Group and Hughes Network Systems have deployed three new Hughes ground gateways in Saudi Arabia and Europe to support NSG’s in-flight connectivity. NSG on Monday announced new gateways with [&#8230;] The post Neo Space and Hughes Deploy 3 Ground Gateways to Support IFC appeared first on Via Satellite .,https://www.satellitetoday.com/technology/2026/07/06/neo-space-and-hughes-deploy-3-ground-gateways-to-support-ifc/,2026-07-06 20:04:37+00:00,Other
Breaking Defense,https://breakingdefense.com/feed/,"Ondas makes $876M acquisition of DYZNE, latest in acquisition spree","After buying eight companies in the last two years, Ondas execs say they will focus on integrating their portfolio of drones “from surface to stratosphere” by developing a new AI command system in partnership with Palantir.",https://breakingdefense.com/2026/07/ondas-makes-876m-acquisition-of-dyzne-latest-in-acquisition-spree/,2026-07-06 20:03:33+00:00,Other
Satellite Today,https://www.satellitetoday.com/feed/,Univity Signs MoU With Indonesia’s Telkomsat on VLEO and D2D Connectivity,"Univity has signed an MoU with Indonesian national satellite operator Telkomsat to explore collaboration on satellite connectivity. The MoU announced Monday includes assessing Very Low Earth Orbit (VLEO) architecture, and [&#8230;] The post Univity Signs MoU With Indonesia’s Telkomsat on VLEO and D2D Connectivity appeared first on Via Satellite .",https://www.satellitetoday.com/connectivity/2026/07/06/univity-signs-mou-with-indonesias-telkomsat-on-vleo-and-d2d-connectivity/,2026-07-06 19:57:08+00:00,Space
Satellite Today,https://www.satellitetoday.com/feed/,Mission to Rescue NASA Swift Observatory Launches,"The mission to boost NASA’s Swift Observatory launched over the weekend, and teams have made contact with the Katalyst Space LINK servicing spacecraft. Northrop Grumman launched the mission on its [&#8230;] The post Mission to Rescue NASA Swift Observatory Launches appeared first on Via Satellite .",https://www.satellitetoday.com/launch/2026/07/06/mission-to-rescue-nasa-swift-observatory-launches/,2026-07-06 19:55:37+00:00,Space
Satellite Today,https://www.satellitetoday.com/feed/,Cyber in Space Signs Partnership Deal with ExeQuantum,Cyber in Space hopes a partnership with ExeQuantum will enable it to deliver better advanced cyber resilience and quantum-readiness services to organizations across the global aerospace and space ecosystem. The [&#8230;] The post Cyber in Space Signs Partnership Deal with ExeQuantum appeared first on Via Satellite .,https://www.satellitetoday.com/cybersecurity/2026/07/06/cyber-in-space-signs-partnership-deal-with-exequantum/,2026-07-06 19:50:31+00:00,Other
TechCrunch,https://techcrunch.com/feed/,Vercel CEO Guillermo Rauch on the fight to split off models from agents,"""The reality is, when you're optimizing for production, you start looking at a price/performance,"" Guillermo Rauch tells TechCrunch.",https://techcrunch.com/2026/07/06/vercel-ceo-guillermo-rauch-on-the-fight-to-split-off-models-from-agents/,2026-07-06 19:49:10+00:00,Other
SpaceNews,https://spacenews.com/feed/,Iridium folds Aireon aviation safety service into Rocket Lab-bound business,"Iridium Communications has completed its takeover of Aireon, bringing the aircraft-tracking venture fully in-house ahead of the satellite operator’s planned $8 billion sale to Rocket Lab. The post Iridium folds Aireon aviation safety service into Rocket Lab-bound business appeared first on SpaceNews .",https://spacenews.com/iridium-folds-aireon-aviation-safety-service-into-rocket-lab-bound-business/,2026-07-06 19:02:32+00:00,"Space, Startups"
TechCrunch,https://techcrunch.com/feed/,You can now customize Siri’s pace and expressivity in the latest iOS 27 beta,"The update is part of Apple's broader effort to make Siri feel more natural and personal, as it rebuilds the assistant around generative AI.",https://techcrunch.com/2026/07/06/you-can-now-customize-siris-pace-and-expressivity-in-the-latest-ios-27-beta/,2026-07-06 19:01:59+00:00,AI
TechCrunch,https://techcrunch.com/feed/,Every major tech layoff in 2026 that has name-checked AI,A running look — in reverse chronological order — at the bigger tech companies that have announced significant layoffs this year with AI as a stated factor.,https://techcrunch.com/2026/07/06/the-running-list-major-tech-layoffs-in-2026-where-employers-cited-ai/,2026-07-06 18:35:00+00:00,Other
Breaking Defense,https://breakingdefense.com/feed/,"Army makes new tweaks to acquisition portfolios, realigns autonomy office","The Army’s approach to acquisition portfolios, which is in flux after an overhaul in the fall, is to “keep what is working and change what is not,” a service spokesperson told Breaking Defense.",https://breakingdefense.com/2026/07/army-makes-new-tweaks-to-acquisition-portfolios-realigns-autonomy-office/,2026-07-06 18:13:15+00:00,Defense
TechCrunch,https://techcrunch.com/feed/,Amazon competitor Bookshop.org says Kobo eReader support will happen this year after all,"Bookship.org seemed to delay this anticipated partnership again, but tells TechCrunch that it has settled business terms and is working on integration.",https://techcrunch.com/2026/07/06/amazon-competitor-bookshop-org-says-kobo-e-reader-support-will-happen-this-year-after-all/,2026-07-06 18:12:01+00:00,Other
MIT Technology Review,https://www.technologyreview.com/feed/,Your family’s $300 stake in OpenAI,"This story originally appeared in The Algorithm, our weekly newsletter on AI. To get stories like this in your inbox first, sign up here. OpenAI CEO Sam Altman’s oft-discussed promise that Americans will share in the wealth AI creates was in the news again last week. On Thursday, the Financial Times reported that Altman is in&#8230;",https://www.technologyreview.com/2026/07/06/1140176/your-familys-300-stake-in-openai/,2026-07-06 18:00:00+00:00,AI
TechCrunch,https://techcrunch.com/feed/,"If you use Google, you’re training its AI. Here’s how to opt out.","Consider this a belated PSA: A recent change to Google’s privacy settings is allowing the company to store more of your data, including media such as “images, files, and audio and video recordings,” to improve its AI models.",https://techcrunch.com/2026/07/06/if-you-use-google-youre-training-its-ai-heres-how-to-opt-out/,2026-07-06 17:04:58+00:00,Other
Breaking Defense,https://breakingdefense.com/feed/,Lockheed Martin to purchase Ultra Maritime in $3.5B deal,Lockheed Martin said that Ultra Maritime will fall under the company’s rotary and mission systems division upon closing.,https://breakingdefense.com/2026/07/lockheed-martin-to-purchase-ultra-maritime-in-3-5b-deal/,2026-07-06 16:45:00+00:00,Other
War on the Rocks,https://warontherocks.com/feed/,Ukrainian Writers Take Aim at Government Narratives,"Welcome to&#160;The Ukraine Compass, a weekly digest of Ukrainian commentary and analysis from across the political spectrum only for&#160;War on the Rocks&#160;members. Each Monday, we bring you a curated selection of articles from Ukrainian media offering insight into how Ukrainians themselves debate the issues shaping their country.American coverage often narrows the view to the battlefield &#8212; these pieces widen it, revealing the texture of daily life, politics, and public argument in a nation at war. The perspectives gathered here are varied, candid, and often surprising, together forming a more complete picture of Ukraine as it really is.Frontline and Strategy&#1045;&#1089;&#1087;&#1088;&#1077;&#1089;&#1086; &#8212; The post Ukrainian Writers Take Aim at Government Narratives appeared first on War on the Rocks .",https://warontherocks.com/ukrainian-writers-take-aim-at-government-narratives/,2026-07-06 16:35:28+00:00,Defense
TechCrunch,https://techcrunch.com/feed/,Apple brings back card payments for Apple Account purchases in India after a four-year hiatus,Apple has started a phased rollout of card payments for Apple Account purchases in India after adapting to the country's payments framework.,https://techcrunch.com/2026/07/06/apple-brings-back-card-payments-for-apple-account-purchases-in-india-after-a-four-year-hiatus/,2026-07-06 16:21:03+00:00,Other
Breaking Defense,https://breakingdefense.com/feed/,"Norway provides both a model, and a warning, for NATO","There are lessons that allies can take from Oslo that would help strengthen the NATO alliance, Joshua Huminski writes.",https://breakingdefense.com/2026/07/norway-provides-both-a-model-and-a-warning-for-nato/,2026-07-06 16:13:26+00:00,Defense
Breaking Defense,https://breakingdefense.com/feed/,Processor upgrades enable computing at the edge,[Sponsored] Avoiding vendor lock and providing more room for sensors and upgrades are critical considerations.,https://breakingdefense.com/2026/07/processor-upgrades-enable-computing-at-the-edge/,2026-07-06 16:09:55+00:00,Other
SpaceNews,https://spacenews.com/feed/,NASA adds three European firms to the commercial data program,"MILAN — NASA’s Commercial Satellite Data Acquisition program (CSDA) announced June 23 contract awards with eight new commercial satellite data providers, three of which are European: Kuva Space (Finland), OroraTech [&#8230;] The post NASA adds three European firms to the commercial data program appeared first on SpaceNews .",https://spacenews.com/nasa-adds-three-european-firms-to-the-commercial-data-program/,2026-07-06 15:57:10+00:00,Other
TechCrunch,https://techcrunch.com/feed/,"Microsoft lays off nearly 5,000 employees across Xbox, commercial sales","Microsoft cut around 4,800 roles, or 2.1% of its global workforce, on Monday — the latest in a series of layoffs that’s stoking fears of AI replacing jobs. The layoffs will hit Xbox and commercial sales the hardest.",https://techcrunch.com/2026/07/06/microsoft-lays-off-nearly-5000-employees-across-xbox-commercial-sales/,2026-07-06 15:32:43+00:00,Other
EU-Startups,https://www.eu-startups.com/feed/,BGF surpasses €5.8 billion deployed after 15 years backing UK and Irish startups,"Fifteen years after it was established to address a structural funding gap in the UK mid-market, growth capital provider BGF has invested over €5.8 billion (£5 billion) in 650 businesses, marking a milestone in its mission to support the country’s growth economy. The firm provides flexible capital as a minority equity partner. Initial investments in [&#8230;] The post BGF surpasses €5.8 billion deployed after 15 years backing UK and Irish startups appeared first on EU-Startups .",https://www.eu-startups.com/2026/07/bgf-surpasses-e5-8-billion-deployed-after-15-years-backing-uk-and-irish-startups/,2026-07-06 15:27:34+00:00,"Startups, Funding"
TechCrunch,https://techcrunch.com/feed/,Reddit is using LLMs to solve a problem LLMs largely created,"In the AI era, platforms have no choice but to fight fire with fire to cull spam.",https://techcrunch.com/2026/07/06/reddit-is-using-llms-to-solve-a-problem-llms-largely-created/,2026-07-06 15:22:08+00:00,AI
C4ISRNET,https://www.c4isrnet.com/arc/outboundfeeds/rss/,Thales to buy French underwater-drone maker Exail in $4.5 billion deal,Industry champions in France and Italy move to consolidate their positions in a growing market for unmanned underwater naval equipment.,https://www.c4isrnet.com/global/europe/2026/07/06/thales-to-buy-french-underwater-drone-maker-exail-in-45-billion-deal/,2026-07-06 15:19:55+00:00,Defense
Defense News,https://www.defensenews.com/arc/outboundfeeds/rss/,"Russian strikes kill 20, exposing Ukraine’s air-defense shortage",President Volodymyr Zelenskyy has repeatedly pleaded for more interceptors — the only weapon in its arsenal that can shoot down ballistic projectiles.,https://www.defensenews.com/global/europe/2026/07/06/russian-strikes-kill-20-exposing-ukraines-air-defense-shortage/,2026-07-06 15:05:12+00:00,Defense
Defense News,https://www.defensenews.com/arc/outboundfeeds/rss/,Pentagon’s top new weapons programs are 12 years behind schedule: Watchdog,A new GAO report examined 104 of the Pentagon’s most expensive weapons programs.,https://www.defensenews.com/news/pentagon-congress/2026/07/06/pentagons-top-new-weapons-programs-are-12-years-behind-schedule-watchdog/,2026-07-06 14:50:05+00:00,Defense
TechCrunch,https://techcrunch.com/feed/,"Canadian spy agency says it hacked drug traffickers, extremists, and a ransomware gang last year",The hacking operations disclosed in a Canadian spy agency's annual report underscores some pressing national security threats facing the country and its top allies.,https://techcrunch.com/2026/07/06/canadian-spy-agency-says-it-hacked-drug-traffickers-extremists-and-a-ransomware-gang-last-year/,2026-07-06 14:43:59+00:00,Defense
TechCrunch,https://techcrunch.com/feed/,How to reserve and change your WhatsApp username,"WhatsApp now lets users reserve usernames ahead of the feature’s full rollout, making it possible to connect without sharing a phone number once usernames go live.",https://techcrunch.com/2026/07/06/how-to-reserve-and-change-your-whatsapp-username/,2026-07-06 14:15:30+00:00,Other
Defense News,https://www.defensenews.com/arc/outboundfeeds/rss/,Pentagon launches ‘War Force’ campaign in push for software engineers,The Defense Department describes it as part of an overall strategy to automate and improve government technology.,https://www.defensenews.com/news/pentagon-congress/2026/07/06/pentagon-launches-war-force-campaign-in-push-for-software-engineers/,2026-07-06 14:12:26+00:00,Defense
EU-Startups,https://www.eu-startups.com/feed/,Europe’s magnet supply chain push gets €8 million boost from German startup alqem,"alqem, a Munich-based DeepTech startup building an AI-driven engine to discover and commercialise next-generation materials, has raised €8 million in pre-Seed funding in their effort to establish a European-led supply chain for materials. The round was co-led by UVC Partners and Union Square Ventures. “For the first time, we have a map of the materials universe. [&#8230;] The post Europe’s magnet supply chain push gets €8 million boost from German startup alqem appeared first on EU-Startups .",https://www.eu-startups.com/2026/07/europes-magnet-supply-chain-push-gets-e8-million-boost-from-german-startup-alqem/,2026-07-06 14:11:48+00:00,"Funding, Startups"
Breaking Defense,https://breakingdefense.com/feed/,"Turkey and European NATO allies draw closer, but tensions remain: Experts","Turkey is &#8220;well-positioned to contribute&#8221; to NATO on several fronts, one analyst told Breaking Defense, but others noted distinct geopolitical sticking points.",https://breakingdefense.com/2026/07/turkey-and-european-nato-allies-draw-closer-but-tensions-remain-experts/,2026-07-06 14:03:00+00:00,Defense
TechCrunch,https://techcrunch.com/feed/,Station F ramps up as a launchpad for Europe’s hottest AI startups,"Station F, a Paris-based startup hub founded by French billionaire Xavier Niel, is gearing up for a new edition of its F/ai accelerator program in a bid to strengthen its positioning as a stepping stone for promising AI startups.",https://techcrunch.com/2026/07/06/station-f-ramps-up-as-a-launchpad-for-europes-hottest-ai-startups/,2026-07-06 13:00:00+00:00,Startups
MIT Technology Review,https://www.technologyreview.com/feed/,"The Download: South Korea’s hottest bachelors, and advancing eye transplants","This is today&#8217;s edition of The Download, our weekday newsletter that provides a daily dose of what&#8217;s going on in the world of technology. South Korea’s hottest new bachelors are chip workers Baek, a 35-year-old manager at the South Korean semiconductor titan SK Hynix, was enrolled in a matchmaking company a year ago. In a&#8230;",https://www.technologyreview.com/2026/07/06/1140172/the-download-south-korea-ai-chipworkers-eye-transplants/,2026-07-06 13:00:00+00:00,Other
SpaceNews,https://spacenews.com/feed/,BAE microchip designed for strategic defense missions passes radiation test,The company is positioning its Endura computing for classified and missile-defense satellite programs The post BAE microchip designed for strategic defense missions passes radiation test appeared first on SpaceNews .,https://spacenews.com/bae-microchip-designed-for-strategic-defense-missions-passes-radiation-test/,2026-07-06 13:00:00+00:00,Defense
Labiotech,https://www.labiotech.eu/feed/,The biggest biotech funding rounds in June 2026,"Parabilis Medicines, NewLimit, Enliven Therapeutics, and Kardigan bagged the biggest biotech funding rounds overall in June 2026. The post The biggest biotech funding rounds in June 2026 appeared first on Labiotech.eu . © Labiotech UG and Labiotech.eu. Unauthorized use and/or duplication of this material without express and written permission from this site’s author and/or owner is strictly prohibited. Excerpts and links may be used, provided that full and clear credit is given to Labiotech UG and Labiotech.eu with appropriate and specific direction to the original content.",https://www.labiotech.eu/in-depth/biotech-funding-rounds-june-2026/,2026-07-06 13:00:00+00:00,"Biotech, Funding"
SpaceNews,https://spacenews.com/feed/,The term ‘dual-use’ is misleading and dangerous,"There is only technology. How it is employed is a question of intent, context and political will, not of the technology itself. A precision optical payload captures imagery whether the [&#8230;] The post The term ‘dual-use&#8217; is misleading and dangerous appeared first on SpaceNews .",https://spacenews.com/the-term-dual-use-is-misleading-and-dangerous/,2026-07-06 13:00:00+00:00,Other
Payload Space,https://payloadspace.com/feed/,Exclusive: Ravee Optics Raises $6M Seed to Build Compact Laser Terminals,"Ravee Optics’ solution is designed to bring laser comms to the masses, with terminals that are lighter, smaller, and easier to manufacture at scale. The post Exclusive: Ravee Optics Raises $6M Seed to Build Compact Laser Terminals appeared first on Payload .",https://payloadspace.com/exclusive-ravee-optics-raises-6m-seed-to-build-compact-laser-terminals/,2026-07-06 12:55:00+00:00,Funding
