source,feed_url,headline,summary,url,published_date,topics
Nature,https://www.nature.com/subjects/medical-research.rss,The moderating effect of child abuse on the association between domestic violence and suicidal ideation/self-harm among Lebanese women,,https://www.nature.com/articles/s41598-026-49332-2,2026-05-23 00:00:00+00:00,Other
SpaceNews,https://spacenews.com/feed/,"Space Force awards Viasat, SES $437 million for military satellite network","The companies will build four small geostationary satellites for the Protected Tactical Satcom-Global program The post Space Force awards Viasat, SES $437 million for military satellite network appeared first on SpaceNews .",https://spacenews.com/space-force-awards-viasat-ses-437-million-for-military-satellite-network/,2026-05-22 23:27:58+00:00,"Space, Defense"
Phys.org,https://phys.org/rss-feed/,Blue and fin whale sightings on the rise in the Southeast Atlantic,"More than 40 years after the end of commercial whaling, new research reveals a recent increase in sightings of the world's two largest whale species in the southeastern Atlantic. The findings, published in the African Journal of Marine Science, compile more than 60 years of confirmed sightings and strandings from Namibia and South Africa's west coast. Although overall numbers remain low, sightings of both species have increased markedly in recent years—with 95% of observations recorded since 2012.",https://phys.org/news/2026-05-blue-fin-whale-sightings-southeast.html,2026-05-22 23:10:01+00:00,Science
TechCrunch,https://techcrunch.com/feed/,AI is being used to resurrect the voices of dead pilots,"People used AI on a spectrogram image of cockpit recordings to reconstruct them, forcing the NTSB to temporarily block access to its docket system.",https://techcrunch.com/2026/05/22/ai-is-being-used-to-resurrect-the-voices-of-dead-pilots/,2026-05-22 23:03:33+00:00,Other
TechCrunch,https://techcrunch.com/feed/,"SpaceX launches Starship V3 for the first time, but loses booster on return","The company had a mostly successful first launch of its upgraded Starship V3, which it needs to power its many ambitious goals in the years to come.",https://techcrunch.com/2026/05/22/spacex-launches-starship-v3-for-the-first-time-but-loses-booster-on-return/,2026-05-22 22:55:57+00:00,Other
Phys.org,https://phys.org/rss-feed/,Imaging ellipsometry tracks MXene thin-film quality during fabrication without damage,"A German–Israeli research team led by Dr. Andreas Furchner has demonstrated how imaging ellipsometry enables non-destructive characterization and quality control of microstructured MXene thin films during device fabrication. The authors used two complementary ellipsometry approaches for precise, multi-scale access to key material properties. The work positions imaging ellipsometry as a powerful platform for monitoring thin-film uniformity, device integrity, and functionality throughout processing, including critical lithographic steps. The study was published in Applied Physics Letters and selected as an Editor's Pick.",https://phys.org/news/2026-05-imaging-ellipsometry-tracks-mxene-thin.html,2026-05-22 22:40:01+00:00,"Science, MedTech"
Breaking Defense,https://breakingdefense.com/feed/,Navy green lights seven MUSV marketplace submissions to advance to prototype phase,The Navy did not reveal which companies&#8217; designs were selected to advance.,https://breakingdefense.com/2026/05/navy-green-lights-seven-musv-marketplace-submissions-to-advance-to-prototype-phase/,2026-05-22 22:37:03+00:00,Defense
Phys.org,https://phys.org/rss-feed/,Understanding the mechanisms of collective cell movement,"Like schools of fish and flocks of birds, our cells can also migrate collectively in coordination with their neighbors. This harmonious movement of cells occurs during embryonic development, wound healing, and cancer metastasis. However, since individual cells can only sense limited local information, how they are able to coordinate as a larger collective has remained poorly understood.",https://phys.org/news/2026-05-mechanisms-cell-movement.html,2026-05-22 22:20:03+00:00,Other
Phys.org,https://phys.org/rss-feed/,"Just outside Jupiter, one region may have forged six meteorite parent bodies","When the solar system formed, a disk of gas and dust orbited the young sun. Over the course of millions of years, the dust gradually clumped together to form kilometer-sized chunks known as planetesimals. Some grew into planets, while the rest are considered to be the precursors of today's asteroids. Researchers assume that this development did not proceed in a linear fashion, with different stages of planetesimal development occurring simultaneously, and not every region of the disk offering favorable ""starting conditions"" for planetesimals.",https://phys.org/news/2026-05-jupiter-region-forged-meteorite-parent.html,2026-05-22 22:00:02+00:00,Science
TechCrunch,https://techcrunch.com/feed/,Blue Origin cleared to fly New Glenn mega-rocket after April mishap,"Jeff Bezos' rocket company confirmed an engine failure led to the loss of an AST SpaceMobile satellite last month, but offered little detail.",https://techcrunch.com/2026/05/22/blue-origin-cleared-to-fly-new-glenn-mega-rocket-after-april-mishap/,2026-05-22 21:37:17+00:00,Space
TechCrunch,https://techcrunch.com/feed/,Google goes for the glitter with disco-ball icons: ‘Are y’all sure you still want this?’,"You can now disco ball-ify your entire Pixel home screen, says Google.",https://techcrunch.com/2026/05/22/google-goes-for-the-glitter-with-disco-ball-icons-are-yall-sure-you-still-want-this/,2026-05-22 21:02:36+00:00,Other
TechCrunch,https://techcrunch.com/feed/,How VCs and founders use inflated ‘ARR’ to crown AI startups,Some AI startups are stretching traditional revenue metrics when talking about progress publicly. And their investors are fully aware.,https://techcrunch.com/2026/05/22/how-vcs-and-founders-use-inflated-arr-to-kingmake-ai-startups/,2026-05-22 20:40:48+00:00,"Startups, Funding"
Defense News,https://www.defensenews.com/arc/outboundfeeds/rss/,All-female Senate delegation sets off for High North amid growing military tensions,The itinerary is set to include briefings at Pituffik Space Base in Greenland on Arctic defense and strategic competition in the region.,https://www.defensenews.com/news/pentagon-congress/2026/05/22/all-female-senate-delegation-sets-off-for-high-north-amid-growing-military-tensions/,2026-05-22 20:24:36+00:00,Defense
Defense News,https://www.defensenews.com/arc/outboundfeeds/rss/,Rubio ratchets up pressure on NATO at key summit,Secretary of State Marco Rubio is casting new doubt on NATO's relevance after key allies recoiled from backing Washington’s “Operation Epic Fury.”,https://www.defensenews.com/news/pentagon-congress/2026/05/22/rubio-ratchets-up-pressure-on-nato-at-key-summit/,2026-05-22 20:15:15+00:00,Defense
C4ISRNET,https://www.c4isrnet.com/arc/outboundfeeds/rss/,US Marine Corps tests using helicopter as mobile drone command center,"During the test, troops launched a Neros Archer FPV drone from the ground before transferring control to operators aboard a helicopter orbiting miles away.",https://www.c4isrnet.com/news/your-marine-corps/2026/05/22/us-marine-corps-tests-using-helicopter-as-mobile-drone-command-center/,2026-05-22 18:59:00+00:00,Defense
Satellite Today,https://www.satellitetoday.com/feed/,"ST Engineering iDirect’s New CEO Kuppanna Talks Ground Tech’s Cloud-Native, Interoperable Future","In late March, ST Engineering iDirect appointed Sridhar Kuppanna as its new CEO as the company navigates an increasingly dynamic and evolving market for ground tech. With Starlink shaking up [&#8230;] The post ST Engineering iDirect&#8217;s New CEO Kuppanna Talks Ground Tech&#8217;s Cloud-Native, Interoperable Future appeared first on Via Satellite .",https://www.satellitetoday.com/technology/2026/05/22/st-engineering-idirects-new-ceo-kuppanna-talks-ground-techs-cloud-native-interoperable-future/,2026-05-22 18:27:31+00:00,Other
Satellite Today,https://www.satellitetoday.com/feed/,UK Inaugurates New Space Domain Awareness Software Borealis,"A new space domain awareness (SDA) software for the U.K. government is now operational, six months ahead of schedule. The new software, called Borealis, improves tracking of satellites and space [&#8230;] The post UK Inaugurates New Space Domain Awareness Software Borealis appeared first on Via Satellite .",https://www.satellitetoday.com/government-military/2026/05/22/uk-inaugurates-new-space-domain-awareness-software-borealis/,2026-05-22 18:24:37+00:00,Space
Breaking Defense,https://breakingdefense.com/feed/,"Loitering munitions, launched effects had strong presence at SOF Week 2026","&#8220;The [Rogue 1] Block 2 upgrade leverages user feedback to greatly enhance performance, resilience, and operational capability, all while maintaining existing form-factor,” a Teledyne FLIR statement read.",https://breakingdefense.com/2026/05/loitering-munitions-launched-effects-had-strong-presence-at-sof-week-2026/,2026-05-22 18:16:04+00:00,Defense
Satellite Today,https://www.satellitetoday.com/feed/,Rocket Lab to Build First GEO Satellites for Space Force Space Domain Awareness Mission,Rocket Lab has secured its first orders for two Geostationary Orbit (GEO) satellites from the U.S. Space Force for a space domain awareness (SDA) mission. Rocket Lab announced a $90 million [&#8230;] The post Rocket Lab to Build First GEO Satellites for Space Force Space Domain Awareness Mission appeared first on Via Satellite .,https://www.satellitetoday.com/government-military/2026/05/22/rocket-lab-to-build-first-geo-satellites-for-space-force-space-domain-awareness-mission/,2026-05-22 18:15:12+00:00,Space
Satellite Today,https://www.satellitetoday.com/feed/,Viasat Completes D2D Demo in Uzbekistan,"Viasat has completed a direct-to-device (D2D) demonstration in the republic of Uzbekistan, featuring application-based messaging on an Android smartphone. The demonstration showcased smartphones sending and receiving messages over Viasat’s L-band [&#8230;] The post Viasat Completes D2D Demo in Uzbekistan appeared first on Via Satellite .",https://www.satellitetoday.com/connectivity/2026/05/22/viasat-completes-d2d-demo-in-uzbekistan/,2026-05-22 18:09:18+00:00,Other
Defense News,https://www.defensenews.com/arc/outboundfeeds/rss/,Congressional report tallies 42 US aircraft lost or damaged in Operation Epic Fury,"Drones took the heaviest hit, accounting for 25 of the 42 aircraft losses listed in the report.",https://www.defensenews.com/news/pentagon-congress/2026/05/22/congressional-report-tallies-42-us-aircraft-lost-or-damaged-in-operation-epic-fury/,2026-05-22 17:49:18+00:00,Other
SpaceNews,https://spacenews.com/feed/,NASA unveils sweeping reorganization,"NASA announced one of its biggest reorganizations in recent memory May 22, combining mission directorates and reshuffling personnel. The post NASA unveils sweeping reorganization appeared first on SpaceNews .",https://spacenews.com/nasa-unveils-sweeping-reorganization/,2026-05-22 17:08:24+00:00,Other
Breaking Defense,https://breakingdefense.com/feed/,"IAI’s new Diamond naval offering envisions flexible drones, missiles for small vessels","The plan involves different defensive systems dispersed across small satellite ships, which can be connected to a mother ship in a disaggregated model.",https://breakingdefense.com/2026/05/iais-new-diamond-naval-offering-envisions-flexible-drones-missiles-for-small-vessels/,2026-05-22 16:45:00+00:00,Other
TechCrunch,https://techcrunch.com/feed/,Kash Patel’s clothing brand website shut down after reports it was hacked,"According to users on X, the website was hijacked by hackers in an attempt to trick visitors into installing malware.",https://techcrunch.com/2026/05/22/kash-patels-clothing-brand-website-shut-down-after-reports-it-was-hacked/,2026-05-22 16:28:06+00:00,Other
TechCrunch,https://techcrunch.com/feed/,Apple says Epic lawsuit shouldn’t reshape App Store rules for all developers,Apple is asking the Supreme Court to narrow the App Store injunction won by Epic Games and overturn the court’s contempt ruling over external payment fees.,https://techcrunch.com/2026/05/22/apple-says-epic-lawsuit-shouldnt-reshape-app-store-rules-for-all-developers/,2026-05-22 16:27:57+00:00,Other
TechCrunch,https://techcrunch.com/feed/,"Spotify’s AI bet: more of everything, less of what you want",Spotify has released a bunch of AI-powered tools that nudge users to create more content. It can be a bit much.,https://techcrunch.com/2026/05/22/spotifys-ai-bet-more-of-everything-less-of-what-you-want/,2026-05-22 16:18:10+00:00,Other
TechCrunch,https://techcrunch.com/feed/,You can no longer Google the word ‘disregard’,"After Google Search's AI update, the word ""disregard"" now effectively breaks the search interface.",https://techcrunch.com/2026/05/22/you-can-no-longer-google-the-word-disregard/,2026-05-22 16:16:48+00:00,Other
Breaking Defense,https://breakingdefense.com/feed/,"Helos need upgrades to perform special ops ‘quieter, with fewer aircraft’: PEO Rotary Wing","Special Operations Command’s fleet of MH-60Ms and MH-47Gs — operated by the 160th Nightstalkers Special Operations Aviation Regiment (SOAR) — could benefit from technology injections coming from the MV-75 Cheyenne, said PEO Rotary Wing Steve Smith.",https://breakingdefense.com/2026/05/helos-need-upgrades-to-perform-special-ops-quieter-with-fewer-aircraft-peo-rotary-wing/,2026-05-22 15:57:23+00:00,Other
TechCrunch,https://techcrunch.com/feed/,We tried Google’s AI glasses and they’re almost there,"Google demoed prototype Android XR glasses that overlay Gemini-powered translation, navigation, and other information directly into your field of view.",https://techcrunch.com/2026/05/22/we-tried-googles-ai-glasses-and-theyre-almost-there/,2026-05-22 15:37:15+00:00,Other
Defense News,https://www.defensenews.com/arc/outboundfeeds/rss/,Libya and Syria join Turkey’s flagship military exercise in historic firsts,Ankara framed both nations’ attendance as part of its broader military-restructuring and advisory programs in each country.,https://www.defensenews.com/global/europe/2026/05/22/libya-and-syria-join-turkeys-flagship-military-exercise-in-historic-firsts/,2026-05-22 15:26:06+00:00,Defense
Breaking Defense,https://breakingdefense.com/feed/,Lockheed breaks ground on new THAAD interceptor plant,"&#8220;These aren&#8217;t just ideas or papers going back and forth,” Lockheed CEO Jim Taiclet said of the Pentagon&#8217;s munitions ramp. “We know it&#8217;s going to be good, and we know it&#8217;s going to happen.”",https://breakingdefense.com/2026/05/lockheed-breaks-ground-on-new-thaad-interceptor-plant-as-pentagon-pushes-for-more-weapons-production/,2026-05-22 15:15:00+00:00,Defense
EU-Startups,https://www.eu-startups.com/feed/,Weekly funding round-up! All of the European startup funding rounds we tracked this week (May 18 – May 22),"This article is visible for CLUB members only. If you are already a member but don’t see the content of this article, please login here. If you’re not a CLUB member yet, but you’d like to read members-only content like this one, have unrestricted access to the site and benefit from many additional perks, you [&#8230;] The post Weekly funding round-up! All of the European startup funding rounds we tracked this week (May 18 – May 22) appeared first on EU-Startups .",https://www.eu-startups.com/2026/05/weekly-funding-round-up-all-of-the-european-startup-funding-rounds-we-tracked-this-week-may-18-may-22/,2026-05-22 15:00:54+00:00,"Startups, Funding"
Breaking Defense,https://breakingdefense.com/feed/,"Inside Sen. Ted Budd’s plan to boost airpower, pilot retention",North Carolina Sen. Ted Budd explains why he recently introduced three bills intended to boost US fighter inventory and improve pilot retention.,https://breakingdefense.com/2026/05/inside-sen-ted-budds-plan-to-boost-airpower-pilot-retention/,2026-05-22 14:45:00+00:00,Other
TechCrunch,https://techcrunch.com/feed/,"Trump Mobile confirms it exposed customers’ personal data, including phone numbers and home addresses",President Trump’s branded cell phone maker and cell provider said the exposure was linked to a third-party platform and was evaluating whether it needs to notify customers.,https://techcrunch.com/2026/05/22/trump-mobile-confirms-it-exposed-customers-personal-data-including-phone-numbers-and-home-addresses/,2026-05-22 14:30:52+00:00,Other
Breaking Defense,https://breakingdefense.com/feed/,General Atomics CCA drone returns to flight,Air Force Col. Timothy Helfrich said the response to the drone’s April 6 crash “validates our approach to accept acquisition/test risk instead of operational risk allowing us to accelerate the program towards fielding.”,https://breakingdefense.com/2026/05/general-atomics-cca-drone-returns-to-flight/,2026-05-22 14:30:26+00:00,Defense
TechCrunch,https://techcrunch.com/feed/,"SpaceX files to go public, and the math requires a little faith","The SpaceX S-1 is finally here, and the story it tells goes&#160;way further&#160;than rockets. The filing runs to 36 pages of risk factors alone, and the numbers inside match the ambition: a&#160;$28 trillion&#160;total addressable market, a pay package tied to&#160;establishing&#160;a Mars colony, and a valuation target that would make it the largest IPO in American [&#8230;]",https://techcrunch.com/video/spacex-files-to-go-public-and-the-math-requires-a-little-faith/,2026-05-22 14:30:00+00:00,Funding
TechCrunch,https://techcrunch.com/feed/,Meta quietly launches a new Reddit-like app called Forum,"The company describes the app as a ""dedicated space built for deeper discussions, real answers and communities you care about.""",https://techcrunch.com/2026/05/22/meta-quietly-launches-a-new-reddit-like-app-called-forum/,2026-05-22 14:24:16+00:00,Other
Breaking Defense,https://breakingdefense.com/feed/,F-35B conducts flight test with British SPEAR mini-cruise missile,"The first flight milestone comes four years later than originally planned, after an initial delay caused by technical troubles.",https://breakingdefense.com/2026/05/f-35b-conducts-flight-test-with-british-spear-mini-cruise-missile/,2026-05-22 14:16:21+00:00,Defense
TechCrunch,https://techcrunch.com/feed/,Smart ring maker Oura files to go public,The Finnish company said in September that it has sold 5.5 million smart rings to date.,https://techcrunch.com/2026/05/22/smart-ring-maker-oura-files-to-go-public/,2026-05-22 14:03:35+00:00,Other
Defense News,https://www.defensenews.com/arc/outboundfeeds/rss/,Taiwan says it has not been told by US of arms sales delays,U.S. President Donald Trump said following a summit with China’s Xi Jinping in Beijing last week that he was undecided on whether to approve it.,https://www.defensenews.com/global/asia-pacific/2026/05/22/taiwan-says-it-has-not-been-told-by-us-of-arms-sales-delays/,2026-05-22 13:39:47+00:00,Other
Breaking Defense,https://breakingdefense.com/feed/,"Russian nukes threaten ‘almost all’ US cities, Norway’s FM says, highlighting NATO’s value","“It is good that Europe is doing more, but there’s a need to remind our good friends on the other side of the Atlantic that NATO is also good for them,” said the Nordic official.",https://breakingdefense.com/2026/05/norways-foreign-minister-warns-that-russian-nuclear-weapons-pose-direct-threat-to-all-american-cities/,2026-05-22 13:22:14+00:00,Defense
SpaceNews,https://spacenews.com/feed/,Leveraging AUKUS and southern geography: building Australia’s dual-use space infrastructure for strategic resilience,"The Deep Space Advanced Radar Capability (DARC) Site 1 in Western Australia is already delivering early tracking data for AUKUS partners, with full operational capability targeted for 2027. This milestone [&#8230;] The post Leveraging AUKUS and southern geography: building Australia’s dual-use space infrastructure for strategic resilience appeared first on SpaceNews .",https://spacenews.com/leveraging-aukus-and-southern-geography-building-australias-dual-use-space-infrastructure-for-strategic-resilience/,2026-05-22 13:00:00+00:00,Other
C4ISRNET,https://www.c4isrnet.com/arc/outboundfeeds/rss/,SOCOM begins fielding new battlefield biometrics system,"Reveal Technology’s Identifi platform allows operators to collect fingerprints, facial scans, iris data and voice recognition in the field.",https://www.c4isrnet.com/industry/techwatch/2026/05/22/socom-begins-fielding-new-battlefield-biometrics-system/,2026-05-22 12:56:25+00:00,Defense
SpaceNews,https://spacenews.com/feed/,SpaceX IPO filing casts Starlink Mobile as future wireless challenger,"SpaceX’s IPO prospectus casts Starlink Mobile as more than a remote-area backup, with next-generation direct-to-smartphone services designed to be “on par with terrestrial mobile networks” even in urban areas. The post SpaceX IPO filing casts Starlink Mobile as future wireless challenger appeared first on SpaceNews .",https://spacenews.com/spacex-prospectus-casts-starlink-mobile-as-future-wireless-challenger/,2026-05-22 12:54:32+00:00,Other
Payload Space,https://payloadspace.com/feed/,"The US Needs a New Launch Site, Air Force Secretary Says","Traffic at US military launch sites is approaching max capacity. The post The US Needs a New Launch Site, Air Force Secretary Says appeared first on Payload .",https://payloadspace.com/the-us-needs-a-new-launch-site-air-force-secretary-says/,2026-05-22 12:45:54+00:00,Defense
EU-Startups,https://www.eu-startups.com/feed/,Málaga’s Magnific launches €10 million fund to help creative teams turn AI experiments into production-ready campaigns,"Magnific (formerly Freepik), a Málaga-based AI platform for creatives, has launched the Magnific Fund. This €10 million initiative aims to support marketing, advertising, and in-house creative teams in transitioning from AI experimentation to fully integrated, production-ready workflows for their campaigns. While the fund primarily targets SMEs and creative teams across the European Union and the [&#8230;] The post Málaga’s Magnific launches €10 million fund to help creative teams turn AI experiments into production-ready campaigns appeared first on EU-Startups .",https://www.eu-startups.com/2026/05/malagas-magnific-launches-e10-million-fund-to-help-creative-teams-turn-ai-experiments-into-production-ready-campaigns/,2026-05-22 12:25:18+00:00,Startups
MIT Technology Review,https://www.technologyreview.com/feed/,"The Download: coding’s future, the ‘Steroid Olympics,’ and AI-driven science","This is today&#8217;s edition of The Download, our weekday newsletter that provides a daily dose of what&#8217;s going on in the world of technology. Anthropic’s Code with Claude showed off coding’s future—whether you like it or not At Anthropic’s developer event in London this week, Code with Claude, attendees were asked if they’d shipped code&#8230;",https://www.technologyreview.com/2026/05/22/1137845/the-download-coding-future-steroid-olympics-ai-science/,2026-05-22 12:10:00+00:00,AI
Labiotech,https://www.labiotech.eu/feed/,LSX Nordic Congress 2026: what came out of the biotech partnering event,"This week, the 2026 LSX Nordic Congress was held in Copenhagen. Find out what came out of the Nordic-focused partnering event. The post LSX Nordic Congress 2026: what came out of the biotech partnering event appeared first on Labiotech.eu . © Labiotech UG and Labiotech.eu. Unauthorized use and/or duplication of this material without express and written permission from this site’s author and/or owner is strictly prohibited. Excerpts and links may be used, provided that full and clear credit is given to Labiotech UG and Labiotech.eu with appropriate and specific direction to the original content.",https://www.labiotech.eu/trends-news/lsx-nordic-congress-2026/,2026-05-22 12:00:00+00:00,Biotech
SpaceNews,https://spacenews.com/feed/,Rocket Lab launches ninth Synspective satellite,Rocket Lab launched another radar imaging satellite for Synspective as the company plans to sell up to $3 billion in stock to fund future initiatives. The post Rocket Lab launches ninth Synspective satellite appeared first on SpaceNews .,https://spacenews.com/rocket-lab-launches-ninth-synspective-satellite/,2026-05-22 11:49:11+00:00,"Space, MedTech"
Breaking Defense,https://breakingdefense.com/feed/,RIAT canceled: Middle East ‘situation’ forces collapse of major UK air show,"&#8220;This has not been an easy decision,&#8221; but it was made after &#8220;extensive discussions&#8221; with the RAF and the US Air Force, said organizers of the Royal International Air Tattoo today.",https://breakingdefense.com/2026/05/middle-east-situation-forces-cancellation-of-major-uk-air-show/,2026-05-22 11:42:28+00:00,Defense
EU-Startups,https://www.eu-startups.com/feed/,UK gets a fresh new unicorn as beauty and wellness platform Fresha lands €68.9 million from KKR,"Fresha, a London-based AI-powered marketplace and business management platform for the beauty and wellness industry, has announced a €68.9 million ($80 million) primary growth investment from funds managed by KKR, a global investment firm. This deal values Fresha at over €861.9 million ($1 billion) and brings Fresha&#8217;s total capital raised to €245.5 million ($285 million). [&#8230;] The post UK gets a fresh new unicorn as beauty and wellness platform Fresha lands €68.9 million from KKR appeared first on EU-Startups .",https://www.eu-startups.com/2026/05/uk-gets-a-fresh-new-unicorn-as-beauty-and-wellness-platform-fresha-lands-e68-9-million-from-kkr/,2026-05-22 10:42:18+00:00,"Funding, Startups"
