source,feed_url,headline,summary,url,published_date,topics
SpaceNews,https://spacenews.com/feed/,Artemis 2 astronaut advocates for equatorial lunar landings,The pilot of Artemis 2 says NASA’s return to the moon should start with human landings in less challenging equatorial regions rather than go directly to the south pole. The post Artemis 2 astronaut advocates for equatorial lunar landings appeared first on SpaceNews .,https://spacenews.com/artemis-2-astronaut-advocates-for-equatorial-lunar-landings/,2026-07-22 10:01:12+00:00,Other
Defense News,https://www.defensenews.com/arc/outboundfeeds/rss/,"Backed by France, Macron sees Germany as nuclear-deterrence ‘vanguard’ in Europe",A French nuclear-capable Rafale jet had been temporarily hosted at a German air base − specifically at Nörvenich near Cologne.,https://www.defensenews.com/global/europe/2026/07/22/backed-by-france-macron-sees-germany-as-nuclear-deterrence-vanguard-in-europe/,2026-07-22 09:39:24+00:00,Funding
Breaking Defense,https://breakingdefense.com/feed/,"BAE unveils Brontanax, a UK-designed CCA drone","The Brontanax drone, roughly the size of a BAE Hawk trainer jet, was unveiled by newly installed Defence Secretary Wes Streeting.",https://breakingdefense.com/2026/07/bae-unveils-brontanax-a-uk-designed-cca-drone/,2026-07-22 09:37:01+00:00,Defense
SpaceNews,https://spacenews.com/feed/,Gravity-1 sea launch off Shanghai puts 9 satellites into orbit,"HELSINKI — Commercial launch firm Orienspace launched its third Gravity-1 solid rocket late Tuesday, sending nine satellites into orbit from waters off Shanghai. The 30-meter-long Gravity-1 solid rocket lifted off [&#8230;] The post Gravity-1 sea launch off Shanghai puts 9 satellites into orbit appeared first on SpaceNews .",https://spacenews.com/gravity-1-sea-launch-off-shanghai-puts-9-satellites-into-orbit/,2026-07-22 09:32:11+00:00,Space
EU-Startups,https://www.eu-startups.com/feed/,Brenus Pharma raises €11 million Series A extension to advance immunotherapy for hard-to-treat solid tumours,"Brenus Pharma, a Lyon-based clinical-stage BioTech startup aiming to prevent cancer recurrence, has announced an €11 million ($12.6M) extension to its Series A round. This brings the company&#8217;s total capital raised since inception to €38 million. The round was supported by strong follow-on participation from existing investors, including Angelor, UI Investissement (managing FRAI), Crédit Agricole [&#8230;] The post Brenus Pharma raises €11 million Series A extension to advance immunotherapy for hard-to-treat solid tumours appeared first on EU-Startups .",https://www.eu-startups.com/2026/07/frances-brenus-pharma-raises-e11-million-series-a-extension-to-advance-immunotherapy-for-hard-to-treat-solid-tumours/,2026-07-22 09:28:28+00:00,"Funding, Startups"
MIT Technology Review,https://www.technologyreview.com/feed/,Shape-shifting mirrors on NASA’s new space telescope could unveil Jupiters like our own,"When NASA’s Nancy Grace Roman Space Telescope launches, as early as the end of next month, it will attempt one of astronomy’s most precise disappearing acts to date. The telescope will carry the first space-bound “active” coronagraph, an instrument that effectively erases most of the light from a star during photography. It will allow astronomers&#8230;",https://www.technologyreview.com/2026/07/22/1140701/shape-shifting-mirrors-roman-space-telescope/,2026-07-22 09:00:00+00:00,Other
EU-Startups,https://www.eu-startups.com/feed/,"Months after raising €102.5 million, Helsinki’s AI infrastructure company Verda secures €22 million NIB loan","The Nordic Investment Bank (NIB) has signed a 4-year €22 million InvestEU-backed loan with Verda (formerly DataCrunch), a Helsinki-based AI infrastructure company. This financing comes months after the company raised €102.5 million ($117 million) in funding to develop its AI cloud infrastructure and international expansion. Ruben Bryon, founder and CEO of Verda Cloud, said, “AI [&#8230;] The post Months after raising €102.5 million, Helsinki’s AI infrastructure company Verda secures €22 million NIB loan appeared first on EU-Startups .",https://www.eu-startups.com/2026/07/months-after-raising-e102-5-million-helsinkis-ai-infrastructure-company-verda-secures-e22-million-nib-loan/,2026-07-22 07:57:03+00:00,"Funding, Startups"
War on the Rocks,https://warontherocks.com/feed/,Total War on Taipei: China Explores Elevating Cognitive Effects into Its Vision of Warfare,"In March 2025, China&#8217;s military researchers published a concept describing how to rapidly capture and subdue the city of Taipei. Distributed in restricted military channels, this approach argues Beijing can achieve victory &#8220;by blocking the city&#8217;s ability to receive external assistance, restricting its ability to enable operations, breaking its operational system, collapsing cognitive cohesion, and eliminating its ability to recover.&#8221; Its objective is to break the Taiwan people&#8217;s will to fight.While this concept is not yet doctrine, it is an important and rarely seen example of how China&#8217;s military strategy and research inform the way it plans to fight a The post Total War on Taipei: China Explores Elevating Cognitive Effects into Its Vision of Warfare appeared first on War on the Rocks .",https://warontherocks.com/total-war-on-taipei-china-explores-elevating-cognitive-effects-into-its-vision-of-warfare/,2026-07-22 07:30:49+00:00,"Defense, Science"
EU-Startups,https://www.eu-startups.com/feed/,London’s Modo Energy secures €14.9 million to scale its AI-powered energy benchmarking and valuation platform,"Modo Energy, a London-based AI-powered benchmarking and valuation platform for energy storage and renewable assets, has secured a €14.9 million ($17 million) growth funding package from CIBC Innovation Banking, bringing the total amount of funding raised by the company to €45.5 million ($52 million). CIBC Innovation Banking is the lead backer in the new capital, [&#8230;] The post London’s Modo Energy secures €14.9 million to scale its AI-powered energy benchmarking and valuation platform appeared first on EU-Startups .",https://www.eu-startups.com/2026/07/londons-modo-energy-secures-e14-9-million-to-scale-its-ai-powered-energy-benchmarking-and-valuation-platform/,2026-07-22 06:50:43+00:00,"Funding, Startups"
Breaking Defense,https://breakingdefense.com/feed/,"Lockheed, RTX in ‘early’ talks for Ukraine Patriot production, execs say","“Working with the United States government, we are working [&#8230;] to determine what is feasible and what is best for Ukraine,” said Raytheon’s Tom Laliberty.",https://breakingdefense.com/2026/07/lockheed-rtx-in-early-talks-for-ukraine-patriot-production-execs-say/,2026-07-22 06:30:00+00:00,Other
Science,https://www.science.org/rss/news_current.xml,White House report calls for big changes to ‘calcified’ U.S. science system,"In Congress today, Trump science adviser Michael Kratsios faced critics of the proposals",https://www.science.org/content/article/white-house-report-calls-big-changes-calcified-u-s-science-system,2026-07-22 06:30:00+00:00,Other
Satellite Today,https://www.satellitetoday.com/feed/,Contrivian Completes Merger With Big Network to Fuel Orchestration Service,"Contrivian has completed its merger with networking software company Big Network in a move that the company says creates a vertically integrated, multi-modal connectivity platform. The merger was first announced in [&#8230;] The post Contrivian Completes Merger With Big Network to Fuel Orchestration Service appeared first on Via Satellite .",https://www.satellitetoday.com/connectivity/2026/07/21/contrivian-completes-merger-with-big-network-to-fuel-orchestration-service/,2026-07-22 00:36:57+00:00,Other
Nature,https://www.nature.com/nature.rss,Electronic-resonance enhanced molecule for perovskite solar cells,"Nature, Published online: 22 July 2026; doi:10.1038/s41586-026-10919-4 Electronic-resonance enhanced molecule for perovskite solar cells",https://www.nature.com/articles/s41586-026-10919-4,2026-07-22 00:00:00+00:00,Science
Nature,https://www.nature.com/nature.rss,Subnuclear genome compartmentalization controls bivalent chromatin activity,"Nature, Published online: 22 July 2026; doi:10.1038/s41586-026-10832-w Knowledge of the spatial location of a gene is necessary to understand its epigenomic regulation.",https://www.nature.com/articles/s41586-026-10832-w,2026-07-22 00:00:00+00:00,Science
Nature,https://www.nature.com/nature.rss,Planetary-mass exosatellite detected around the substellar companion of a star,"Nature, Published online: 22 July 2026; doi:10.1038/s41586-026-10751-w Radial velocity measurements provide evidence for a Jupiter-mass exosatellite orbiting the brown dwarf companion CD-35 2722 B, a promising detection of an exomoon-like object.",https://www.nature.com/articles/s41586-026-10751-w,2026-07-22 00:00:00+00:00,Science
Nature,https://www.nature.com/nature.rss,Imaging of nanoscale polar textures in quantum paraelectric SrTiO 3,"Nature, Published online: 22 July 2026; doi:10.1038/s41586-026-10823-x Cryo-STEM reveals that SrTiO3 forms periodic polar nanodomains below 105 K, but these fragment below 40 K, linking quantum paraelectricity to nanoscale polar ordering and disordering.",https://www.nature.com/articles/s41586-026-10823-x,2026-07-22 00:00:00+00:00,"MedTech, Science"
Nature,https://www.nature.com/nature.rss,‘Good design takes mastery’: scientific illustrators sketch out AI’s future,"Nature, Published online: 22 July 2026; doi:10.1038/d41586-026-02230-z Nature talks to five artists about their approaches to communicating science visually.",https://www.nature.com/articles/d41586-026-02230-z,2026-07-22 00:00:00+00:00,Science
Nature,https://www.nature.com/nature.rss,Efficient and precise programmable DNA knock-in without double-strand breaks,"Nature, Published online: 22 July 2026; doi:10.1038/s41586-026-10819-7 Kilobase-scale nickase-targeting (KNIT) editing enables single-nick-based DNA insertion across genomic loci and cell types, supporting insertion of DNA fragments exceeding 10 kb, with high efficiency and minimal unwanted off-target effects.",https://www.nature.com/articles/s41586-026-10819-7,2026-07-22 00:00:00+00:00,Science
Nature,https://www.nature.com/nature.rss,Semiconducting and magnetic lanthanide MXenes from intercalated halides,"Nature, Published online: 22 July 2026; doi:10.1038/s41586-026-10802-2 A bottom-up synthesis strategy creates lanthanide MXenes (Ln2CT2) that combine semiconducting behaviour with ferromagnetism, offering a promising new class of two-dimensional materials for spintronic applications.",https://www.nature.com/articles/s41586-026-10802-2,2026-07-22 00:00:00+00:00,Science
Nature,https://www.nature.com/nature.rss,A radical approach to making C-glycoside molecules,"Nature, Published online: 22 July 2026; doi:10.1038/d41586-026-02237-6 A platform for synthesizing highly desirable C-glycoside molecules from sugar has been developed that uses glycosyl sulfonyl hydrazides as readily accessible free-radical precursors. The strategy enables targeted formation of carbon–carbon bonds across carbohydrate scaffolds and with specificity for the desired 3D arrangement of atoms.",https://www.nature.com/articles/d41586-026-02237-6,2026-07-22 00:00:00+00:00,Science
Nature,https://www.nature.com/nature.rss,Exceptional brain and ecological diversity in the earliest snakes,"Nature, Published online: 22 July 2026; doi:10.1038/s41586-026-10809-9 A well-preserved fossil snake from the Late Cretaceous of Brazil shows early ecological and brain shape disparity in the group.",https://www.nature.com/articles/s41586-026-10809-9,2026-07-22 00:00:00+00:00,Science
Nature,https://www.nature.com/nature.rss,Here’s what’s next for the Artemis II astronauts,"Nature, Published online: 22 July 2026; doi:10.1038/d41586-026-02020-7 Newfound fame has proved to be stellar for some astronauts but harder for others. Will NASA’s popular crew need some space?",https://www.nature.com/articles/d41586-026-02020-7,2026-07-22 00:00:00+00:00,Science
Nature,https://www.nature.com/nature.rss,How to use AI to make a graphical abstract in minutes,"Nature, Published online: 22 July 2026; doi:10.1038/d41586-026-02072-9 Artificial intelligence is a democratizing force for those without graphic-design experience, as long as it is used conscientiously.",https://www.nature.com/articles/d41586-026-02072-9,2026-07-22 00:00:00+00:00,"Science, AI"
Nature,https://www.nature.com/nature.rss,AI identifies interactions in CRISPR complexes to improve specificity of DNA editing,"Nature, Published online: 22 July 2026; doi:10.1038/d41586-026-02042-1 AlphaFold3 predictions of the molecular contacts made by a genome-editing enzyme have been used to improve the enzyme’s selectivity for target DNA sequences.",https://www.nature.com/articles/d41586-026-02042-1,2026-07-22 00:00:00+00:00,"Biotech, Science"
Nature,https://www.nature.com/nature.rss,Genetic background sets the trajectory of experimental cancer evolution,"Nature, Published online: 22 July 2026; doi:10.1038/s41586-026-10821-z Experimentally replaying tumour evolution in divergent mouse strains reveals the importance of interactions between genetic ancestry and acquired cancer-driving mutations in shaping the earliest stages of cancer development.",https://www.nature.com/articles/s41586-026-10821-z,2026-07-22 00:00:00+00:00,Science
Nature,https://www.nature.com/nature.rss,Background genetics and new mutations interact to direct cancer evolution,"Nature, Published online: 22 July 2026; doi:10.1038/d41586-026-02155-7 Rerunning tumour evolution in mice shows how cancer develops after DNA damage and reveals that background genetics and acquired mutations interact to shape genome stability and selection. This provides experimental evidence that genetic ancestry has an important role in setting the trajectory of cancer evolution.",https://www.nature.com/articles/d41586-026-02155-7,2026-07-22 00:00:00+00:00,Science
Nature,https://www.nature.com/nature.rss,Brown bullhead catfish melanoma represents a novel transmissible cancer,"Nature, Published online: 22 July 2026; doi:10.1038/s41586-026-10828-6 Whole-genome sequencing analysis of tumour and matched non-tumour host tissues of the brown bullhead catfish reveals a type of naturally occurring transmissible cancer.",https://www.nature.com/articles/s41586-026-10828-6,2026-07-22 00:00:00+00:00,Science
Nature,https://www.nature.com/nature.rss,What counts as a moon? Huge ‘exosatellite’ sparks debate,"Nature, Published online: 22 July 2026; doi:10.1038/d41586-026-02299-6 Discovery of a distant Jupiter-mass object could pave the way for detection of exomoons — plus, a rare transmissible cancer found in catfish.",https://www.nature.com/articles/d41586-026-02299-6,2026-07-22 00:00:00+00:00,Science
Nature,https://www.nature.com/nature.rss,Mapping drivers of life expectancy change in Asia from 1990 to 2023,"Nature, Published online: 22 July 2026; doi:10.1038/s41586-026-10739-6 Using the Global Burden of Disease Study data across Asian countries and territories, life expectancy trends and the effects of cause-specific mortality and risk factors on changes in these trends are analysed.",https://www.nature.com/articles/s41586-026-10739-6,2026-07-22 00:00:00+00:00,Science
Nature,https://www.nature.com/nature.rss,RNA synthesis and substrate analog inhibition in the CCHFV polymerase,"Nature, Published online: 22 July 2026; doi:10.1038/s41586-026-10913-w RNA synthesis and substrate analog inhibition in the CCHFV polymerase",https://www.nature.com/articles/s41586-026-10913-w,2026-07-22 00:00:00+00:00,Science
Nature,https://www.nature.com/nature.rss,Eyes upturned towards infinity,"Nature, Published online: 22 July 2026; doi:10.1038/d41586-026-02256-3 Stars in our eyes.",https://www.nature.com/articles/d41586-026-02256-3,2026-07-22 00:00:00+00:00,Science
Nature,https://www.nature.com/nature.rss,How do quantum computers work?,"Nature, Published online: 22 July 2026; doi:10.1038/d41586-026-02219-8 Recent breakthroughs suggest usable devices could be here in a decade.",https://www.nature.com/articles/d41586-026-02219-8,2026-07-22 00:00:00+00:00,Science
Nature,https://www.nature.com/nature.rss,Precise DNA base editing using AlphaFold3-based contact modelling,"Nature, Published online: 22 July 2026; doi:10.1038/s41586-026-10794-z ContactSeek is an AlphaFold3-driven model that can improve the precision of genome-editing tools.",https://www.nature.com/articles/s41586-026-10794-z,2026-07-22 00:00:00+00:00,Science
Nature,https://www.nature.com/nature.rss,The heart has a ‘little brain’ — and it protects against stress,"Nature, Published online: 22 July 2026; doi:10.1038/d41586-026-02269-y A subset of cardiac neurons keep the heart from malfunctioning in stressed mice.",https://www.nature.com/articles/d41586-026-02269-y,2026-07-22 00:00:00+00:00,Science
Nature,https://www.nature.com/nature.rss,Fly neurons carry a molecular ‘timestamp’ that encodes their birth order,"Nature, Published online: 22 July 2026; doi:10.1038/d41586-026-02240-x A single-cell gene-expression atlas of the fly nerve cord mapped onto its wiring diagram has uncovered a simple shared gene-expression code. The code enables neurons to carry a molecular memory of the order of their birth from a parent cell, and shapes their diversity.",https://www.nature.com/articles/d41586-026-02240-x,2026-07-22 00:00:00+00:00,Science
Nature,https://www.nature.com/nature.rss,Geomagnetic storms caused by solar wind might be more extreme than previously thought,"Nature, Published online: 22 July 2026; doi:10.1038/d41586-026-02245-6 The severity of geomagnetic storms — magnetic disturbances in Earth’s outer atmosphere — is widely understood to reach an upper limit as the strength of the solar wind increases. But this upper limit is an illusion that results from uncertainty in the measurement of solar-wind strength as the true value regresses towards the mean.",https://www.nature.com/articles/d41586-026-02245-6,2026-07-22 00:00:00+00:00,Science
Nature,https://www.nature.com/nature.rss,A global molecular code for birth order and neuronal identity in Drosophila,"Nature, Published online: 22 July 2026; doi:10.1038/s41586-026-10797-w A high-resolution developmental transcriptional atlas of the Drosophila melanogaster nerve cord identifies a shared transcriptional code that records neuronal birth order and organizes neuronal diversity.",https://www.nature.com/articles/s41586-026-10797-w,2026-07-22 00:00:00+00:00,Science
Nature,https://www.nature.com/nature.rss,Three tips to avoid AI image mistakes in science,"Nature, Published online: 22 July 2026; doi:10.1038/d41586-026-02233-w Artificial-intelligence tools can be useful for brainstorming and creating graphics, but they can introduce errors. If you’re going to use them, here’s how to avoid problems.",https://www.nature.com/articles/d41586-026-02233-w,2026-07-22 00:00:00+00:00,Science
Nature,https://www.nature.com/nature.rss,Structures and inhibition of the Crimean–Congo haemorrhagic fever virus polymerase,"Nature, Published online: 22 July 2026; doi:10.1038/s41586-026-10701-6 Structural studies of Crimean–Congo haemorrhagic fever virus (CCHFV) polymerase reveal the structural basis of CCHFV RNA synthesis and highlight druggable sites for designing both nucleoside antivirals and non-nucleoside antivirals.",https://www.nature.com/articles/s41586-026-10701-6,2026-07-22 00:00:00+00:00,Science
Nature,https://www.nature.com/nature.rss,The planktonic microbiome of the Great Barrier Reef,"Nature, Published online: 22 July 2026; doi:10.1038/s41586-026-10778-z The Great Barrier Reef Microbial Genomes Database compiles prokaryotic, viral and eukaryotic genomes from seawater collected from the Great Barrier Reef, providing a rich resource for the study of marine microbial communities and ecosystem research and management.",https://www.nature.com/articles/s41586-026-10778-z,2026-07-22 00:00:00+00:00,Science
Nature,https://www.nature.com/nature.rss,AI-redesigned starting points and outcomes enhance protein evolution,"Nature, Published online: 22 July 2026; doi:10.1038/s41586-026-10820-0 A workflow using artificial intelligence-redesigned starting points to evolve enzymes with improved properties compared with those evolved from natural proteins is established.",https://www.nature.com/articles/s41586-026-10820-0,2026-07-22 00:00:00+00:00,"Science, AI"
Nature,https://www.nature.com/nature.rss,Structural basis of the RNA-editing cascade in trypanosome mitochondria,"Nature, Published online: 22 July 2026; doi:10.1038/s41586-026-10831-x Cryo-electron microscopy sheds light on the architecture of the Trypanosoma brucei mitochondrial editosome and reveals how this assembly mediates mRNA editing through the insertion and deletion of uridine nucleotides.",https://www.nature.com/articles/s41586-026-10831-x,2026-07-22 00:00:00+00:00,Science
Nature,https://www.nature.com/nature.rss,A vector-based strategy for olfactory navigation in Drosophila,"Nature, Published online: 22 July 2026; doi:10.1038/s41586-026-10827-7 Using a virtual reality system, experiments in Drosophila show that flies use memory mechanisms to navigate along the boundary of an odour plume and track the source of a smell.",https://www.nature.com/articles/s41586-026-10827-7,2026-07-22 00:00:00+00:00,Science
Nature,https://www.nature.com/nature.rss,Tertiary lymphoid structures harbour stem-like tumour-specific T cells,"Nature, Published online: 22 July 2026; doi:10.1038/s41586-026-10808-w Renal cell carcinoma tumours containing tertiary lymphoid structures (TLSs) are enriched for exhausted CD8+ T cells, including tumour-specific clonotypes with stem-like progenitor features and reduced terminal exhaustion.",https://www.nature.com/articles/s41586-026-10808-w,2026-07-22 00:00:00+00:00,Science
Nature,https://www.nature.com/nature.rss,Air conditioning is not enough to keep people cool — can scientists find an alternative?,"Nature, Published online: 22 July 2026; doi:10.1038/d41586-026-02273-2 Advances in materials allow buildings to be cooled as temperatures rise.",https://www.nature.com/articles/d41586-026-02273-2,2026-07-22 00:00:00+00:00,Science
Nature,https://www.nature.com/nature.rss,Insulator-free topological photonic multi-lane highways,"Nature, Published online: 22 July 2026; doi:10.1038/s41586-026-10817-9 An insulator-free topological waveguide architecture comprising four inequivalent photonic valley half-semimetals arranged in a parallel, cyclic configuration and stacked very close to one another demonstrates robust, multi-lane, unidirectional light transport with 100% spatial efficiency.",https://www.nature.com/articles/s41586-026-10817-9,2026-07-22 00:00:00+00:00,Science
Nature,https://www.nature.com/nature.rss,Prior therapy defines mutation profiles in childhood cancer at relapse,"Nature, Published online: 22 July 2026; doi:10.1038/s41586-026-10803-1 Chemotherapy, particularly with platinum-based drugs, is associated with substantial, rapidly detectable mutagenesis in childhood cancers, tripling private signatures and doubling mutation burden, highlighting therapy-induced tumour evolution and opportunities for safer, de-escalated treatment.",https://www.nature.com/articles/s41586-026-10803-1,2026-07-22 00:00:00+00:00,Science
Nature,https://www.nature.com/nature.rss,Non-Gaussian statistics of the order parameter across a phase transition,"Nature, Published online: 22 July 2026; doi:10.1038/s41586-026-10811-1 Single-atom measurements show non-Gaussian order-parameter fluctuations and critical scaling across a continuous phase transition, highlighting the importance of full statistical distributions in understanding universality.",https://www.nature.com/articles/s41586-026-10811-1,2026-07-22 00:00:00+00:00,Science
Nature,https://www.nature.com/nature.rss,Non-epitaxial perovskite polariton laser diode operating under direct current,"Nature, Published online: 22 July 2026; doi:10.1038/s41586-026-10824-w By integrating a solution-grown perovskite microplate with chemically inert single-walled carbon nanotube electrodes and embedding them into an optical microcavity, the new microdevices can achieve polariton lasing under a constant direct current at 8 K.",https://www.nature.com/articles/s41586-026-10824-w,2026-07-22 00:00:00+00:00,Science
Nature,https://www.nature.com/nature.rss,CRISPR–Cas regulates expression of embedded anti-phage defence systems,"Nature, Published online: 22 July 2026; doi:10.1038/s41586-026-10833-9 CRISPR–Cas systems transcriptionally tune diverse innate defences using CRISPR RNA-like guides to balance antiviral protection with fitness, and hyperactivate these defences when compromised, establishing a layered bacterial ‘immunity guard’ network.",https://www.nature.com/articles/s41586-026-10833-9,2026-07-22 00:00:00+00:00,"Biotech, Science"
Defense News,https://www.defensenews.com/arc/outboundfeeds/rss/,"Cost of Iran war rises to $37.5 billion, Pentagon requests $67.1 billion more","The Iran war has cost the DoD $37.5 billion to date, Hegseth told senators Tuesday, as he requested $67.1 billion more in emergency funding.",https://www.defensenews.com/news/pentagon-congress/2026/07/21/cost-of-iran-war-rises-to-375-billion-pentagon-requests-671-billion-more/,2026-07-21 23:13:23+00:00,"Defense, Funding"
Breaking Defense,https://breakingdefense.com/feed/,Hegseth offers $37.5B price tag for ‘certain aspects’ of Iran war,"In an at times contentious hearing, the defense secretary said the administration urgently needed nearly $90 billion in supplemental funding in part to cover Iran conflict-related costs.",https://breakingdefense.com/2026/07/hegseth-offers-37-5b-price-tag-for-certain-aspects-of-iran-war/,2026-07-21 22:34:02+00:00,"Defense, Funding"
