source,feed_url,headline,summary,url,published_date,topics
Science,https://www.science.org/rss/news_current.xml,"Exclusive: NSF slashes research programs to support new tech initiative, insiders say",Unexpected shift in funds has meant sharp drop in grants this fiscal year,https://www.science.org/content/article/exclusive-nsf-slashes-research-programs-support-new-tech-initiative-insiders-say,2026-06-22 11:15:00+00:00,Science
EU-Startups,https://www.eu-startups.com/feed/,Grid.online raises €4 million to expand shared last-mile delivery network for parcel carriers,"Grid.online, the Czech company building shared infrastructure for first- or last-mile parcel delivery, has raised €4 million after scaling parcel volumes more than 10× in its first year, surpassing 1 million deliveries through the network. The round is led by DFF Ventures and co-led by Movens Capital, with participation from angel investors from the early [&#8230;] The post Grid.online raises €4 million to expand shared last-mile delivery network for parcel carriers appeared first on EU-Startups .",https://www.eu-startups.com/2026/06/with-almost-2000-active-couriers-grid-online-raises-e4-million-to-expand-shared-last-mile-delivery-network/,2026-06-22 11:00:30+00:00,"Funding, Startups"
EU-Startups,https://www.eu-startups.com/feed/,"EU Inc. could fix one of Europe’s biggest startup headaches, but only if done right","Europe has a startup international expansion problem it can no longer afford to treat as technical or marginal. Too many promising companies still face unnecessary friction when growing in Europe. The issue is not a lack of talent or ambition. It is that Europe’s legal, regulatory and administrative landscape remains fragmented along national lines. For [&#8230;] The post EU Inc. could fix one of Europe’s biggest startup headaches, but only if done right appeared first on EU-Startups .",https://www.eu-startups.com/2026/06/eu-inc-could-fix-one-of-europes-biggest-startup-headaches-but-only-if-done-right/,2026-06-22 10:02:22+00:00,Startups
C4ISRNET,https://www.c4isrnet.com/arc/outboundfeeds/rss/,Ukraine launches ‘TrophyLab’ platform to share captured Russian weapons with allies,"Among the listed items available for study are, for example, a Kinzhal hypersonic missile and a T-90M tank.",https://www.c4isrnet.com/global/europe/2026/06/22/ukraine-launches-trophylab-platform-to-share-captured-russian-weapons-with-allies/,2026-06-22 09:27:55+00:00,"Defense, Science"
EU-Startups,https://www.eu-startups.com/feed/,London’s Isometric lands €34 million to scale certification platform for industrial markets,"Isometric has closed a €34 million ($40 million) Series A to expand its AI certification platform across the €305 billion ($350 billion) industrial certification market and accelerate its AI-enabled services expansion. The round is led by AVP. All of Isometric’s existing institutional investors, including Lowercarbon Capital and Plural, joined the round, with personal investment from Kleiner [&#8230;] The post London’s Isometric lands €34 million to scale certification platform for industrial markets appeared first on EU-Startups .",https://www.eu-startups.com/2026/06/londons-isometric-lands-e34-million-to-scale-certification-platform-for-industrial-markets/,2026-06-22 09:08:07+00:00,"Funding, Startups"
EU-Startups,https://www.eu-startups.com/feed/,Seedcamp raises €279 million to back Europe’s next generation of global startups,"Seedcamp, a British first check investor and backer of companies including Revolut, Wise, UiPath, Synthesia and Fluidstack, has raised €279 million ($320 million) to launch Fund VII and invest in the next generation of global companies. The new capital is allocated between €192 million ($220 million) for Seedcamp VII, the first check fund, and €87 [&#8230;] The post Seedcamp raises €279 million to back Europe’s next generation of global startups appeared first on EU-Startups .",https://www.eu-startups.com/2026/06/seedcamp-raises-e279-million-to-back-europes-next-generation-of-global-startups/,2026-06-22 08:07:41+00:00,"Funding, Startups"
MIT Technology Review,https://www.technologyreview.com/feed/,Inside the world’s deepest and longest subsea road tunnel,"It’s cold, it’s very, very noisy, and—if I can be quite honest with you—I’m not feeling super relaxed. I’m currently around 300 meters, or 1,000 feet, beneath the North Sea, in a dark, dank cave. It smells weird. And I am increasingly aware of the pressure from millions of tons of seawater just above my&#8230;",https://www.technologyreview.com/2026/06/22/1138821/inside-worlds-deepest-longest-subsea-road-tunnel/,2026-06-22 08:00:00+00:00,Other
War on the Rocks,https://warontherocks.com/feed/,"Too Big To Break Again: India, Italy, and the Defense Partnership That Almost Wasn’t","A single bribe nearly ruined a defense partnership most people didn&#8217;t know even existed. It took India and Italy almost a decade to recover.The story of how that rupture happened &#8212; and what it exposed about Italy&#8217;s quiet but deep role in India&#8217;s military &#8212; is essential to understanding why both countries now treat their renewed ties as something too valuable to lose again.When Indian authorities cancelled the AgustaWestland helicopter contract in 2014, the fallout went far beyond the headlines. Torpedo supplies to the Indian Navy&#8217;s Scorp&#232;ne-class submarines froze, upgrades to over 20 Sea King helicopters stalled, and a naval The post Too Big To Break Again: India, Italy, and the Defense Partnership That Almost Wasn’t appeared first on War on the Rocks .",https://warontherocks.com/too-big-to-break-again-india-italy-and-the-defense-partnership-that-almost-wasnt/,2026-06-22 07:30:07+00:00,Defense
EU-Startups,https://www.eu-startups.com/feed/,From field notes to field intelligence: Greenda’s AI bet on everyday farming (Sponsored),"Munich-based AgriTech startup Greenda, founded in 2024, is building an AI-powered crop advisory platform aimed at helping small and medium-sized farms detect and manage pests faster, while giving cooperative technicians a clearer overview of what is happening across hundreds of plots. For many farmers, the problem is not a lack of knowledge. It is timing, [&#8230;] The post From field notes to field intelligence: Greenda’s AI bet on everyday farming (Sponsored) appeared first on EU-Startups .",https://www.eu-startups.com/2026/06/from-field-notes-to-field-intelligence-greendas-ai-bet-on-everyday-farming-sponsored/,2026-06-22 07:15:06+00:00,Startups
Science,https://www.science.org/rss/news_current.xml,"After backlash, CDC revises plan to retire research monkeys to Texas sanctuary","New call for proposals seeks alternatives, though critics say the agency’s original choice is still leading option",https://www.science.org/content/article/after-backlash-cdc-revises-plan-retire-research-monkeys-texas-sanctuary,2026-06-22 05:13:00+00:00,Science
Science,https://www.science.org/rss/news_current.xml,Interstellar comet is unlike anything seen in our Solar System,Chemical signature of 3I/ATLAS suggests it formed early in the history of the Milky Way,https://www.science.org/content/article/interstellar-comet-unlike-anything-seen-our-solar-system,2026-06-22 01:35:00+00:00,Other
Nature,https://www.nature.com/subjects/biotechnology.rss,Distinct healing dynamics associated with xenograft selection in guided bone regeneration,,https://www.nature.com/articles/s41598-026-54078-y,2026-06-22 00:00:00+00:00,Other
Nature,https://www.nature.com/subjects/biotechnology.rss,Bioaugmentation with bacterial consortia for sustainable plastic waste treatment,,https://www.nature.com/articles/s44296-026-00113-y,2026-06-22 00:00:00+00:00,Other
Nature,https://www.nature.com/subjects/biotechnology.rss,Probing the limits of genetic recoding using multi-omics-guided evolution,,https://www.nature.com/articles/s41467-026-74300-9,2026-06-22 00:00:00+00:00,Other
Nature,https://www.nature.com/subjects/biotechnology.rss,Smart and bioactive packaging systems from anthocyanins and zinc oxide nanoparticles for quality monitoring and shelf-life extension of Nile perch (Lates niloticus),,https://www.nature.com/articles/s41598-026-58478-y,2026-06-22 00:00:00+00:00,Other
Nature,https://www.nature.com/subjects/biotechnology.rss,Toxic effects of Annona squamosa seed extracts against Tuta absoluta (Meyrick) (Lepidoptera: Gelechiidae) and their enzymatic response,,https://www.nature.com/articles/s41598-026-46436-7,2026-06-22 00:00:00+00:00,Other
Nature,https://www.nature.com/subjects/biotechnology.rss,Effects of preharvest 1-methylcyclopropene (1-MCP) spraying on delaying peel-color change and expression of carotenogenic genes in CO2-deastringed persimmons,,https://www.nature.com/articles/s41598-026-58754-x,2026-06-22 00:00:00+00:00,Other
Nature,https://www.nature.com/subjects/biotechnology.rss,Biomimetic mineralization of electrospun elastin-like recombinamer nanofibers,,https://www.nature.com/articles/s41598-026-58373-6,2026-06-22 00:00:00+00:00,Other
Nature,https://www.nature.com/subjects/biotechnology.rss,Menstrual blood for health and disease monitoring,,https://www.nature.com/articles/s44222-026-00465-z,2026-06-22 00:00:00+00:00,Other
Nature,https://www.nature.com/subjects/biotechnology.rss,Sowing date restructures carbon partitioning between defence and nutritional susceptibility to modulate stem borer resistance in sweet sorghum,,https://www.nature.com/articles/s41598-026-57668-y,2026-06-22 00:00:00+00:00,Defense
Nature,https://www.nature.com/subjects/biotechnology.rss,Reclone: a global research community building equitable access to reagents,,https://www.nature.com/articles/s41592-026-03148-0,2026-06-22 00:00:00+00:00,Science
Nature,https://www.nature.com/subjects/biotechnology.rss,Multi-omics insights into floral–fruity aroma formation during Pu’er tea fermentation inoculated with a synthetic fungal community,,https://www.nature.com/articles/s41538-026-00945-x,2026-06-22 00:00:00+00:00,Other
Nature,https://www.nature.com/subjects/biotechnology.rss,Moderate-temperature DNA cleavage activity of TtAgo activated by dCTP/TthSSB for one-step isothermal microRNAs detection,,https://www.nature.com/articles/s41467-026-74731-4,2026-06-22 00:00:00+00:00,Other
Nature,https://www.nature.com/subjects/biotechnology.rss,Automated in situ microfluidic Random-seq for robust single-nucleus and spatial total RNA profiling of diverse FFPE specimens,,https://www.nature.com/articles/s41467-026-74203-9,2026-06-22 00:00:00+00:00,Other
Nature,https://www.nature.com/subjects/biotechnology.rss,"Biological and genetic characteristics of Pospiviroid exocortiscitri and Hostuviroid impedihumuli in mulberry trees from Shiraz, Iran, using infectious clones",,https://www.nature.com/articles/s41598-026-57721-w,2026-06-22 00:00:00+00:00,Other
Nature,https://www.nature.com/subjects/biotechnology.rss,Sustained intravitreal delivery of carnosic acid by RADA16 peptide hydrogel protects the retina in acute ocular hypertension,,https://www.nature.com/articles/s41598-026-56818-6,2026-06-22 00:00:00+00:00,Other
Nature,https://www.nature.com/subjects/biotechnology.rss,Dynamic biophysical coupling in bioelectronic interfaces for peripheral nerve modulation,,https://www.nature.com/articles/s44287-026-00301-x,2026-06-22 00:00:00+00:00,Other
Nature,https://www.nature.com/subjects/biotechnology.rss,Direct inoculation of bioreactor-controlled stirred suspension culture with cryopreserved human pluripotent stem cells,,https://www.nature.com/articles/s41596-026-01398-y,2026-06-22 00:00:00+00:00,Other
Nature,https://www.nature.com/subjects/biotechnology.rss,"Phytochemical characterization, nutritional profile and biological activities of Urtica urens L. plant organs",,https://www.nature.com/articles/s41598-026-58771-w,2026-06-22 00:00:00+00:00,Other
Nature,https://www.nature.com/subjects/biotechnology.rss,Lead contamination fixation through CO2-based biomineralization,,https://www.nature.com/articles/s41598-026-58559-y,2026-06-22 00:00:00+00:00,Other
Nature,https://www.nature.com/subjects/biotechnology.rss,A trio-based long-read sequencing workflow identifies a pathogenic transposable element insertion in a previously undiagnosed patient,,https://www.nature.com/articles/s10038-026-01487-6,2026-06-22 00:00:00+00:00,Other
Nature,https://www.nature.com/subjects/biotechnology.rss,Scaling biodegradable plastics for a nature-positive future,,https://www.nature.com/articles/s41427-026-00656-5,2026-06-22 00:00:00+00:00,Other
