source,feed_url,headline,summary,url,published_date,topics
Breaking Defense,https://breakingdefense.com/feed/,"Reconciliation ‘floodgates’ about to open after slow start for contracts, Hegseth says","“Why do we suddenly have a two part budget where this committee and the Congress generally has oversight and input, to a process where a corner of the budget is essentially a slush fund?” asked Sen. Angus King, I-Maine, during a SASC hearing.",https://breakingdefense.com/2026/04/reconciliation-floodgates-about-to-open-after-slow-start-for-contracts-hegseth-says/,2026-04-30 20:17:06+00:00,Other
TechCrunch,https://techcrunch.com/feed/,Legal AI startup Legora hits $5.6B valuation and its battle with Harvey just got hotter,"The two wildly fast-growing rivals have raised massive sums, pushed into each other's home turf, and now have dueling ad campaigns.",https://techcrunch.com/2026/04/30/legal-ai-startup-legora-hits-5-6-valuation-and-its-battle-with-harvey-just-got-hotter/,2026-04-30 20:14:47+00:00,"Funding, Startups"
Satellite Today,https://www.satellitetoday.com/feed/,FCC Updates EPFD Framework that Covers GEO/NGSO Spectrum Sharing,"The FCC on Thursday voted to adopt a new framework for Equivalent Power Flux Density (EPFD), which governs spectrum-sharing between GEO and NGSO systems. EPFD limits have been a hot-button [&#8230;] The post FCC Updates EPFD Framework that Covers GEO/NGSO Spectrum Sharing appeared first on Via Satellite .",https://www.satellitetoday.com/government-military/2026/04/30/fcc-updates-epfd-framework-that-covers-geo-ngso-spectrum-sharing/,2026-04-30 20:10:29+00:00,Other
Phys.org,https://phys.org/rss-feed/,Superconducting quantum circuit simulates proton tunneling phenomenon in chemical systems,"Researchers at Yale, Google, and the University of California-Santa Barbara have created a device that simulates the quantum ""tunneling"" behavior of protons that occurs in chemistry, a process so common it occurs in everything from photosynthesis to the formation of human DNA.",https://phys.org/news/2026-04-superconducting-quantum-circuit-simulates-proton.html,2026-04-30 20:10:01+00:00,Science
TechCrunch,https://techcrunch.com/feed/,Rivian downsizes DOE loan to $4.5B for Georgia factory,"Rivian has reworked its loan deal with the Department of Energy and now expects to borrow $4.5 billion to build its new factory in Georgia, down from the original amount of $6.6 billion.",https://techcrunch.com/2026/04/30/rivian-downsizes-doe-loan-to-4-5b-of-georgia-factory/,2026-04-30 20:02:02+00:00,Other
Phys.org,https://phys.org/rss-feed/,Autumn leaves transformed into biodegradable mulch film can curb farm plastic pollution,"Fallen leaves, which are discarded every year, have been transformed into a resource that can replace waste plastics, a major nuisance in rural areas. A research team at the Korea Advanced Institute of Science and Technology (KAIST) has developed biodegradable agricultural vinyl made from fallen leaves, presenting a new way to solve the problem of conventional plastic vinyl, which is a cause of soil pollution. The study is published in the journal Green Chemistry.",https://phys.org/news/2026-04-autumn-biodegradable-mulch-curb-farm.html,2026-04-30 20:00:05+00:00,Science
Phys.org,https://phys.org/rss-feed/,Light-activated protein illuminates when embryos can cope with disruptions to cell division,"Cell division during the early stage of embryo development is a trade-off between speed and accuracy; the cells need to divide quickly to enable rapid growth, but it's important not to introduce errors that could be fatal to the developing embryo. But some stages of embryo development might be more tolerant of errors, coping with them without leading to complete failure.",https://phys.org/news/2026-04-protein-illuminates-embryos-cope-disruptions.html,2026-04-30 20:00:01+00:00,Other
Phys.org,https://phys.org/rss-feed/,"Malaria parasite sneaks mRNA into immune cell nuclei, disrupting defenses","RNA technology is regarded as one of the newest frontiers in medicine, but in fact a primordial innovator got there way before we did. The malaria parasite, an ancient single-celled organism, has been using sophisticated RNA maneuvers for millennia. In a study recently published in Cell Reports, researchers at the Weizmann Institute of Science uncover the parasite's RNA strategies—mechanisms that could inspire unexpected applications for RNA-based tools in multiple areas of medicine.",https://phys.org/news/2026-04-malaria-parasite-mrna-immune-cell.html,2026-04-30 19:50:02+00:00,Science
TechCrunch,https://techcrunch.com/feed/,"Hackers are actively exploiting a bug in cPanel, used by millions of websites",Web hosts are scrambling to fix the bug under active attack by hackers. One company said hackers have been abusing the bug for months.,https://techcrunch.com/2026/04/30/hackers-are-actively-exploiting-a-bug-in-cpanel-used-by-millions-of-websites/,2026-04-30 19:36:53+00:00,Other
War on the Rocks,https://warontherocks.com/feed/,Economic Fury and Claims of Victory,"Welcome to The Adversarial.&#160;Every other week, we&#8217;ll provide you with expert analysis on America&#8217;s greatest challengers: China, Russia, Iran, North Korea, and jihadists. Read more below.***IranThree weeks since a ceasefire took effect, the United States and Iran have shifted from open hostilities to unsuccessful negotiations to economic brinksmanship. The Trump administration has been squeezing Tehran on two parallel fronts: A naval blockade physically subduing its maritime trade, complemented by increasing sanctions pressure against its oil and banking networks. The Iranian government was already in a weak financial position before the war, so additional sanctions as part of what the U.S. The post Economic Fury and Claims of Victory appeared first on War on the Rocks .",https://warontherocks.com/economic-fury-and-claims-of-victory/,2026-04-30 19:30:45+00:00,Other
TechCrunch,https://techcrunch.com/feed/,"After dissing Anthropic for limiting Mythos, OpenAI restricts access to Cyber, too","OpenAI will begin rolling out its cybersecurity testing tool, GPT-5.5 Cyber only ""to critical cyber defenders"" at first.",https://techcrunch.com/2026/04/30/after-dissing-anthropic-for-limiting-mythos-openai-restricts-access-to-cyber-too/,2026-04-30 19:27:41+00:00,AI
Breaking Defense,https://breakingdefense.com/feed/,Air Force seeks to scrap its E-11 BACN fleet,"An Air Force spokesperson told Breaking Defense following the hearing that there are seven E-11s in the current fleet, and confirmed that the plan is to replace them with the emerging DAF (Department of the Air Force) Battle Network.",https://breakingdefense.com/2026/04/air-force-seeks-to-scrap-its-e-11-bacn-fleet/,2026-04-30 19:23:23+00:00,Defense
TechCrunch,https://techcrunch.com/feed/,EV startup Faraday Future paid $7.5M to company tied to founder Jia Yueting,The perpetually struggling EV company made the payments while being investigated by the SEC. That four-year probe was ultimately closed in March.,https://techcrunch.com/2026/04/30/ev-startup-faraday-future-paid-7-5m-to-company-tied-to-founder-jia-yueting/,2026-04-30 18:56:59+00:00,Startups
Breaking Defense,https://breakingdefense.com/feed/,Russia’s windfall from the Iran war is temporary. Ukraine’s isn’t.,"Kyiv, unlike Moscow, has secured strategic advantages from the war in Iran, writes Artur Kalandarov.",https://breakingdefense.com/2026/04/russias-windfall-from-the-iran-war-is-temporary-ukraines-isnt/,2026-04-30 18:54:27+00:00,Other
Defense News,https://www.defensenews.com/arc/outboundfeeds/rss/,Romania enters US counter-drone marketplace,"Romania will now be able to acquire counter-unmanned aerial system technology through the U.S.’s counter-drone marketplace, the Army said on Wednesday.",https://www.defensenews.com/news/your-military/2026/04/30/romania-enters-us-counter-drone-marketplace/,2026-04-30 18:44:01+00:00,Defense
MIT Technology Review,https://www.technologyreview.com/feed/,Exclusive eBook: Inside the stealthy startup that pitched brainless human clones,"The ultimate plan to live forever is a brand new body. This subscriber-only eBook explores R3 Bio, a small startup that has pitched a startling and ethically charged vision for &#8220;brainless clones&#8221; to serve the role of backup human bodies. by Antonio Regalado March 20, 2026 Related Stories: Access all subscriber-only eBooks:",https://www.technologyreview.com/2026/04/30/1136684/exclusive-ebook-inside-the-stealthy-startup-that-pitched-brainless-human-clones/,2026-04-30 18:42:50+00:00,Startups
TechCrunch,https://techcrunch.com/feed/,"OpenAI announces new advanced security for ChatGPT accounts, including a partnership with Yubico",OpenAI is launching additional opt-in protections for ChatGPT accounts. The new security initiative includes a new partnership with security key provider Yubico.,https://techcrunch.com/2026/04/30/openai-announces-new-advanced-security-for-chatgpt-accounts-including-a-partnership-with-yubico/,2026-04-30 18:20:03+00:00,AI
Breaking Defense,https://breakingdefense.com/feed/,Marines to start development on Advanced Reconnaissance Vehicle Increment 2 in 2029,"The Increment 2 iteration will consist of a counter unmanned aerial system variant, a recovery variant and one for precision fires.",https://breakingdefense.com/2026/04/marines-to-start-development-on-advanced-reconnaissance-vehicle-increment-2-in-2029/,2026-04-30 18:06:05+00:00,Other
TechCrunch,https://techcrunch.com/feed/,Elon Musk testifies that xAI trained Grok on OpenAI models,"""Distillation"" is a hot topic as frontier labs try to prevent smaller competitors from copying their models.",https://techcrunch.com/2026/04/30/elon-musk-testifies-that-xai-trained-grok-on-openai-models/,2026-04-30 18:03:57+00:00,AI
TechCrunch,https://techcrunch.com/feed/,"FDA approval, fundraising, and the reality of building in healthcare according to BioticsAI founder",BioticsAI CEO Robhy Bustami joined Isabelle Johannessen on Build Mode to discuss how the company has navigated a highly regulated space and kept the team motivated while cutting through all the red tape.,https://techcrunch.com/2026/04/30/fda-approval-fundraising-and-the-reality-of-building-in-healthcare-according-to-bioticsai-founder/,2026-04-30 17:53:53+00:00,Startups
TechCrunch,https://techcrunch.com/feed/,Google’s Gemini AI assistant is hitting the road in millions of vehicles,"The move signals Google’s push to bring more advanced, conversational AI into the driving experience.",https://techcrunch.com/2026/04/30/googles-gemini-ai-assistant-is-hitting-the-road-in-millions-of-vehicles/,2026-04-30 17:46:54+00:00,Other
TechCrunch,https://techcrunch.com/feed/,TikTok’s new ‘Campus Hub’ features college group chats and feeds,"The new hub features dedicated college group chats and personalized feeds designed to help students stay connected with their campus communities, even while they’re away for the summer.",https://techcrunch.com/2026/04/30/tiktoks-new-campus-hub-features-college-group-chats-and-feeds/,2026-04-30 17:24:49+00:00,Other
Defense News,https://www.defensenews.com/arc/outboundfeeds/rss/,From prototypes to production: US Air Force seeks nearly $1B for initial CCA procurement,"In a first, the Air Force is asking Congress to fund the purchase of Collaborative Combat Aircraft, marking the beginning of the “loyal wingman"" era.",https://www.defensenews.com/news/your-military/2026/04/30/from-prototypes-to-production-us-air-force-seeks-nearly-1b-for-initial-cca-procurement/,2026-04-30 17:19:41+00:00,Defense
TechCrunch,https://techcrunch.com/feed/,"Stripe introduces Link, a digital wallet that autonomous AI agents can use, too","Link lets users connect cards, banks, and subscriptions, then authorize AI agents to spend securely via approval flows.",https://techcrunch.com/2026/04/30/stripe-link-digital-wallet-ai-agents-shopping/,2026-04-30 17:15:19+00:00,Other
Defense News,https://www.defensenews.com/arc/outboundfeeds/rss/,Ukraine’s army chief shakes up troop rotations after outcry,"In some cases, the troops had resorted to drinking rain water, relatives of soldiers deployed in one frontline unit said.",https://www.defensenews.com/global/europe/2026/04/30/ukraines-army-chief-shakes-up-troop-rotations-after-outcry/,2026-04-30 16:29:37+00:00,Defense
TechCrunch,https://techcrunch.com/feed/,Salesforce is crowdsourcing its AI roadmap — with customers,"Salesforce lets its customers lead its product roadmap with the thinking that if one enterprise customer has a problem, the others likely do too.",https://techcrunch.com/2026/04/30/salesforce-is-crowdsourcing-its-ai-roadmap-with-customers/,2026-04-30 16:06:49+00:00,Other
MIT Technology Review,https://www.technologyreview.com/feed/,This startup’s new mechanistic interpretability tool lets you debug LLMs,"The San Francisco–based startup Goodfire just released a new tool, called Silico, that lets researchers and engineers peer inside an AI model and adjust its parameters—the settings that determine a model’s behavior—during training. This could give model makers more fine-grained control over how this technology is built than was once thought possible. Goodfire claims Silico&#8230;",https://www.technologyreview.com/2026/04/30/1136721/this-startups-new-mechanistic-interpretability-tool-lets-you-debug-llms/,2026-04-30 15:59:41+00:00,"AI, Science"
TechCrunch,https://techcrunch.com/feed/,"Uber taps Hertz to clean, charge, and fix its Lucid Motors robotaxis","Hertz is creating a new affiliate company called ""Oro Mobility"" to provide fleet management solutions ""across a range of mobility segments.""",https://techcrunch.com/2026/04/30/uber-taps-hertz-to-clean-charge-and-fix-its-lucid-motors-robotaxis/,2026-04-30 15:55:28+00:00,Other
EU-Startups,https://www.eu-startups.com/feed/,Weekly funding round-up! All of the European startup funding rounds we tracked this week (Apr. 27 – May 01),"This article is visible for CLUB members only. If you are already a member but don’t see the content of this article, please login here. If you’re not a CLUB member yet, but you’d like to read members-only content like this one, have unrestricted access to the site and benefit from many additional perks, you [&#8230;] The post Weekly funding round-up! All of the European startup funding rounds we tracked this week (Apr. 27 – May 01) appeared first on EU-Startups .",https://www.eu-startups.com/2026/04/weekly-funding-round-up-all-of-the-european-startup-funding-rounds-we-tracked-this-week-apr-27-may-01/,2026-04-30 15:45:50+00:00,"Startups, Funding"
EU-Startups,https://www.eu-startups.com/feed/,Swiss BioTech startup ALP Bio raises €1.9 million to advance immune organoid and AI platform,"Schlieren-based ALP Bio AG today announced it has raised €1.9 million in pre-Seed financing to accelerate their platform which combines human immune organoid biology with generative AI to help antibody developers identify, understand, and reduce immunogenicity risk earlier in drug development. The round was led by Munich-based VC 42CAP, with participation from Venture Kick and [&#8230;] The post Swiss BioTech startup ALP Bio raises €1.9 million to advance immune organoid and AI platform appeared first on EU-Startups .",https://www.eu-startups.com/2026/04/swiss-biotech-startup-alp-bio-raises-e1-9-million-to-advance-immune-organoid-and-ai-platform/,2026-04-30 15:37:36+00:00,"Funding, Startups"
TechCrunch,https://techcrunch.com/feed/,SpaceX backer 137 Ventures raises $700M for two growth-stage funds,"VC firm 137 Ventures has raised over $700 million to back growth-stage startups. Its portfolio includes SpaceX, Anduril, Hadrian.",https://techcrunch.com/2026/04/30/spacex-backer-137-ventures-raises-700m-for-two-growth-stage-funds/,2026-04-30 15:29:49+00:00,"Funding, Startups"
Breaking Defense,https://breakingdefense.com/feed/,"With unmanned systems in the forefront, Marine Corps evolves how it operates","Marines could begin operational testing with drone wingmen in 2029, and in the future could conduct their own intelligence, surveillance and reconnaissance missions in lieu of contractors, officials said during the Modern Day Marine conference in Washington.",https://breakingdefense.com/2026/04/with-unmanned-systems-in-the-forefront-marine-corps-evolves-how-it-operates/,2026-04-30 15:29:34+00:00,Defense
War on the Rocks,https://warontherocks.com/feed/,What a Post-Orbán Hungary Means for Hungarians and Europe,"Hungary has turned the page. After 16 years of rule by Viktor Orb&#225;n, opposition leader P&#233;ter Magyar has emerged as the winner by a landslide. Ryan is joined by S&#225;ndor &#201;sik, the lawyer and writer behind the&#160;Hungarian Muse, to understand how Orb&#225;n built his &#8220;soft-authoritarian&#8221; system, how it failed to stave off Magyar&#8217;s challenge, and what comes next. Of course, Orb&#225;n was anti-Ukrainian, pro-Russian, and antagonistic towards the European Union, so they also discuss what a post-Orb&#225;n Hungary means on those fronts. And, as a bonus, S&#225;ndor shares the bizarre story of how Orb&#225;n&#8217;s son &#8212; an Army officer &#8212; The post What a Post-Orbán Hungary Means for Hungarians and Europe appeared first on War on the Rocks .",https://warontherocks.com/what-a-post-orban-hungary-means-for-hungarians-and-europe/,2026-04-30 15:28:21+00:00,Defense
TechCrunch,https://techcrunch.com/feed/,Dental practice software maker fixes bug that exposed patients’ medical records,"The security bug is now fixed, but the patient who found it said it was challenging to alert the software company about the issue.",https://techcrunch.com/2026/04/30/dental-practice-software-maker-fixes-bug-that-exposed-patients-medical-records/,2026-04-30 15:15:41+00:00,Other
Defense News,https://www.defensenews.com/arc/outboundfeeds/rss/,US military commanders to brief Trump on military options against Iran,"Top U.S. military leaders, including CENTCOM head Adm. Brad Cooper, will brief President Trump on Thursday on potential military action against Iran.",https://www.defensenews.com/news/pentagon-congress/2026/04/30/us-military-commanders-to-brief-trump-on-military-options-against-iran/,2026-04-30 14:46:59+00:00,Defense
Breaking Defense,https://breakingdefense.com/feed/,CH-53K gears up for first deployment with 26th Marine Expeditionary Unit,"“The Marine Corps has a very deliberate plan for not only training, but also personnel and additional preparation for that deployment,” Col. Kate Fleeger, the helicopter’s program manager, said. “So we are deliberately moving through those individual checklist items to get ready and are continuing to progress towards that 26th MEU deployment.”",https://breakingdefense.com/2026/04/ch-53k-gears-up-for-first-deployment-with-26th-marine-expeditionary-unit/,2026-04-30 14:15:00+00:00,Other
Defense News,https://www.defensenews.com/arc/outboundfeeds/rss/,The US Army wants to manufacture meatless proteins in combat zones,"The service ""is exploring how the emerging alternative-protein sector can help meet several objectives, including enhancing food supply chain resilience.""",https://www.defensenews.com/news/your-military/2026/04/30/the-us-army-wants-to-manufacture-meatless-proteins-in-combat-zones/,2026-04-30 14:04:02+00:00,Defense
Breaking Defense,https://breakingdefense.com/feed/,"Ukraine to allow drone sales abroad, with caveats","Zelenskyy said he will ease restrictions on Ukrainian arms manufacturers, with regulations prioritizing the requirements of national forces first before exports are allowed.",https://breakingdefense.com/2026/04/ukraine-to-allow-drone-sales-abroad-with-caveats/,2026-04-30 13:31:00+00:00,Defense
Defense News,https://www.defensenews.com/arc/outboundfeeds/rss/,Romania picks Rheinmetall’s Lynx combat vehicle in $4 billion acquisition,Romanian defense leaders want the purchase of the Rheinmetall-made vehicles to be underwritten by European Union-backed loans.,https://www.defensenews.com/global/europe/2026/04/30/romania-picks-rheinmetalls-lynx-combat-vehicle-in-4-billion-acquisition/,2026-04-30 13:20:21+00:00,Defense
Labiotech,https://www.labiotech.eu/feed/,Five companies pushing biotech in Scotland,"Let’s pick up the bagpipes as we take a look at 5 biotech companies in Scotland driving the country's flourishing life sciences scene. The post Five companies pushing biotech in Scotland appeared first on Labiotech.eu . © Labiotech UG and Labiotech.eu. Unauthorized use and/or duplication of this material without express and written permission from this site’s author and/or owner is strictly prohibited. Excerpts and links may be used, provided that full and clear credit is given to Labiotech UG and Labiotech.eu with appropriate and specific direction to the original content.",https://www.labiotech.eu/best-biotech/top-biotechs-scotland/,2026-04-30 13:00:00+00:00,Biotech
Breaking Defense,https://breakingdefense.com/feed/,"Army requests funds to speed development, production of EW systems",The Army&#8217;s FY27 budget request allows faster fielding and continued experimentation on key electronic warfare and signals intelligence capabilities.,https://breakingdefense.com/2026/04/army-requests-funds-to-speed-development-production-of-ew-systems/,2026-04-30 12:52:34+00:00,Defense
Payload Space,https://payloadspace.com/feed/,CATALYST Unveils its Sat Product for City Skylines,"“Now we can show a construction firm what was already moving before they broke ground, an insurer the risk they were underwriting blind, and a city authority the consequences of densification they had approved but were not monitoring,” PCI Geomatics CEO June McAlarey said in a statement. The post CATALYST Unveils its Sat Product for City Skylines appeared first on Payload .",https://payloadspace.com/catalyst-unveils-its-sat-product-for-city-skylines/,2026-04-30 12:45:06+00:00,Other
Payload Space,https://payloadspace.com/feed/,York Space Systems to Acquire ALL.SPACE for $355M,"York hopes the combined tech will increase its exposure to “high-growth adjacent markets,” namely comms and multi-domain military use cases. The post York Space Systems to Acquire ALL.SPACE for $355M appeared first on Payload .",https://payloadspace.com/york-space-systems-to-acquire-all-space-for-355m/,2026-04-30 12:32:25+00:00,Defense
MIT Technology Review,https://www.technologyreview.com/feed/,The Download: the North Pole’s future and humanoid data,"This is today&#8217;s edition of The Download, our weekday newsletter that provides a daily dose of what&#8217;s going on in the world of technology. Digging for clues about the North Pole’s past In the past, getting to the North Pole involved a treacherous trip through ice many meters thick. But last year, a research vessel&#8230;",https://www.technologyreview.com/2026/04/30/1136713/the-download-north-pole-future-humanoid-data/,2026-04-30 12:10:00+00:00,Science
EU-Startups,https://www.eu-startups.com/feed/,AI game testing startup ManaMind lands €1.2 million to automate Quality Assurance,"ManaMind, a British autonomous game testing company, has closed a €1.2 million ($1.5 million) pre-Seed round in order to continue their work in replacing repetitive manual Quality Assurance (QA) with autonomous AI agents. The round was led by SVV (Sure Valley Ventures), with participation from EWOR, Ascension, Syndicate Room, and Heartfelt. Emil Kostadinov, CEO and [&#8230;] The post AI game testing startup ManaMind lands €1.2 million to automate Quality Assurance appeared first on EU-Startups .",https://www.eu-startups.com/2026/04/ai-game-testing-startup-manamind-lands-e1-2-million-to-automate-quality-assurance/,2026-04-30 11:58:24+00:00,"Startups, Funding"
EU-Startups,https://www.eu-startups.com/feed/,Cambridge-based Arm spin-out Kigen secures €11.5 million to scale eSIM cybersecurity,"Kigen, a Cambridge-based startup specialising in eSIM and Remote SIM Provisioning (RSP) security technologies, has secured €11.5 million (£10 million) in funding from Salica Investments, a UK-based investment firm. The growth debt investment will support Kigen’s next phase of growth across the UK, EU, and US. “This investment allows us to accelerate our next phase [&#8230;] The post Cambridge-based Arm spin-out Kigen secures €11.5 million to scale eSIM cybersecurity appeared first on EU-Startups .",https://www.eu-startups.com/2026/04/cambridge-based-arm-spin-out-kigen-secures-e11-5-million-to-scale-esim-cybersecurity/,2026-04-30 10:42:31+00:00,"Startups, Funding"
Payload Space,https://payloadspace.com/feed/,Orbital Data Center Competitive Landscape,"Orbital data center competition includes big players like SpaceX, Blue Origin, Sophia Space, Starcloud, Aetherflux, and Axiom. Plus, satellite manufacturing suppliers such as Apex and K2 Space. The post Orbital Data Center Competitive Landscape appeared first on Payload Pro. The post Orbital Data Center Competitive Landscape appeared first on Payload .",https://payloadspace.com/orbital-data-center-competitive-landscape/,2026-04-30 10:18:10+00:00,Space
Defense News,https://www.defensenews.com/arc/outboundfeeds/rss/,Investigation: Russian shadow airlines use Algeria as base for secretive missions,Algeria has become a key customer for Russian arms at a time when Moscow has seen a slump in its military-export business after the invasion of Ukraine.,https://www.defensenews.com/global/europe/2026/04/30/investigation-russian-shadow-airlines-use-algeria-as-base-for-secretive-missions/,2026-04-30 10:08:25+00:00,Defense
