source,feed_url,headline,summary,url,published_date,topics
EU-Startups,https://www.eu-startups.com/feed/,Can European startups learn from U.S. storytelling?,"Across AI, FinTech, HealthTech, ClimateTech, and B2B SaaS, European founders are building serious products for complex markets. Many understand regulation, infrastructure, trust and long enterprise sales cycles better than anyone. But, their communication does not always reflect the scale of what they are building. European startups often lead with precision, product detail, and proof. American [&#8230;] The post Can European startups learn from U.S. storytelling? appeared first on EU-Startups .",https://www.eu-startups.com/2026/06/can-european-startups-learn-from-u-s-storytelling/,2026-06-29 09:47:17+00:00,"Startups, MedTech"
EU-Startups,https://www.eu-startups.com/feed/,"Amid rising UK cyber talent growth, Osney Capital closes oversubscribed €69 million debut fund","UK venture capital firm Osney Capital today announced the final close of its debut fund, oversubscribed at its €69 million (£60 million) hard cap &#8211; cementing its position as one of the UK&#8217;s first cybersecurity Seed funds. The fund was supported by a cornerstone commitment from the British Business Bank through its Enterprise Capital Funds [&#8230;] The post Amid rising UK cyber talent growth, Osney Capital closes oversubscribed €69 million debut fund appeared first on EU-Startups .",https://www.eu-startups.com/2026/06/amid-rising-uk-cyber-talent-growth-osney-capital-closes-oversubscribed-e69-million-debut-fund/,2026-06-29 09:15:33+00:00,"Startups, Funding"
Phys.org,https://phys.org/rss-feed/,Toward experiment-guided AlphaFold: Researchers overcome AI tool's single-conformation limitation,"The AI-based program AlphaFold predicts a protein's 3D structure with remarkable accuracy. However, it tends to reduce heterogeneous structures to a single dominant conformation, or shape, and overlooks experimental conditions that can alter local structure. Researchers at the Institute of Science and Technology Austria (ISTA) and international collaborators have now developed a way to guide AlphaFold with experimental data. Their approach, published in Nature Biotechnology, paves the way for improved future predictive models.",https://phys.org/news/2026-06-alphafold-ai-tool-conformation-limitation.html,2026-06-29 09:00:01+00:00,"Science, Biotech"
SpaceNews,https://spacenews.com/feed/,Craft Prospect selected for The Sunday Times Scotland Fast 50,"(Glasgow, UK) Glasgow-based space engineering company Craft Prospect has been selected for inclusion in the inaugural edition of The Sunday Times Scotland Fast 50, a new annual list recognising some [&#8230;] The post Craft Prospect selected for The Sunday Times Scotland Fast 50 appeared first on SpaceNews .",https://spacenews.com/craft-prospect-selected-for-the-sunday-times-scotland-fast-50/,2026-06-29 09:00:00+00:00,Other
SpaceNews,https://spacenews.com/feed/,China establishes VLEO industry alliance as satellites demonstrate sustained low-orbit operations,"HELSINKI — China has established a national very low Earth orbit industry alliance, as multiple satellites demonstrate sustained operations below 300 kilometers and propulsion startups attract investment. China established a [&#8230;] The post China establishes VLEO industry alliance as satellites demonstrate sustained low-orbit operations appeared first on SpaceNews .",https://spacenews.com/china-establishes-vleo-industry-alliance-as-satellites-demonstrate-sustained-low-orbit-operations/,2026-06-29 08:53:12+00:00,"Space, Startups"
EU-Startups,https://www.eu-startups.com/feed/,British Business Bank portfolio passes 50 companies after €695 million scale-up push,"The British Business Bank today announced that they have invested more than €695 million (£600 million) into British science and technology scale-ups, increasing its direct equity portfolio to more than 50 high-growth companies. According to the Bank, they have more than doubled their direct equity investments since October 2025, reportedly investing more in the last [&#8230;] The post British Business Bank portfolio passes 50 companies after €695 million scale-up push appeared first on EU-Startups .",https://www.eu-startups.com/2026/06/british-business-bank-portfolio-passes-50-companies-after-e695-million-scale-up-push/,2026-06-29 08:31:26+00:00,Startups
War on the Rocks,https://warontherocks.com/feed/,The Defense Industrial Alliance Washington Is Throwing Away,"As the relationship between the United States and Canada continues to degrade, it now comes at the expense of each country&#8217;s industrial security.Last month, the Pentagon announced the unilateral suspension of the 86-year-old Canadian Permanent Joint Board on Defense in response to what the White House sees as Ottawa&#8217;s failure to present a credible plan to spend 3.5 percent of GDP on defense by 2035. And the opening of the gleaming new bridge between Detroit and Windsor has been long delayed in the tense run-up to the continental trade deal review.What many policymakers in Washington fail to realize is that The post The Defense Industrial Alliance Washington Is Throwing Away appeared first on War on the Rocks .",https://warontherocks.com/cogs-of-war/the-defense-industrial-alliance-washington-is-throwing-away/,2026-06-29 08:00:17+00:00,Defense
War on the Rocks,https://warontherocks.com/feed/,A New Force Posture Concept for Europeanizing Extended Nuclear Deterrence,"During the Cold War, Europe kept asking whether Washington would risk an American city to save a European one. It was an impolite question, but a useful one, which is why it never quite left the room. It has now packed its bags and moved east. Earlier this year, French President Emmanuel Macron created quite a stir with an important speech on French nuclear weapons policy. Under what he called a new path of dissuasion avanc&#233;e, or &#8220;forward deterrence,&#8221; he declared that just as French strategic submarines &#8220;dilute naturally in the oceans, guaranteeing a permanent-strike capability,&#8221; so also now will The post A New Force Posture Concept for Europeanizing Extended Nuclear Deterrence appeared first on War on the Rocks .",https://warontherocks.com/a-new-force-posture-concept-for-europeanizing-extended-nuclear-deterrence/,2026-06-29 07:30:58+00:00,Other
War on the Rocks,https://warontherocks.com/feed/,The Art of Statecraft in an Age of Strategic Failure,"Jack Watling, Statecraft: The New Rules of Power in a Divided World (Macmillan, 2026)The war against Iran exposed a multitude of forced errors and own goals in the conduct of statecraft. The purpose of sound statecraft is the integrated application of a state&#8217;s tools and its repertoire of governmental instruments of power to gain its desired outcomes in international relations. The yet-to-be-resolved contest against the Islamic Republic of Iran reveals a litany of shortfalls in the conduct of U.S. statecraft.It is unlikely that the present U.S. government will conduct a candid assessment of its shortcomings. Acknowledging the failure to achieve The post The Art of Statecraft in an Age of Strategic Failure appeared first on War on the Rocks .",https://warontherocks.com/the-art-of-statecraft-in-an-age-of-strategic-failure/,2026-06-29 07:15:56+00:00,Other
Phys.org,https://phys.org/rss-feed/,"The order of species loss alters how grasslands maintain stability, study finds",Grasslands account for roughly 40% of terrestrial ecosystems and are paramount to global food security. Wild grasslands provide food for livestock and habitat for pollinators and act as a carbon sink in the era of climate change. Maintaining the health of native grasslands is a critical component of protecting the human food supply and sustaining biodiversity in the face of rising global temperatures and changes in weather patterns.,https://phys.org/news/2026-06-species-loss-grasslands-stability.html,2026-06-29 04:10:06+00:00,Science
Phys.org,https://phys.org/rss-feed/,The oldest evidence of mourning rituals reveals Paleolithic communities grieved like we do,"Roughly 27,500 years ago, a 15-year-old boy was brutally mauled by a bear in Arene Candide in what is now Liguria, Italy. The attack tore through his jaw, neck and left shoulder. He was dying, but he was not alone in his final moments.",https://phys.org/news/2026-06-oldest-evidence-rituals-reveals-paleolithic.html,2026-06-29 00:30:01+00:00,Other
Phys.org,https://phys.org/rss-feed/,"Lost megalodon vertebrae resurface, confirming 80-foot size estimate","An associated set of gigantic vertebrae belonging to the iconic extinct megalodon, or megatooth shark, that had been missing in action since the 1980s was discovered, providing new information about the shark's lifestyle. Two Museum of Southern Jutland staff members, Mette Elstrup and Trine Sørensen, and a researcher at Aarhus University, Henrik Lauridsen, teamed up with a scientist in the United States and another in Australia and took a renewed look at a once-lost vertebral specimen of Otodus megalodon, the fossil shark that lived nearly worldwide about 15 million to 3.6 million years ago.",https://phys.org/news/2026-06-lost-megalodon-vertebrae-resurface-foot.html,2026-06-29 00:10:01+00:00,Science
Nature,https://www.nature.com/subjects/medical-research.rss,"Engineering stable, off-the-shelf cellular depots",,https://www.nature.com/articles/s41551-026-01729-0,2026-06-29 00:00:00+00:00,Other
Nature,https://www.nature.com/subjects/medical-research.rss,Clinical outcomes of the new generation VISUMAX 800 platform in small incision lenticule extraction for Myopia in Chinese patients,,https://www.nature.com/articles/s41598-026-57868-6,2026-06-29 00:00:00+00:00,Other
Nature,https://www.nature.com/subjects/medical-research.rss,SSRI/SNRI and long COVID in children and adolescents with neuropsychiatric conditions: a cohort study from the RECOVER Initiative,,https://www.nature.com/articles/s44220-026-00675-9,2026-06-29 00:00:00+00:00,Science
Nature,https://www.nature.com/subjects/medical-research.rss,"Metabolic health conditions in pregnancy, human milk hormone concentrations, and infant adiposity",,https://www.nature.com/articles/s41372-026-02782-y,2026-06-29 00:00:00+00:00,Other
Nature,https://www.nature.com/subjects/medical-research.rss,Comparative sedative effects of intravenous etomidate/fentanyl/midazolam versus propofol/fentanyl/midazolam combination for dental treatment of uncooperative children: a randomized clinical trial,,https://www.nature.com/articles/s41598-026-59790-3,2026-06-29 00:00:00+00:00,Biotech
Nature,https://www.nature.com/subjects/medical-research.rss,DHA and EPA alleviate atherosclerosis by synergistically regulating the aorta–liver axis via miRNA networks,,https://www.nature.com/articles/s41538-026-00920-6,2026-06-29 00:00:00+00:00,Other
Nature,https://www.nature.com/subjects/medical-research.rss,Translation of frozen sections into FFPE images for skin cancer resection margins using generative AI,,https://www.nature.com/articles/s41746-026-02939-1,2026-06-29 00:00:00+00:00,AI
Nature,https://www.nature.com/subjects/medical-research.rss,Acute fatigue and recovery responses to resistance training performed to momentary muscular failure: an exploratory multimodal physiological study,,https://www.nature.com/articles/s41598-026-59113-6,2026-06-29 00:00:00+00:00,Science
Nature,https://www.nature.com/subjects/medical-research.rss,A retargeted recombinase for precise insertion of large DNA,,https://www.nature.com/articles/s41587-026-03198-x,2026-06-29 00:00:00+00:00,Other
Nature,https://www.nature.com/subjects/medical-research.rss,Assessment of biological individuality in periodontitis patients using a specific algorithm and the Salus method,,https://www.nature.com/articles/s41598-026-59760-9,2026-06-29 00:00:00+00:00,Other
Nature,https://www.nature.com/subjects/medical-research.rss,Comment on: Application of gelatin sponge (Gelfoam®) as a hemostatic agent in inflatable penile prosthesis implantation,,https://www.nature.com/articles/s41443-026-01309-5,2026-06-29 00:00:00+00:00,Other
Nature,https://www.nature.com/subjects/medical-research.rss,Automated segmentation reveals sex-divergent age-related decline in temporalis muscle volume among Asian adults,,https://www.nature.com/articles/s41598-026-59470-2,2026-06-29 00:00:00+00:00,Other
Nature,https://www.nature.com/subjects/medical-research.rss,Comparative analysis of quantitative fundus results of the left and right eyes and screening for coronary atherosclerotic disease: a binocular study,,https://www.nature.com/articles/s41433-026-04565-3,2026-06-29 00:00:00+00:00,Science
Nature,https://www.nature.com/subjects/medical-research.rss,One-year outcomes of infants discharged with a nasogastric feeding tube,,https://www.nature.com/articles/s41372-026-02770-2,2026-06-29 00:00:00+00:00,Other
Phys.org,https://phys.org/rss-feed/,Human activity has driven retreat of Antarctica's fastest melting glacier,"Human-driven climate change significantly intensified the retreat of one of the most important glaciers in Antarctica during the 20th century. The Pine Island Glacier, which drains a large part of the West Antarctic Ice Sheet into the Amundsen Sea, is one of the biggest contributors to global sea level rise.",https://phys.org/news/2026-06-human-driven-retreat-antarctica-fastest.html,2026-06-28 23:00:01+00:00,Other
Phys.org,https://phys.org/rss-feed/,Bird flu is deadly for backyard chickens—and even cats. A vet expert explains,The deadly H5N1 strain of bird flu has been found in seabirds in two Australian states.,https://phys.org/news/2026-06-bird-flu-deadly-backyard-chickens.html,2026-06-28 22:30:01+00:00,Other
TechCrunch,https://techcrunch.com/feed/,California law targeting loud streaming ads takes effect on July 1,Streaming ads might be getting a lot quieter.,https://techcrunch.com/2026/06/28/california-law-targeting-loud-streaming-ads-takes-effect-on-july-1/,2026-06-28 21:34:14+00:00,Other
Phys.org,https://phys.org/rss-feed/,The solar gravitational lens could map white dwarfs and black holes,"It feels like every few months we get to report on another academic paper singing the praises of the Solar Gravitational Lens (SGL). Partly, this is due to Dr. Slava Turyshev's astounding productivity in pumping out academic articles, but partly because such a groundbreaking mission has lots of positive aspects—as well as challenges that need to be addressed. A new paper, posted to the arXiv preprint server from Dr. Turyshev, stresses an often overlooked feature of the SGL: how useful it can be for imaging things other than faraway exoplanets.",https://phys.org/news/2026-06-solar-gravitational-lens-white-dwarfs.html,2026-06-28 21:00:21+00:00,"MedTech, Science"
Phys.org,https://phys.org/rss-feed/,Europe swelters as heat wave moves east,"Europe's deadly heat wave pushed east Sunday, with hundreds of millions still sweltering across the continent despite fleeting relief from overnight storms, notably in France and Belgium.",https://phys.org/news/2026-06-europe-swelters-east.html,2026-06-28 20:19:35+00:00,Other
Phys.org,https://phys.org/rss-feed/,Nanopattern method unlocks precise control of disorder for wave-guiding devices,"A research team has developed a methodology to precisely design and control the ""degree of disorder"" in nanopattern arrays using metal-infiltrated block copolymer (BCP) thin films. The work was led by Professor So Youn Kim of the Seoul National University College of Engineering Department of Chemical and Biological Engineering, in collaboration with Professor Su-Mi Hur's team at DGIST and Professor S. Joon Kwon's team at Sungkyunkwan University. The paper is published in the journal Nature Communications. The study was selected as an Editors' Highlight in materials science and chemistry.",https://phys.org/news/2026-06-nanopattern-method-precise-disorder-devices.html,2026-06-28 20:00:01+00:00,Science
TechCrunch,https://techcrunch.com/feed/,Ford rehires ‘gray beard’ engineers after AI falls short,"""Mistakenly we thought that by just introducing artificial intelligence ... that would produce a high-quality product.”",https://techcrunch.com/2026/06/28/ford-rehires-gray-beard-engineers-after-ai-falls-short/,2026-06-28 19:05:39+00:00,AI
Phys.org,https://phys.org/rss-feed/,Injectable silk-kudzu hydrogel achieves complete wound closure in laboratory tests,"Researchers at the Terasaki Institute for Biomedical Innovation have developed an injectable hydrogel, a water-based gel material, made from silk proteins and a plant-derived compound. In laboratory tests, the material promoted complete wound closure within 72 hours, suggesting a potential new approach to minimally invasive soft tissue repair.",https://phys.org/news/2026-06-silk-kudzu-hydrogel-wound-closure.html,2026-06-28 19:00:01+00:00,Science
Phys.org,https://phys.org/rss-feed/,"Reanalysis suggests 'Phoebe' is a variable star, not a primordial black hole","A new study debunks a recent claim that astronomers may have detected a lunar-mass primordial black hole. In a reanalysis of observations from the Dark Energy Camera (DECam), researchers found that the star nicknamed ""Phoebe"" was simply doing something ordinary that many stars do: changing its brightness naturally over time. The new findings have been reported in a paper posted to the arXiv preprint server on June 17.",https://phys.org/news/2026-06-reanalysis-phoebe-variable-star-primordial.html,2026-06-28 18:20:01+00:00,Science
Phys.org,https://phys.org/rss-feed/,"12 billion years old, this interstellar comet is older than our solar system","One year ago, on July 1, 2025, astronomers discovered a fascinating new object moving through the solar system. Detected by the Asteroid Terrestrial-impact Last Alert System (ATLAS), the object was quickly recognized as something special.",https://phys.org/news/2026-06-billion-years-interstellar-comet-older.html,2026-06-28 18:00:01+00:00,Other
TechCrunch,https://techcrunch.com/feed/,Writer Ian Bogost says ‘The Small Stuff’ can help us reclaim our lives from too much convenience,Has Silicon Valley been building the wrong things?,https://techcrunch.com/2026/06/28/writer-ian-bogost-says-the-small-stuff-can-help-us-reclaim-our-lives-from-dematerialization/,2026-06-28 17:03:16+00:00,Other
Phys.org,https://phys.org/rss-feed/,Ancient algal defenses against UV may have helped plants conquer land,"A new study sheds light on how the ancestors of modern land plants survived one of the most challenging aspects of life outside water: exposure to harmful ultraviolet (UV) radiation. By examining a microscopic alga closely related to the earliest land plants, researchers have uncovered a sophisticated and dynamic system for coping with sunburn—one that likely helped plants colonize land more than 500 million years ago. The results are published in Current Biology.",https://phys.org/news/2026-06-ancient-algal-defenses-uv-conquer.html,2026-06-28 17:00:01+00:00,Science
Phys.org,https://phys.org/rss-feed/,Better unemployment welfare could curb rise of populism,"The study, by researchers Chase Foster (King's College London) and Jeffry Frieden (Columbia University), analyzed 134 national elections in 16 countries between 1990 and 2021, alongside data from 11 waves of the European Social Survey. The research is published in the journal European Union Politics.",https://phys.org/news/2026-06-unemployment-welfare-curb-populism.html,2026-06-28 16:30:02+00:00,Science
TechCrunch,https://techcrunch.com/feed/,TechCrunch Mobility: All eyes on Tesla FSD,"Welcome back to TechCrunch Mobility, your hub for the future of transportation and now, more than ever, how AI is playing a part.",https://techcrunch.com/2026/06/28/techcrunch-mobility-all-eyes-on-tesla-fsd/,2026-06-28 16:05:00+00:00,Other
Phys.org,https://phys.org/rss-feed/,Australia boosts shark-spotting drone coverage at Sydney beaches,"Australia will expand shark-spotting drone coverage year-round at beaches across Sydney and beyond from July 1, authorities said Sunday, following a rise in attacks and sightings.",https://phys.org/news/2026-06-australia-boosts-shark-drone-coverage.html,2026-06-28 15:40:04+00:00,Defense
Phys.org,https://phys.org/rss-feed/,Shining blue light on gold-graphene nanodots achieves wound healing trifecta,"Closing wounds, burns and deep cuts isn't enough to kick-start healing. A wound needs a clean environment, free of bacterial infection and interruption. That calls for three components working together—one to kill bacteria, one to clean the wound and one to support recovery.",https://phys.org/news/2026-06-blue-gold-graphene-nanodots-wound.html,2026-06-28 15:40:02+00:00,Other
Phys.org,https://phys.org/rss-feed/,NASA races to save Swift telescope from falling back to Earth with daring rescue mission,NASA is racing to save an aging telescope from falling back to Earth with a daring rescue mission.,https://phys.org/news/2026-06-nasa-swift-telescope-falling-earth.html,2026-06-28 15:23:34+00:00,Other
Phys.org,https://phys.org/rss-feed/,"More than 1,300 excess deaths recorded in Europe heat wave: WHO","The World Health Organization said Sunday that more than 1,300 excess deaths had been recorded in Europe since June 21 in connection with the record-breaking heat wave roasting much of the continent.",https://phys.org/news/2026-06-excess-deaths-europe.html,2026-06-28 15:21:20+00:00,Other
Phys.org,https://phys.org/rss-feed/,"Everyone experiences loss and grief, but that doesn't make it any easier to talk with kids about it","When I was a school social worker, a teary-eyed father once came to the school to tell his 4-year-old daughter's teacher that the child's mother had been in an accident. He did not speak to his child as she looked on, but simply relayed pickup arrangements to the teacher before he hurried to the hospital.",https://phys.org/news/2026-06-loss-grief-doesnt-easier-kids.html,2026-06-28 15:00:01+00:00,Other
TechCrunch,https://techcrunch.com/feed/,Why Wall Street thinks US memory maker Micron is the next Nvidia,"Eager to find more public AI-related companies that may do as well as Nvidia, Wall Street investors think they've found a winner with Micron.",https://techcrunch.com/2026/06/28/why-wall-street-thinks-us-memory-maker-micron-is-the-next-nvidia/,2026-06-28 15:00:00+00:00,Funding
Phys.org,https://phys.org/rss-feed/,The sun's outbursts may briefly weaken rain and snow events across North America,"For decades, scientists have searched for a clear link between the sun's explosive storms and the weather that occurs on Earth. A breakthrough study from the University of New Hampshire reveals that in the hours and days following a solar storm, parts of North America can see sharp changes in the weather—such as declines in precipitation—and the more powerful the storm, the more dramatic the shift.",https://phys.org/news/2026-06-sun-outbursts-briefly-weaken-events.html,2026-06-28 14:00:04+00:00,Science
TechCrunch,https://techcrunch.com/feed/,Govee’s smart nugget ice maker makes every iced drink feel like a luxury,"For some people, the ice in a beverage is almost as important as the drink itself. That&#8217;s the audience Govee had in mind when designing its latest ice maker, the GoveeLife Smart Nugget Ice Maker Pro.&#160;This $500 premium smart home gadget is aimed at those who crave what&#8217;s called “the good ice,” the soft, chewable [&#8230;]",https://techcrunch.com/2026/06/28/govees-smart-nugget-ice-maker-makes-every-iced-drink-feel-like-a-luxury/,2026-06-28 14:00:00+00:00,Other
Phys.org,https://phys.org/rss-feed/,Scientists uncover evolutionary edge behind plant invasions,"Plants that become invasive may owe their success to an advantage shaped long before they arrive, according to new research led by King's College London.",https://phys.org/news/2026-06-scientists-uncover-evolutionary-edge-invasions.html,2026-06-28 13:30:01+00:00,Science
Phys.org,https://phys.org/rss-feed/,Off-center stellar death points to wandering supermassive black hole stripped of its own galaxy,Astronomers have uncovered new details about the black hole that ripped apart a star in a tidal disruption event named AT2024tvd. Findings suggest it is a wandering supermassive black hole—the kind that is not located at the center of a visible galaxy. The paper outlining this research was published in The Astrophysical Journal Letters on June 12.,https://phys.org/news/2026-06-center-stellar-death-supermassive-black.html,2026-06-28 13:20:01+00:00,Science
Phys.org,https://phys.org/rss-feed/,Oxygen atoms in 15‑million‑year‑old giant eggshells reveal how plants reacted to a hotter Earth,"Some periods in Earth's history are so different from our own that they may as well belong to another planet. Many people are interested in the age of dinosaurs or the Ice Ages, but it is an intermediate world, the Miocene Epoch—a sort of ""in-between"" world, geologically speaking: less recent than mammoths and stone tools, but not the deep past of dinosaurs—that many scientists find interesting.",https://phys.org/news/2026-06-oxygen-atoms-15millionyearold-giant-eggshells.html,2026-06-28 12:00:01+00:00,Science
Phys.org,https://phys.org/rss-feed/,Climate change to blame for intensity of Europe heat wave: Scientists,"Human-caused climate change is ""unequivocally"" responsible for the intensity of a record-breaking heat wave scorching Europe, scientists said Friday.",https://phys.org/news/2026-06-climate-blame-intensity-europe-scientists.html,2026-06-28 10:20:01+00:00,Science
