source,feed_url,headline,summary,url,published_date,topics
Phys.org,https://phys.org/rss-feed/,'Morale boost': NASA carries out Moon mission during tough year for science,As the four Artemis astronauts approached a high point of their lunar mission—getting slung around the far side of the moon—NASA staffers crowded into Houston's famed mission control room Monday for a team photo.,https://phys.org/news/2026-04-morale-boost-nasa-moon-mission.html,2026-04-07 09:20:02+00:00,Other
Phys.org,https://phys.org/rss-feed/,Water on the moon? New study narrows down the mostly likely locations,"Water likely accumulated on the moon slowly over billions of years, rather than during one big event, according to a new study by an international team of scientists. The researchers, including Paul Hayne, a planetary scientist at the Laboratory for Atmospheric and Space Physics (LASP) at the University of Colorado Boulder, have published their findings in Nature Astronomy.",https://phys.org/news/2026-04-moon-narrows.html,2026-04-07 09:00:03+00:00,Science
Phys.org,https://phys.org/rss-feed/,"Artemis astronauts survey lunar surface on flyby, solar eclipse up next",The four astronauts carrying out NASA's first lunar flyby in more than half-a-century were sending back detailed observations of the moon after traveling farther from Earth than any human before.,https://phys.org/news/2026-04-artemis-astronauts-survey-lunar-surface.html,2026-04-07 08:50:01+00:00,Other
Phys.org,https://phys.org/rss-feed/,"After milestone-rich lunar flyby, astronauts start trip home","The Artemis II astronauts wrapped up their lunar flyby as they continue their journey back to Earth on Tuesday, bringing with them rich celestial observations including little-known lunar craters, a solar eclipse and meteor strikes that scientists hope will open doors.",https://phys.org/news/2026-04-milestone-rich-lunar-flyby-astronauts.html,2026-04-07 08:40:01+00:00,Science
Phys.org,https://phys.org/rss-feed/,Lunar crater named after Artemis commander's deceased wife,Artemis astronauts at the outer edge of human space travel had an emotional moment Monday as they proposed to name a crater in honor of the deceased wife of mission commander Reid Wiseman.,https://phys.org/news/2026-04-lunar-crater-artemis-deceased-wife.html,2026-04-07 08:20:01+00:00,Other
Phys.org,https://phys.org/rss-feed/,"Artemis astronauts pass behind moon, expected communications cut starts","The four Artemis astronauts on a lunar flyby are now unreachable by NASA scientists on Earth, an expected communications blackout anticipated to last some 40 minutes as their spacecraft passes behind the moon.",https://phys.org/news/2026-04-artemis-astronauts-moon-communications.html,2026-04-07 08:07:50+00:00,"Space, Science"
Phys.org,https://phys.org/rss-feed/,"Laughter, tears: Historic day for astronaut Jenni Gibbons in Houston","Canadian astronaut Jenni Gibbons was at the heart of NASA's control room in Houston on Monday, supporting her Artemis II crewmates remotely during their flight around the moon.",https://phys.org/news/2026-04-laughter-historic-day-astronaut-jenni.html,2026-04-07 08:03:16+00:00,Other
War on the Rocks,https://warontherocks.com/feed/,The Hidden System Turning Chinese Tech Companies into Military Suppliers,"In October 2022, Unitree Robotics joined Boston Dynamics, Agility Robotics, and three other firms in signing an open letter pledging not to weaponize their machines and to review customers&#8217; intended applications. This Chinese startup based in Hangzhou had earned its place in that group. Founded in 2016 by a 26-year-old engineer named Wang Xingxing, who quit his job at the drone maker DJI during his probationary period, Unitree set out to build affordable quadruped robots. It worked. By 2023, the company held over 60 percent of the global quadruped robot market by unit sales. Its investors included Sequoia China, Meituan, The post The Hidden System Turning Chinese Tech Companies into Military Suppliers appeared first on War on the Rocks .",https://warontherocks.com/2026/04/the-hidden-system-turning-chinese-tech-companies-into-military-suppliers-2/,2026-04-07 08:00:02+00:00,"Defense, Startups"
War on the Rocks,https://warontherocks.com/feed/,Closing the Air and Missile Defense Gap in the Indo-Pacific,"During last summer&#8217;s 12-day war between Iran, Israel, and the United States, the U.S. military supported Israeli air and missile defense operations by utilizing its regionally deployed air and missile defense assets to intercept Iranian missiles and drones. By the time the shooting had stopped, CNN reported that the United States had expended 100 to 150 upper-tier, terminal-phase missile interceptors against Iranian missiles. This means that, in 12 days of fighting, the United States expended approximately 25 percent of its total stockpile &#8212; or 150 percent of annual global production at current production rates (though production increases are anticipated). The The post Closing the Air and Missile Defense Gap in the Indo-Pacific appeared first on War on the Rocks .",https://warontherocks.com/2026/04/closing-the-air-and-missile-defense-gap-in-the-indo-pacific/,2026-04-07 07:30:22+00:00,Defense
War on the Rocks,https://warontherocks.com/feed/,Iran’s Anti-Access and Area Denial Strategy Is Cruder Than China’s But Still Dangerous,"In past wars, commanders worried about what would happen after crossing the line of departure. Today, the concern is whether they can cross it at all. Surely this is a concern as the United States considers sending a Marine expeditionary unit into the Persian Gulf. Before they enter, whether by air or sea, the fight will already be underway. Meanwhile, closed shipping routes are increasing the costs of shipping, America&#8217;s Gulf partners are under continued pressure, and the Houthis fired a missile to underscore the point. The path to the battlefield is the battlefield. No longer a prelude.This is by The post Iran’s Anti-Access and Area Denial Strategy Is Cruder Than China&#8217;s But Still Dangerous appeared first on War on the Rocks .",https://warontherocks.com/2026/04/irans-anti-access-and-area-denial-strategy-is-cruder-than-chinas-but-still-dangerous/,2026-04-07 07:15:10+00:00,Defense
TechCrunch,https://techcrunch.com/feed/,AI startup Rocket offers vibe McKinsey-style reports at a fraction of the cost,"Rocket's new AI platform combines strategy, product building, and competitive intelligence, aiming to move beyond code generation.",https://techcrunch.com/2026/04/06/indian-startup-rocket-wants-its-ai-to-do-mckinsey-style-consulting-at-a-fraction-of-the-cost/,2026-04-07 05:30:00+00:00,Startups
TechCrunch,https://techcrunch.com/feed/,AI design platform Picsart launches a creator monetization program,"The program invites creators to create original content with Picsart tools for a specific campaign, share it on their social channels, and earn revenue based on how their audience engages.",https://techcrunch.com/2026/04/06/ai-design-platform-picsart-launches-a-creator-monetization-program/,2026-04-07 04:01:00+00:00,Other
Phys.org,https://phys.org/rss-feed/,"GMO pictures may reinforce existing views, deepening the divide of attitudes towards them","Images have long played a powerful role in shaping public perceptions of genetically modified organisms (GMOs), often reinforcing emotional reactions more than scientific understanding. A new experimental study published in the Journal of Science Communication (JCOM) explores how different types of images can influence people's attitudes toward GMOs—and suggests that pictures may reinforce existing views, further polarizing them.",https://phys.org/news/2026-04-gmo-pictures-views-deepening-attitudes.html,2026-04-07 04:00:02+00:00,Science
Phys.org,https://phys.org/rss-feed/,New method rapidly analyzes cell proteins and metabolites,"Researchers at Cedars-Sinai have developed a fast, new technique for analyzing cells, described in the journal Angewandte Chemie. The approach, called single-injection multi-omics analysis by direct infusion (SMAD), can detect more than 1,300 proteins and more than 9,000 molecular features from a single sample in less than five minutes.",https://phys.org/news/2026-04-method-rapidly-cell-proteins-metabolites.html,2026-04-07 02:40:01+00:00,Science
SpaceNews,https://spacenews.com/feed/,Artemis 2 swings around the moon,Four astronauts from the United States and Canada became the humans to travel the furthest from the Earth April 6 as they went around the moon on the Artemis 2 mission. The post Artemis 2 swings around the moon appeared first on SpaceNews .,https://spacenews.com/artemis-2-swings-around-the-moon/,2026-04-07 01:51:44+00:00,Other
Phys.org,https://phys.org/rss-feed/,How an eye physician who translated classical Greek medicine into Arabic helped form Western medical thought,"A medieval ophthalmologist who translated Greek works by Galen, Hippocrates, and Plato into Arabic played a pivotal role in shaping Western medical scholarship, according to a study published in the journal Cogent Arts and Humanities.",https://phys.org/news/2026-04-eye-physician-classical-greek-medicine.html,2026-04-07 01:30:01+00:00,Science
Phys.org,https://phys.org/rss-feed/,"By age 7, most children quickly spot individuals' social biases toward social groups, study finds","Most elementary school-aged children have a surprising cognitive ability: they can detect—nearly as well as adults—when someone treats people from one social group differently than another. The study, ""Children's and adults' detection of social biases,"" published in Child Development, demonstrates children's emerging capacity to recognize and reason about social bias.",https://phys.org/news/2026-04-age-children-quickly-individuals-social.html,2026-04-07 00:20:01+00:00,Science
Breaking Defense,https://breakingdefense.com/feed/,General Atomics CCA drone wingman prototype crashes in California,The company said a mishap occurred “following takeoff” today.,https://breakingdefense.com/2026/04/general-atomics-cca-drone-wingman-prototype-crashes-in-california/,2026-04-07 00:19:03+00:00,Defense
Nature,https://www.nature.com/subjects/medical-research.rss,A combined PBL and flipped classroom intervention enhances self-directed learning ability and empathy in ophthalmology undergraduates,,https://www.nature.com/articles/s41598-026-47584-6,2026-04-07 00:00:00+00:00,Other
Nature,https://www.nature.com/subjects/medical-research.rss,Association between estimated plasma volume status and all-cause mortality in critically ill patients with non-traumatic subarachnoid hemorrhage: analysis of the MIMIC-IV database,,https://www.nature.com/articles/s41598-026-47116-2,2026-04-07 00:00:00+00:00,Other
Nature,https://www.nature.com/subjects/medical-research.rss,Montelukast attenuates diclofenac sodium-induced cardiotoxicity in male rats via targeting Wnt/β-catenin pathway,,https://www.nature.com/articles/s41598-026-46514-w,2026-04-07 00:00:00+00:00,Other
Nature,https://www.nature.com/subjects/medical-research.rss,Identification and structural characterisation of a novel mutation in the CNKSR2 gene associated with Houge-Type X-Linked Intellectual Developmental Disorder,,https://www.nature.com/articles/s10038-026-01475-w,2026-04-07 00:00:00+00:00,Other
Nature,https://www.nature.com/subjects/medical-research.rss,A multi therapy bioelectronic wound dressing,,https://www.nature.com/articles/s44385-026-00081-x,2026-04-07 00:00:00+00:00,Other
Nature,https://www.nature.com/subjects/medical-research.rss,Zodasiran for cholesterol and triglyceride lowering in patients with hyperlipidemia: final report of phase 1 basket trial,,https://www.nature.com/articles/s41591-026-04307-8,2026-04-07 00:00:00+00:00,Other
Nature,https://www.nature.com/subjects/medical-research.rss,Suppression of mitochondrial energy production by a photosynthetic bacterial cupredoxin peptide inhibits tumor growth,,https://www.nature.com/articles/s41392-026-02703-7,2026-04-07 00:00:00+00:00,Other
Nature,https://www.nature.com/subjects/medical-research.rss,Racial and microvascular determinants of progression to treatment-warranted diabetic eye disease,,https://www.nature.com/articles/s41433-026-04417-0,2026-04-07 00:00:00+00:00,Other
Nature,https://www.nature.com/subjects/medical-research.rss,Don’t rush use of lymphatic surgery in Alzheimer’s disease,,https://www.nature.com/articles/d41586-026-01093-8,2026-04-07 00:00:00+00:00,Other
Nature,https://www.nature.com/subjects/medical-research.rss,Comparative study on changes in serum amino acid metabolic profiles in mice exposed to perfluorooctanoic acid and sodium ρ-perfluorous nonenoxybenzene sulfonate,,https://www.nature.com/articles/s41598-026-47516-4,2026-04-07 00:00:00+00:00,Science
Nature,https://www.nature.com/subjects/medical-research.rss,Assessing the reproducibility of a subject-specific finite element modelling pipeline for the human metastatic vertebrae,,https://www.nature.com/articles/s41598-026-46900-4,2026-04-07 00:00:00+00:00,Other
Nature,https://www.nature.com/subjects/medical-research.rss,Growth hormone-releasing hormone attenuates amyloid deposition and neuroinflammation in Alzheimer’s disease models,,https://www.nature.com/articles/s41419-026-08699-w,2026-04-07 00:00:00+00:00,Other
Nature,https://www.nature.com/subjects/medical-research.rss,Gait asymmetry in Parkinson’s disease – a systematic review and meta-analysis (AsymmGait-Parkinson study),,https://www.nature.com/articles/s41598-026-46469-y,2026-04-07 00:00:00+00:00,Science
Nature,https://www.nature.com/subjects/medical-research.rss,Unmasking non-malarial mosquito-borne infections among febrile children in malaria-endemic regions of western Kenya,,https://www.nature.com/articles/s41598-026-47471-0,2026-04-07 00:00:00+00:00,Other
Nature,https://www.nature.com/subjects/medical-research.rss,Effects of different inflatable heater temperature settings on early postoperative recovery after hysteroscopic surgery: a randomized clinical trial,,https://www.nature.com/articles/s41598-026-47337-5,2026-04-07 00:00:00+00:00,Biotech
Nature,https://www.nature.com/subjects/medical-research.rss,Extensive Age-Balanced and Subject-Varied mmWave Radar Dataset of Referenced Records for Vital Signs,,https://www.nature.com/articles/s41597-026-07172-9,2026-04-07 00:00:00+00:00,Other
Nature,https://www.nature.com/subjects/medical-research.rss,The portability paradox of foundation models for clinical decision support,,https://www.nature.com/articles/s41746-026-02615-4,2026-04-07 00:00:00+00:00,AI
Nature,https://www.nature.com/subjects/medical-research.rss,Influence of B cell-lineage targeted CAR-T cell therapy on humoral immunity and vaccine-induced antibody response,,https://www.nature.com/articles/s41467-026-71473-1,2026-04-07 00:00:00+00:00,Biotech
Nature,https://www.nature.com/subjects/medical-research.rss,Development and validation of a nomogram for overall survival in pancreatic solid pseudopapillary neoplasm: a population-based study,,https://www.nature.com/articles/s41598-026-47722-0,2026-04-07 00:00:00+00:00,Science
Nature,https://www.nature.com/subjects/medical-research.rss,Characterization of residual kidney function in chronic hemodialysis patients using plasma metabolomics,,https://www.nature.com/articles/s41598-026-47357-1,2026-04-07 00:00:00+00:00,Other
Nature,https://www.nature.com/subjects/medical-research.rss,Osteoarthritis and analgesic consumption in haemochromatosis HFE C282Y homozygotes with normal or low iron parameters,,https://www.nature.com/articles/s41467-026-71367-2,2026-04-07 00:00:00+00:00,Other
Nature,https://www.nature.com/subjects/medical-research.rss,Importance of balanced datasets with feature selection and ensemble methods on heart disease classification using distinctive machine learning techniques: a comparative analysis,,https://www.nature.com/articles/s41598-026-47691-4,2026-04-07 00:00:00+00:00,AI
Nature,https://www.nature.com/subjects/medical-research.rss,Development of a novel external fixation device for inducing knee arthrofibrosis in rats,,https://www.nature.com/articles/s41598-026-46668-7,2026-04-07 00:00:00+00:00,Other
Nature,https://www.nature.com/subjects/medical-research.rss,Lightweight liquid neural networks decipher salivary metabolic fingerprinting for high-risk periodontitis screening in diabetes,,https://www.nature.com/articles/s41746-026-02593-7,2026-04-07 00:00:00+00:00,Other
Nature,https://www.nature.com/subjects/medical-research.rss,"Myricetin alleviates testosterone-induced benign prostatic hyperplasia by attenuating inflammation, oxidative stress, apoptosis and androgen signaling",,https://www.nature.com/articles/s41598-026-47374-0,2026-04-07 00:00:00+00:00,Other
Phys.org,https://phys.org/rss-feed/,3D-printed 'spanlastics' could change how cancer drugs reach tumors,"University of Mississippi research offers hope that cancer drug therapies packaged in 3D-printed carriers could deliver medication directly to tumors while reducing many of the side effects that cancer patients endure. In a study published in Pharmaceutical Research, the Ole Miss team demonstrated that 3D-printed spanlastics—a tiny carrier filled with cancer-fighting drugs—could be implanted directly at the site of a tumor and kill those cells.",https://phys.org/news/2026-04-3d-spanlastics-cancer-drugs-tumors.html,2026-04-06 23:40:01+00:00,Science
Phys.org,https://phys.org/rss-feed/,Study finds 70% of remediated Los Angeles yards still exceed lead limit,"Even after one of the largest environmental remediation efforts in California history, dangerous levels of lead persist in residential neighborhoods surrounding a former battery smelter in Southeast Los Angeles, according to a new study from the University of California, Irvine's Joe C. Wen School of Population & Public Health. The research is published in the journal Environmental Science & Technology. The findings reveal a serious public health failure while also highlighting the power of community-driven research to hold institutions accountable and drive meaningful change.",https://phys.org/news/2026-04-remediated-los-angeles-yards-exceed.html,2026-04-06 23:20:06+00:00,Science
Phys.org,https://phys.org/rss-feed/,Review details photocatalyst–biocatalyst systems for semi-artificial photosynthesis,"A new review from Osaka Metropolitan University (OMU) summarizes the biocatalysts involved in semi-artificial photosynthesis, an exciting research field that combines natural photosynthesis with artificial technology to efficiently generate fuels and useful substances from sunlight. The review is published in Chemical Reviews.",https://phys.org/news/2026-04-photocatalystbiocatalyst-semi-artificial-photosynthesis.html,2026-04-06 23:20:01+00:00,Science
Phys.org,https://phys.org/rss-feed/,Global warming may be a boon for this aggressive prairie plant,"Climate change may reduce yields of crops like corn and soybeans, but it can also give some plants an edge. That's one of the takeaways of a recent study of tall goldenrod, a common wildflower that runs rampant in fields across its native range in North America and other parts of the world where it has been introduced.",https://phys.org/news/2026-04-global-boon-aggressive-prairie.html,2026-04-06 23:00:02+00:00,Science
Phys.org,https://phys.org/rss-feed/,Water-repelling surfaces reveal surprising charging effects,"Materials that repel water are used in countless applications, including industrial separation processes, routine laboratory pipetting, and medical devices. When water touches these surfaces, the interface where they meet tends to acquire a small electrical charge—an effect that is ubiquitous, yet poorly understood. KAUST researchers have now studied this in detail and their findings could have broad implications. The findings are published in the journal Langmuir.",https://phys.org/news/2026-04-repelling-surfaces-reveal-effects.html,2026-04-06 22:40:01+00:00,"Science, MedTech"
Phys.org,https://phys.org/rss-feed/,"If life exists in Venus's atmosphere, it could have come from Earth","The theory of panspermia holds that life is spread through the cosmos via asteroids, comets, and other objects. When the building blocks of life emerge on one planet, impacts can eject surface material into space, which then carries these seeds to other worlds. For decades, scientists have debated whether this could have occurred between Earth and Mars (in both directions). However, the recent controversy over the possible existence of microbial life in Venus's dense clouds has sparked discussions of interplanetary transfers between Venus, Earth, and Mars.",https://phys.org/news/2026-04-life-venus-atmosphere-earth.html,2026-04-06 22:30:02+00:00,Science
Phys.org,https://phys.org/rss-feed/,Improving air temperature forecasts one to five weeks in advance without new model simulations,"Researchers at the Institute of Industrial Science, The University of Tokyo and George Mason University's College of Science have developed a new method that improves air temperature forecasts one to five weeks in advance—without requiring additional model simulations. The methodology, detailed in the Proceedings of the National Academy of Sciences, provides a dual benefit, not requiring significant increase in computational cost while improving predictions.",https://phys.org/news/2026-04-air-temperature-weeks-advance-simulations.html,2026-04-06 22:30:01+00:00,Science
Phys.org,https://phys.org/rss-feed/,A nanoparticle therapy to treat lung cancer and associated muscle wasting at the same time,"Researchers at Oregon State University have developed a technique for simultaneously treating lung cancer and a serious muscle-wasting condition that often accompanies it. The study, published in the Journal of Controlled Release, involves lipid nanoparticles delivering therapeutic genetic material to lung tumors.",https://phys.org/news/2026-04-nanoparticle-therapy-lung-cancer-muscle.html,2026-04-06 22:20:02+00:00,"Science, Biotech"
Phys.org,https://phys.org/rss-feed/,Advancing synthetic cells: A more flexible system to replicate cellular functions,"Creating artificial systems that mimic the functioning of cells is one of the goals of what is known as synthetic biology. These models, known as synthetic or biomimetic cells, allow some of the basic processes of life to be reproduced in the laboratory to better understand how natural cells work and develop new technologies. In this context, a study involving a team of researchers from the Center for Research in Biological Chemistry and Molecular Materials (CiQUS) of the University of Santiago (USC) proposes a more flexible chemical strategy to create this type of system.",https://phys.org/news/2026-04-advancing-synthetic-cells-flexible-replicate.html,2026-04-06 22:10:06+00:00,Science
Phys.org,https://phys.org/rss-feed/,"Dual-drug nanotherapy crosses blood–brain barrier, improving survival in preclinical glioblastoma models","Mayo Clinic researchers developed an experimental nanotherapy that delivers two cancer drugs directly to brain tumors, according to a study published in Communications Medicine. The strategy extended survival in preclinical models of glioblastoma, the most aggressive form of brain cancer.",https://phys.org/news/2026-04-dual-drug-nanotherapy-bloodbrain-barrier.html,2026-04-06 22:00:01+00:00,Science
TechCrunch,https://techcrunch.com/feed/,"OpenAI alums have been quietly investing from a new, potentially $100M fund","Zero Shot, a new venture capital fund with deep ties to OpenAI, is aiming to raise $100 million for its first fund. It has already written some checks.",https://techcrunch.com/2026/04/06/openai-alums-have-been-quietly-investing-from-a-new-potentially-100m-fund/,2026-04-06 21:54:26+00:00,"Funding, AI"
Phys.org,https://phys.org/rss-feed/,Fluorescence imaging technique reveals hidden magnetic chemistry in living systems,"A research team at the University of Tokyo has developed a new microscopy platform that can observe a previously hidden layer of biomolecular chemistry linked to weak magnetic fields. The work, led by Project Researcher Noboru Ikeya and Professor Jonathan R. Woodward at the Graduate School of Arts and Sciences, addresses a long-standing technical gap in life-science measurement: Many important intermediates in spin-dependent reactions are ""dark"" molecules that do not emit light directly and therefore escape conventional fluorescence imaging.",https://phys.org/news/2026-04-fluorescence-imaging-technique-reveals-hidden.html,2026-04-06 21:50:01+00:00,"MedTech, Science"
Phys.org,https://phys.org/rss-feed/,Experiments refute dark matter claim,"The doctoral thesis of Sophia Hollick, Ph.D. '25, a recent graduate of Yale's Wright Lab in professor Reina Maruyama's group, has significantly contributed to answering a decades-long question in her field about whether or not a signal observed in an experiment that has taken data since 1997 was indicative of a direct detection of dark matter. The results of her analysis, which have excluded the dark matter explanation with greater confidence, were published in Physics Review Letters in the article ""Combined Annual Modulation Dark Matter Search with COSINE-100 and ANAIS-112.""",https://phys.org/news/2026-04-refute-dark.html,2026-04-06 21:40:04+00:00,Science
