source,feed_url,headline,summary,url,published_date,topics
Breaking Defense,https://breakingdefense.com/feed/,Estonia’s CV90 exit has no ‘big effect’ on joint European order: BAE Hägglunds chief,"“The effect is marginal. I think the other customers will get vehicles earlier,” Tommy Gustafsson-Rask, general manager of BAE Systems Hägglunds, said during a media visit to its Ornskoldsvik site.",https://breakingdefense.com/2026/04/bae-hagglunds-chief-estonias-cv90-exit-has-no-big-effect-on-joint-european-order/,2026-04-29 15:58:00+00:00,Other
Defense News,https://www.defensenews.com/arc/outboundfeeds/rss/,Navy releases list of ships it plans to inactivate this year,The service intends to remove 14 vessels from its fleet.,https://www.defensenews.com/news/your-navy/2026/04/29/navy-releases-list-of-ships-it-plans-to-inactivate-this-year/,2026-04-29 15:37:04+00:00,Defense
Defense News,https://www.defensenews.com/arc/outboundfeeds/rss/,US Marines help gun down beach invaders in simulated Philippines defense,"Afterwards, as the repulsed “enemy” withdrew in disorder, a coup de grace was delivered by an explosive-laden, first-person-view drone.",https://www.defensenews.com/global/asia-pacific/2026/04/29/us-marines-help-gun-down-beach-invaders-in-simulated-philippines-defense/,2026-04-29 14:05:37+00:00,Defense
Defense News,https://www.defensenews.com/arc/outboundfeeds/rss/,"Drone diplomacy wins Ukraine valuable allies, but now it must deliver","The Iran war has confirmed how central drones are to modern warfare and handed Zelenskiy a diplomatic trump card, analysts say.",https://www.defensenews.com/global/europe/2026/04/29/drone-diplomacy-wins-ukraine-valuable-allies-but-now-it-must-deliver/,2026-04-29 13:19:38+00:00,Defense
Labiotech,https://www.labiotech.eu/feed/,When ADCs meet targeted protein degraders: The emerging field of degrader-antibody conjugates,"Discover the emerging class of degrader–antibody conjugates – a modality that is drawing increasing interest from biotech companies. The post When ADCs meet targeted protein degraders: The emerging field of degrader-antibody conjugates appeared first on Labiotech.eu . © Labiotech UG and Labiotech.eu. Unauthorized use and/or duplication of this material without express and written permission from this site’s author and/or owner is strictly prohibited. Excerpts and links may be used, provided that full and clear credit is given to Labiotech UG and Labiotech.eu with appropriate and specific direction to the original content.",https://www.labiotech.eu/in-depth/degrader-antibody-conjugates-review/,2026-04-29 13:00:00+00:00,Biotech
MIT Technology Review,https://www.technologyreview.com/feed/,The Download: storing nuclear waste and orchestrating agents,"This is today&#8217;s edition of The Download, our weekday newsletter that provides a daily dose of what&#8217;s going on in the world of technology. It’s time to make a plan for nuclear waste Today, nuclear energy enjoys rare support across the political spectrum. Public approval has spiked, and Big Tech is throwing money around to&#8230;",https://www.technologyreview.com/2026/04/29/1136666/the-download-nuclear-waste-orchestrated-ai-agents/,2026-04-29 12:10:00+00:00,Other
Payload Space,https://payloadspace.com/feed/,DPhi’s Second Demo Brings Compute Space to Orbit,"Swiss startup DPhi Space hosted Liquid AI’s large language model to analyze an EO image—without first transmitting the image to the ground. That was the first public result of DPhi’s second mission, Clustergate-2, which rode to orbit on a Momentus Vigoride 7 sat in March. The transmission, which was announced today, signifies a new age… The post DPhi’s Second Demo Brings Compute Space to Orbit appeared first on Payload .",https://payloadspace.com/dphis-second-demo-brings-compute-space-to-orbit/,2026-04-29 11:43:44+00:00,"Space, Startups"
Science,https://www.science.org/rss/news_current.xml,Guns and bulletproof vests: How federal agents arrested Fauci aide,"David Morens, 78, was stripped and handcuffed for email violations",https://www.science.org/content/article/guns-and-bulletproof-vests-how-federal-agents-arrested-fauci-aide,2026-04-29 08:40:00+00:00,Other
Labiotech,https://www.labiotech.eu/feed/,CAR-T cell therapies going in vivo,"There has been a swing towards in vivo CAR-T therapies lately, as big pharmas sign acquisition deals and new therapies hit the clinic. The post CAR-T cell therapies going in vivo appeared first on Labiotech.eu . © Labiotech UG and Labiotech.eu. Unauthorized use and/or duplication of this material without express and written permission from this site’s author and/or owner is strictly prohibited. Excerpts and links may be used, provided that full and clear credit is given to Labiotech UG and Labiotech.eu with appropriate and specific direction to the original content.",https://www.labiotech.eu/trends-news/in-vivo-car-t-cell-therapy-momentum/,2026-04-29 08:13:00+00:00,Other
War on the Rocks,https://warontherocks.com/feed/,Aligning the U.S. and Canadian Defense Industrial Bases,"The United States and Canada are both racing to rebuild their defense industrial bases, recognizing that future conflicts will be determined not only by military capability, but by the ability to produce at scale. But they cannot succeed alone &#8212; and importantly, they do not need to start from scratch.After decades of reliance on globalized supply chains for everything from consumer products to critical defense technologies, the United States is reasserting a more active industrial policy, using tools ranging from the Defense Production Act to incentivizing private capital investments and even selective government equity stakes. Canada is undergoing a parallel The post Aligning the U.S. and Canadian Defense Industrial Bases appeared first on War on the Rocks .",https://warontherocks.com/cogs-of-war/aligning-the-us-and-canadian-defense-industrial-bases/,2026-04-29 08:00:54+00:00,Defense
MIT Technology Review,https://www.technologyreview.com/feed/,It’s time to make a plan for nuclear waste,"Today, nuclear energy enjoys a rare moment of support across the political spectrum in the US. Interest from tech companies that are scrambling to meet demand for massive data centers has sparked a resurgence of money and attention in the industry. That newfound interest is exactly why it’s time to talk about an old problem:&#8230;",https://www.technologyreview.com/2026/04/29/1136659/plan-nuclear-waste/,2026-04-29 08:00:00+00:00,Other
