source,feed_url,headline,summary,url,published_date,topics
Phys.org,https://phys.org/rss-feed/,Tools to fight hantavirus show promise despite limited funding. Now researchers hope to continue,"When a rare but deadly rodent-borne virus struck passengers on a cruise ship and seemed to be spreading, there were no treatments for those who fell ill and no vaccines to protect others.",https://phys.org/news/2026-06-tools-hantavirus-limited-funding.html,2026-06-04 09:10:01+00:00,"Science, Funding"
EU-Startups,https://www.eu-startups.com/feed/,Dutch startup New Dawn Bio raises €2.1 million to grow wood from tree stem cells in bioreactors,"New Dawn Bio, a Wageningen-based DeepTech startup claiming to be developing the world’s first cultured wood, has closed its €2.1 million oversubscribed pre-seed funding round to advance product development and expand the interdisciplinary R&#38;D team. The round was led by CapitalT, with participation from Norrsken Evolve, Ontdekkers Group and a group of prominent angel investors, [&#8230;] The post Dutch startup New Dawn Bio raises €2.1 million to grow wood from tree stem cells in bioreactors appeared first on EU-Startups .",https://www.eu-startups.com/2026/06/dutch-startup-new-dawn-bio-raises-e2-1-million-to-grow-wood-from-tree-stem-cells-in-bioreactors/,2026-06-04 09:07:34+00:00,"Funding, Startups"
Phys.org,https://phys.org/rss-feed/,SpaceX's IPO is set to be the biggest ever and could make Elon Musk a trillionaire,"SpaceX says it plans to raise up to $75 billion when it goes public this month, setting the stage for the largest-ever stock market debut and putting Elon Musk on course to becoming the world's first trillionaire.",https://phys.org/news/2026-06-spacex-ipo-biggest-elon-musk.html,2026-06-04 09:00:06+00:00,Funding
Phys.org,https://phys.org/rss-feed/,New gold-palladium catalysis mechanism could advance bio-based chemical manufacturing,"The building‐block chemicals behind everyday products—like shampoo bottles, food containers, and kitchen spatulas—are largely derived from oil. Researchers are now working to replace those fossil‐fuel‐based inputs with materials sourced from renewable biological systems, a shift with implications for health, economic resilience, and national security.",https://phys.org/news/2026-06-gold-palladium-catalysis-mechanism-advance.html,2026-06-04 09:00:05+00:00,"Science, Defense"
Phys.org,https://phys.org/rss-feed/,Screwworm fly detected in Texas decades after cattle threat was largely eradicated in US,"The New World screwworm fly has reached south Texas, the U.S. Department of Agriculture confirmed Wednesday, the first time in decades that the parasite with flesh-eating larvae has threatened the nation's cattle industry and only the third time it's appeared in the U.S. in that time.",https://phys.org/news/2026-06-screwworm-fly-texas-decades-cattle.html,2026-06-04 08:50:01+00:00,Other
Phys.org,https://phys.org/rss-feed/,Canadian government endorses a plan to move whales from shuttered Marineland park to US and Spain,Canada's government endorsed a plan Wednesday to move the last remaining captive whales from a shuttered theme park in Ontario to aquariums in the United States and Spain—a plan that could save them from mass euthanasia if the deal goes through.,https://phys.org/news/2026-06-canadian-endorses-whales-shuttered-marineland.html,2026-06-04 08:34:53+00:00,Other
EU-Startups,https://www.eu-startups.com/feed/,German VC Merantix Capital closes €103 million fund for early-stage AI startups,"Berlin-based Merantix Capital today announced the closing of its €103 million AI Fund, which will invest in early-stage, AI-native companies across logistics, manufacturing, energy, finance, healthcare, life sciences, robotics, enterprise and physical AI. The fund will make approximately 40 investements across European AI, with strategic LPs including Union Investment, Jungheinrich, KPMG Germany, the Robert Wood [&#8230;] The post German VC Merantix Capital closes €103 million fund for early-stage AI startups appeared first on EU-Startups .",https://www.eu-startups.com/2026/06/german-vc-merantix-capital-closes-e103-million-fund-for-early-stage-ai-startups/,2026-06-04 08:14:19+00:00,"Startups, Funding"
War on the Rocks,https://warontherocks.com/feed/,Forged in a Knife Fight: China’s Brutal Domestic AI Competition,"China&#8217;s plan to become a world leader in AI by 2030 is a fixture of practically every Congressional briefing and expert commentary on Beijing&#8217;s AI ambitions. The plan&#8217;s logic &#8212; introduced in 2017 &#8212; was simple and alarming: Beijing would direct capital, mobilize its firms, recruit talent, and execute with the strategic patience of a state-led innovation ecosystem. Nearly a decade later, that frame has only hardened. Beijing&#8217;s recently issued 15th Five-Year Plan directs Party organs to take &#8220;extraordinary measures&#8221; to strengthen technological self-reliance and launch a new &#8220;AI+&#8221; initiative to integrate AI across the nation&#8217;s strategic sectors. Beijing has The post Forged in a Knife Fight: China&#8217;s Brutal Domestic AI Competition appeared first on War on the Rocks .",https://warontherocks.com/cogs-of-war/forged-in-a-knife-fight-chinas-brutal-domestic-ai-competition/,2026-06-04 08:00:49+00:00,Other
Phys.org,https://phys.org/rss-feed/,Stonehenge Altar Stone's epic transportation across ancient Britain detailed in new study,"New research by Curtin University has revealed how one of Stonehenge's most mysterious stones was likely transported hundreds of kilometers across Britain through challenging terrain, highlighting the remarkable capabilities of ancient communities.",https://phys.org/news/2026-06-stonehenge-altar-stone-epic-ancient.html,2026-06-04 08:00:01+00:00,Science
War on the Rocks,https://warontherocks.com/feed/,Revisiting The Importance of the Battle of Midway,"The Battle of Midway has assumed a place in American naval lore that has put it on par with other great battles in world naval history. What Salamis was for the Greeks, Trafalgar for the British Royal Navy, and Tsushima for the Japanese, the clash northwest of Midway Island on June 4, 1942, represents for the U.S. Navy. It was a moment of heroism, professional skill, and victory, which came to define how the Navy viewed itself for the rest of the 20th century and beyond.Unlike those other great battles, however, Midway was a decidedly modern naval operation. It involved The post Revisiting The Importance of the Battle of Midway appeared first on War on the Rocks .",https://warontherocks.com/revisiting-the-importance-of-the-battle-of-midway/,2026-06-04 07:30:09+00:00,Defense
EU-Startups,https://www.eu-startups.com/feed/,Profitable French scale-up Innovorder raises €20 million to accelerate AI-first restaurant digitalisation,"Innovorder, a Paris-based scale-up specialising in the digitalisation of the restaurant industry, has raised €20 million in a funding round to accelerate its “AI-first&#8221; transformation. The round was led by UL Invest, the family office of tech entrepreneur Laurent Useldinger. This deal combines a capital increase and the buyout of shares from historical investors. Evolem, [&#8230;] The post Profitable French scale-up Innovorder raises €20 million to accelerate AI-first restaurant digitalisation appeared first on EU-Startups .",https://www.eu-startups.com/2026/06/profitable-french-scale-up-innovorder-raises-e20-million-to-accelerate-ai-first-restaurant-digitalisation/,2026-06-04 07:20:28+00:00,"Funding, Startups"
War on the Rocks,https://warontherocks.com/feed/,"Wrong Audience, Wrong Ask: Why Trump’s Abraham Accords Gambit Falls on Deaf Ears","When President Donald Trump repeatedly pressed regional leaders on Abraham Accords expansion late last month &#8212; framing Arab-Israeli normalization as a debt owed and a condition for a settlement to end the Iran war &#8212; he apparently commented there had been silence on the other end of the line.Arab and Muslim states are not silent because they lack a position on normalization. Indeed, collectively they have already articulated one through the Arab Peace Initiative &#173;&#8212; the 2002 proposal that offered normalized relations between Israel and over 50 countries. In exchange, it required Israel to fully withdraw from occupied territories, agree The post Wrong Audience, Wrong Ask: Why Trump’s Abraham Accords Gambit Falls on Deaf Ears appeared first on War on the Rocks .",https://warontherocks.com/wrong-audience-wrong-ask-why-trumps-abraham-accords-gambit-falls-on-deaf-ears/,2026-06-04 07:15:24+00:00,Other
EU-Startups,https://www.eu-startups.com/feed/,London’s Semble raises €34.7 million Series C to scale its healthcare management platform for outpatient providers,"Semble, a London-based HealthTech startup helping outpatient providers coordinate care and manage the entire patient journey, has secured a €34.7 million (£30 million) Series C funding round. The round was led by European growth investor Revaia, with participation from a second new investor, Partech, alongside continued backing from existing investors Mercia Ventures and Octopus Ventures. [&#8230;] The post London’s Semble raises €34.7 million Series C to scale its healthcare management platform for outpatient providers appeared first on EU-Startups .",https://www.eu-startups.com/2026/06/londons-semble-raises-e34-7-million-series-c-to-scale-its-healthcare-management-platform-for-outpatient-providers/,2026-06-04 06:14:43+00:00,"Funding, Startups"
Phys.org,https://phys.org/rss-feed/,"Moms' learned fear of snakes gets inherited by offspring in a critically endangered mouse, biologists discover","Conservationists often raise the young of endangered species in captivity before releasing them into suitable habitats as adults. The benefits are obvious: survival to adulthood is typically high, as captive animals are safe from predators and food scarcity. Unfortunately, a lack of exposure to enemies in early life may become a drawback later, if the released individuals have never learned to recognize and avoid their predators.",https://phys.org/news/2026-06-moms-snakes-inherited-offspring-critically.html,2026-06-04 04:00:03+00:00,Funding
TechCrunch,https://techcrunch.com/feed/,Benchmark raises its first-ever growth fund as part of $2B capital raise,The legendary abandons its more than 20 year tradition of keeping its funds to about $425 million.,https://techcrunch.com/2026/06/03/benchmark-raises-its-first-ever-growth-fund-as-part-of-2b-capital-raise/,2026-06-04 03:52:15+00:00,Funding
Phys.org,https://phys.org/rss-feed/,Reconnecting the last wild landscapes of the Javan leopard,"Research from the University of Twente shows how the Javan leopard, one of the world's rarest big cats, survives on one of the most crowded islands on Earth. Using camera traps and spatial models, Andhika Chandra Ariyanto, a doctoral researcher at ITC, found that the cat depends on a wide range of prey and on recovering forests as much as on the protected reserves that conservation usually prioritizes.",https://phys.org/news/2026-06-reconnecting-wild-landscapes-javan-leopard.html,2026-06-04 03:00:01+00:00,Science
SpaceNews,https://spacenews.com/feed/,SpaceX to raise at least $75 billion in IPO,"SpaceX plans to raise at least $75 billion in its initial public offering, valuing the company at more than $1.75 trillion. The post SpaceX to raise at least $75 billion in IPO appeared first on SpaceNews .",https://spacenews.com/spacex-to-raise-at-least-75-billion-in-ipo/,2026-06-04 02:54:32+00:00,Funding
Phys.org,https://phys.org/rss-feed/,Q&A: How approval processes drive up housing costs in major cities,"Austin Zwick, associate teaching professor in the College of Professional Studies and the Maxwell School of Citizenship and Public Affairs, explains how cities can fix their planning systems to address housing crises.",https://phys.org/news/2026-06-qa-housing-major-cities.html,2026-06-04 02:20:02+00:00,Other
Phys.org,https://phys.org/rss-feed/,The next-generation Very Large Array prototype gathers its first light,"The Very Large Array, the iconic field of radio antennas featured in the film ""Contact"" (inspired by Carl Sagan's novel), has a long and distinguished history of service. But after more than 45 years of studying the radio sky and probing the mysteries of the universe, the U.S. National Science Foundation National Radio Astronomy Observatory, which operates the VLA, is looking to create a new generation of telescopes that will pick up where the VLA leaves off.",https://phys.org/news/2026-06-generation-large-array-prototype.html,2026-06-04 01:20:02+00:00,Other
Phys.org,https://phys.org/rss-feed/,"Great apes: What we know about their cognition, cooperation and curiosity after two decades of research",Leipzig Zoo in central Germany is a world-leading center of great ape research. Recent studies have seen chimpanzees there using touchscreen controls to navigate virtual forests and locate food rewards—applying similar techniques to what they would use in the wild.,https://phys.org/news/2026-06-great-apes-cognition-cooperation-curiosity.html,2026-06-04 01:00:02+00:00,Science
Phys.org,https://phys.org/rss-feed/,Asteroid dirt is 'fluffier' than we thought,"The strength of gravity is different on every body in the solar system. Whether it's the crushing weight of Jupiter or the minuscule pull of a small asteroid, this fundamental force of physics still has a major impact on the material those bodies are made up of. A new paper from researchers at the University of Duisburg-Essen and the German Aerospace Center (DLR) showcases just how different it can be by letting planetary simulants freefall inside a giant drop tower and measuring how ""fluffy"" the space dirt got. The findings are published on the arXiv preprint server.",https://phys.org/news/2026-06-asteroid-dirt-fluffier-thought.html,2026-06-04 00:40:04+00:00,Science
TechCrunch,https://techcrunch.com/feed/,Quick commerce FirstClub doubles valuation to $255M in nine months,The Bengaluru startup has crossed 1 million orders and reached a $50 million annualized GMV run rate within a year of launch.,https://techcrunch.com/2026/06/03/firstclub-doubles-valuation-to-255m-in-nine-months-on-quality-first-grocery-bet/,2026-06-04 00:30:00+00:00,"Startups, Funding"
SpaceNews,https://spacenews.com/feed/,NASA declares end to MAVEN Mars mission,NASA has formally ended a Mars mission that has been out of contact for six months while the investigation into the spacecraft’s demise continues. The post NASA declares end to MAVEN Mars mission appeared first on SpaceNews .,https://spacenews.com/nasa-declares-end-to-maven-mars-mission/,2026-06-04 00:20:49+00:00,Space
Phys.org,https://phys.org/rss-feed/,"Species of Brazilian moths described in honor of Orixás, foundational deities of Afro-Brazilian religions","A species of moth that was first described in 1818 was believed to be a single species. However, it has since been discovered that it is actually a complex of species, eight of which are found in Brazil. These findings are the result of a study that integrated molecular techniques, morphological data, and the identification of host plants from populations in the Amazon, Atlantic Forest, and Pantanal regions.",https://phys.org/news/2026-06-species-brazilian-moths-honor-orixs.html,2026-06-04 00:20:02+00:00,Science
Phys.org,https://phys.org/rss-feed/,Hybrid work is not always the golden compromise employees expect—even as more companies implement it,A truce of sorts has quelled the return-to-office wars that have raged in the post-pandemic workplace.,https://phys.org/news/2026-06-hybrid-golden-compromise-employees-companies.html,2026-06-04 00:00:02+00:00,Other
Nature,https://www.nature.com/nature.rss,This mysterious lung disease affects millions of people – a drug tested in mice shows promise,"Nature, Published online: 04 June 2026; doi:10.1038/d41586-026-01789-x The therapy activates a protein that could stop pulmonary fibrosis from progressing.",https://www.nature.com/articles/d41586-026-01789-x,2026-06-04 00:00:00+00:00,Science
Nature,https://www.nature.com/nature.rss,What’s behind China’s historically high counts of corresponding authors?,"Nature, Published online: 04 June 2026; doi:10.1038/d41586-026-01623-4 From 2016 to 2020, almost one-third of papers by authors in China had multiple corresponding authors — but policy reforms are expected to have dampened the trend.",https://www.nature.com/articles/d41586-026-01623-4,2026-06-04 00:00:00+00:00,Science
Phys.org,https://phys.org/rss-feed/,Monitoring reveals elevated antidepressant levels in some waterways,"Depression, anxiety and sleep disorders are among the conditions often treated with antidepressant drugs. Yet, up to 90% of these drugs pass through the body into wastewater. They're also difficult to remove during water treatment, presenting a possible risk of environmental contamination and threats to ecological and human health. Now, researchers reporting in Environmental Science & Technology have found some antidepressant drugs at levels that could be harmful to aquatic wildlife in North Carolina waterways.",https://phys.org/news/2026-06-reveals-elevated-antidepressant-waterways.html,2026-06-03 23:40:03+00:00,Science
Phys.org,https://phys.org/rss-feed/,Dynamic nanogates let longer molecules pass faster through flexible pores,"A research team led by Professor Shuichi Hiraoka at the University of Tokyo and Professor Masanori Tachikawa at Yokohama City University has quantitatively analyzed how molecules pass through dynamic nanoscale pores using self-assembled molecular ""nanocubes"" in water. The researchers discovered an unexpected phenomenon: For linear alkane molecules, longer molecules passed through the molecular gates faster than shorter ones.",https://phys.org/news/2026-06-dynamic-nanogates-longer-molecules-faster.html,2026-06-03 23:40:01+00:00,Science
Phys.org,https://phys.org/rss-feed/,Q&A: Why scientists are studying a microbe they found in a sink,"Scientists commonly use bacteria as tiny factories that can produce molecules for uses ranging from drug development to pollution remediation. Recently, NC State biologist Carlos Goller and former undergraduate students Pushkar Sai and Andrew Hoyek did a deeper dive into Delftia, a bacterial strain that is found everywhere from soil to the kitchen sink, to determine its usefulness in applications such as malarial suppression and gold detoxification. The team's paper is published in the journal Applied and Environmental Microbiology.",https://phys.org/news/2026-06-qa-scientists-microbe.html,2026-06-03 23:20:03+00:00,Science
Phys.org,https://phys.org/rss-feed/,"Nitric oxide overload jams plant immune signals, researchers find","A new study from the University of Kentucky Martin-Gatton College of Agriculture, Food and Environment (CAFE) helps explain how plants can lose track of their own disease warnings.",https://phys.org/news/2026-06-nitric-oxide-overload-immune.html,2026-06-03 23:20:01+00:00,Science
Phys.org,https://phys.org/rss-feed/,A new capability to detect chemical weapons involves two existing methods,"In the aftermath of suspected chemical attacks, investigators from the Organization for the Prohibition of Chemical Weapons (OPCW) step in to collect chemical, environmental, and biomedical samples. Thorough forensic laboratory analysis of these samples is essential for proving what—if any—chemical agents were used and verifying their identities.",https://phys.org/news/2026-06-capability-chemical-weapons-involves-methods.html,2026-06-03 23:10:06+00:00,Science
Phys.org,https://phys.org/rss-feed/,Tanzania's iconic heritage sites face damage from state-backed tourism,"Assessment of four heritage sites in Tanzania finds that all are under threat from the institutions meant to steward them, prioritizing income from tourism over the sites' preservation and refusing to engage with community protection initiatives.",https://phys.org/news/2026-05-tanzania-iconic-heritage-sites-state.html,2026-06-03 23:00:04+00:00,Other
Phys.org,https://phys.org/rss-feed/,How methane policy will make or break the climate crisis,There's no sign that methane emissions are declining globally.,https://phys.org/news/2026-06-methane-policy-climate-crisis.html,2026-06-03 23:00:03+00:00,Other
TechCrunch,https://techcrunch.com/feed/,"Lovable signs multiyear deal with Google Cloud to up usage 5x, source says","Lovable and Google signed an expanded multiyear deal that involves a 5x expansion of Lovable's footprint on Google Cloud, and expanded access to Anthropic Claude.",https://techcrunch.com/2026/06/03/lovable-signs-multi-year-deal-with-google-cloud-to-up-usage-5x-source-says/,2026-06-03 22:56:51+00:00,AI
Phys.org,https://phys.org/rss-feed/,How Jupiter may have redirected life's ingredients toward Earth 4.5 billion years ago,"NASA-supported scientists have provided new information about how the early Earth may have acquired some elements necessary for the planet to become habitable. They also suggest a new role for Jupiter in the distribution of these elements throughout the young solar system. The study, published in Science Advances, examines this history by looking at the ratio of phosphorus to nitrogen in iron meteorites and in younger objects known as chondrites.",https://phys.org/news/2026-06-jupiter-redirected-life-ingredients-earth.html,2026-06-03 22:50:01+00:00,Science
Phys.org,https://phys.org/rss-feed/,"Plants boost carbon uptake through water efficiency, not heat adaptation, global analysis reveals",An international team of scientists has discovered that plants are not responding to global warming in the way researchers long assumed. Scientists have expected that ecosystems would keep pace with warming by raising the temperature at which photosynthesis works best.,https://phys.org/news/2026-06-boost-carbon-uptake-efficiency-global.html,2026-06-03 22:40:03+00:00,Science
Phys.org,https://phys.org/rss-feed/,"AI offers promise for agriculture, but smallholder farmers risk being left behind","Globally, agriculture faces mounting pressures. These are driven by climate change, land degradation, labor shortages, supply chain disruptions and the demand for food from a growing population.",https://phys.org/news/2026-06-ai-agriculture-smallholder-farmers-left.html,2026-06-03 22:40:01+00:00,Other
Phys.org,https://phys.org/rss-feed/,Interstellar object 3I/ATLAS reveals no technosignatures in seven-hour radio scan,"Scientists at the SETI Institute recently searched for technological signals from 3I/ATLAS, the third interstellar object observed in our solar system. Using the Allen Telescope Array (ATA) at the Hat Creek Radio Observatory in Northern California, the team scanned a wide range of radio frequencies for signs of extraterrestrial technology and found none, as expected based on other astronomical observations showing that the object exhibits natural comet-like composition and behavior. The paper is published in The Astronomical Journal.",https://phys.org/news/2026-06-interstellar-3iatlas-reveals-technosignatures-hour.html,2026-06-03 22:30:01+00:00,Science
Phys.org,https://phys.org/rss-feed/,A very strong El Niño is approaching. Here's what we can expect,"El Niño is a recurring climate event with impacts across the globe. It has three phases: one cold (known as La Niña), one neutral, and one warm (El Niño).",https://phys.org/news/2026-06-strong-el-nio-approaching.html,2026-06-03 22:20:04+00:00,Other
Phys.org,https://phys.org/rss-feed/,Research could pave the way for more resilient winter cereals in warmer climates,"The arrival of winter marks not only a change in weather, temperature, and day length, but also a change in our activity and behavior. The social outdoor events and trips to the beach over summer soon become a distant memory, and we ready ourselves for more solitary evenings indoors with a hot drink and a good book. Things slow down.",https://phys.org/news/2026-06-pave-resilient-winter-cereals-warmer.html,2026-06-03 22:20:01+00:00,Science
Phys.org,https://phys.org/rss-feed/,Japan's new seafloor record could sharpen megathrust earthquake warnings in Nankai Trough,"Off the southern coast of Japan, the Philippine Sea Plate lies underneath the Japanese mainland. The locked tectonic plates threaten to unleash a catastrophic megathrust earthquake, likely within the next few decades. Given the potential devastation a large quake could evoke, constant developments in predictive technology must be sought. However, predicting the unpredictable movement of the seafloor requires innovative thought.",https://phys.org/news/2026-06-japan-seafloor-sharpen-megathrust-earthquake.html,2026-06-03 22:00:06+00:00,Other
Phys.org,https://phys.org/rss-feed/,Why 'psychopath' is a dangerous label when it comes to criminal justice,"A defendant stands in the dock. An expert describes them as a ""psychopath."" In an instant, one word threatens to eclipse their history, circumstances and the crime itself.",https://phys.org/news/2026-06-psychopath-dangerous-criminal-justice.html,2026-06-03 22:00:05+00:00,Other
Phys.org,https://phys.org/rss-feed/,Thundering footsteps warn caterpillars of lethal ladybeetle attacks,"Diminutive warty birch caterpillars (Falcaria bilineata), less than 1.5mm long, ardently defend their leaf tip homes from invading caterpillars by scraping and pounding the leaf to warn off potential invaders. But how might the day-old caterpillars defend themselves when voracious ladybeetles (known as ladybugs in the US) are on the prowl?",https://phys.org/news/2026-06-thundering-footsteps-caterpillars-lethal-ladybeetle.html,2026-06-03 22:00:03+00:00,Other
