source,feed_url,headline,summary,url,published_date,topics
Nature,https://www.nature.com/subjects/medical-research.rss,Therapeutic potential of mitochondrial transfer in reversing mutant-to-wild-type mtDNA ratio and improving mitochondrial dysfunction in 1555A>G mtDNA mutation-associated hearing loss,,https://www.nature.com/articles/s41598-026-51402-4,2026-05-13 00:00:00+00:00,Biotech
Labiotech,https://www.labiotech.eu/feed/,The real reason CGT programs struggle to scale,"Learn how cryopreservation improves scalability and helps CGT programs move from early development to commercial manufacturing. The post The real reason CGT programs struggle to scale appeared first on Labiotech.eu . © Labiotech UG and Labiotech.eu. Unauthorized use and/or duplication of this material without express and written permission from this site’s author and/or owner is strictly prohibited. Excerpts and links may be used, provided that full and clear credit is given to Labiotech UG and Labiotech.eu with appropriate and specific direction to the original content.",https://www.labiotech.eu/partner/cryopreservation-cgt-scaling-bottlenecks/,2026-05-12 08:00:00+00:00,Other
EU-Startups,https://www.eu-startups.com/feed/,African-Startups.com launches as sister publication of EU-Startups for Africa’s startup ecosystem,"African-Startups.com (AFS), a new English-language media platform dedicated to covering startups, venture capital, and innovation across Africa, has officially launched during the EU-Startups Summit in Malta. Launched as a sister publication to EU-Startups under the aegis of MeOut Group, African-Startups aims to spotlight, inform, connect, and elevate the continent’s startup ecosystem through factual, unbiased, practical, [&#8230;] The post African-Startups.com launches as sister publication of EU-Startups for Africa’s startup ecosystem appeared first on EU-Startups .",https://www.eu-startups.com/2026/05/african-startups-com-launches-as-sister-publication-of-eu-startups-for-africas-startup-ecosystem/,2026-05-12 07:59:29+00:00,"Startups, Funding"
EU-Startups,https://www.eu-startups.com/feed/,Index Ventures backed-Adfin raises €15.3 million to help businesses automate revenue collection with AI,"Adfin, a London-based FinTech startup building the agentic money movement platform for businesses, has raised €15.3 million ($18 million) in Series A funding to expand its product into end-to-end cashflow management, step up hiring across engineering and sales, and prepare for international expansion. The round was led by Index Ventures, with participation from Visionaries Club [&#8230;] The post Index Ventures backed-Adfin raises €15.3 million to help businesses automate revenue collection with AI appeared first on EU-Startups .",https://www.eu-startups.com/2026/05/index-ventures-backed-adfin-raises-e15-3-million-to-help-businesses-automate-revenue-collection-with-ai/,2026-05-12 07:34:02+00:00,"Funding, Startups"
War on the Rocks,https://warontherocks.com/feed/,The Other Border Problem: How Russia and China’s Lawfare Threaten the Arctic,"What happens when the Arctic starts to look like the South China Sea?Historically, a neutral region where cooperation prevailed, the Arctic is quickly becoming a contested space. This is no more evident than in the increasing scope and volume of Russian and Chinese lawfare affecting the region. Through excessive maritime regulations, coordinated challenges to Western continental shelf claims, and the use of shadow fleets to avoid accountability, Russia and China are increasingly coordinating their efforts to exert influence and challenge Western claims to Arctic resources and freedom of navigation. As these tactics continue to converge, the United States and its The post The Other Border Problem: How Russia and China’s Lawfare Threaten the Arctic appeared first on War on the Rocks .",https://warontherocks.com/the-other-border-problem-how-russia-and-chinas-lawfare-threaten-the-arctic/,2026-05-12 07:30:20+00:00,Other
War on the Rocks,https://warontherocks.com/feed/,Closing the Gap? Italy Sets New Rules for Its First National Security Strategy Amidst Old Obstacles,"Italy may finally be about to publish its first-ever national security strategy, a striking development for the only G7 country that has never had one.For decades, a mix of government instability, competition between institutions, a relatively permissive international environment, and the perceived reliability of U.S. security guarantees in Europe and the Mediterranean reduced incentives to produce a strategy. Recently, however, domestic political consolidation and external pressures have appeared to align in a way not seen before. Until recently, limited news articles and confidential interviews with policymakers, diplomats, and military officials pointed to a forthcoming publication that could address what military The post Closing the Gap? Italy Sets New Rules for Its First National Security Strategy Amidst Old Obstacles appeared first on War on the Rocks .",https://warontherocks.com/closing-the-gap-italys-first-national-security-strategy-faces-old-obstacles/,2026-05-12 07:15:35+00:00,Defense
EU-Startups,https://www.eu-startups.com/feed/,London’s Dessn raises €5 million to help product teams design and prototype inside real codebases,"Dessn, a London-based AI design-in-production platform, has raised €5 million ($6 million) to build a global community of product builders and expand the team. The round was led by Connect Ventures, with participation from Betaworks, N49P, and other leading funds. &#8220;The best product founders are overly technical and bold. They build products that let users [&#8230;] The post London’s Dessn raises €5 million to help product teams design and prototype inside real codebases appeared first on EU-Startups .",https://www.eu-startups.com/2026/05/londons-dessn-raises-e5-million-to-help-product-teams-design-and-prototype-inside-real-codebases/,2026-05-12 06:00:10+00:00,"Startups, Funding"
EU-Startups,https://www.eu-startups.com/feed/,Rotterdam’s Ditto raises €7.6 million to make “what did the doctor say?” easier to answer,"Ditto, a Rotterdam-based HealthTech startup that has developed a free app that translates complex medical information into plain language, has raised €7.6 million for its European rollout. The round was led by Heal Capital, with participation from Optiverder and Rubio Impact Ventures. “No patient should have to guess what was just said. We are fundamentally [&#8230;] The post Rotterdam’s Ditto raises €7.6 million to make “what did the doctor say?” easier to answer appeared first on EU-Startups .",https://www.eu-startups.com/2026/05/rotterdams-ditto-raises-e7-6-million-to-make-what-did-the-doctor-say-easier-to-answer/,2026-05-12 05:32:41+00:00,"Startups, Funding"
TechCrunch,https://techcrunch.com/feed/,Thinking Machines wants to build an AI that actually listens while it talks,"Right now, every AI model you've ever used works the same way. You talk, it listens. It responds, you listen. Thinking Machines is trying to change that by building a model that processes your input and generates a response at the same time, so it's more like a phone call than a text chain.",https://techcrunch.com/2026/05/11/thinking-machines-wants-to-build-an-ai-that-actually-listens-while-it-talks/,2026-05-12 04:52:35+00:00,AI
Phys.org,https://phys.org/rss-feed/,"New tectonic plate boundary could be forming in Zambia, scientists say","Isotope analysis of gas from geothermal springs in Zambia could show that a new continental rift is forming, scientists say. Unexpectedly high helium isotope ratios indicate that a weakness in Earth's crust has broken through to reach the mantle beneath. This rift could eventually become a new tectonic plate boundary. In the meantime, opportunities for geothermal energy could boost local economies.",https://phys.org/news/2026-05-tectonic-plate-boundary-zambia-scientists.html,2026-05-12 04:00:03+00:00,Science
Phys.org,https://phys.org/rss-feed/,New model finds the lower size limit for habitable exoplanets,"The search for Earth 2.0 has begun in earnest. But there's a huge variety of exoplanets out there, so narrowing down the search to focus valuable telescope time on only the best candidates is critical. One variable of a planet that will have a huge impact on its habitability is its size. A new paper, now available in preprint on arXiv, by researchers at the University of California Riverside, looks into the impact of a planet's size on one of its more critical features for habitability—whether it holds onto an atmosphere—and determines that slightly smaller than Earth is likely the smallest a planet can be and still be viable for life to develop.",https://phys.org/news/2026-05-size-limit-habitable-exoplanets.html,2026-05-12 03:40:01+00:00,Science
Phys.org,https://phys.org/rss-feed/,Birds of prey in South Africa are in trouble—a study analyzes data from 16 years of road counts,"Birds of prey and vultures (raptors) play a vital role in ecosystems, both as top predators and key scavengers. However, compared to many other bird species, raptor populations are declining faster. This is because they need large areas to live in, have low population densities, and reproduce slowly. For these reasons, they are vulnerable to human impacts like farming with pesticides, electrocution, collision with wind turbines, or poaching.",https://phys.org/news/2026-05-birds-prey-south-africa-years.html,2026-05-12 03:20:03+00:00,Science
Defense News,https://www.defensenews.com/arc/outboundfeeds/rss/,"US Navy open to building ships overseas, new plan says",The new plan comes after President Donald Trump and previous Navy Secretary John Phelan reportedly disagreed over outsourcing construction on select ships.,https://www.defensenews.com/news/your-navy/2026/05/12/us-navy-open-to-building-ships-overseas-new-plan-says/,2026-05-12 03:18:39+00:00,Defense
EU-Startups,https://www.eu-startups.com/feed/,Belgium’s Holmes launches with €1.1 million pre-Seed to catch software bugs before they reach users,"Holmes, a technology startup automating software testing in the AI era, has launched with a €1.1 million pre-Seed funding round. The round was led by Syndicate One, with participation from Aikido founders Roeland Delrue and Willem Delbare, Showpad co-founder Louis Jonckheere, and serial entrepreneur Thomas Van Overbeke. The funds NewSchool, RDY, and 100IN also participated. [&#8230;] The post Belgium’s Holmes launches with €1.1 million pre-Seed to catch software bugs before they reach users appeared first on EU-Startups .",https://www.eu-startups.com/2026/05/belgiums-holmes-launches-with-e1-1-million-pre-seed-to-catch-software-bugs-before-they-reach-users/,2026-05-12 03:00:33+00:00,"Startups, Funding"
Phys.org,https://phys.org/rss-feed/,Algal bloom crisis shows climate risks need evaluative governance,"Identifying and analyzing climate risks is a necessary function of governments, but researchers at Adelaide University's Environment Institute argue such processes will not lead to effective action without taking additional steps to understand which risks are considered unacceptable by the community and prioritizing responses accordingly.",https://phys.org/news/2026-05-algal-bloom-crisis-climate.html,2026-05-12 02:20:01+00:00,Science
Phys.org,https://phys.org/rss-feed/,Generative AI may significantly reduce the number of animal experiments,"In early phases of drug development, new active substances are tested in animals—alongside numerous other experimental methods. Researchers face a dilemma: on the one hand, for ethical reasons, they aim to keep the number of animals used in an experiment as low as possible. On the other hand, animal experiments must include enough animals to produce reliable and representative results, for example, to determine whether a new drug candidate produces a specific effect.",https://phys.org/news/2026-05-generative-ai-significantly-animal.html,2026-05-12 01:40:03+00:00,"Science, AI"
Phys.org,https://phys.org/rss-feed/,Scurvy's skeletal fingerprint found in California's Late Holocene archaeological sites,"A recent study published in the International Journal of Osteoarchaeology documented skeletal changes linked to scurvy in Late Holocene archaeological sites in California (500 BCE–1834 CE). The change observed shows the cascading impacts of dietary practices on skeletal development, including in infants, which may have been affected during pregnancy or breastfeeding, highlighting the largely invisible impacts of pregnancy in the archaeological record.",https://phys.org/news/2026-05-scurvy-skeletal-fingerprint-california-late.html,2026-05-12 01:20:01+00:00,Science
Phys.org,https://phys.org/rss-feed/,Chip-scale photonic approach achieves ultralow-noise microwave and millimeter-wave signal generation,"Researchers led by Dr. Changmin Ahn and Prof. Jungwon Kim at KAIST, in collaboration with Prof. Hansuek Lee, have demonstrated a chip-scale photonic approach for generating ultralow-noise and highly stable microwave and millimeter-wave signals based on optical frequency combs (microcombs), offering a potential pathway toward compact, high-performance frequency sources for next-generation technologies.",https://phys.org/news/2026-05-chip-scale-photonic-approach-ultralow.html,2026-05-12 00:40:03+00:00,Science
Phys.org,https://phys.org/rss-feed/,Why prescribed fire often fails: Scorched invasive shrubs can resprout instead of die,"Invasive woody plants present a major ecological challenge in eastern U.S. forests by outcompeting native species and spreading quickly, forming dense thickets that crowd out native plants and disrupt ecosystems. Land managers have tried, with some success, to use prescribed fire to kill them, but is it effective? Researchers at Penn State reported mixed results when it comes to two of the most aggressive colonizers across North American landscapes: burning bush and border privet.",https://phys.org/news/2026-05-invasive-shrubs-resprout-die.html,2026-05-12 00:40:01+00:00,Science
Phys.org,https://phys.org/rss-feed/,Pet loss is difficult for people—what about for other pets?,"I recently lost one of my cocker spaniels, Bobbi. She was fit, healthy and active, but had a catastrophic diagnosis of oral melanoma two months before I had to make the decision that anyone with deeply loved pets dreads.",https://phys.org/news/2026-05-pet-loss-difficult-people-pets.html,2026-05-12 00:20:01+00:00,Other
TechCrunch,https://techcrunch.com/feed/,"Riding an AI rally, Robinhood preps second retail venture IPO","Robinhood files confidentially for its second venture fund, this time targeting growth and early-stage startups.",https://techcrunch.com/2026/05/11/riding-an-ai-rally-robinhood-preps-second-retail-venture-ipo/,2026-05-12 00:09:01+00:00,Startups
Phys.org,https://phys.org/rss-feed/,New research examines 'remorse bias' in legal decision-making,"Two newly published studies by Colleen M. Berryessa, associate professor at the Rutgers University School of Criminal Justice, examine how expressions of remorse are interpreted in the legal system and how those interpretations can contribute to unequal outcomes.",https://phys.org/news/2026-05-remorse-bias-legal-decision.html,2026-05-12 00:00:01+00:00,Science
Nature,https://www.nature.com/subjects/medical-research.rss,Technical performance of L3 skeletal muscle area (SMA) measurement on CT for L3 skeletal muscle index (L3SMI) assessment,,https://www.nature.com/articles/s41598-026-51010-2,2026-05-12 00:00:00+00:00,Other
Nature,https://www.nature.com/subjects/medical-research.rss,"Assessment of drug-related problems and associated factors among patients with chronic obstructive pulmonary disease in Dailekh, Nepal: a cross-sectional study",,https://www.nature.com/articles/s41598-026-51951-8,2026-05-12 00:00:00+00:00,Science
Nature,https://www.nature.com/subjects/medical-research.rss,Digital stethoscope use by non-physician primary care health workers on children under five years of age in rural Bangladesh: a feasibility study,,https://www.nature.com/articles/s41598-026-52899-5,2026-05-12 00:00:00+00:00,Science
Nature,https://www.nature.com/subjects/medical-research.rss,CT-based radiomic markers to predict late-onset seizures after traumatic brain injury,,https://www.nature.com/articles/s41598-026-47942-4,2026-05-12 00:00:00+00:00,Other
Nature,https://www.nature.com/subjects/medical-research.rss,Comparative analysis of bypass vs. stent for coronary revascularization using an ex-vivo organ care system in an animal model,,https://www.nature.com/articles/s41598-026-50599-8,2026-05-12 00:00:00+00:00,Other
Phys.org,https://phys.org/rss-feed/,NASA fuel cell tests pave way for energy storage on the moon,"With a small blue crane, four researchers hoist a cylindrical fuel cell, which looks like a stack of flattened silver and gold soda cans bundled together, into the air and lower it into a rectangular cart on wheels. A tangle of tubes and wires spirals away from the system, where nearly 270 sensors and 1,000 components are nestled inside.",https://phys.org/news/2026-05-nasa-fuel-cell-pave-energy.html,2026-05-11 23:40:03+00:00,Science
Phys.org,https://phys.org/rss-feed/,Unexplored interactions between electrons and atomic nuclei shed light on dark matter,"Dark matter particles could be mediators of the interaction between electrons and atomic nuclei, as shown by a study conducted by junior group leader, Dr. Konstantin Gaul, Dr. Lei Cong, and Professor Dr. Dmitry Budker, of Johannes Gutenberg University Mainz (JGU), Helmholtz Institute Mainz (HIM) and the PRISMA++ Cluster of Excellence. Their work, published last week in Physical Review Letters, presents new constraints on previously unexplored candidates for dark matter and, more generally, some hypothetical particles that are not included in the Standard Model of particle physics (SM).",https://phys.org/news/2026-05-unexplored-interactions-electrons-atomic-nuclei.html,2026-05-11 23:40:01+00:00,Science
Phys.org,https://phys.org/rss-feed/,"Aquifer recharge could buffer water scarcity, yet policy blocks uptake in five countries","Climate change will increasingly stress water supply and economic and environmental systems, creating a mounting need for more ideas to reduce reliance and conserve diminishing river and groundwater resources. MAR takes surface water, such as rainwater, stormwater or treated wastewater, and stores it underground to replenish groundwater, restore ecosystems, and provide a reliable climate-independent water supply.",https://phys.org/news/2026-05-aquifer-recharge-buffer-scarcity-policy.html,2026-05-11 23:20:06+00:00,Other
Phys.org,https://phys.org/rss-feed/,"Brazilian microfossils interpreted as animal traces are actually algae and bacteria, research reveals",A reexamination of microfossils found in the Brazilian state of Mato Grosso do Sul shows that the marks previously interpreted as traces of worms or other small oceanic animals are actually communities of fossilized microscopic bacteria and algae.,https://phys.org/news/2026-05-brazilian-microfossils-animal-algae-bacteria.html,2026-05-11 23:20:03+00:00,Science
TechCrunch,https://techcrunch.com/feed/,GM just laid off hundreds of IT workers to hire those with stronger AI skills,"Some of the positions focus on AI-native development, data engineering and analytics, cloud-based engineering, and agent and model development as well as prompt engineering and new AI workflows.",https://techcrunch.com/2026/05/11/gm-just-laid-off-hundreds-of-it-workers-to-hire-those-with-stronger-ai-skills/,2026-05-11 23:04:10+00:00,Other
Phys.org,https://phys.org/rss-feed/,Lab-grown diamond device could change how radiation doses are measured,"A team led by researchers from Tokyo Metropolitan University, in collaboration with Tohoku University and Orbray Co., Ltd., using heteroepitaxial diamond materials developed by Orbray, have shown that lab-grown diamonds might realize a radiation dosimeter compatible with both medical diagnosis and radiation therapy.",https://phys.org/news/2026-05-lab-grown-diamond-device-doses.html,2026-05-11 23:00:06+00:00,Science
Phys.org,https://phys.org/rss-feed/,Snow and glacier ecosystems across remote Antarctic island reveal hidden microbial diversity,"Research led by a University of Bristol Ph.D. student has revealed a host of thriving microscopic algae communities in snow and glaciers across one of the most remote locations on Earth. The study, which appears in ISME Communications and includes Dr. Emily Broadwell's intrepid polar and alpine adventures as part of her Ph.D. in physical geography, sheds surprising new light on how glacier ecosystems respond to rising global temperatures.",https://phys.org/news/2026-05-glacier-ecosystems-remote-antarctic-island.html,2026-05-11 23:00:02+00:00,Science
Phys.org,https://phys.org/rss-feed/,Heat index maps uncover when city greening cools most—and when it can backfire,"Tree shade is one of the fastest ways to make heat more bearable. It cuts direct sunlight, protects people walking or working outdoors, and remains essential for heat action plans. A new study by researchers from the Indian Institute of Technology Gandhinagar (IITGN) adds a sharper planning question: If greening is so important, why does the same strategy cool some urban areas more reliably than others?",https://phys.org/news/2026-05-index-uncover-city-greening-cools.html,2026-05-11 22:40:03+00:00,Science
Phys.org,https://phys.org/rss-feed/,"Nudge theory was all about taking responsibility, but it allowed big business to look the other way","Feelings of despair at the state of the world can be overwhelming. Social and environmental problems persist, but political discourse is polarized, divisive and often ineffective.",https://phys.org/news/2026-05-nudge-theory-responsibility-big-business.html,2026-05-11 22:40:01+00:00,Other
Phys.org,https://phys.org/rss-feed/,Researchers find coherent ferrons—polarization waves with potential across quantum and telecom applications,"In new research published in Nature Materials, a team of researchers led by Columbia University chemist Xiaoyang Zhu, in collaboration with fellow Columbians Xavier Roy, Milan Delor, Dmitri Basov, and James McIver, has observed coherent ferrons for the first time.",https://phys.org/news/2026-05-coherent-ferrons-polarization-potential-quantum.html,2026-05-11 22:30:01+00:00,Science
Phys.org,https://phys.org/rss-feed/,Metagenomics and AI could unlock uncultivated bacteria and archaea,"Advances in DNA sequencing have expanded our view of the microbial world, but the inability to cultivate most microbes has been a major constraint. Now, a systematic, predictive framework that combines existing genomic and computational modeling approaches to accelerate the discovery and cultivation of novel prokaryotic taxa has been proposed by KAUST researchers, in collaboration with an international team of scientists. The work is published in The ISME Journal.",https://phys.org/news/2026-05-metagenomics-ai-uncultivated-bacteria-archaea.html,2026-05-11 22:20:07+00:00,Science
Phys.org,https://phys.org/rss-feed/,"From AI companions to climate action, we undervalue what lies ahead","Millions of people around the world now use AI companions—for friendship, emotional support, mental health counseling and romantic interactions. This includes 72% of adolescents, according to one study from the United States.",https://phys.org/news/2026-05-ai-companions-climate-action-undervalue.html,2026-05-11 22:20:02+00:00,Science
Defense News,https://www.defensenews.com/arc/outboundfeeds/rss/,"US, partner nations sink two decommissioned ships during Exercise Balikatan","A two-day strike saw the sinking of two vessels, utilizing land, sea and air platforms from the U.S., Philippine, Japanese and Canadian forces.",https://www.defensenews.com/news/your-military/2026/05/11/us-partner-nations-sink-two-decommissioned-ships-during-exercise-balikatan/,2026-05-11 22:11:59+00:00,Other
Phys.org,https://phys.org/rss-feed/,Smarter search for fuel-cell catalysts uses machine learning,"A computational method combining generative AI with atomistic simulations can identify promising platinum alloy catalyst structures for hydrogen fuel cells, report researchers from Science Tokyo. Their approach addresses a longstanding challenge in catalyst design and consistently produces high-performing candidates from several material combinations.",https://phys.org/news/2026-05-smarter-fuel-cell-catalysts-machine.html,2026-05-11 22:10:01+00:00,"AI, Science"
Phys.org,https://phys.org/rss-feed/,Hidden proton pathways emerge as ultrathin polymer film method splits interface signals,"Understanding how protons move at the interface between polymers and electrode materials is essential for improving fuel cells and related energy devices. However, conventional impedance measurements under inert conditions have long masked these interfacial contributions, showing only a single, merged signal.",https://phys.org/news/2026-05-hidden-proton-pathways-emerge-ultrathin.html,2026-05-11 22:00:08+00:00,Other
Phys.org,https://phys.org/rss-feed/,What it would have been like to experience the dinosaur‑killing asteroid armageddon: A blow‑by‑blow account,"A great Tyrannosaurus rex strides through the conifer trees of her territory, sniffing the air. She picks up the scent from the carcass of a dead horned dinosaur, Triceratops, that she was feeding on yesterday. She walks over and strips off some more shreds of meat, but the smell is foul even for her.",https://phys.org/news/2026-05-dinosaurkilling-asteroid-armageddon-blowbyblow-account.html,2026-05-11 22:00:01+00:00,Other
