source,feed_url,headline,summary,url,published_date,topics
Phys.org,https://phys.org/rss-feed/,Bacteria discovered with the ability to jettison cells as a survival mechanism,"Popular science fiction is no stranger to escape-pod scenarios, typically featuring characters who narrowly avoid their demise by jettisoning from a spaceship—think R2-D2 and C-3PO shooting away from a rebel spaceship in the opening of Star Wars: A New Hope. Biologists at the University of California San Diego have found that communities of bacteria feature a similar ejection capability.",https://phys.org/news/2026-07-bacteria-ability-jettison-cells-survival.html,2026-07-07 09:00:14+00:00,Other
Phys.org,https://phys.org/rss-feed/,How proximity steals energy from nanoresonators,"Nanomechanical resonators are miniature vibrating structures on chips that oscillate at frequencies ranging from a few kilohertz to gigahertz. They are used as ultrasensitive detectors of mass and force, temperature and pressure, and as components in radio frequency filters and on-chip clocks. Modern, state-of-the-art resonators are also used to create quantum states of macroscopic objects and test fundamental physics.",https://phys.org/news/2026-07-proximity-energy-nanoresonators.html,2026-07-07 09:00:09+00:00,Other
Phys.org,https://phys.org/rss-feed/,Raptorial insect forelegs evolved repeatedly but never converged on one winning design,"The evolutionary paths that created snatching forelimbs in insects multiple times moved in a similar direction but didn't end at a single solution. Kobe University research is pioneering a study of how organs with similar functions evolve, providing a new analytical approach to identify evolutionary dynamics quantitatively.",https://phys.org/news/2026-07-raptorial-insect-forelegs-evolved-converged.html,2026-07-07 09:00:04+00:00,Science
Phys.org,https://phys.org/rss-feed/,Ancient rocks reveal how water reshaped Earth's interior 3.1 billion years ago,Geologists studying some of the planet's oldest volcanic rocks have uncovered new evidence that water was playing a major role in shaping Earth's interior and driving volcanic activity more than 3 billion years ago.,https://phys.org/news/2026-07-ancient-reveal-reshaped-earth-interior.html,2026-07-07 09:00:01+00:00,Other
TechCrunch,https://techcrunch.com/feed/,The first American autonomous ground vehicles are fighting in Ukraine,Forterra has deployed more than 100,https://techcrunch.com/2026/07/07/the-first-american-autonomous-ground-vehicles-are-fighting-in-ukraine/,2026-07-07 09:00:00+00:00,Other
EU-Startups,https://www.eu-startups.com/feed/,London-based HIVE raises €13.1 million to build “silicon brain” for industrial machines,"HIVE, a London-based physical AI company building the intelligence layer for industrial machines, today announced a €13.1 million ($15 million) pre-Series A round to further build its platform, expand its founding team, and scale its commercial deployments. The round was led by SuperSeed, with participation from Veriten, Skyfall, and Nysnø. Angel investors include Børge Hald, [&#8230;] The post London-based HIVE raises €13.1 million to build &#8220;silicon brain” for industrial machines appeared first on EU-Startups .",https://www.eu-startups.com/2026/07/london-based-hive-raises-e13-1-million-to-build-silicon-brain-for-industrial-machines/,2026-07-07 08:58:16+00:00,"Funding, Startups"
Phys.org,https://phys.org/rss-feed/,"Death toll from China storms rises to 15, hundreds injured","The death toll from devastating storms in parts of China rose to 15 on Tuesday, with hundreds more injured and tens of thousands evacuated, state media reported, as President Xi Jinping urged ""all-out"" rescue efforts.",https://phys.org/news/2026-07-death-toll-china-storms-hundreds.html,2026-07-07 08:13:06+00:00,Other
War on the Rocks,https://warontherocks.com/feed/,Gathering Clouds: Building Digital Strategic Depth in the Compute Age,"The wars in Ukraine and the Middle East have exposed a strategic reality that military planners are only beginning to confront: In a data-centric age, digital infrastructure has become part of the battlespace. Data centers and cloud regions are now the digital backbone of military power and economic prosperity. As such, they present attractive targets for rapidly proliferating long-range strike systems, drones, and cyber capabilities. As the protective value of physical distance erodes, strategic depth &#8212; once conceived in geographical terms &#8212; must now be measured in the resilience of data and compute.Alex Rough detailed the physical vulnerability of data The post Gathering Clouds: Building Digital Strategic Depth in the Compute Age appeared first on War on the Rocks .",https://warontherocks.com/cogs-of-war/gathering-clouds-building-digital-strategic-depth-in-the-compute-age/,2026-07-07 08:00:42+00:00,Defense
SpaceNews,https://spacenews.com/feed/,Isar Aerospace signs agreement for Canadian launch site,"Isar Aerospace has signed a contract to develop a Canadian launch site for its Spectrum rocket, an agreement linked to a deal to sell submarines to the Canadian military. The post Isar Aerospace signs agreement for Canadian launch site appeared first on SpaceNews .",https://spacenews.com/isar-aerospace-signs-agreement-for-canadian-launch-site/,2026-07-07 08:00:00+00:00,Defense
Labiotech,https://www.labiotech.eu/feed/,Why Customer Experience Centers are becoming practical infrastructure for life sciences innovation in Europe,"Discover how Customer Experience Centers (CECs) are reshaping genomics and biotech in Europe by bridging innovation and implementation across labs. The post Why Customer Experience Centers are becoming practical infrastructure for life sciences innovation in Europe appeared first on Labiotech.eu . © Labiotech UG and Labiotech.eu. Unauthorized use and/or duplication of this material without express and written permission from this site’s author and/or owner is strictly prohibited. Excerpts and links may be used, provided that full and clear credit is given to Labiotech UG and Labiotech.eu with appropriate and specific direction to the original content.",https://www.labiotech.eu/partner/customer-experience-centers-biotech-innovation/,2026-07-07 08:00:00+00:00,Biotech
EU-Startups,https://www.eu-startups.com/feed/,Largest European fusion investment on record sees Proxima Fusion raise €411 million,"Munich-based Proxima Fusion today announced a €411 million ($468 million) financing round, bringing the company’s valuation to €2.4 billion ($2.7 billion) and establishing Proxima as one of the best-funded fusion companies in Europe. The round was led by XTX Ventures and East X Ventures, with RWE and Google as strategic investors. KfW Capital, SPRIND and [&#8230;] The post Largest European fusion investment on record sees Proxima Fusion raise €411 million appeared first on EU-Startups .",https://www.eu-startups.com/2026/07/largest-european-fusion-investment-on-record-sees-proxima-fusion-raise-e411-million/,2026-07-07 07:59:37+00:00,"Funding, Startups"
EU-Startups,https://www.eu-startups.com/feed/,Lisbon-based BIZAY raises €48.7 million Series D; set to surpass €88.6 million revenue and reach profitability,"BIZAY, a Lisbon-based marketing services and products company that claims to operate the world’s largest catalogue of customised products, today announced a €48.75 million ($55 million) Series D round. The round was led by existing investor Indico Capital Partners with strong participation from Lince Capital, Cedrus and BPF. The company is on the verge of [&#8230;] The post Lisbon-based BIZAY raises €48.7 million Series D; set to surpass €88.6 million revenue and reach profitability appeared first on EU-Startups .",https://www.eu-startups.com/2026/07/lisbon-based-bizay-raises-e48-75-million-series-d-set-to-surpass-e88-6-million-revenue-and-reach-profitability/,2026-07-07 07:41:54+00:00,"Funding, Startups"
Breaking Defense,https://breakingdefense.com/feed/,"NATO to acquire “up to” 10 Saab GlobalEyes for E-3 replacement, says Secretary General",The selection decision in favor of the Swedish aircraft comes after NATO axed plans to acquire Boeing E-7 Wedgetail surveillance planes.,https://breakingdefense.com/2026/07/nato-to-acquire-up-to-10-saab-globaleye-for-e-3-replacement-says-secretary-general/,2026-07-07 07:38:49+00:00,Defense
War on the Rocks,https://warontherocks.com/feed/,Sinews of War at Sea: The Armed Services Need a Common Watercraft Family,"To sustain future maritime operations, the U.S military will need to run supplies through an environment that spans thousands of miles of open ocean, denied ports, contested straits, and archipelagic chokepoints against adversaries that have spent decades studying how to target American logistics. That problem does not require one identical vessel for every mission. It does require a more common family of watercraft for the manned ships that carry cargo and vehicles inside a theater, built for scale, interoperability, and wartime replacement. Getting this right is arguably the most important acquisition problem the joint force faces in the next decade.So The post Sinews of War at Sea: The Armed Services Need a Common Watercraft Family appeared first on War on the Rocks .",https://warontherocks.com/sinews-of-war-at-sea-the-armed-services-need-a-common-watercraft-family/,2026-07-07 07:30:46+00:00,Defense
Phys.org,https://phys.org/rss-feed/,Making scents of cannabis: How cannabis cultivar and preparation methods influence aroma,"Ongoing research reveals how the aroma of cannabis is influenced not only by the chosen cultivar, but also by different drying and storage methods. Through a combination of high-resolution chromatography and human-perception aroma assessments, this project provides detailed insights into the impact of preparation and transportation on cannabis chemistry and how humans perceive and interpret its aromas.",https://phys.org/news/2026-07-scents-cannabis-cultivar-methods-aroma.html,2026-07-07 07:30:02+00:00,Science
EU-Startups,https://www.eu-startups.com/feed/,Leiden-based Whispp raises €5 million to scale on-device voice reconstruction AI technology globally,"Whispp, a Leiden-based AI startup specialising in audio-to-audio voice reconstruction AI, has raised €5 million to scale the global deployment of its technology. This follow-on investment round was led by LUMO Labs, together with strategic angel investors, and complemented by non-dilutive funding from the European Innovation Council (EIC) Accelerator. “With this funding round, we make [&#8230;] The post Leiden-based Whispp raises €5 million to scale on-device voice reconstruction AI technology globally appeared first on EU-Startups .",https://www.eu-startups.com/2026/07/leiden-based-whispp-raises-e5m-to-scale-on-device-voice-reconstruction-ai-technology-globally/,2026-07-07 06:00:43+00:00,"Funding, Startups"
Defense News,https://www.defensenews.com/arc/outboundfeeds/rss/,"Canada picks Germany’s TKMS for historic submarine buy, in nod to Europe","The firm had offered its Type 212CD submarine which is being built for both Germany and Norway, beating a competing bid from South Korea's Hanwha Ocean.",https://www.defensenews.com/global/europe/2026/07/07/canada-picks-germanys-tkms-for-historic-submarine-buy-in-nod-to-europe/,2026-07-07 04:59:44+00:00,Other
Phys.org,https://phys.org/rss-feed/,New biobased polymers exhibit excellent tensile properties beyond polyolefins,"The research group of Professor Kotohiro Nomura, Tokyo Metropolitan University, in cooperation with the research groups of Senior Researcher Hiroshi Hirano and Director Seiji Higashi of the Osaka Research Institute of Industrial Science and Technology, and Associate Professor Hiroki Takeshita of The University of Shiga Prefecture, has developed biobased poly(ester amide)s from inedible biorenewables that can be easily chemically recycled and exhibit better mechanical (tensile) properties in film than commodity plastics.",https://phys.org/news/2026-07-biobased-polymers-excellent-tensile-properties.html,2026-07-07 04:00:02+00:00,Science
Phys.org,https://phys.org/rss-feed/,Newly discovered mineral named for researcher Tyler Spano,"Tyler Spano's impact on the field of mineralogy is anything but small. So when a newly discovered mineral, modest in size but significant in meaning, was named spanoite in her honor, it became a fitting tribute to her contributions to the field.",https://phys.org/news/2026-07-newly-mineral-tyler-spano.html,2026-07-07 03:20:01+00:00,Other
Phys.org,https://phys.org/rss-feed/,Q&A: Harnessing climate investments to serve development goals,"Climate pledges are designed to help countries reduce emissions and adapt to a changing climate, but the current iterations of these pledges place additional stresses on vulnerable nations, an international team of researchers co-led by University of Michigan Engineering and KTH Royal Institute of Technology in Sweden has shown.",https://phys.org/news/2026-07-qa-harnessing-climate-investments-goals.html,2026-07-07 02:40:01+00:00,Science
Phys.org,https://phys.org/rss-feed/,How an interstellar comet sheds light on universe's 'cosmic noon',"Last year, an interstellar traveler entered our solar system. Some speculated that it was an alien spacecraft, but it turned out to be a comet, 3I/Atlas, and it provoked interest from astronomers and astrophysicists eager for insights into galaxies far, far away. Detailed observations from the National Aeronautics and Space Administration (NASA) shot down the alien spacecraft idea, but recent NASA analysis holds clues about the comet's ancient and, literally, alien origins.",https://phys.org/news/2026-07-interstellar-comet-universe-cosmic-noon.html,2026-07-07 02:20:01+00:00,Other
Phys.org,https://phys.org/rss-feed/,Efficient method for preparing pseudopregnant mice promotes laboratory animal welfare,"In biomedical research using mouse models, preparing pseudopregnant recipient females is a standard step in embryo transfer protocols. Conventionally, this process requires technicians to select female mice showing clear signs of estrus. Because only a limited percentage of mice naturally enter this stage daily, facilities often maintain a relatively large stock of female mice. Furthermore, group housing can induce the ""Lee-Boot effect,"" a biological phenomenon in which caged females suppress one another's estrous cycles, decreasing selection efficiency and requiring careful management to ensure animal well-being.",https://phys.org/news/2026-07-efficient-method-pseudopregnant-mice-laboratory.html,2026-07-07 02:00:01+00:00,Science
Phys.org,https://phys.org/rss-feed/,What everyone gets wrong about the modern job search—and what actually works,"Job searching has never been more accessible—or more confusing. Platforms like LinkedIn, Indeed and employer career pages let candidates submit applications with just a few clicks. What happens after they click ""submit,"" however, has become fertile ground for misinformation.",https://phys.org/news/2026-07-wrong-modern-job.html,2026-07-07 01:40:04+00:00,Other
Phys.org,https://phys.org/rss-feed/,"AI system translates protein sequences into text, helping reveal functions of unknown proteins","In a paper published in Proceedings of the National Academy of Sciences, researchers from Technion and Tel Aviv University present BetaDescribe, an AI system that translates protein sequences into natural-language descriptions, opening a new path toward understanding protein functions and accelerating drug development and material design.",https://phys.org/news/2026-07-ai-protein-sequences-text-reveal.html,2026-07-07 01:20:03+00:00,"Science, AI"
Phys.org,https://phys.org/rss-feed/,Newly identified marine bacterial enzyme opens new route to building bioactive compound libraries,"Many important medicines and agricultural compounds have origins in natural products made by microorganisms. One such compound is prodigiosin, a vivid red pigment produced by certain bacteria. Beyond its color, prodigiosin and related compounds known as prodiginines have attracted scientific interest because they have shown antibacterial, anticancer, immunosuppressive, antifungal and plant-protection activities.",https://phys.org/news/2026-07-newly-marine-bacterial-enzyme-route.html,2026-07-07 01:20:02+00:00,Other
Phys.org,https://phys.org/rss-feed/,"Soil thickness controls landslide occurrence, study finds","Researchers at University of Tsukuba analyzed high-resolution topographic data from airborne LiDAR to examine the relationships among landslide area, depth, and slope gradient.",https://phys.org/news/2026-07-soil-thickness-landslide-occurrence.html,2026-07-07 01:00:03+00:00,Science
Phys.org,https://phys.org/rss-feed/,Why customers stick with troubled brands: Emotional attachment may override perceived risk,"Strong emotional attachment to a brand may help explain why some consumers remain loyal even in the wake of negative publicity, according to research published in the International Journal of Business and Emerging Markets.",https://phys.org/news/2026-07-customers-brands-emotional-override.html,2026-07-07 01:00:01+00:00,Science
TechCrunch,https://techcrunch.com/feed/,Netflix invented binge-watching. Now it may have outgrown it.,A new report suggests Netflix viewers aren’t sticking around for Season 2. The bigger issue may be that binge-watching itself is no longer the advantage it once was.,https://techcrunch.com/2026/07/06/netflix-invented-binge-watching-now-it-may-have-outgrown-it/,2026-07-07 00:47:33+00:00,Other
Phys.org,https://phys.org/rss-feed/,Wasted pumpkin peel can keep your food fresh,"Researchers at Kyushu University have developed a new food preservation solution. Using pumpkin peel as a raw material, they synthesized a nanomaterial for food packaging that slows the deterioration of fruit and other produce while reducing transport damage. The findings were published April 30, 2026, in Food Research International.",https://phys.org/news/2026-07-pumpkin-food-fresh.html,2026-07-07 00:40:01+00:00,Science
Phys.org,https://phys.org/rss-feed/,"Quantum computing: Laser-optical system offers full control over 2,000 trapped Rydberg atoms","Fraunhofer ILT in Aachen has developed a highly complex laser-optical system for a quantum computer currently under construction at the 5th Institute of Physics at the University of Stuttgart. This system enables 2,000 Rydberg atoms to be positioned with submicrometer precision in the computer's highly compact vacuum chamber. To do this, the system projects an array of 2,000 individually controllable laser beams into the chamber. These beams act as optical tweezers and hold the trapped Rydberg atoms precisely at the distance required for them to interact with each other. The computer's quantum logic processes are based on these interactions.",https://phys.org/news/2026-07-quantum-laser-optical-full-rydberg.html,2026-07-07 00:20:02+00:00,Other
Phys.org,https://phys.org/rss-feed/,"Cultural power distance limits classroom voices across three communication pathways, review finds","A systematic review of research on intercultural communication in higher education finds that cultural ""power distance,"" which is the extent to which people accept unequal authority, continues to shape who speaks, who is heard and how knowledge is shared in multicultural classrooms.",https://phys.org/news/2026-07-cultural-power-distance-limits-classroom.html,2026-07-07 00:00:02+00:00,Science
Nature,https://www.nature.com/subjects/medical-research.rss,Prevalence and related factors of Dupuytren’s contracture in a community-dwelling Japanese population,,https://www.nature.com/articles/s41598-026-61045-0,2026-07-07 00:00:00+00:00,Other
Nature,https://www.nature.com/subjects/medical-research.rss,Laparoscopic ovum pick-up (LOPU) in neotropical primates of Amazonia: a post mortem model study,,https://www.nature.com/articles/s41598-026-58257-9,2026-07-07 00:00:00+00:00,Science
Nature,https://www.nature.com/subjects/medical-research.rss,Evaluation of the meningococcal C toddler vaccination and of introducing ACWY adolescent vaccination in Germany,,https://www.nature.com/articles/s44528-026-00010-9,2026-07-07 00:00:00+00:00,Other
Nature,https://www.nature.com/subjects/medical-research.rss,"A comparative analysis of routine hospital admission data for sickle cell anaemia, cystic fibrosis and haemophilia in England",,https://www.nature.com/articles/s41598-026-58441-x,2026-07-07 00:00:00+00:00,Other
Nature,https://www.nature.com/subjects/medical-research.rss,Effects of functional endoscopic sinus surgery on olfactory and trigeminal function in chronic rhinosinusitis with nasal polyps,,https://www.nature.com/articles/s41598-026-58587-8,2026-07-07 00:00:00+00:00,Other
Nature,https://www.nature.com/subjects/medical-research.rss,Association of the CHG index combined with obesity indices and incident cardiometabolic multimorbidity in a nationwide prospective cohort study,,https://www.nature.com/articles/s41598-026-61144-y,2026-07-07 00:00:00+00:00,Science
Nature,https://www.nature.com/subjects/medical-research.rss,Decoding immune signaling landscapes: what AlphaGenome reveals,,https://www.nature.com/articles/s41392-026-02844-9,2026-07-07 00:00:00+00:00,Other
Nature,https://www.nature.com/subjects/medical-research.rss,Effectiveness of minimally invasive pre-measured endotracheal tube suction on physiological indicators in mechanically ventilated infants: a clinical trial study,,https://www.nature.com/articles/s41598-026-60771-9,2026-07-07 00:00:00+00:00,"Biotech, Science"
Nature,https://www.nature.com/subjects/medical-research.rss,Dynamic heart rate variability assessment based on fixed-frequency auditory perturbation in prolonged disorders of consciousness,,https://www.nature.com/articles/s41598-026-60158-w,2026-07-07 00:00:00+00:00,Other
Nature,https://www.nature.com/subjects/medical-research.rss,The strategic importance of mRNA vaccine technologies in Africa for achieving public health independence,,https://www.nature.com/articles/s43856-026-01768-3,2026-07-07 00:00:00+00:00,Biotech
Nature,https://www.nature.com/subjects/medical-research.rss,Censoring-adjusted tree-based policy learning for estimating dynamic treatment regimes with censored outcomes,,https://www.nature.com/articles/s41598-026-53856-y,2026-07-07 00:00:00+00:00,Other
Nature,https://www.nature.com/subjects/medical-research.rss,Prospective evaluation of hepatic steatosis and fibrosis after one anastomosis gastric bypass using transient elastography,,https://www.nature.com/articles/s41598-026-60993-x,2026-07-07 00:00:00+00:00,Other
Nature,https://www.nature.com/subjects/medical-research.rss,"Motor and cognitive development is associated with anthropometry and severe zinc deficiency in infants, in rural Madagascar",,https://www.nature.com/articles/s41598-026-59463-1,2026-07-07 00:00:00+00:00,Other
Nature,https://www.nature.com/subjects/medical-research.rss,Feasibility and safety of a novel activated leukocyte adsorption device during cardiopulmonary bypass: a first-in-human pilot study,,https://www.nature.com/articles/s41598-026-60608-5,2026-07-07 00:00:00+00:00,Science
Nature,https://www.nature.com/subjects/medical-research.rss,Serum uric acid levels and mortality in diabetic patients with chronic kidney disease,,https://www.nature.com/articles/s41598-026-61218-x,2026-07-07 00:00:00+00:00,Other
TechCrunch,https://techcrunch.com/feed/,The ‘first’ AI-run ransomware attack still needed a human,"An AI agent carried out the technical execution of a real-world ransomware attack for the first known time, but new details show a human still chose the victim, set up the infrastructure, and supplied stolen credentials — meaning it wasn't quite the fully autonomous cybercrime debut that last week's headlines suggested.",https://techcrunch.com/2026/07/06/the-first-ai-run-ransomware-attack-still-needed-a-human/,2026-07-06 23:56:14+00:00,Other
Phys.org,https://phys.org/rss-feed/,How to create the blackest black ever known: From nature to nanotechnology,Achieving the blackest of blacks has been one of humanity's enduring challenges. It is a frontier that unites modern nanotechnologists with nature's ancient color palette.,https://phys.org/news/2026-07-blackest-black-nature-nanotechnology.html,2026-07-06 23:40:02+00:00,Other
TechCrunch,https://techcrunch.com/feed/,"US investors will soon get access to SK Hynix, another memory maker riding the AI boom","SK Hynix is experiencing a boom credited to AI. It will ride that to a multibillion-dollar U.S. IPO, expected to take place on Friday.",https://techcrunch.com/2026/07/06/us-investors-will-soon-get-access-to-sk-hynix-another-memory-maker-riding-the-ai-boom/,2026-07-06 23:21:03+00:00,Funding
Phys.org,https://phys.org/rss-feed/,Stored water can develop slimy bacterial films: Nanotechnology may be a solution,"When drinking water is stored in containers, a thin layer of microorganisms can grow at the interface of the container and water. This thin layer is called a biofilm. It's made up of bacteria that make the water unsafe to drink. Slimy biofilms are harder to kill with ordinary disinfectants like chlorine. So scientists are always looking for new ways to clean water in household storage systems.",https://phys.org/news/2026-07-slimy-bacterial-nanotechnology-solution.html,2026-07-06 23:20:01+00:00,Science
