source,feed_url,headline,summary,url,published_date,topics
SpaceNews,https://spacenews.com/feed/,AST SpaceMobile sees New Glenn setback delaying initial commercial service into 2027,"AST SpaceMobile expects Blue Origin’s recent launchpad explosion will delay its direct-to-smartphone constellation by three to six months, investment bank William Blair said in an equity research note, pushing initial commercial services into the first half of 2027. The post AST SpaceMobile sees New Glenn setback delaying initial commercial service into 2027 appeared first on SpaceNews .",https://spacenews.com/ast-spacemobile-sees-new-glenn-setback-delaying-initial-commercial-service-into-2027/,2026-06-03 21:12:58+00:00,"Funding, Science"
TechCrunch,https://techcrunch.com/feed/,"Defense tech is flooded with money, but who’s built to last?","Defense tech is red hot right now.&#160;Anduril&#160;and&#160;Mach Industries&#160;just doubled and quadrupled their valuations, respectively,&#160;and the U.S.&#160;government is proposing&#160;a&#160;40% increase&#160;in defense budget. A wave of new startups&#160;is&#160;chasing those government contracts, but according to Ross Fubini, the venture investor who wrote Anduril’s first check, most of them&#160;will get lost in the Valley of Death between prototype contract [&#8230;]",https://techcrunch.com/video/defense-tech-is-flooded-with-money-but-whos-built-to-last/,2026-06-03 20:51:41+00:00,"Startups, Funding"
C4ISRNET,https://www.c4isrnet.com/arc/outboundfeeds/rss/,"Creating a separate Cyber Force would require $10 billion and a minimum of 1 year, report says",Two D.C. think tanks examined a proposed implementation plan for an independent U.S. Cyber Force as some lawmakers push for its creation.,https://www.c4isrnet.com/news/pentagon-congress/2026/06/03/creating-a-separate-cyber-force-would-require-10-billion-and-a-minimum-of-1-year-report-says/,2026-06-03 20:49:16+00:00,Other
Defense News,https://www.defensenews.com/arc/outboundfeeds/rss/,Experts warn terrorism threat is rising in Africa as US pulls back,"A jihadist front is gaining ground across Africa, the Center for Strategic and International Studies warned in its annual risk analysis.",https://www.defensenews.com/news/pentagon-congress/2026/06/03/experts-warn-terrorism-threat-is-rising-in-africa-as-us-pulls-back/,2026-06-03 20:31:34+00:00,Other
Satellite Today,https://www.satellitetoday.com/feed/,Muon Space Debuts High-Power ‘Ultra’ Satellite Designed for Orbital Data Centers,"Muon Space debuted a new, higher power satellite platform on Wednesday, targeting orbital data centers as an key application. The first pathfinder mission is planned for delivery in 2028. Condor-Ultra [&#8230;] The post Muon Space Debuts High-Power ‘Ultra’ Satellite Designed for Orbital Data Centers appeared first on Via Satellite .",https://www.satellitetoday.com/manufacturing/2026/06/03/muon-space-debuts-high-power-ultra-satellite-designed-for-orbital-data-centers/,2026-06-03 20:23:09+00:00,Space
Satellite Today,https://www.satellitetoday.com/feed/,Beyond Gravity Releases New Propulsion Pointing Mechanism,Beyond Gravity is to bring to market a new ultra-light propulsion pointing mechanism with high maneuverability for Low Earth Orbit (LEO) constellations. The new two-axis mechanism aims to address what [&#8230;] The post Beyond Gravity Releases New Propulsion Pointing Mechanism appeared first on Via Satellite .,https://www.satellitetoday.com/technology/2026/06/03/beyond-gravity-releases-new-propulsion-pointing-mechanism/,2026-06-03 20:20:36+00:00,Space
TechCrunch,https://techcrunch.com/feed/,Uber to put 500 data-collection vehicles on the road this year,The modified Ioniq 5 will be loaded with sensors to capture data for Uber's new AV Labs division.,https://techcrunch.com/2026/06/03/uber-to-put-500-data-collection-vehicles-on-the-road-this-year/,2026-06-03 20:08:28+00:00,Other
TechCrunch,https://techcrunch.com/feed/,Alphabet’s record-breaking $85B raise for Google’s AI business is a helluva good signal,"If Alphabet's record-breaking $85 billion stock sale signals investor appetite for AI-related offerings, we can see that investors are ready to chow.",https://techcrunch.com/2026/06/03/alphabets-record-breaking-85b-raise-for-googles-ai-business-is-a-helluva-good-signal/,2026-06-03 19:38:32+00:00,Funding
Breaking Defense,https://breakingdefense.com/feed/,"Air Force awards GE, Rolls-Royce for ‘medium thrust’ drone engines","The two engine makers will advance designs to power medium thrust class drones, an Air Force spokesperson told Breaking Defense.",https://breakingdefense.com/2026/06/air-force-awards-ge-rolls-royce-for-medium-thrust-drone-engines/,2026-06-03 19:31:00+00:00,Defense
TechCrunch,https://techcrunch.com/feed/,Meta mercifully spun out VR fitness game Supernatural instead of just killing it,Meta appears to have listened to the Supernatural users who protested the app's sad fate after sweeping layoffs.,https://techcrunch.com/2026/06/03/meta-mercifully-spun-out-vr-fitness-game-supernatural-instead-of-just-killing-it/,2026-06-03 19:22:53+00:00,Other
TechCrunch,https://techcrunch.com/feed/,Substack’s new ‘Reply Rules’ feature lets creators control how people respond,Substack's new Reply Rules feature is currently available for all English-language publications and is designed to give creators greater control over how their audiences respond.,https://techcrunch.com/2026/06/03/substacks-new-reply-rules-feature-lets-creators-control-how-people-respond/,2026-06-03 19:08:55+00:00,Other
TechCrunch,https://techcrunch.com/feed/,"Google’s Dreambeans, its weirdest-named AI tool to date, will turn your life into a cartoon","Dreambeans is a curated list of AI-illustrated ""stories"" culled from the personal data in your Google account.",https://techcrunch.com/2026/06/03/googles-dreambeans-its-weirdest-named-ai-tool-to-date-will-turn-your-life-into-a-cartoon/,2026-06-03 19:07:42+00:00,Other
Breaking Defense,https://breakingdefense.com/feed/,Marine Corps’ Harrier completes final flight following SOUTHCOM deployment,The Marine Corps is moving through its Tactical Aircraft Transition Plan as it plans to fully adopt fifth-generation aircraft across the entire fleet.,https://breakingdefense.com/2026/06/marine-corps-harrier-completes-final-flight-following-southcom-deployment/,2026-06-03 18:39:27+00:00,Other
Satellite Today,https://www.satellitetoday.com/feed/,Applied Aerospace & Defense IPOs to Raise $650M,"Applied Aerospace &#38; Defense began trading on the New York Stock Exchange on Wednesday, offering 32.5 million shares to raise $650 million. Applied Aerospace &#38; Defense is an aerospace and [&#8230;] The post Applied Aerospace &#038; Defense IPOs to Raise $650M appeared first on Via Satellite .",https://www.satellitetoday.com/finance/2026/06/03/applied-aerospace-defense-ipos-to-raise-650m/,2026-06-03 18:22:13+00:00,"Defense, Funding"
SpaceNews,https://spacenews.com/feed/,"After cooperation on SMILE mission, ESA and China chart parallel but separate paths","ESA and China recently launched the joint SMILE magnetosphere mission after a decade of cooperation, but despite similar goals, another collaboration appears distant. The post After cooperation on SMILE mission, ESA and China chart parallel but separate paths appeared first on SpaceNews .",https://spacenews.com/after-cooperation-on-smile-mission-esa-and-china-chart-parallel-but-separate-paths/,2026-06-03 18:20:34+00:00,Other
Satellite Today,https://www.satellitetoday.com/feed/,"Assessing SpaceX Finances, Addressable Market, and the AI Pitch Ahead of IPO","Ahead of SpaceX’s plans to go public next week, Via Satellite surveyed leading space analysts about what we’ve learned from the company’s financial filings ahead of the IPO. The company’s [&#8230;] The post Assessing SpaceX Finances, Addressable Market, and the AI Pitch Ahead of IPO appeared first on Via Satellite .",https://www.satellitetoday.com/finance/2026/06/03/assessing-spacex-finances-addressable-market-and-the-ai-pitch-ahead-of-ipo/,2026-06-03 18:15:51+00:00,Other
TechCrunch,https://techcrunch.com/feed/,Ultrahuman says hackers accessed customers’ wellness data via internal tool,The breach at wearable ring maker Ultrahuman stemmed from credentials stolen from a malware-infected employee laptop.,https://techcrunch.com/2026/06/03/ultrahuman-says-hackers-accessed-customers-wellness-data-via-internal-tool/,2026-06-03 17:30:52+00:00,MedTech
War on the Rocks,https://warontherocks.com/feed/,Will China and the United States Pursue Strategic Stability?,"In 2024, Michael Swaine wrote, &#8220;How to Stop the United States and China from Sliding into War,&#8221; where he identified areas that could increase the possibility of an armed conflict between the United States and China. Two years later, after recent talks between President Trump and President Xi, we asked Michael to revisit his arguments.Image: U.S. Department of StateIn your 2024 article, you flagged a rising possibility of major armed conflict between China and the United States. That was before American forces became militarily involved in Iran. Does that involvement change your calculus? And critically &#8212; does it deter Beijing, The post Will China and the United States Pursue Strategic Stability? appeared first on War on the Rocks .",https://warontherocks.com/will-china-and-the-united-states-pursue-strategic-stability/,2026-06-03 17:30:42+00:00,Other
Breaking Defense,https://breakingdefense.com/feed/,"The biggest industry, training hurdles for making drone wingman a reality","In our final video looking at manned-unmanned teaming, we consider likely changes ahead for defense manufacturers as the US increasingly partners with drones in combat.",https://breakingdefense.com/2026/06/the-biggest-industry-training-hurdles-for-making-drone-wingman-a-reality/,2026-06-03 17:27:07+00:00,Defense
TechCrunch,https://techcrunch.com/feed/,Carvana ties up with Bezos-backed Slate Auto as it plans new car sales,"Carvana was granted a warrant to buy shares in Slate last year, according to documents obtained by TechCrunch. Guggenheim Partners CEO Mark Walter is heavily invested in both companies.",https://techcrunch.com/2026/06/03/carvana-ties-up-with-bezos-backed-slate-auto-as-it-plans-new-car-sales/,2026-06-03 17:25:51+00:00,Other
MIT Technology Review,https://www.technologyreview.com/feed/,How virtual power plants could provide energy for data centers,"Would you take a payment to ramp down your electricity use? Would it change anything if you were doing so to help power a local data center? Google just signed a new deal to help pay for a virtual power plant (VPP) in the largest power grid in the US. The agreement is with Voltus,&#8230;",https://www.technologyreview.com/2026/06/03/1138350/virtual-power-plants-data-centers/,2026-06-03 16:51:38+00:00,Other
Breaking Defense,https://breakingdefense.com/feed/,Anduril teams with Elbit America for Army’s self-propelled howitzer competition,Anduril joins the US subsidiary of Israeli company Elbit along with OshKosh Defense for the team’s offering for the highly anticipated competition.,https://breakingdefense.com/2026/06/anduril-teams-with-elbit-america-for-armys-self-propelled-howitzer-competition/,2026-06-03 16:41:02+00:00,Defense
TechCrunch,https://techcrunch.com/feed/,Instagram is alerting users who were targeted by hackers during AI chatbot attacks,"Hackers appeared to take over victims’ accounts even after Meta said it fixed its AI-powered support chatbot, which granted hackers access to victims’ accounts.",https://techcrunch.com/2026/06/03/instagram-is-alerting-users-who-were-targeted-by-hackers-during-ai-chatbot-attacks/,2026-06-03 16:12:06+00:00,Other
Defense News,https://www.defensenews.com/arc/outboundfeeds/rss/,"US tells Europe, Canada to boost NATO air and naval forces","“Nations just need to assign the capabilities they have to NATO,” a spokesman for the alliance's military headquarters said.",https://www.defensenews.com/global/europe/2026/06/03/us-tells-europe-canada-to-boost-nato-air-and-naval-forces/,2026-06-03 15:55:26+00:00,Defense
TechCrunch,https://techcrunch.com/feed/,Amazon will show AI product images when you search for some reason,Amazon will use visual search and AI to show AI-generated product images that match your search queries. The retailer says it will help guide users to products.,https://techcrunch.com/2026/06/03/amazon-will-show-ai-product-images-when-you-search-for-some-reason/,2026-06-03 15:50:26+00:00,Other
Defense News,https://www.defensenews.com/arc/outboundfeeds/rss/,Lockheed’s GRIZZLY C-UAS system downs attack drone in live-fire demo,"The live-fire demonstration paired the radars, Sanctum software and launcher to destroy the target at Yuma Proving Ground, Arizona.",https://www.defensenews.com/news/your-military/2026/06/03/lockheeds-grizzly-c-uas-system-downs-attack-drone-in-live-fire-demo/,2026-06-03 15:34:13+00:00,Defense
TechCrunch,https://techcrunch.com/feed/,"Still facing copyright lawsuits, AI music generator Suno raises another $400M","The prominent AI music-generation startup is now valued at over $5.4 billion -- about seven months ago, it raised at a $2.45 billion valuation.",https://techcrunch.com/2026/06/03/still-facing-copyright-lawsuits-ai-music-generator-suno-raises-another-400m/,2026-06-03 15:31:42+00:00,"Funding, Startups"
SpaceNews,https://spacenews.com/feed/,"Electronics manufacturer Murata to explore Xona satellite timing service for telecom, data centers","Xona is developing a low Earth orbit network to provide backup to GPS-dependent systems The post Electronics manufacturer Murata to explore Xona satellite timing service for telecom, data centers appeared first on SpaceNews .",https://spacenews.com/electronics-manufacturer-murata-to-explore-xona-satellite-timing-service-for-telecom-data-centers/,2026-06-03 15:19:56+00:00,Space
Defense News,https://www.defensenews.com/arc/outboundfeeds/rss/,"Gulf tensions escalate as Iran hits Kuwait, US strikes near Hormuz","CENTCOM said it had carried out a new round of defensive strikes in southern Iran, while an Iranian drone attack on the Kuwait airport killed one person.",https://www.defensenews.com/news/your-military/2026/06/03/gulf-tensions-escalate-as-iran-hits-kuwait-us-strikes-near-hormuz/,2026-06-03 15:09:44+00:00,Defense
Breaking Defense,https://breakingdefense.com/feed/,"Army, J-7 to test new sensor with high-altitude balloon in coming days",The Wallabee prototype is set to provide the Army and the J-7 with more intelligence-gathering capabilities in the stratosphere.,https://breakingdefense.com/2026/06/army-j-7-to-test-new-sensor-with-high-altitude-balloon-in-coming-days/,2026-06-03 15:08:00+00:00,Defense
Labiotech,https://www.labiotech.eu/feed/,Highlights of ASCO 2026: how is cancer care evolving?,"Labiotech heard from experts about the major trends and highlights in cancer care at ASCO 2026. The post Highlights of ASCO 2026: how is cancer care evolving? appeared first on Labiotech.eu . © Labiotech UG and Labiotech.eu. Unauthorized use and/or duplication of this material without express and written permission from this site’s author and/or owner is strictly prohibited. Excerpts and links may be used, provided that full and clear credit is given to Labiotech UG and Labiotech.eu with appropriate and specific direction to the original content.",https://www.labiotech.eu/trends-news/asco-2026-cancer-care/,2026-06-03 15:03:34+00:00,Other
TechCrunch,https://techcrunch.com/feed/,These two founders left Goldman and Meta to build voice AI for markets everyone else overlooked,"The startup's own stack for Africa and Middle East is now handling more than 17,000 calls per day.",https://techcrunch.com/2026/06/03/these-two-founders-left-goldman-and-meta-to-build-voice-ai-for-markets-everyone-else-overlooked/,2026-06-03 15:00:00+00:00,Startups
TechCrunch,https://techcrunch.com/feed/,GitLab cuts 14% of staff as it scales its platform to serve AI workloads,"The company is reducing its workforce as it exits 22 countries, reduces management layers, and invests in its infrastructure to scale its platform.",https://techcrunch.com/2026/06/03/gitlab-cuts-14-of-staff-as-it-scales-its-platform-to-serve-ai-workloads/,2026-06-03 14:59:30+00:00,Other
TechCrunch,https://techcrunch.com/feed/,"Publishers will be able to opt out of AI Search, thanks to new regulation",U.K. regulators are requiring Google offer a tool allowing website publishers to opt-out of generative AI search features. The option will be tested in the U.K. then rolled out globally.,https://techcrunch.com/2026/06/03/publishers-will-be-able-to-opt-out-of-ai-search-thanks-to-new-regulation/,2026-06-03 14:58:33+00:00,AI
EU-Startups,https://www.eu-startups.com/feed/,Why your funding announcement is not the PR win you think it is – and why speaking at events is,"In the European tech ecosystem, we have a Series B problem, and it’s not new. We are excellent at launching startups with Seed funding, but many struggle to maintain the velocity required to become global leaders. There are many reasons for this, but from a PR perspective, the missing ingredient is often the architecture of [&#8230;] The post Why your funding announcement is not the PR win you think it is &#8211; and why speaking at events is appeared first on EU-Startups .",https://www.eu-startups.com/2026/06/why-your-funding-announcement-is-not-the-pr-win-you-think-it-is-and-why-speaking-at-events-is/,2026-06-03 14:38:26+00:00,"Funding, Startups"
TechCrunch,https://techcrunch.com/feed/,"TikTok launches TikTok Pro Events, an app for cultural moments like the FIFA World Cup","The app allows users to engage with other fans, explore trending videos, and access curated creator feeds.",https://techcrunch.com/2026/06/03/tiktok-launches-tiktok-pro-events-an-app-for-cultural-moments-like-the-fifa-world-cup/,2026-06-03 14:04:38+00:00,Other
C4ISRNET,https://www.c4isrnet.com/arc/outboundfeeds/rss/,SOCOM wants to revive legacy M4 carbine with ‘hypervelocity’ cartridge,The elite command asked vendors to double the effective range of the M4 platform with the Hypervelocity Improved Carbine program.,https://www.c4isrnet.com/industry/techwatch/2026/06/03/socom-wants-to-revive-legacy-m4-carbine-with-hypervelocity-cartridge/,2026-06-03 14:03:04+00:00,Other
TechCrunch,https://techcrunch.com/feed/,The worst hacks and breaches of 2026 (so far),"From a massive DOGE data breach and the hacking of critical energy and water systems to the hack of an FBI surveillance system, here are the most damaging security incidents and data breaches of 2026.",https://techcrunch.com/2026/06/03/the-worst-hacks-and-breaches-of-2026-so-far/,2026-06-03 14:02:45+00:00,Other
Breaking Defense,https://breakingdefense.com/feed/,The US is delaying weapon sales to allies. Will there be long-term impact?,"A number of factors may &#8220;lead even long-standing allies and partners to question whether or not it&#8217;s wise to continue to depend on the United States for essential defense articles and services,” one analyst said.",https://breakingdefense.com/2026/06/the-us-is-delaying-weapon-sales-to-allies-will-there-be-long-term-impact/,2026-06-03 14:02:35+00:00,Defense
TechCrunch,https://techcrunch.com/feed/,"Meet Wander, a StumbleUpon-inspired tool for discovering the ‘small web’",This open source community project lets you create a StumbleUpon-like experience for recommending your favorite sites.,https://techcrunch.com/2026/06/03/meet-wander-a-stumbleupon-inspired-tool-for-discovering-the-small-web/,2026-06-03 14:00:58+00:00,Other
SpaceNews,https://spacenews.com/feed/,Europe is rearming together — except in space,"Europe is rapidly rewriting its security architecture. Faced with Russian aggression, mounting doubts about long-term American commitment and growing pressure to shoulder more of its own defense burden, European states [&#8230;] The post Europe is rearming together — except in space appeared first on SpaceNews .",https://spacenews.com/europe-is-rearming-together-except-in-space/,2026-06-03 13:00:00+00:00,Defense
Payload Space,https://payloadspace.com/feed/,"Muon Space Unveils New, Larger Satellite Bus","Condor-Ultra is three times larger than its Condor-XL satellite bus, and geared toward the nascent orbital-data-center market. The post Muon Space Unveils New, Larger Satellite Bus appeared first on Payload .",https://payloadspace.com/muon-space-unveils-new-larger-satellite-bus/,2026-06-03 12:20:04+00:00,Space
Payload Space,https://payloadspace.com/feed/,NASA Reverts to Original CLD Procurement Plan,“The industry position will now shape the path forward as NASA proceeds with the original commercial strategy.” The post NASA Reverts to Original CLD Procurement Plan appeared first on Payload .,https://payloadspace.com/nasa-reverts-to-original-cld-procurement-plan/,2026-06-03 12:17:54+00:00,Other
MIT Technology Review,https://www.technologyreview.com/feed/,"The Download: Trump’s new AI order, and smart glasses for warfare","This is today&#8217;s edition of The Download, our weekday newsletter that provides a daily dose of what&#8217;s going on in the world of technology. 5 key points in Trump&#8217;s new AI order Less than two weeks after scrapping an executive order on AI, President Donald Trump signed a new one on Tuesday. Promising to promote&#8230;",https://www.technologyreview.com/2026/06/03/1138322/the-download-trump-ai-order-smart-glasses-warfare/,2026-06-03 12:10:00+00:00,Defense
Science,https://www.science.org/rss/news_current.xml,"After empty promises, string theory finds new uses",Physicists hope back-to-basics approach could point toward alternative paths to “theory of everything”,https://www.science.org/content/article/after-empty-promises-string-theory-finds-new-uses,2026-06-03 11:45:00+00:00,Other
SpaceNews,https://spacenews.com/feed/,Muon Space unveils Starship-class satellite platform for orbital data centers,"Muon Space announced a Starship-class satellite platform June 3 designed from the ground up to meet the demands of the emerging orbital data center market, with an initial launch slated for 2028 after securing customers. The post Muon Space unveils Starship-class satellite platform for orbital data centers appeared first on SpaceNews .",https://spacenews.com/muon-space-unveils-starship-class-satellite-platform-for-orbital-data-centers/,2026-06-03 11:39:41+00:00,Space
C4ISRNET,https://www.c4isrnet.com/arc/outboundfeeds/rss/,"At a NATO range in Latvia, hits and misses mark Europe’s counter-drone journey","Drone technology is “a couple of steps ahead” of countermeasures, one officer said, with interceptors having to work every time to prevent losses.",https://www.c4isrnet.com/global/europe/2026/06/03/at-a-nato-range-in-latvia-hits-and-misses-mark-europes-counter-drone-journey/,2026-06-03 11:33:30+00:00,Defense
EU-Startups,https://www.eu-startups.com/feed/,Edinburgh-based Wordsmith raises €60.2 million Series B to scale legal AI platform for in-house teams,"Wordsmith, an Edinburgh-based legal AI startup building the legal operations platform for in-house teams, today announced a €60.2 million ($70 million) Series B funding round, bringing the company’s total funding to €86 million ($100 million). The funding was secured from Highland Europe and Index Ventures, among others. The round comes alongside an expansion of Wordsmith’s [&#8230;] The post Edinburgh-based Wordsmith raises €60.2 million Series B to scale legal AI platform for in-house teams appeared first on EU-Startups .",https://www.eu-startups.com/2026/06/edinburgh-based-wordsmith-raises-e60-2-million-series-b-to-scale-legal-ai-platform-for-in-house-teams/,2026-06-03 11:30:05+00:00,"Funding, Startups"
SpaceNews,https://spacenews.com/feed/,Blue Origin seeks to resume New Glenn launches by year’s end,Blue Origin’s CEO says damage to its New Glenn launch pad is not as bad as feared and the rocket could return to flight by the end of the year. The post Blue Origin seeks to resume New Glenn launches by year’s end appeared first on SpaceNews .,https://spacenews.com/blue-origin-seeks-to-resume-new-glenn-launches-by-years-end/,2026-06-03 10:39:28+00:00,Other
Breaking Defense,https://breakingdefense.com/feed/,"A Cyber Force budget would require at least $10 billion, new commission report says",The Commission on US Cyber Force Generation released its report outlining what a new military service could look like.,https://breakingdefense.com/2026/06/a-cyber-force-budget-would-require-at-least-10-billion-new-commission-report-says/,2026-06-03 10:00:00+00:00,Defense
EU-Startups,https://www.eu-startups.com/feed/,UK’s Oxford Quantum Circuits raises €301 million Series C to scale Quantum-AI data-centre platform,"Oxford Quantum Circuits (OQC), a UK-based company building quantum computers and a secure, scalable Quantum-AI data-centre platform for enterprise and government customers, has closed an oversubscribed €301 million (£260 million/$350 million) Series C funding round. OQC claims this to be Europe’s largest ever private funding round for a quantum computing company. The round was led [&#8230;] The post UK’s Oxford Quantum Circuits raises €301 million Series C to scale Quantum-AI data-centre platform appeared first on EU-Startups .",https://www.eu-startups.com/2026/06/uks-oxford-quantum-circuits-raises-e301-million-series-c-to-scale-quantum-ai-data-centre-platform/,2026-06-03 09:42:29+00:00,"Funding, Startups"
