source,feed_url,headline,summary,url,published_date,topics
Science,https://www.science.org/rss/news_current.xml,AI algorithms can become ‘agents of chaos’,"Given autonomous control of other software, programs shared private medical details and deleted files without permission",https://www.science.org/content/article/ai-algorithms-can-become-agents-chaos,2026-03-23 02:05:00+00:00,Other
Science,https://www.science.org/rss/news_current.xml,Iran’s internet shutdown muddies global efforts to track damage to historical sites,At least 56 cultural sites have been damaged since strikes began in February—but internet blackouts and academic isolation are obscuring the true toll,https://www.science.org/content/article/iran-s-internet-shutdown-muddies-global-efforts-track-damage-historical-sites,2026-03-23 01:45:00+00:00,Other
Payload Space,https://payloadspace.com/feed/,SpaceX v. Amazon Heats Up at the FCC,"In a world where regulatory filings can feel dull and dry, this case brings the drama—and the snark. Let’s walk through how these two satcom mega constellations are publicly dueling in a governmental arena. The post SpaceX v. Amazon Heats Up at the FCC appeared first on Payload .",https://payloadspace.com/spacex-v-amazon-heats-up-at-the-fcc/,2026-03-23 00:54:09+00:00,Other
Nature,https://www.nature.com/subjects/medical-research.rss,IgG4 surge predicts relapse in IgG4-RD,,https://www.nature.com/articles/s41584-026-01368-4,2026-03-23 00:00:00+00:00,Other
Nature,https://www.nature.com/subjects/medical-research.rss,Change in the chondroitin/dermatan structure in distal lung tissue from COPD patients,,https://www.nature.com/articles/s41598-026-44120-4,2026-03-23 00:00:00+00:00,Other
Nature,https://www.nature.com/subjects/medical-research.rss,The first limb-sparing use of histotripsy for canine osteosarcoma,,https://www.nature.com/articles/s41598-026-42319-z,2026-03-23 00:00:00+00:00,Other
Nature,https://www.nature.com/subjects/medical-research.rss,Association of thiamine supplementation with 30-day mortality among ICU patients with sepsis-associated delirium,,https://www.nature.com/articles/s41598-026-44384-w,2026-03-23 00:00:00+00:00,Other
Nature,https://www.nature.com/subjects/medical-research.rss,Paraspinal muscle fatty infiltration is associated with nonunion and cage subsidence after anterolateral lumbar interbody fusion: a level-specific analysis,,https://www.nature.com/articles/s41598-026-44810-z,2026-03-23 00:00:00+00:00,Other
Nature,https://www.nature.com/subjects/medical-research.rss,"Epidemiology, aetiology and outcomes of paediatric ocular trauma: a population-level study in Northern Ireland",,https://www.nature.com/articles/s41433-026-04406-3,2026-03-23 00:00:00+00:00,Science
Nature,https://www.nature.com/subjects/medical-research.rss,Knowledge attitudes and practices regarding MRI safety among healthcare providers and patients/family members in China,,https://www.nature.com/articles/s41598-026-44648-5,2026-03-23 00:00:00+00:00,Other
Nature,https://www.nature.com/subjects/medical-research.rss,Large language models in healthcare,,https://www.nature.com/articles/s41581-026-01071-3,2026-03-23 00:00:00+00:00,AI
Nature,https://www.nature.com/subjects/medical-research.rss,Quality of TikTok videos on sudden cardiac death varies by video characteristics and health information accuracy,,https://www.nature.com/articles/s41598-026-39081-7,2026-03-23 00:00:00+00:00,Other
Nature,https://www.nature.com/subjects/medical-research.rss,Early levothyroxine sodium administration and clinical outcomes in patients with sepsis: a MIMIC-IV database analysis,,https://www.nature.com/articles/s41598-026-43822-z,2026-03-23 00:00:00+00:00,Other
Nature,https://www.nature.com/subjects/medical-research.rss,Emergency response capacity among nurses in tertiary hospitals: a latent profile analysis,,https://www.nature.com/articles/s41598-026-45355-x,2026-03-23 00:00:00+00:00,Other
Nature,https://www.nature.com/subjects/medical-research.rss,Effects of post-treatment systolic blood pressure on adverse outcomes in hypertensive population with comorbidity,,https://www.nature.com/articles/s41598-026-42443-w,2026-03-23 00:00:00+00:00,Other
Nature,https://www.nature.com/subjects/medical-research.rss,Cortical gradient compression links cognition and transcriptomic signatures in primary angle-closure glaucoma,,https://www.nature.com/articles/s42003-026-09886-3,2026-03-23 00:00:00+00:00,Other
Nature,https://www.nature.com/subjects/medical-research.rss,Impact of thiamin supplementation on thiamin pyrophosphate effect and cardiac function in pediatric heart disease patients on diuretics: a randomized controlled trial,,https://www.nature.com/articles/s41598-026-45100-4,2026-03-23 00:00:00+00:00,Other
Nature,https://www.nature.com/subjects/medical-research.rss,Obstructive sleep apnea in never-smokers with newly diagnosed lung cancer: a prospective study in a predominantly female Korean population,,https://www.nature.com/articles/s41598-026-45232-7,2026-03-23 00:00:00+00:00,Science
Nature,https://www.nature.com/subjects/medical-research.rss,Association of leukocyte mitochondrial DNA copy number and inflammation with mortality among older adults,,https://www.nature.com/articles/s43856-026-01531-8,2026-03-23 00:00:00+00:00,Other
Nature,https://www.nature.com/subjects/medical-research.rss,Convolutional neural networks using preoperative CT to predict short-term recurrence after incisional hernia repair,,https://www.nature.com/articles/s41598-026-44070-x,2026-03-23 00:00:00+00:00,Other
Nature,https://www.nature.com/subjects/medical-research.rss,Infographic: AREDS1&AREDS2—oral supplementation with antioxidants for age-related macular degeneration (AMD),,https://www.nature.com/articles/s41433-026-04392-6,2026-03-23 00:00:00+00:00,Other
Nature,https://www.nature.com/subjects/medical-research.rss,"Validity, reliability and precision of a novel virtual reality rod and disk test to assess visual dependence",,https://www.nature.com/articles/s41598-026-45536-8,2026-03-23 00:00:00+00:00,Other
Nature,https://www.nature.com/subjects/medical-research.rss,Wearable technologies in clinical trials for drug development: trends and emerging opportunities,,https://www.nature.com/articles/s41573-026-01403-9,2026-03-23 00:00:00+00:00,"MedTech, Biotech"
Nature,https://www.nature.com/subjects/medical-research.rss,Visualizing cortical laminar architecture in the living human brain using next-generation ultra-high-gradient diffusion MRI,,https://www.nature.com/articles/s42003-026-09887-2,2026-03-23 00:00:00+00:00,Other
Nature,https://www.nature.com/subjects/medical-research.rss,Validation of the Persian version of the computer ergonomics knowledge assessment questionnaire among frequent computer users,,https://www.nature.com/articles/s41598-026-45142-8,2026-03-23 00:00:00+00:00,Other
Nature,https://www.nature.com/subjects/medical-research.rss,The role of sperm DNA fragmentation testing in predicting IVF and PGT-A outcomes,,https://www.nature.com/articles/s41598-026-38974-x,2026-03-23 00:00:00+00:00,Other
Nature,https://www.nature.com/subjects/medical-research.rss,Protein microarray-based profiling of salivary IgA antibodies against human proteins in COVID-19 patients with depressive symptoms,,https://www.nature.com/articles/s41598-026-45180-2,2026-03-23 00:00:00+00:00,Other
Nature,https://www.nature.com/subjects/medical-research.rss,Proteomic characterization of intrahepatic cholangiocarcinoma identifies risk-stratifying subgroups and EIF4A1 as a therapeutic target,,https://www.nature.com/articles/s41467-026-70817-1,2026-03-23 00:00:00+00:00,Biotech
Nature,https://www.nature.com/subjects/medical-research.rss,AI-based hematological malignancy prediction from peripheral blood smears in a large diagnostic laboratory cohort,,https://www.nature.com/articles/s41375-026-02934-1,2026-03-23 00:00:00+00:00,"MedTech, Science"
Nature,https://www.nature.com/subjects/medical-research.rss,"Evaluating the efficacy of smoke management technologies in laparoscopic sleeve gastrectomy: insights from a prospective, single-centre comparative study",,https://www.nature.com/articles/s41598-026-43227-y,2026-03-23 00:00:00+00:00,Science
SpaceNews,https://spacenews.com/feed/,SpaceX offers details on orbital data center satellites,"SpaceX Chief Executive Elon Musk revealed more technical, but not financial, details about his company’s plans to deploy an orbital data center constellation. The post SpaceX offers details on orbital data center satellites appeared first on SpaceNews .",https://spacenews.com/spacex-offers-details-on-orbital-data-center-satellites/,2026-03-22 18:08:55+00:00,Space
