source,feed_url,headline,summary,url,published_date,topics
Science,https://www.science.org/rss/news_current.xml,Relics of an ancient sandstorm on Mars point to Earth-like winds,Curiosity rover finds what may be the first direct evidence that Mars once had a thick atmosphere,https://www.science.org/content/article/relics-ancient-sandstorm-mars-point-earth-winds,2026-04-06 02:45:00+00:00,Other
Science,https://www.science.org/rss/news_current.xml,"As war escalates, Iran’s universities face increasing fire",Attacks have destroyed or damaged a wide range of academic and commercial research centers,https://www.science.org/content/article/war-escalates-iran-s-universities-face-increasing-fire,2026-04-06 01:55:00+00:00,Science
Nature,https://www.nature.com/subjects/medical-research.rss,Impact of delayed first radioiodine therapy on response evaluation in intermediate risk differentiated thyroid cancer,,https://www.nature.com/articles/s41598-026-47698-x,2026-04-06 00:00:00+00:00,Other
Nature,https://www.nature.com/subjects/medical-research.rss,Development and validation of a clinical-adipometric nomogram for predicting tumor response to transarterial chemoembolization in hepatocellular carcinoma,,https://www.nature.com/articles/s41598-026-47502-w,2026-04-06 00:00:00+00:00,Other
Nature,https://www.nature.com/subjects/medical-research.rss,"Development, validation, and visualization of a novel nomogram for predicting clinical outcomes of postoperative cervical cancer patients",,https://www.nature.com/articles/s41598-026-42652-3,2026-04-06 00:00:00+00:00,Other
Nature,https://www.nature.com/subjects/medical-research.rss,Association of periodontitis with reduced kidney function and albuminuria in early chronic kidney disease: a population-based study,,https://www.nature.com/articles/s41368-026-00435-6,2026-04-06 00:00:00+00:00,Science
Nature,https://www.nature.com/subjects/medical-research.rss,The “Asian Paradox” in multiple primary lung cancer: a geographic monopole driven by phenotypic divergence,,https://www.nature.com/articles/s41533-026-00504-7,2026-04-06 00:00:00+00:00,Other
SpaceNews,https://spacenews.com/feed/,Isaacman defends NASA budget proposal despite steep cuts,NASA Administrator Jared Isaacman defended a fiscal year 2027 budget proposal that would cut the agency’s budget by nearly 25%. The post Isaacman defends NASA budget proposal despite steep cuts appeared first on SpaceNews .,https://spacenews.com/isaacman-defends-nasa-budget-proposal-despite-steep-cuts/,2026-04-05 22:20:09+00:00,Other
SpaceNews,https://spacenews.com/feed/,NASA stops work on SLS Mobile Launcher 2,NASA has stopped work on a second mobile launch platform intended for an upgraded version of the Space Launch System the agency no longer plans to develop. The post NASA stops work on SLS Mobile Launcher 2 appeared first on SpaceNews .,https://spacenews.com/nasa-stops-work-on-sls-mobile-launcher-2/,2026-04-05 20:29:48+00:00,Other
TechCrunch,https://techcrunch.com/feed/,Polymarket took down wagers tied to rescue of downed Air Force officer,A Democratic congressman had harsh criticism for Polymarket for allowing users to bet on the date the U.S. would confirm the rescue of Air Force service members shot down over Iran.,https://techcrunch.com/2026/04/05/polymarket-took-down-wagers-tied-to-rescue-of-downed-air-force-officer/,2026-04-05 19:36:03+00:00,Defense
TechCrunch,https://techcrunch.com/feed/,"Copilot is ‘for entertainment purposes only,’ according to Microsoft’s terms of use",AI skeptics aren’t the only ones warning users not to unthinkingly trust models’ outputs — that’s what the AI companies say themselves in their terms of service.,https://techcrunch.com/2026/04/05/copilot-is-for-entertainment-purposes-only-according-to-microsofts-terms-of-service/,2026-04-05 18:51:37+00:00,AI
Defense News,https://www.defensenews.com/arc/outboundfeeds/rss/,US special forces rescue second F-15 airman from Iran,"The airman, the weapons officer of an F-15 jet shot down on Friday, was wounded but “will be just fine,” President Trump announced.",https://www.defensenews.com/news/your-military/2026/04/05/us-special-forces-rescue-f-15-airman-from-iran/,2026-04-05 13:40:03+00:00,Other
