source,feed_url,headline,summary,url,published_date,topics
TechCrunch,https://techcrunch.com/feed/,Indian payments chief thinks AI will be heavily involved in next era of digital payment growth,Dilip Asbe said that newer UPI apps could be more competitive with a viable commercial model,https://techcrunch.com/2026/06/27/indian-payments-chief-thinks-ai-will-be-heavily-involved-in-next-era-of-digital-payment-growth/,2026-06-28 05:00:00+00:00,Other
Nature,https://www.nature.com/subjects/medical-research.rss,High angular resolution diffusion imaging of neurodevelopment in children through data creation with deep learning,,https://www.nature.com/articles/s41598-026-60107-7,2026-06-28 00:00:00+00:00,"MedTech, AI"
Nature,https://www.nature.com/subjects/medical-research.rss,Cross-attention-based multimodal fusion for early diabetic retinopathy detection,,https://www.nature.com/articles/s41598-026-59735-w,2026-06-28 00:00:00+00:00,Other
Nature,https://www.nature.com/subjects/medical-research.rss,Clinical crown height changes in mandibular anterior teeth retained with two types of fixed retainers over two years: findings from a randomized clinical trial,,https://www.nature.com/articles/s41598-026-60081-0,2026-06-28 00:00:00+00:00,Biotech
Nature,https://www.nature.com/subjects/medical-research.rss,Indoor PM2.5 levels and self-reported health symptoms in office workers during the haze seasons in Chiang Mai Thailand,,https://www.nature.com/articles/s41598-026-59343-8,2026-06-28 00:00:00+00:00,Other
Nature,https://www.nature.com/subjects/medical-research.rss,Comparison of serum irisin and leptin levels in obese and non-obese women with polycystic ovary syndrome,,https://www.nature.com/articles/s41598-026-58075-z,2026-06-28 00:00:00+00:00,Other
Nature,https://www.nature.com/subjects/medical-research.rss,Implementation of manual perineal protection reduced OASIS incidence in first vaginal births after previous caesarean section,,https://www.nature.com/articles/s41598-026-58742-1,2026-06-28 00:00:00+00:00,Other
Nature,https://www.nature.com/subjects/medical-research.rss,Determinants of pregnancy termination among ever-married women of reproductive age in Bangladesh,,https://www.nature.com/articles/s41598-026-60301-7,2026-06-28 00:00:00+00:00,Other
Nature,https://www.nature.com/subjects/medical-research.rss,Deep learning for time-series segmentation of mechanical ventilator waveforms,,https://www.nature.com/articles/s41598-026-58565-0,2026-06-28 00:00:00+00:00,AI
Nature,https://www.nature.com/subjects/medical-research.rss,A multi-scale feature fusion network for CNV segmentation in SD-OCT images toward quantitative assessment of neovascular AMD,,https://www.nature.com/articles/s41598-026-59215-1,2026-06-28 00:00:00+00:00,Other
Nature,https://www.nature.com/subjects/medical-research.rss,"Validation of the pediatric index of mortality 3 in a pediatric intensive care unit in Thailand: a prospective, single-center observational study",,https://www.nature.com/articles/s41598-026-60199-1,2026-06-28 00:00:00+00:00,Science
Nature,https://www.nature.com/subjects/medical-research.rss,Effects of synbiotic supplementation on cardiometabolic risk factors in overweight or obese calcium oxalate stone formers: a randomized controlled trial,,https://www.nature.com/articles/s41598-026-58024-w,2026-06-28 00:00:00+00:00,Other
Nature,https://www.nature.com/subjects/medical-research.rss,Effects of concurrent transcranial direct current stimulation and robotic lower-limb training on motor recovery after stroke: a randomized sham-controlled trial,,https://www.nature.com/articles/s41598-026-60099-4,2026-06-28 00:00:00+00:00,Other
Nature,https://www.nature.com/subjects/medical-research.rss,Explainable and clinically audited hybrid self-supervised framework for multi-class DFU classification and mobile deployment,,https://www.nature.com/articles/s41598-026-55510-z,2026-06-28 00:00:00+00:00,Other
Nature,https://www.nature.com/subjects/medical-research.rss,Effect of magnesium supplementation on inflammatory factors and clinical outcomes of allogeneic hematopoietic stem cell transplantation in patients with acute leukemia receiving a neutropenic diet: a randomized clinical trial,,https://www.nature.com/articles/s41598-026-59888-8,2026-06-28 00:00:00+00:00,Biotech
Nature,https://www.nature.com/subjects/medical-research.rss,Artificial intelligence in headache care,,https://www.nature.com/articles/s41582-026-01226-7,2026-06-28 00:00:00+00:00,AI
Nature,https://www.nature.com/subjects/medical-research.rss,Comparing the effects of two occupational therapy programmes on selected indicators in women with rheumatoid arthritis: a randomised controlled trial,,https://www.nature.com/articles/s41598-026-59911-y,2026-06-28 00:00:00+00:00,Other
Phys.org,https://phys.org/rss-feed/,Female baboons keep family bonds strong: Research reveals the benefits,"Baboons are one of the most widespread of Africa's primate groups. They range across sub-Saharan Africa and into the Arabian Peninsula. Baboons' ability to spread across such a vast geographic area is based on their great ecological adaptability and dietary flexibility. This enables them to flourish in a wide variety of habitats, including deserts, swamps, open grasslands, woodlands and tropical forests.",https://phys.org/news/2026-06-female-baboons-family-bonds-strong.html,2026-06-27 23:00:01+00:00,Science
Phys.org,https://phys.org/rss-feed/,When the rapid adaptation of sales channels pays off,"Greater agility in the sales system—that is, a company's ability to rapidly adapt its sales channels to changing market conditions—is associated with higher operating profit, but only under certain conditions. That is the result of an observational, survey-based study involving 356 predominantly European companies carried out by retail and marketing experts from the University of Cologne, the École des hautes études commerciales Paris (HEC Paris), the University of Mannheim and the University of Manchester.",https://phys.org/news/2026-06-rapid-sales-channels-pays.html,2026-06-27 21:30:01+00:00,Science
TechCrunch,https://techcrunch.com/feed/,Instagram is testing more ways to customize ‘Your Algorithm’,Instagram users could soon see more ways to tune their content.,https://techcrunch.com/2026/06/27/instagram-is-testing-more-ways-for-users-to-customize-your-algorithm/,2026-06-27 21:27:37+00:00,Other
Phys.org,https://phys.org/rss-feed/,Peptide alternative to antibiotics could combat antimicrobial resistance crisis,"A University of Alberta research team has designed a promising alternative for treating antimicrobial-resistant infections, a pressing global health issue. In a paper recently published in Cell Biomaterials, the team describes preclinical testing results for its human-derived peptide treatment, D-GK17. The peptide is stable and nontoxic to humans and is synthesized to attack the surfaces of bacterial or fungal cells that create biofilms, a sticky matrix that is often impenetrable to antibiotic treatments.",https://phys.org/news/2026-06-peptide-alternative-antibiotics-combat-antimicrobial.html,2026-06-27 21:00:03+00:00,Science
TechCrunch,https://techcrunch.com/feed/,SoftBank’s CEO isn’t the only one with questions about Elon Musk’s orbital data center hype,Not everyone is buying Elon Musk’s vision for orbital data centers.,https://techcrunch.com/2026/06/27/softbanks-ceo-isnt-the-only-one-with-questions-about-elon-musks-orbital-data-center-hype/,2026-06-27 20:42:36+00:00,Other
Phys.org,https://phys.org/rss-feed/,"Burned-home soils showed uneven lead, arsenic contamination after Los Angeles wildfires","A chemical analysis of residential soils and ash around California homes burned by the Eaton and Palisades wildfires in early 2025 revealed wide variation in contamination by potentially harmful elements, including lead, according to a study published in Environmental Science and Technology Letters on May 12. The researchers made their findings available to the Los Angeles Public Health Department over the course of the study.",https://phys.org/news/2026-06-home-soils-uneven-arsenic-contamination.html,2026-06-27 20:00:05+00:00,Science
Phys.org,https://phys.org/rss-feed/,New research identifies types of dishonesty that occur in a relationship—and their consequences,"From ""harmless"" white lies to infidelity, dishonesty in romantic relationships is a complex phenomenon that takes on many forms. New research from the University of Copenhagen shows that while dishonesty between partners often fuels distrust and resentment, it may also, in some cases, help couples solve issues and repair their bond.",https://phys.org/news/2026-06-dishonesty-relationship-consequences.html,2026-06-27 20:00:02+00:00,Science
Phys.org,https://phys.org/rss-feed/,World's largest particle smasher halts for upgrade to boost hunt for dark matter,The world's most powerful particle accelerator will shutter operations Monday for four years of renovations to dramatically boost its collision capacity and the potential for unlocking one of the greatest mysteries of the universe: dark matter.,https://phys.org/news/2026-06-world-largest-particle-smasher-halts.html,2026-06-27 19:29:47+00:00,Startups
TechCrunch,https://techcrunch.com/feed/,Apple Vision Pro exec is reportedly leaving for OpenAI,"Paul Meade, the Apple vice president in charge of the Vision Pro headset, is reportedly leaving the company to join OpenAI’s hardware team.",https://techcrunch.com/2026/06/27/apple-vision-pro-exec-is-reportedly-leaving-for-openai/,2026-06-27 16:45:09+00:00,AI
TechCrunch,https://techcrunch.com/feed/,The fittest founder in the room got cancer. Here’s how he used AI to fight back.,"When confronted with cancer, Connor Christou fed everything tied tied to his regime — blood results, scan data, wearable output, journal entries — into Claude.",https://techcrunch.com/2026/06/27/the-fittest-founder-in-the-room-got-cancer-heres-how-he-used-ai-to-fight-back/,2026-06-27 14:00:00+00:00,"Startups, MedTech"
TechCrunch,https://techcrunch.com/feed/,Asian AI startups launch Mythos-like models as Anthropic’s export ban drags on,New models are launching in Asia that promise Mythos-like capabilities without fear of an export ban. U.S. AI labs may never recover this enormous market.,https://techcrunch.com/2026/06/27/asian-ai-startups-launch-mythos-like-models-as-anthropics-export-ban-drags-on/,2026-06-27 12:00:00+00:00,"AI, Startups"
