source,feed_url,headline,summary,url,published_date,topics
Phys.org,https://phys.org/rss-feed/,"Floating litter extends over Chesapeake Bay, the largest estuary in the US","A study led by researchers from the Smithsonian Institution and the UB reveals that reducing single-use plastic is essential for protecting coastal ecosystems. Floating litter has also invaded Chesapeake Bay, the largest estuary in the United States and one of the most important in the world.",https://phys.org/news/2026-06-litter-chesapeake-bay-largest-estuary.html,2026-06-17 21:00:01+00:00,Science
SpaceNews,https://spacenews.com/feed/,Relativity Space to privately develop Mars orbiter mission,Relativity Space plans to launch a Mars orbiter in 2028 as part of a new initiative to privately develop planetary missions. The post Relativity Space to privately develop Mars orbiter mission appeared first on SpaceNews .,https://spacenews.com/relativity-space-to-privately-develop-mars-orbiter-mission/,2026-06-17 20:45:04+00:00,Other
Phys.org,https://phys.org/rss-feed/,Study advocates cross-tier traceability to improve food safety,"The Hong Kong SAR imports more than 90% of its food, and it can be very difficult, when food safety incidents occur, to trace the source across a complex supply chain. Prof. Leng Mingming, dean of the Faculty of Business and chair professor of operations and risk management at Lingnan University, has published a new study proposing the introduction of a unified product tracing system across the food supply chain.",https://phys.org/news/2026-06-advocates-tier-traceability-food-safety.html,2026-06-17 20:40:04+00:00,Science
TechCrunch,https://techcrunch.com/feed/,Roelof Botha joins SpaceX’s board of directors,"The former Sequoia Capital leader is filling an ""existing vacancy"" on SpaceX's board, days after the company went public in the largest IPO ever.",https://techcrunch.com/2026/06/17/roelof-botha-joins-spacexs-board-of-directors/,2026-06-17 20:32:52+00:00,Other
Satellite Today,https://www.satellitetoday.com/feed/,Intellian Calls New Production Facility in California a ‘Defining Milestone’,"Intellian Technologies is opening a huge new manufacturing facility in the United States, with CEO Eric Sung calling it “a defining milestone” for the company. It is Intellian’s first large-scale [&#8230;] The post Intellian Calls New Production Facility in California a &#8216;Defining Milestone&#8217; appeared first on Via Satellite .",https://www.satellitetoday.com/technology/2026/06/17/intellian-calls-new-production-facility-in-california-a-defining-milestone/,2026-06-17 20:31:02+00:00,Other
TechCrunch,https://techcrunch.com/feed/,"After unveiling ridiculously expensive AR glasses, Snap’s stock takes a dive",Snap's long-awaited smart glasses debut hasn't exactly done wonders for the company's stock.,https://techcrunch.com/2026/06/17/after-unveiling-ridiculously-expensive-ar-glasses-snaps-stock-takes-a-dive/,2026-06-17 20:24:28+00:00,Other
TechCrunch,https://techcrunch.com/feed/,NEA’s Tiffany Luck says enterprises are still figuring out their AI ROI,"Tokenmaxxing&#160;was&#160;the hottest trend in Silicon Valley earlier this year, with CEOs encouraging employees to push AI usage as far&#160;as it would go.&#160;Then the bill came due. Uber&#160;reportedly blew&#160;through its annual AI budget in a few months, some companies cut Claude licenses for parts of their org, and Meta killed its internal leaderboard.&#160; This tension between [&#8230;]",https://techcrunch.com/video/neas-tiffany-luck-says-enterprises-are-still-figuring-out-their-ai-roi/,2026-06-17 20:17:38+00:00,Other
Defense News,https://www.defensenews.com/arc/outboundfeeds/rss/,Read the 14-point memorandum of understanding between the United States and Iran,The 14-point memorandum of understanding between the United States and Iran leaves contentious issues between the countries unresolved.,https://www.defensenews.com/news/pentagon-congress/2026/06/17/read-the-14-point-memorandum-of-understanding-between-the-united-states-and-iran/,2026-06-17 20:02:22+00:00,Other
Satellite Today,https://www.satellitetoday.com/feed/,Lyntris Acquires Robotics Firm Novium to Further Satellite Offerings,"Recently formed defense tech company Lyntris has made an acquisition, buying Houston-based robotics firm Novium to further its satellite offerings. Lyntis was formed last month through the merger of Vitesse [&#8230;] The post Lyntris Acquires Robotics Firm Novium to Further Satellite Offerings appeared first on Via Satellite .",https://www.satellitetoday.com/finance/2026/06/17/lyntris-acquires-robotics-firm-novium-to-further-satellite-offerings/,2026-06-17 19:56:14+00:00,Defense
Satellite Today,https://www.satellitetoday.com/feed/,Bezos Earth Fund Invests in FireSat Constellation Build-Out,Jeff Bezos’ philanthropic organization the Bezos Earth Fund is joining the investment coalition for the wildfire-monitoring FireSat constellation. Bezos Earth Fund announced a $26 million investment in the non-profit Earth [&#8230;] The post Bezos Earth Fund Invests in FireSat Constellation Build-Out appeared first on Via Satellite .,https://www.satellitetoday.com/finance/2026/06/17/bezos-earth-fund-invests-in-firesat-constellation-build-out/,2026-06-17 19:50:32+00:00,"Space, Funding"
TechCrunch,https://techcrunch.com/feed/,FTC lawsuit reveals how subscription scam networks evade app store enforcement,A new FTC lawsuit reveals how sophisticated subscription app operators can allegedly use shell companies and payment infrastructure to stay active on app stores despite mounting consumer complaints.,https://techcrunch.com/2026/06/17/ftc-lawsuit-reveals-how-subscription-scam-networks-evade-app-store-enforcement/,2026-06-17 19:46:16+00:00,Other
Satellite Today,https://www.satellitetoday.com/feed/,Thursday Morning Conversation With Tina Ghataore,"In our latest Thursday Morning Conversation, we interview a former Satellite Executive of the Year, Tina Ghataore, about what comes next. There&#8217;s a bit of breaking news in this TMC, [&#8230;] The post Thursday Morning Conversation With Tina Ghataore appeared first on Via Satellite .",https://www.satellitetoday.com/video/thursday-morning-conversations/2026/06/17/thursday-morning-conversation-with-tina-ghataore/,2026-06-17 19:43:56+00:00,Other
Satellite Today,https://www.satellitetoday.com/feed/,Gitai Delays Robotic Servicing Mission to Prioritize SBI Work,"Gitai has completed a flight model for an upcoming robotic on-orbit servicing mission, but is delaying the mission to focus on space-based interceptor (SBI) technologies after a recent U.S. Space [&#8230;] The post Gitai Delays Robotic Servicing Mission to Prioritize SBI Work appeared first on Via Satellite .",https://www.satellitetoday.com/technology/2026/06/17/gitai-delays-robotic-servicing-mission-to-prioritize-sbi-work/,2026-06-17 19:43:03+00:00,Space
SpaceNews,https://spacenews.com/feed/,Upgraded Ariane 6 launches Amazon Leo satellites,An Ariane 6 with upgraded solid rocket boosters successfully launched three dozen Amazon Leo satellites June 17 as ESA weighs options for increasing the vehicle’s launch rate. The post Upgraded Ariane 6 launches Amazon Leo satellites appeared first on SpaceNews .,https://spacenews.com/upgraded-ariane-6-launches-amazon-leo-satellites/,2026-06-17 19:13:40+00:00,Space
TechCrunch,https://techcrunch.com/feed/,World leaders want American AI. They just don’t want America to be able to turn it off.,French President Macron and Indian PM Modi raised alarms at the G7 summit that the U.S. could cut off access to American AI overnight — a fear the Anthropic blackout just made real.,https://techcrunch.com/2026/06/17/world-leaders-want-american-ai-they-just-dont-want-america-to-be-able-to-turn-it-off/,2026-06-17 19:01:19+00:00,"AI, Funding"
TechCrunch,https://techcrunch.com/feed/,Anthropic becomes first AI startup to join the Frontier carbon removal coalition,"Anthropic has joined the Frontier coalition, which received another $915M in pledges to fund carbon removal projects.",https://techcrunch.com/2026/06/17/anthropic-becomes-first-ai-startup-to-join-the-frontier-carbon-removal-coalition/,2026-06-17 18:30:56+00:00,"AI, Startups"
TechCrunch,https://techcrunch.com/feed/,Cybercriminals allegedly hacked tens of thousands of Fortinet firewalls used by major companies all over the world,An alleged Russian-speaking group of cybercriminals is reportedly compromising and targeting several major companies that use Fortinet Firewalls and VPNs through previously known passwords.,https://techcrunch.com/2026/06/17/cybercriminals-allegedly-hacked-tens-of-thousands-of-fortinet-firewalls-used-by-major-companies-all-over-the-world/,2026-06-17 18:20:06+00:00,Other
TechCrunch,https://techcrunch.com/feed/,Social media’s next evolution: user-controlled algorithms,"Social media feeds are becoming more customizable as platforms like Threads, Instagram, and TikTok introduce tools that let users directly influence the algorithms powering their recommendations.",https://techcrunch.com/2026/06/17/social-medias-next-evolution-user-controlled-algorithms/,2026-06-17 18:19:48+00:00,Other
Breaking Defense,https://breakingdefense.com/feed/,How Honeywell Aerospace plans to tap into the global CCA market,Honeywell Aerospace executive Matthew Milas lays out Honeywell&#8217;s view on CCAs as a key platform-agnostic supplier.,https://breakingdefense.com/2026/06/how-honeywell-aerospace-plans-to-tap-into-the-global-cca-market/,2026-06-17 18:12:00+00:00,Other
TechCrunch,https://techcrunch.com/feed/,World model maker Odyssey nabs $1.45B valuation backed by Amazon and other big names,"World models are the next big thing in AI beyond LLMs and, with this round, Odyssey has cemented itself as one of the startups to watch.",https://techcrunch.com/2026/06/17/world-model-maker-odyssey-nabs-1-45b-valuation-backed-by-amazon-and-other-big-names/,2026-06-17 17:43:07+00:00,"Funding, AI"
TechCrunch,https://techcrunch.com/feed/,Mastodon looks to newsletters to help revive the open social web,"Mastodon’s newly launched newsletter feature lets anyone subscribe to creators by email, even without a Mastodon account.",https://techcrunch.com/2026/06/17/mastodon-looks-to-newsletters-to-help-revive-the-open-social-web/,2026-06-17 17:38:01+00:00,Other
Defense News,https://www.defensenews.com/arc/outboundfeeds/rss/,Congress seeks to limit US Navy vessels built in foreign shipyards,The Senate Armed Services Committee seeks to strip the waiver authority granted to the president to approve offshore ship construction.,https://www.defensenews.com/news/pentagon-congress/2026/06/17/congress-seeks-to-limit-us-navy-vessels-built-in-foreign-shipyards/,2026-06-17 17:10:15+00:00,Defense
TechCrunch,https://techcrunch.com/feed/,"Only 16 percent of Americans think AI will have a positive impact on society, a new study shows","Although Wall Street loves AI, every day Americans are significantly less optimistic about the industry, a new report from Pew Research shows.",https://techcrunch.com/2026/06/17/only-16-percent-of-americans-think-ai-will-have-a-positive-impact-on-society-a-new-study-shows/,2026-06-17 17:00:01+00:00,Science
TechCrunch,https://techcrunch.com/feed/,Two Stanford grads raise $11M to build a noninvasive wearable for hormone tracking,"Clair Health will track inflammation and bloating markers, energy levels, and cycle phase classification to give insights into cycle irregularities and perimenopause, as well as hormonal fluctuations, and how to navigate those changes.",https://techcrunch.com/2026/06/17/two-stanford-grads-raise-11m-to-build-a-noninvasive-wearable-for-hormone-tracking/,2026-06-17 16:54:48+00:00,"Funding, MedTech"
Satellite Today,https://www.satellitetoday.com/feed/,DHS Promotes Latest Space Cybersecurity Research in SPARTA,"The Department of Homeland Security (DHS) Science and Technology Directorate (S&#38;T) has revealed details of the latest space cybersecurity research to help protect critical infrastructure. Through the Aerospace SPARTA framework, [&#8230;] The post DHS Promotes Latest Space Cybersecurity Research in SPARTA appeared first on Via Satellite .",https://www.satellitetoday.com/cybersecurity/2026/06/17/dhs-promotes-latest-space-cybersecurity-research-in-sparta/,2026-06-17 16:47:58+00:00,Science
TechCrunch,https://techcrunch.com/feed/,Google bets on Gemini to reinvent the smart home speaker,Google is betting generative AI can breathe new life into the smart speaker. The company's new $99.99 Google Home Speaker replaces the rigid commands of the Google Assistant era with more conversational Gemini interactions.,https://techcrunch.com/2026/06/17/google-bets-on-gemini-to-reinvent-the-smart-home-speaker/,2026-06-17 16:30:09+00:00,AI
Breaking Defense,https://breakingdefense.com/feed/,Army to release proposal requests for ISV-Heavy late this year: Official,"The service is looking to &#8220;accelerate&#8221; the delivery timeline of the ISV-Heavy, a top Army acquisition official told lawmakers.",https://breakingdefense.com/2026/06/army-to-release-proposal-requests-for-isv-heavy-late-this-year-official/,2026-06-17 16:20:49+00:00,Defense
Satellite Today,https://www.satellitetoday.com/feed/,The Space Sector Under Cyber Fire in the US-Israel-Iran War,"On February 28, the United States and Israel launched Operation Epic Fury, carrying out airstrikes against Iran alongside cyber and electronic operations. This unfolded amid renewed tensions in negotiations over [&#8230;] The post The Space Sector Under Cyber Fire in the US-Israel-Iran War appeared first on Via Satellite .",https://www.satellitetoday.com/opinion/2026/06/17/the-space-sector-under-cyber-fire-in-the-us-israel-iran-war/,2026-06-17 16:16:38+00:00,Other
EU-Startups,https://www.eu-startups.com/feed/,Warsaw’s Microamp raises €6.5 million to support European 5G and 6G network technology,"Warsaw-based Microamp, an innovator in resilient 5G mmWave wireless solutions, has been awarded €6.5 million in funding to accelerate the development of the Microamp Any-G mmWave AI-RAN Wireless Platform &#8211; a fully reconfigurable, software-defined system enabling seamless adaptation across evolving 3GPP standards, frequency bands, network modes and 6G features. The funding came from the European [&#8230;] The post Warsaw’s Microamp raises €6.5 million to support European 5G and 6G network technology appeared first on EU-Startups .",https://www.eu-startups.com/2026/06/warsaws-microamp-raises-e6-5-million-to-support-european-5g-and-6g-network-technology/,2026-06-17 16:13:17+00:00,"Funding, Startups"
TechCrunch,https://techcrunch.com/feed/,PayPal Ventures shutters as company restructuring continues,The corporate venture arm ends after 10 years and 80 investments.,https://techcrunch.com/2026/06/17/paypal-ventures-shutters-as-company-restructuring-continues/,2026-06-17 16:10:13+00:00,Startups
Breaking Defense,https://breakingdefense.com/feed/,Aselsan lands $900M deal to help Turkey build Steel Dome air defense systems,"Steel Dome, or Celik Kubbe, is a Turkish layered air defense project akin to the US Golden Dome effort, or Israel&#8217;s various layered systems.",https://breakingdefense.com/2026/06/aselsan-lands-900m-deal-to-help-turkey-build-steel-dome-air-defense-systems/,2026-06-17 15:55:00+00:00,Defense
TechCrunch,https://techcrunch.com/feed/,The slowtech revolution is here to kill your phone addiction and rescue your attention span,"“People just really want to take back control of their time, their lives, their attention... They’re down for whatever helps them do that.”",https://techcrunch.com/2026/06/17/the-slowtech-revolution-is-here-to-kill-your-phone-addiction-and-rescue-your-attention-span/,2026-06-17 15:24:41+00:00,Other
TechCrunch,https://techcrunch.com/feed/,"Collecting robot training data is dirty, unglamorous work. Some AI labs are already paying XDOF to do it.","If physical AI is going to match the accomplishments of LLMs, there's a data problem that needs to be solved.",https://techcrunch.com/2026/06/17/collecting-robot-training-data-is-dirty-unglamorous-work-some-ai-labs-are-already-paying-xdof-to-do-it/,2026-06-17 15:00:00+00:00,AI
Breaking Defense,https://breakingdefense.com/feed/,How one US Army brigade is learning to sacrifice robots in lieu of humans,"The 3rd Mobile Brigade Combat Team, 101st Airborne Division performed a successful robotic combined arms breach during a recent JRTC rotation, the brigade&#8217;s commander told Breaking Defense.",https://breakingdefense.com/2026/06/preparing-for-the-future-fight-how-one-brigade-is-sacrificing-robots-in-lieu-of-humans/,2026-06-17 14:55:33+00:00,Defense
Breaking Defense,https://breakingdefense.com/feed/,"3D printing company Divergent to produce Tomahawk structure at new factory, CEO says","“We need all hands on deck, we need as many of these as we can possibly get, and Divergent is good complimentary supply for [Raytheon],” said CEO Lukas Czinger.",https://breakingdefense.com/2026/06/3d-printing-company-divergent-to-produce-tomahawk-structure-at-new-factory-ceo-says/,2026-06-17 14:03:28+00:00,Other
Breaking Defense,https://breakingdefense.com/feed/,Goodbye INDOPACOM: Pentagon reverts back to Pacific Command,The rechristening follows a series of other name changes inside the department under Defense Secretary Pete Hegseth.,https://breakingdefense.com/2026/06/goodbye-indopacom-pentagon-reverts-back-to-pacific-command/,2026-06-17 13:52:02+00:00,Defense
EU-Startups,https://www.eu-startups.com/feed/,Ex-Palantir team behind Conduct raises €51 million to make enterprise systems AI-ready,"London-based Conduct, an AI OS that help enterprises understand, operate, and change their software systems, today announced a €51 million ($60 million) Series A to expand its engineering and go-to-market teams, deepen its SAP capabilities, and accelerate work across Salesforce, Oracle, MES, WMS, and other systems. The round was co-led by Index Ventures and ICONIQ, [&#8230;] The post Ex-Palantir team behind Conduct raises €51 million to make enterprise systems AI-ready appeared first on EU-Startups .",https://www.eu-startups.com/2026/06/ex-palantir-team-behind-conduct-raises-e51-million-to-make-enterprise-systems-ai-ready/,2026-06-17 13:21:37+00:00,"Funding, Startups"
Breaking Defense,https://breakingdefense.com/feed/,NATO Secretary General says US not ‘pulling away’ from allies,Rutte also repeated messaging around the need for NATO allies to ramp up weapons production and deliver a stronger industrial base by making “steady” increases to defense investment plans.,https://breakingdefense.com/2026/06/nato-secretary-general-says-us-not-pulling-away-from-allies/,2026-06-17 13:06:33+00:00,"Defense, Funding"
Defense News,https://www.defensenews.com/arc/outboundfeeds/rss/,"Fair winds, INDOPACOM: Pentagon returns command name to US Pacific Command","U.S. Pacific Command was the formation's official name until 2018, when it was changed to U.S. Indo-Pacific Command.",https://www.defensenews.com/news/pentagon-congress/2026/06/17/fair-winds-indopacom-pentagon-returns-command-name-to-us-pacific-command/,2026-06-17 13:01:48+00:00,Defense
Labiotech,https://www.labiotech.eu/feed/,Eight in vivo CAR T biotechs to follow closely,"We have curated a list of in vivo CAR T biotechs in preclinical and clinical stages that you should keep an eye out for. The post Eight in vivo CAR T biotechs to follow closely appeared first on Labiotech.eu . © Labiotech UG and Labiotech.eu. Unauthorized use and/or duplication of this material without express and written permission from this site’s author and/or owner is strictly prohibited. Excerpts and links may be used, provided that full and clear credit is given to Labiotech UG and Labiotech.eu with appropriate and specific direction to the original content.",https://www.labiotech.eu/best-biotech/in-vivo-car-t-companies/,2026-06-17 13:00:00+00:00,Other
SpaceNews,https://spacenews.com/feed/,"America’s next economic frontier is 240,000 miles away","Humans have always gazed up at the moon in wonder. A generation ago, NASA astronauts did the extraordinary and touched down on its surface, planting an American flag and igniting [&#8230;] The post America’s next economic frontier is 240,000 miles away appeared first on SpaceNews .",https://spacenews.com/americas-next-economic-frontier-is-240000-miles-away/,2026-06-17 13:00:00+00:00,Other
Payload Space,https://payloadspace.com/feed/,Instinct Space Unveils Plans for Low-Cost Lunar Landers,Instinct Space announced a significant pivot today from helping lunar surface missions find their way to getting in on the surface action itself. The post Instinct Space Unveils Plans for Low-Cost Lunar Landers appeared first on Payload .,https://payloadspace.com/instinct-space-unveils-plans-for-low-cost-lunar-landers/,2026-06-17 12:59:00+00:00,Space
Defense News,https://www.defensenews.com/arc/outboundfeeds/rss/,Poland weighs joining X-BAT autonomous vertical-takeoff fighter program,The announcement comes as the Polish government is mulling plans to acquire up to 32 new fighter jets.,https://www.defensenews.com/global/europe/2026/06/17/poland-weighs-joining-x-bat-autonomous-vertical-takeoff-fighter-program/,2026-06-17 12:34:54+00:00,Other
EU-Startups,https://www.eu-startups.com/feed/,Berlin-based NexDash secures €2.5 million from EIT Urban Mobility to electrify Europe’s road freight,"NexDash, a Berlin-based integrated logistics operator electrifying Europe&#8217;s road freight, has secured €2.5 million in funding from EIT Urban Mobility, an initiative of the European Institute of Innovation and Technology (EIT), a body of the European Union. The investment is a pre-Series A commitment securing EIT Urban Mobility’s Series A participation. The investment was led [&#8230;] The post Berlin-based NexDash secures €2.5 million from EIT Urban Mobility to electrify Europe’s road freight appeared first on EU-Startups .",https://www.eu-startups.com/2026/06/berlin-based-nexdash-secures-e2-5-million-from-eit-urban-mobility-to-electrify-europes-road-freight/,2026-06-17 12:31:55+00:00,"Funding, Startups"
Payload Space,https://payloadspace.com/feed/,Katalyst Raises $12M to Extend Satellite Servicing to GEO,"Katalyst’s first GEO mission in 2027 will be preceded by a mission closer to home, launching this month. The post Katalyst Raises $12M to Extend Satellite Servicing to GEO appeared first on Payload .",https://payloadspace.com/katalyst-raises-12m-to-extend-satellite-servicing-to-geo/,2026-06-17 12:22:26+00:00,"Space, Funding"
SpaceNews,https://spacenews.com/feed/,"China conducts 4 launches in 3 days, but silence follows Kuaizhou–11 launch","China continued its accelerated launch pace with a series of missions, but long silence followed liftoff of a Kuaizhou-11 solid rocket Wednesday, suggesting potential issues. The post China conducts 4 launches in 3 days, but silence follows Kuaizhou–11 launch appeared first on SpaceNews .",https://spacenews.com/china-conducts-4-launches-in-3-days-but-silence-follows-kuaizhou-11-launch/,2026-06-17 12:18:53+00:00,Other
Satellite Today,https://www.satellitetoday.com/feed/,SpaceX Launches 3 AST SpaceMobile BlueBirds in Stacked Mission,"SpaceX completed a launch for AST SpaceMobile early Wednesday morning, marking the first mission to stack three BlueBird satellites in the launch fairing. SpaceX launched the BlueBird 8, 9, 10 [&#8230;] The post SpaceX Launches 3 AST SpaceMobile BlueBirds in Stacked Mission appeared first on Via Satellite .",https://www.satellitetoday.com/launch/2026/06/17/spacex-launches-3-ast-spacemobile-bluebirds-in-stacked-mission/,2026-06-17 12:17:30+00:00,Space
MIT Technology Review,https://www.technologyreview.com/feed/,The Download: a reality check for geoengineering and the science of interoception,"This is today&#8217;s edition of The Download, our weekday newsletter that provides a daily dose of what&#8217;s going on in the world of technology. Hacking the atmosphere: geoengineering gets a reality check Solar geoengineering, the controversial idea that we could deliberately intervene in the climate system to counteract global warming, is moving beyond computer simulations&#8230;",https://www.technologyreview.com/2026/06/17/1139200/the-download-solar-geoengineering-interoception/,2026-06-17 12:10:00+00:00,Other
Science,https://www.science.org/rss/news_current.xml,A space telescope is falling to Earth. NASA is racing to rescue it,Vehicle will attempt a daring capture-and-boost mission to extend the life of the Swift observatory,https://www.science.org/content/article/space-telescope-falling-earth-nasa-racing-rescue-it,2026-06-17 12:00:00+00:00,Other
SpaceNews,https://spacenews.com/feed/,Dawn Aerospace raises $25 million,Dawn Aerospace has raised $25 million to scale up its work in both in-space transportation and suborbital spaceplanes. The post Dawn Aerospace raises $25 million appeared first on SpaceNews .,https://spacenews.com/dawn-aerospace-raises-25-million/,2026-06-17 11:29:32+00:00,Funding
SpaceNews,https://spacenews.com/feed/,Look Up and Skynopy partner on automated satellite collision avoidance service,"Space surveillance venture Look Up plans to use Skynopy’s ground station network to help automate its proposed low Earth orbit collision avoidance service, the French startups announced June 17. The post Look Up and Skynopy partner on automated satellite collision avoidance service appeared first on SpaceNews .",https://spacenews.com/look-up-and-skynopy-partner-on-automated-satellite-collision-avoidance-service/,2026-06-17 11:23:13+00:00,"Space, Startups"
