source,feed_url,headline,summary,url,published_date,topics
Phys.org,https://phys.org/rss-feed/,Cell 'snowball' may be answer to large-scale tissue engineering,"Cell cultures—single layers of cells grown in a small dish—have enabled researchers to study biological growth, develop or test drugs and even discover what causes some diseases. Cell spheroids, 3D versions of cell cultures built using a process known as cell aggregation, are the next step in advancing this work, capable of more closely modeling real tissue. A new technology, invented by researchers from Penn State and detailed in a paper published in Advanced Science, could breathe fresh air into bottom-up tissue fabrication and potentially large-scale tissue engineering by addressing these issues.",https://phys.org/news/2026-04-cell-snowball-large-scale-tissue.html,2026-04-06 21:30:01+00:00,Science
Defense News,https://www.defensenews.com/arc/outboundfeeds/rss/,Israel to sell PULS systems to Greece for $750 million,The deal between the two countries includes dozens of launchers and rockets.,https://www.defensenews.com/global/mideast-africa/2026/04/06/israel-to-sell-puls-systems-to-greece-for-750-million/,2026-04-06 21:21:55+00:00,Other
Phys.org,https://phys.org/rss-feed/,"New plan aims to track microplastics in U.S. drinking water, EPA says","U.S. officials are taking a closer look at what's in America's drinking water, including microplastics and leftover medications.",https://phys.org/news/2026-04-aims-track-microplastics-epa.html,2026-04-06 21:20:04+00:00,Other
Phys.org,https://phys.org/rss-feed/,'Switch' behind flash drought in Puerto Rico uncovered,"In Puerto Rico, drought doesn't always arrive slowly. Sometimes, it appears in days. That speed can leave producers scrambling, reservoirs dropping, and communities facing water restrictions before they can react. In a place often associated with heavy rain and hurricanes, drought is often overlooked, but very much a reality. New research from Virginia Tech is helping explain why.",https://phys.org/news/2026-04-drought-puerto-rico-uncovered.html,2026-04-06 21:20:01+00:00,Science
TechCrunch,https://techcrunch.com/feed/,Gas prices aren’t the only factor fueling used EV sales,The most recent electric vehicle sales data provided a grim picture — at least for new EVs. Used EVs are moving in the opposite direction.,https://techcrunch.com/2026/04/06/gas-prices-arent-the-only-factor-fueling-used-ev-sales/,2026-04-06 21:15:09+00:00,Other
Phys.org,https://phys.org/rss-feed/,Stitching precise patterns—with lasers,"Just as embroiderers, with needle and thread, can transform plain fabric into an intricate pattern, engineers can use lasers and polymers to create flexible, complex structures that could transform life-saving sensing technology. An interdisciplinary team at the University of Pittsburgh's Swanson School of Engineering has developed a new manufacturing strategy that reveals where and how laser-induced graphene (LIG) forms on polymers.",https://phys.org/news/2026-04-precise-patterns-lasers.html,2026-04-06 21:10:01+00:00,Other
Phys.org,https://phys.org/rss-feed/,"More dives, fewer reef sharks: Caribbean study links tourism pressure to shark sightings","Reef sharks are observed less frequently on Caribbean reefs that have high levels of diving activity and greater coastal development, according to new research published in the Journal of Applied Ecology. Even recreational activities that are often considered low impact are associated with fewer sharks on these reefs. Reef sharks play an important role in maintaining healthy reefs by helping to keep the ecosystem in balance.",https://phys.org/news/2026-04-reef-sharks-caribbean-links-tourism.html,2026-04-06 21:00:03+00:00,Science
Phys.org,https://phys.org/rss-feed/,"Body size, lifespan and mobility can help predict which species are most threatened as planet changes",How can we predict species' responses to always-arising changes in our world? A long-term ecological study from Yokohama National University researchers suggests the answer may lie in a few small simple biological traits. Their findings offer a framework for better anticipating biodiversity change and improving proactive conservation strategies. The results were published in Nature Communications on March 14.,https://phys.org/news/2026-04-body-size-lifespan-mobility-species.html,2026-04-06 20:50:01+00:00,Science
Phys.org,https://phys.org/rss-feed/,Parasitic tapeworm—a risk to domestic dogs and humans—found in Washington coyotes,"New evidence suggests that a disease-causing tapeworm that has been spreading across the United States and Canada has arrived in the Pacific Northwest. The tapeworm, called Echinococcus multilocularis, lives as a parasite in coyotes, foxes and other canid species and can cause severe disease if passed to domestic dogs or humans.",https://phys.org/news/2026-04-parasitic-tapeworm-domestic-dogs-humans.html,2026-04-06 20:40:01+00:00,Other
Satellite Today,https://www.satellitetoday.com/feed/,Artemis II Crew Travels Farther from Earth Than Apollo 13 in a New Record,"The Artemis II crew has now officially traveled farther from Earth than any previous human mission. On Monday afternoon at approximately 1:56 p.m. EDT,, the crew surpassed the Apollo 13... The post Artemis II Crew Travels Farther from Earth Than Apollo 13 in a New Record appeared first on Via Satellite .",https://www.satellitetoday.com/government-military/2026/04/06/artemis-ii-crew-travels-farther-from-earth-than-apollo-13-in-a-new-record/,2026-04-06 20:33:04+00:00,Other
Satellite Today,https://www.satellitetoday.com/feed/,"Trump 2027 Budget Request Targets Cuts for NASA, Boost for Golden Dome","The White House released its fiscal 2027 budget proposal on Friday, which called for a “historic increase” in defense spending and fully funding the Golden Dome missile defense initiative, while... The post Trump 2027 Budget Request Targets Cuts for NASA, Boost for Golden Dome appeared first on Via Satellite .",https://www.satellitetoday.com/government-military/2026/04/06/trump-2027-budget-request-targets-cuts-for-nasa-boost-for-golden-dome/,2026-04-06 20:08:45+00:00,"Defense, Funding"
Satellite Today,https://www.satellitetoday.com/feed/,"How Iceye Satellites Track Russian Vessels, Illegal Shipping in the Arctic","On a dark, clouded night, a Russian ballistic missile submarine departs a naval base in the Arctic. A small vessel navigates the Mediterranean Sea at 15 miles per hour. A... The post How Iceye Satellites Track Russian Vessels, Illegal Shipping in the Arctic appeared first on Via Satellite .",https://www.satellitetoday.com/imagery-and-sensing/2026/04/06/how-iceye-satellites-track-russian-vessels-illegal-shipping-in-the-arctic/,2026-04-06 20:04:13+00:00,"Space, Defense"
Satellite Today,https://www.satellitetoday.com/feed/,L3Harris and Comtech Release Multi-Orbit Tactical Satcom Modem,"L3Harris and Comtech have recently released a new multi-orbit, tactical satcom embeddable modem, which works with certain L3Harris terminals. The partners said the new C2 modem announced March 31 will... The post L3Harris and Comtech Release Multi-Orbit Tactical Satcom Modem appeared first on Via Satellite .",https://www.satellitetoday.com/government-military/2026/04/06/l3harris-and-comtech-release-multi-orbit-tactical-satcom-modem/,2026-04-06 20:02:07+00:00,Space
Breaking Defense,https://breakingdefense.com/feed/,Greece inks $750M deal with Israel for Elbit’s PULS Rocket Artillery Systems,Greece and Israel have become increasingly close partners in the Eastern Mediterranean in recent years.,https://breakingdefense.com/2026/04/greece-inks-750m-deal-with-israel-for-elbits-puls-rocket-artillery-systems/,2026-04-06 19:44:41+00:00,Defense
SpaceNews,https://spacenews.com/feed/,Moog Highlights Growing Satellite Bus Capabilities with Full‑Scale METEOR Reveal at Space Symposium,"East Aurora, NY &#8212; Moog Inc. (NYSE: MOG.A and MOG.B), a worldwide designer, manufacturer and systems integrator of high-performance precision motion and fluid controls and control systems will highlight its [&#8230;] The post Moog Highlights Growing Satellite Bus Capabilities with Full‑Scale METEOR Reveal at Space Symposium appeared first on SpaceNews .",https://spacenews.com/moog-highlights-growing-satellite-bus-capabilities-with-full-scale-meteor-reveal-at-space-symposium/,2026-04-06 19:19:49+00:00,Other
Breaking Defense,https://breakingdefense.com/feed/,Army’s Scarlet Dragon exercise adds commercial data to battlefield data flows,"“We&#8217;ve had to iterate and figure out what worked, what didn&#8217;t work, different pathways, different APIs, different cross domain solutions, to find out okay, this is the best one, this is more reliable one, okay, let&#8217;s turn the spigot on full blast to see what we get,&#8221; Chief Warrant Officer 4 Sean Benson told Breaking Defense.",https://breakingdefense.com/2026/04/armys-scarlet-dragon-exercise-adds-commercial-data-to-battlefield-data-flows/,2026-04-06 19:12:19+00:00,Defense
SpaceNews,https://spacenews.com/feed/,FOSSA targets Japan’s defense market as larger smallsats expand capabilities,"Spanish startup FOSSA Systems is pushing into Japan’s defense market after securing a local partner to expand its reach, building on a shift beyond tiny picosatellites used to connect low-power monitoring devices toward more capable spacecraft for broader government applications. The post FOSSA targets Japan’s defense market as larger smallsats expand capabilities appeared first on SpaceNews .",https://spacenews.com/fossa-targets-japans-defense-market-as-larger-smallsats-expand-capabilities/,2026-04-06 18:57:46+00:00,"Defense, Startups"
TechCrunch,https://techcrunch.com/feed/,Google quietly launched an AI dictation app that works offline,Google's new offline-first dictation app uses Gemma AI models to take on the apps like Wispr Flow.,https://techcrunch.com/2026/04/06/google-quietly-releases-an-offline-first-ai-dictation-app-on-ios/,2026-04-06 18:54:33+00:00,Other
Breaking Defense,https://breakingdefense.com/feed/,DIU wants ‘moving map’ to help aircrews with situational awareness,"A new prototype platform sought by the Pentagon’s Defense Innovation Unit could significantly boost situational awareness for users like mobility aircrews, whose decades-old aircraft often lack modern communications equipment.",https://breakingdefense.com/2026/04/diu-wants-moving-map-to-help-aircrews-with-situational-awareness/,2026-04-06 18:28:53+00:00,Defense
TechCrunch,https://techcrunch.com/feed/,Netflix is expanding into kids’ games with a new stand-alone app,"Netflix says the app gives children access to an ""ever-growing"" library of games for kids.",https://techcrunch.com/2026/04/06/netflix-launches-a-standalone-app-for-kids-games/,2026-04-06 18:21:49+00:00,Other
TechCrunch,https://techcrunch.com/feed/,Why safety regulators closed their investigation into Tesla’s remote parking feature,"The NHTSA closed its investigation into Tesla's ""Actually Smart Summon"" feature, saying that only a fraction of cases resulted in an incident and that no incidents resulted in injury. Tesla has also issued a number of software updates.",https://techcrunch.com/2026/04/06/tesla-actually-smart-summon-nhtsa-investigation-smart-parking/,2026-04-06 18:17:23+00:00,Other
War on the Rocks,https://warontherocks.com/feed/,Reopening the Strait of Hormuz & Saving Downed Pilots,"Two retired U.S. admirals with deep experience at sea and in the air joined Ryan to discuss the military challenge of reopening the Strait of Hormuz. Adm. (ret.) Jamie Foggo and Vice Adm. (ret.) John &#8220;Fozzie&#8221; Miller unpack how Iran has been able to throttle one of the world&#8217;s most important waterways and what it would actually take to restore freedom of navigation. The conversation explores mines, drones, missiles, escorts, air strikes, how a Marine expeditionary unit might raid Kharg Island, and (of course) the strategy. Hours before this was recorded, news had broken that a U.S. Air Force F15E The post Reopening the Strait of Hormuz &#038; Saving Downed Pilots appeared first on War on the Rocks .",https://warontherocks.com/2026/04/reopening-the-strait-of-hormuz-saving-downed-pilots/,2026-04-06 18:12:05+00:00,Defense
TechCrunch,https://techcrunch.com/feed/,Iran threatens ‘Stargate’ AI data centers,"Iran said it will target U.S.-linked data centers with new missile strikes, as the war between the U.S. and Iran escalates.",https://techcrunch.com/2026/04/06/iran-threatens-stargate-ai-data-centers/,2026-04-06 18:06:28+00:00,Defense
TechCrunch,https://techcrunch.com/feed/,Apple moves to take its App Store fight back to the Supreme Court,"Apple plans to ask the Supreme Court to review its App Store fight with Epic Games, as it challenges a ruling limiting its ability to charge fees on external payments.",https://techcrunch.com/2026/04/06/apple-epic-games-lawsuit-supreme-court-appeal-app-store-commission/,2026-04-06 17:38:05+00:00,Other
TechCrunch,https://techcrunch.com/feed/,Watch this video of how a job interviewer exposes a North Korean fake IT worker,An apparent North Korean worker was caught visibly stumped during a remote job interview when asked to insult the country's leader.,https://techcrunch.com/2026/04/06/watch-this-video-of-how-a-job-interviewer-exposes-a-north-korean-fake-it-worker/,2026-04-06 17:00:25+00:00,Other
TechCrunch,https://techcrunch.com/feed/,North Korea’s hijack of one of the web’s most used open source projects was likely weeks in the making,North Korean hackers pushed out malicious updates to a popular open source project by hacking a top developer's computer in a long-running campaign.,https://techcrunch.com/2026/04/06/north-koreas-hijack-of-one-of-the-webs-most-used-open-source-projects-was-likely-weeks-in-the-making/,2026-04-06 16:43:25+00:00,Other
MIT Technology Review,https://www.technologyreview.com/feed/,The one piece of data that could actually shed light on your job and AI,"This story originally appeared in The Algorithm, our weekly newsletter on AI. To get stories like this in your inbox first, sign up here. Within Silicon Valley’s orbit, an AI-fueled jobs apocalypse is spoken about as a given. The mood is so grim that a societal impacts researcher at Anthropic, responding Wednesday to a call for&#8230;",https://www.technologyreview.com/2026/04/06/1135187/the-one-piece-of-data-that-could-actually-shed-light-on-your-job-and-ai/,2026-04-06 16:33:35+00:00,AI
TechCrunch,https://techcrunch.com/feed/,"OpenAI’s vision for the AI economy: public wealth funds, robot taxes, and a four-day workweek","OpenAI proposes taxes on AI profits, public wealth funds, and expanded safety nets to address job loss and inequality, blending redistribution with capitalism as policymakers debate AI’s economic impact.",https://techcrunch.com/2026/04/06/openais-vision-for-the-ai-economy-public-wealth-funds-robot-taxes-and-a-four-day-work-week/,2026-04-06 15:55:55+00:00,AI
War on the Rocks,https://warontherocks.com/feed/,Are Perceptions the Reality?,"Welcome to&#160;The Ukraine Compass, a weekly digest of Ukrainian commentary and analysis from across the political spectrum only for&#160;War on the Rocks&#160;members. Each Monday, we bring you a curated selection of articles from Ukrainian media offering insight into how Ukrainians themselves debate the issues shaping their country.American coverage often narrows the view to the battlefield &#8212; these pieces widen it, revealing the texture of daily life, politics, and public argument in a nation at war. The perspectives gathered here are varied, candid, and often surprising, together forming a more complete picture of Ukraine as it really is.Frontline and Strategy&#1062;&#1077;&#1085;&#1079;&#1086;&#1088;.&#1053;&#1045;&#1058; &#8212; The post Are Perceptions the Reality? appeared first on War on the Rocks .",https://warontherocks.com/2026/04/are-perceptions-the-reality/,2026-04-06 15:30:46+00:00,Defense
TechCrunch,https://techcrunch.com/feed/,"Startup Battlefield 200 applications open: a chance for VC access, TechCrunch coverage, and $100K","Nominate your startup, or one you know that deserves the spotlight, and finish the process by applying. Selected 200 have a chance at VC access, TechCrunch coverage, and $100K for Startup Battlefield 200. Applications close on May 27.",https://techcrunch.com/2026/04/06/startup-battlefield-200-applications-open-get-vc-access-techcrunch-coverage-and-100k/,2026-04-06 14:30:00+00:00,"Startups, Defense"
TechCrunch,https://techcrunch.com/feed/,"How to use the new ChatGPT app integrations, including DoorDash, Spotify, Uber, and others","Learn how to use Spotify, Canva, Figma, Expedia, and other apps directly in ChatGPT.",https://techcrunch.com/2026/04/06/how-to-use-chatgpt-apps-doordash-spotify-uber/,2026-04-06 14:11:42+00:00,Other
TechCrunch,https://techcrunch.com/feed/,Ticket savings of up to $500 this week for TechCrunch Disrupt 2026,"Starting today, you have 5 days to save nearly $500 on your ticket to TechCrunch Disrupt 2026. This offer disappears Friday, April 10, at 11:59 p.m. PT. Register here to secure these low rates.",https://techcrunch.com/2026/04/06/massive-ticket-savings-of-up-to-500-this-week-for-techcrunch-disrupt-2026/,2026-04-06 14:00:00+00:00,Other
Defense News,https://www.defensenews.com/arc/outboundfeeds/rss/,Ukraine missile maker targets ‘game changer’ air defense system by 2027,"Fire Point, maker of Ukraine’s Flamingo cruise missile, is in talks with European companies to launch a new air defense system by next year.",https://www.defensenews.com/industry/techwatch/2026/04/06/ukraine-missile-maker-targets-game-changer-air-defense-system-by-2027/,2026-04-06 13:55:57+00:00,Defense
Breaking Defense,https://breakingdefense.com/feed/,Will private capital and disruption reshape the defense industrial base?,"Private capital is pouring into defense firms, but unless the relevant stakeholders align, the surge may fail to produce proper returns, according to two op-ed authors.",https://breakingdefense.com/2026/04/will-private-capital-and-disruption-reshape-the-defense-industrial-base/,2026-04-06 13:53:20+00:00,Defense
Defense News,https://www.defensenews.com/arc/outboundfeeds/rss/,"US Army wants new grenade launcher, ammunition to be able to destroy drones","The Army is calling for prototype submissions that include 16 weapons, fire controls systems and around 25,000 rounds of ammunition.",https://www.defensenews.com/industry/techwatch/2026/04/06/us-army-wants-new-grenade-launcher-ammunition-to-be-able-to-destroy-drones/,2026-04-06 13:38:21+00:00,Defense
TechCrunch,https://techcrunch.com/feed/,Convicted spyware maker Bryan Fleming avoids jail at sentencing,The pcTattletale founder escapes a custodial sentence following the first successful prosecution of a spyware maker in the U.S. in over a decade.,https://techcrunch.com/2026/04/06/convicted-spyware-maker-bryan-fleming-avoids-jail-at-sentencing/,2026-04-06 13:03:04+00:00,Startups
SpaceNews,https://spacenews.com/feed/,"The moon base has a hardware plan. It needs a software strategy, too.","Early in my career at SpaceX, I was the only person dedicated to training the mission control team for Dragon. For three years, I built the training for the operations team. The documentation came second, always the thing I&#8217;d get to later, always the thing that felt like overhead against the actual work of getting [&#8230;] The post The moon base has a hardware plan. It needs a software strategy, too. appeared first on SpaceNews .",https://spacenews.com/the-moon-base-has-a-hardware-plan-it-needs-a-software-strategy-too/,2026-04-06 13:00:00+00:00,Other
TechCrunch,https://techcrunch.com/feed/,Spain’s Xoople raises $130 million Series B to map the Earth for AI,The company is also announcing a deal with L3Harris to build the sensors for Xoople's spacecraft.,https://techcrunch.com/2026/04/06/spains-xoople-raises-130-million-series-b-to-map-the-earth-for-ai/,2026-04-06 13:00:00+00:00,Funding
Payload Space,https://payloadspace.com/feed/,The State of Satcom 2026,"With SpaceX and Amazon storming into the satcom market, traditional players and startups alike are realizing they can’t compete directly with these growing giants—and are pivoting to find creative new ways to play in the crowded market. The post The State of Satcom 2026 appeared first on Payload .",https://payloadspace.com/the-state-of-satcom-2026/,2026-04-06 12:45:00+00:00,Startups
Payload Space,https://payloadspace.com/feed/,Artemis II Supplier Series: Orion’s Windows,"For astronauts who put in decades of work and training, getting to see space with their own eyes is a big part of the payoff. The post Artemis II Supplier Series: Orion&#8217;s Windows appeared first on Payload .",https://payloadspace.com/artemis-ii-supplier-series-orions-windows/,2026-04-06 12:30:00+00:00,Other
SpaceNews,https://spacenews.com/feed/,Seagate Space Signs MOU with Firefly Aerospace to Collaborate on Offshore Launch Infrastructure for Alpha,"St. Petersburg, FL — April 6, 2026&#160;— Seagate Space Corporation announced today a Memorandum of Understanding (MOU) with Firefly Aerospace to collaborate on the development of an offshore launch platform [&#8230;] The post Seagate Space Signs MOU with Firefly Aerospace to Collaborate on Offshore Launch Infrastructure for Alpha appeared first on SpaceNews .",https://spacenews.com/seagate-space-signs-mou-with-firefly-aerospace-to-collaborate-on-offshore-launch-infrastructure-for-alpha/,2026-04-06 12:15:00+00:00,Other
SpaceNews,https://spacenews.com/feed/,Military space programs confront hidden supply constraints,Industry report warns components – from optical links to valves – may become chokepoints The post Military space programs confront hidden supply constraints appeared first on SpaceNews .,https://spacenews.com/military-space-confronts-hidden-supplier-constraints/,2026-04-06 11:30:00+00:00,Defense
SpaceNews,https://spacenews.com/feed/,Artemis 2 ready to fly around the moon,"The Artemis 2 mission will swing around the moon April 6, setting a distance record as astronauts study part of the lunar farside. The post Artemis 2 ready to fly around the moon appeared first on SpaceNews .",https://spacenews.com/artemis-2-ready-to-fly-around-the-moon/,2026-04-06 11:21:26+00:00,Science
MIT Technology Review,https://www.technologyreview.com/feed/,AI is changing how small online sellers decide what to make,"For years Mike McClary sold the Guardian LTE Flashlight, a heavy-duty black model, online through his small outdoor brand. The product, designed for brightness and durability, became one of his most popular items ever. Even after he stopped offering it around 2017, customers kept sending him emails asking where they could buy it.&#160; When McClary&#8230;",https://www.technologyreview.com/2026/04/06/1135118/ai-online-seller-alibaba-accio/,2026-04-06 11:00:00+00:00,Other
Science,https://www.science.org/rss/news_current.xml,AIs can ‘memorize’ data they shouldn’t. Can they be forced to forget?,New tool could help researchers probe how models “unlearn” sensitive training material,https://www.science.org/content/article/ais-can-memorize-data-they-shouldn-t-can-they-be-forced-forget,2026-04-06 08:00:00+00:00,Science
War on the Rocks,https://warontherocks.com/feed/,The Age of Unlearning: How Democracies Lost Their Grip on Strategic Time,"The past several years have produced a quiet but consequential shift in how the United States understands, and fails to understand, time. American strategy has gradually weakened through bureaucratic cuts, institutional downgrades, and political incentives that privilege immediacy over endurance and partisanship over long-term statecraft. The temporary elimination of the Pentagon&#8217;s Office of Net Assessment last year is particularly emblematic. Established during the Cold War, the Office was designed to provide the Department of Defense with independent, long-term comparative assessments of U.S. and adversary military capabilities. On paper, its dismantling was framed as an exercise in streamlining. In practice, it The post The Age of Unlearning: How Democracies Lost Their Grip on Strategic Time appeared first on War on the Rocks .",https://warontherocks.com/2026/04/the-age-of-unlearning-how-democracies-lost-their-grip-on-strategic-time/,2026-04-06 07:30:35+00:00,"Defense, Science"
War on the Rocks,https://warontherocks.com/feed/,Sharpening Signals and Reducing Noise for Better Defense Budgets,"Editor&#8217;s note: This article is the fifth in an 11-part series examining how the United States should organize, lead, and integrate economic statecraft into strategy, defense practice, and the broader national security ecosystem. This special series is brought to you by the Potomac Institute for Policy Studies&#160;and&#160;War on the Rocks. Prior installments can be found at the&#160;War by Other Ledgers&#160;page.&#160;Debates over defense budgets and economic statecraft are not a distraction from warfighting. They reflect a basic reality: Military power does not exist in isolation. It is built, sustained, and ultimately limited by America&#8217;s economic capacity and the system that translates The post Sharpening Signals and Reducing Noise for Better Defense Budgets appeared first on War on the Rocks .",https://warontherocks.com/2026/04/sharpening-signals-and-reducing-noise-for-better-defense-budgets/,2026-04-06 07:15:02+00:00,Defense
TechCrunch,https://techcrunch.com/feed/,Xiaomi 17 Ultra pushes smartphone photography even further,"The Xiaomi 17 Ultra gives you a ton of options to play around with images, including preset filters and hardware add-ons.",https://techcrunch.com/2026/04/06/xiaomi-17-ultra-review-camera-leica-specs-photography-kit-pro/,2026-04-06 07:00:00+00:00,Other
