source,feed_url,headline,summary,url,published_date,topics
TechCrunch,https://techcrunch.com/feed/,"Finally, texts between Android and iPhone users can be end-to-end encrypted",Google had urged Apple for years to support RCS texting to make communication between each company's devices more seamless.,https://techcrunch.com/2026/05/11/finally-texts-between-android-and-iphone-users-can-be-end-to-end-encrypted/,2026-05-11 21:59:34+00:00,Other
Phys.org,https://phys.org/rss-feed/,Climate patterns may shape where violent conflict risks are amplified,"A new Rice University study is shedding light on a long-debated question: Can climate variability influence the risk of armed conflict? The answer, researchers say, is yes—but in more nuanced and region-specific ways than previously understood.",https://phys.org/news/2026-05-climate-patterns-violent-conflict-amplified.html,2026-05-11 21:50:01+00:00,Science
Phys.org,https://phys.org/rss-feed/,"Relaxing rules on carbon markets would undermine climate action, scientists warn","Researchers have cautioned that well-intended suggested changes to carbon markets risk worsening climate impacts if core safeguards are weakened. Climate change, biodiversity loss and human rights are deeply interconnected challenges, often sharing solutions that can deliver shared benefits.",https://phys.org/news/2026-05-carbon-undermine-climate-action-scientists.html,2026-05-11 21:40:04+00:00,Science
Phys.org,https://phys.org/rss-feed/,How carbon dioxide cools the upper atmosphere—and warms Earth below,"Even as temperatures rise on Earth's surface and in the lower atmosphere, the planet's upper atmosphere has cooled dramatically. This paradoxical pattern is a well-known sign of humanity's climate impacts—but until now, the underlying physics has remained a mystery.",https://phys.org/news/2026-05-carbon-dioxide-cools-upper-atmosphere.html,2026-05-11 21:40:01+00:00,Other
Phys.org,https://phys.org/rss-feed/,Inland seas may face widespread heat waves by midcentury as warming accelerates,"Under the lead of the Leibniz Institute for Baltic Sea Research Warnemünde (IOW), climate simulations were used to investigate how 19 inland seas, including the Baltic Sea, are responding to climate change. The researchers found that they have been warming faster than the global ocean since the 2000s. Projections show that marine heat waves will affect around 60% of these seas on an average annual basis as early as the middle of the 21st century. Without adherence to the Paris Agreement targets, up to 90% of these seas would be affected by heat waves. The study contributes to climate change management practices and was published in the journal Communications Earth & Environment.",https://phys.org/news/2026-05-inland-seas-widespread-midcentury.html,2026-05-11 21:30:01+00:00,Science
Satellite Today,https://www.satellitetoday.com/feed/,Space42 Enhances D2D Prospects with Skylo Partnership,"Space42 has made a significant move in the direct-to-device (D2D) arena, partnering with Skylo Technologies to deliver standards-based D2D connectivity through its Thuraya-4 geostationary (GEO) satellite. Space42 announced Monday that [&#8230;] The post Space42 Enhances D2D Prospects with Skylo Partnership appeared first on Via Satellite .",https://www.satellitetoday.com/connectivity/2026/05/11/space42-enhances-d2d-prospects-with-skylo-partnership/,2026-05-11 21:28:57+00:00,Other
Phys.org,https://phys.org/rss-feed/,Can plants hear? Latest research offers new insights,"Researchers at MIT have suggested that rice seeds can hear the sound of rain, according to a new study. MIT calls it ""the first direct evidence that plant seeds and seedlings can sense sounds in nature."" Perhaps surprisingly, the effects reported in this new study are not as radical as they may appear.",https://phys.org/news/2026-05-latest-insights.html,2026-05-11 21:20:07+00:00,Science
Phys.org,https://phys.org/rss-feed/,Shark face study uncovers 400-million-year-old blueprint shared across jawed vertebrates,"Most of what scientists know about face development comes from studies in bony vertebrates such as mice, chickens, and zebrafish. However, their evolutionary counterparts, cartilaginous fishes, have remained largely unexplored. This gap has limited our understanding of how facial structures evolved at the origin of jawed vertebrates.",https://phys.org/news/2026-05-shark-uncovers-million-year-blueprint.html,2026-05-11 21:20:06+00:00,Science
Breaking Defense,https://breakingdefense.com/feed/,SOCOM to test SkyFi satellite imagery-to-tablet prototype,SkyFi&#8217;s Sovereign Intelligence Platform for US Special Operations Command is designed to allow commanders in the field to task a commercial satellite for near-real time imagery.,https://breakingdefense.com/2026/05/socom-to-test-skyfi-satellite-imagery-to-tablet-prototype/,2026-05-11 21:19:29+00:00,Other
Satellite Today,https://www.satellitetoday.com/feed/,Vitesse Systems and Accelint Become Part of New Defense Tech Company Lyntris,"Vitesse Systems has combined with Accelint to form a new defense tech company called Lyntris, focused on the connected battlefield. Both companies have been under the ownership of Trive Capital [&#8230;] The post Vitesse Systems and Accelint Become Part of New Defense Tech Company Lyntris appeared first on Via Satellite .",https://www.satellitetoday.com/government-military/2026/05/11/vitesse-systems-and-accelint-become-part-of-new-defense-tech-company-lyntris/,2026-05-11 20:23:18+00:00,Defense
Satellite Today,https://www.satellitetoday.com/feed/,Hughes Posts Decline in Broadband Subscribers and Service Revenue in Q1 2026,"Hughes Network Systems continues to report lower satellite broadband subscribers, citing competition from satellite competitors and other technologies. Hughes reported broadband subscribers on Monday as part of EchoStar’s first quarter [&#8230;] The post Hughes Posts Decline in Broadband Subscribers and Service Revenue in Q1 2026 appeared first on Via Satellite .",https://www.satellitetoday.com/finance/2026/05/11/hughes-posts-decline-in-broadband-subscribers-and-service-revenue-in-q1-2026/,2026-05-11 20:15:48+00:00,Other
Satellite Today,https://www.satellitetoday.com/feed/,"Aetherflux Rebrands as Cowboy Space, Expanding Plans to In-Orbit Compute and Launch","Aetherflux, the company started by former Robinhood co-founder Baiju Bhatt, has rebranded as Cowboy Space and expanded its focus to orbital data centers and associated launch infrastructure. Cowboy Space announced [&#8230;] The post Aetherflux Rebrands as Cowboy Space, Expanding Plans to In-Orbit Compute and Launch appeared first on Via Satellite .",https://www.satellitetoday.com/finance/2026/05/11/aetherflux-rebrands-as-cowboy-space-expanding-plans-to-in-orbit-compute-and-launch/,2026-05-11 20:11:47+00:00,"Space, Startups"
Breaking Defense,https://breakingdefense.com/feed/,"Saab launches new Carl-Gustaf, air defense munitions, expands production in US, India",The Swedish defense firm has revealed new warheads and provided details on delivery timelines from its new production sites outside Europe.,https://breakingdefense.com/2026/05/saab-launches-new-carl-gustaf-air-defense-munitions-expands-production-in-us-india/,2026-05-11 18:55:05+00:00,Defense
Breaking Defense,https://breakingdefense.com/feed/,"Navy unveils three new PAEs for aviation, mission systems, munitions","“The establishment of these PAEs today will accelerate acquisition efforts in three key portfolios,” said Jason Potter, who is performing the duties of assistant secretary of the Navy for research and development.",https://breakingdefense.com/2026/05/navy-unveils-three-new-paes-for-aviation-mission-systems-munitions/,2026-05-11 17:42:20+00:00,"Defense, Science"
TechCrunch,https://techcrunch.com/feed/,Daniel Ek-backed defense tech Helsing to raise $1.2B at $18B valuation,Five-year old European military drone startup Helsing is close to raising another monster round.,https://techcrunch.com/2026/05/11/daniel-ek-backed-defense-tech-helsing-to-raise-1-2b-at-18b-valuation/,2026-05-11 17:38:32+00:00,"Defense, Funding"
War on the Rocks,https://warontherocks.com/feed/,Sensationalism Doesn’t Serve Society,"Welcome to&#160;The Ukraine Compass, a weekly digest of Ukrainian commentary and analysis from across the political spectrum only for&#160;War on the Rocks&#160;members. Each Monday, we bring you a curated selection of articles from Ukrainian media offering insight into how Ukrainians themselves debate the issues shaping their country.American coverage often narrows the view to the battlefield &#8212; these pieces widen it, revealing the texture of daily life, politics, and public argument in a nation at war. The perspectives gathered here are varied, candid, and often surprising, together forming a more complete picture of Ukraine as it really is.Frontline and Strategy&#1054;&#1073;&#1086;&#1079;&#1088;&#1077;&#1074;&#1072;&#1090;&#1077;&#1083;&#1100; &#8212; The post Sensationalism Doesn&#8217;t Serve Society appeared first on War on the Rocks .",https://warontherocks.com/sensationalism-doesnt-serve-society/,2026-05-11 17:35:25+00:00,Defense
MIT Technology Review,https://www.technologyreview.com/feed/,"Three things in AI to watch, according to a Nobel-winning economist","This story originally appeared in The Algorithm, our weekly newsletter on AI. To get stories like this in your inbox first, sign up here. A few months before he was awarded the Nobel Prize in economics in 2024, Daron Acemoglu published a paper that earned him few fans in Silicon Valley. Contrary to what Big Tech&#8230;",https://www.technologyreview.com/2026/05/11/1137090/three-things-in-ai-to-watch-according-to-a-nobel-winning-economist/,2026-05-11 17:35:12+00:00,Science
Defense News,https://www.defensenews.com/arc/outboundfeeds/rss/,5 US bases selected for anti-drone pilot program,Two military installations along the southern border are among the five that will receive anti-drone energy systems.,https://www.defensenews.com/industry/techwatch/2026/05/11/5-us-bases-selected-for-anti-drone-pilot-program/,2026-05-11 17:25:18+00:00,Defense
Breaking Defense,https://breakingdefense.com/feed/,"Turkey’s STM debuts new unmanned systems, is ‘really open’ to Gulf collaboration","“We are already using artificial intelligence, image processing, machine learning and things like that. But we are also going more deep and deep in those areas,” the company’s general manager told Breaking Defense.",https://breakingdefense.com/2026/05/turkeys-stm-debuts-new-unmanned-systems-is-really-open-to-gulf-collaboration/,2026-05-11 17:24:30+00:00,"AI, Defense"
TechCrunch,https://techcrunch.com/feed/,Bravo is creating unscripted microdramas for the Peacock app,"As microdrama apps like ReelShort and DramaBox quietly rake in billions, Peacock announced on Monday that it is launching two unscripted Bravo microdramas, which will stream in the Peacock app.",https://techcrunch.com/2026/05/11/bravo-is-creating-unscripted-microdramas-for-the-peacock-app/,2026-05-11 17:14:01+00:00,Other
TechCrunch,https://techcrunch.com/feed/,"Digg tries again, this time as an AI news aggregator","In an email to beta testers, the company said the site's goal is to ""track the most influential voices in a space"" and to surface the news that's actually worth ""paying attention to.""",https://techcrunch.com/2026/05/11/digg-tries-again-this-time-as-an-ai-news-aggregator/,2026-05-11 17:02:35+00:00,Other
Breaking Defense,https://breakingdefense.com/feed/,Taiwan’s parliament passes pared-back supplementary defense budget,"The approved supplemental budget is much lower than the NT$1.25 trillion proposed by the Lai administration, with the funding going towards two separate US arms packages for Taiwan.",https://breakingdefense.com/2026/05/taiwans-parliament-passes-pared-back-supplementary-defense-budget/,2026-05-11 16:34:58+00:00,"Defense, Funding"
TechCrunch,https://techcrunch.com/feed/,"‘Too early’ to talk IPO, Redwood Materials’ incoming CFO says","The battery-recycling and energy-storage company has hired former Tesla finance chief Deepak Ahuja, reuniting him with former Tesla CTO JB Straubel.",https://techcrunch.com/2026/05/11/too-early-to-talk-ipo-for-redwood-materials-incoming-cfo-says/,2026-05-11 16:00:00+00:00,Other
EU-Startups,https://www.eu-startups.com/feed/,Nscale extends funding momentum with €670 million for Norway AI infrastructure project,"London&#8217;s AI infrastructure hyperscaler titan Nscale has announced an additional €670 million ($790 million) in financing to reinforce the continued development of the AI data centre in Narvik, Norway; reportedly the largest AI infrastructure project in the country. The financing was committed by ABN AMRO, DNB, Eksfin, Nordea and SEB. The committed financing includes an [&#8230;] The post Nscale extends funding momentum with €670 million for Norway AI infrastructure project appeared first on EU-Startups .",https://www.eu-startups.com/2026/05/nscale-extends-funding-momentum-with-e670-million-for-norway-ai-infrastructure-project/,2026-05-11 15:35:14+00:00,"Funding, Startups"
Defense News,https://www.defensenews.com/arc/outboundfeeds/rss/,Ukraine and Russia fight on despite US-mediated ceasefire,Russia and Ukraine reported fighting along their front line despite agreeing to a ceasefire from May 9 to May 11 as part of a Trump-led push for peace.,https://www.defensenews.com/news/pentagon-congress/2026/05/11/ukraine-and-russia-fight-on-despite-us-mediated-ceasefire/,2026-05-11 15:22:54+00:00,Other
Defense News,https://www.defensenews.com/arc/outboundfeeds/rss/,Canada eyes Turkey as a fellow mid-power ally in weapons development,"Canada looks for lessons in Turkey's effort to nurse a homegrown industrial ecosystem for making vital defense equipment, a senior Canadian official said.",https://www.defensenews.com/global/europe/2026/05/11/canada-eyes-turkey-as-a-fellow-mid-power-ally-in-weapons-development/,2026-05-11 15:13:06+00:00,Defense
EU-Startups,https://www.eu-startups.com/feed/,‘Ever Wondered’ if startups need better stories? Ex-BBC and Daily Mail tech journalists launch AI-era comms firm,"London-based Ever Wondered, a journalist-led strategic communications advisory firm, has launched today to help startups, scale-ups, VC funds and corporates cut through across traditional media, owned channels, LinkedIn, and AI search. Founded in 2026 by Sam Shead, formerly Tech &#38; Innovation Editor at LinkedIn News and a tech journalist at the BBC, CNBC and Business [&#8230;] The post &#8216;Ever Wondered&#8217; if startups need better stories? Ex-BBC and Daily Mail tech journalists launch AI-era comms firm appeared first on EU-Startups .",https://www.eu-startups.com/2026/05/ever-wondered-if-startups-need-better-stories-ex-bbc-and-daily-mail-tech-journalists-launch-ai-era-comms-firm/,2026-05-11 14:24:44+00:00,Startups
TechCrunch,https://techcrunch.com/feed/,NYT’s Wordle to become a TV game show,"This will be the first time that The Times has collaborated with a TV broadcaster for an entertainment-based program, representing yet another pivot in the media company's attempt to build a sustainable digital subscription business as print revenue continues to decline.",https://techcrunch.com/2026/05/11/nyts-wordle-to-become-a-tv-game-show/,2026-05-11 14:23:25+00:00,Other
Defense News,https://www.defensenews.com/arc/outboundfeeds/rss/,Epic Fury has Navy rethinking carrier deployment tempo,The record-breaking deployment of the USS Gerald R. Ford has reopened the debate about how the Navy should structure deployments and time at home.,https://www.defensenews.com/news/your-navy/2026/05/11/epic-fury-has-navy-rethinking-carrier-deployment-tempo/,2026-05-11 14:21:13+00:00,Defense
TechCrunch,https://techcrunch.com/feed/,TikTok launches an ad-free subscription plan in the UK,"Users who sign up for the plan won’t see ads on TikTok, and their data won’t be used for advertising purposes.",https://techcrunch.com/2026/05/11/tiktok-launches-an-ad-free-subscription-plan-in-the-uk/,2026-05-11 14:05:47+00:00,Other
EU-Startups,https://www.eu-startups.com/feed/,London’s Fifth Dimension raises €22 million to scale AI-powered decision intelligence for real assets,"Fifth Dimension, a London-based startup offering decision intelligence for real-assets investors and managers, has raised €22 million ($26 million) in a Series A round. The round was led by HV Capital, with participation from Prudence, Mercia, MMC and AFG, and continued support from Speedinvest, Seedcamp, and Anthemis. The company’s total funding now exceeds €33.9 million [&#8230;] The post London’s Fifth Dimension raises €22 million to scale AI-powered decision intelligence for real assets appeared first on EU-Startups .",https://www.eu-startups.com/2026/05/londons-fifth-dimension-raises-e22-million-to-scale-ai-powered-decision-intelligence-for-real-assets/,2026-05-11 13:47:36+00:00,"Funding, Startups"
Defense News,https://www.defensenews.com/arc/outboundfeeds/rss/,Remains of missing soldier found off the coast of Morocco,"The remains of a U.S. soldier reported missing in Southern Morocco last week have been recovered, the Army said in a statement Sunday.",https://www.defensenews.com/news/your-military/2026/05/11/remains-of-missing-soldier-found-off-the-coast-of-morocco/,2026-05-11 13:39:31+00:00,Defense
MIT Technology Review,https://www.technologyreview.com/feed/,Fostering breakthrough AI innovation through customer-back engineering,"Despite years of digitization, organizations capture less than one-third of the value expected from digital investments, according to McKinsey research. That’s because most big companies begin with technological capabilities and bolt applications onto them, rather than starting with customer needs and working backward to technology solutions. Not prioritizing the customer can create fragmented solutions; disjointed&#8230;",https://www.technologyreview.com/2026/05/11/1136967/fostering-breakthrough-ai-innovation-through-customer-back-engineering/,2026-05-11 13:33:06+00:00,Science
EU-Startups,https://www.eu-startups.com/feed/,Meet AlterEcho: The winner of the EU-Startups Summit 2026 Pitch Competition!,"And that’s a wrap! The 2026 edition of the EU-Startups Summit has officially come to a close. Over two action-packed days in Malta, and about 2,400 founders, investors, and startup enthusiasts came together to exchange ideas, find inspiration, and make meaningful connections. A huge thank you to everyone who joined us in sunny Malta – [&#8230;] The post Meet AlterEcho: The winner of the EU-Startups Summit 2026 Pitch Competition! appeared first on EU-Startups .",https://www.eu-startups.com/2026/05/meet-alterecho-the-winner-of-the-eu-startups-summit-2026-pitch-competition/,2026-05-11 13:10:38+00:00,"Startups, Funding"
TechCrunch,https://techcrunch.com/feed/,There aren’t enough rockets for space data centers — Cowboy Space raised $275M to build them,"The apparently insatiable demand for AI compute has data center entrepreneurs looking to the stars. There's a key problem: There aren't enough rockets to put data centers in orbit around Earth, and they're too expensive.",https://techcrunch.com/2026/05/11/there-arent-enough-rockets-for-space-data-centers-cowboy-space-raised-275-million-to-build-them/,2026-05-11 13:00:00+00:00,Funding
MIT Technology Review,https://www.technologyreview.com/feed/,Implementing advanced AI technologies in finance,"In finance departments that have long been defined by precision and control, AI has arrived less as a neatly managed upgrade than as a quiet insurgency. Employees are already using it while leadership races to impose structure, governance, and strategy after the fact. The result is a paradox: one of the most tightly regulated functions&#8230;",https://www.technologyreview.com/2026/05/11/1136786/implementing-advanced-ai-technologies-in-finance/,2026-05-11 13:00:00+00:00,Other
Payload Space,https://payloadspace.com/feed/,"Aetherflux Rebrands, Pivots Business—and Raises $275M","To better align with its new business, Aetherflux is rebranding to Cowboy Space Corporation. The post Aetherflux Rebrands, Pivots Business—and Raises $275M appeared first on Payload .",https://payloadspace.com/aetherflux-rebrands-pivots-business-and-raises-275m/,2026-05-11 13:00:00+00:00,Funding
TechCrunch,https://techcrunch.com/feed/,"Discord launches Nitro Rewards, giving subscribers access to the base tier of Xbox Game Pass for no extra cost","Discord's Nitro Rewards program will give Nitro subscribers access to Xbox Game Pass and discounts from Logitech, SteelSeries, and other gaming brands.",https://techcrunch.com/2026/05/11/discord-launches-nitro-rewards-giving-subscribers-access-to-the-base-tier-of-xbox-game-pass-for-no-extra-cost/,2026-05-11 13:00:00+00:00,Other
Payload Space,https://payloadspace.com/feed/,SOCOM Taps SkyFi to Build Tactical EO Imagery Tools,"SkyFi will develop an early prototype of a new sovereign intelligence platform, aimed at giving troops quicker and easier access to geospatial imagery. The post SOCOM Taps SkyFi to Build Tactical EO Imagery Tools appeared first on Payload .",https://payloadspace.com/socom-taps-skyfi-to-build-tactical-eo-imagery-tools/,2026-05-11 13:00:00+00:00,Other
MIT Technology Review,https://www.technologyreview.com/feed/,Innovation abounds in device charging,"The changes may be less perceptible than in smartphones, tablets, or wearables, but chargers have also been quietly reinvented over the last decade. At one time a bulky mix of tangled cables and connectors, slow to perform and prone to overheating, they’re now smaller, safer, and faster, thanks to a slew of technological advances. These&#8230;",https://www.technologyreview.com/2026/05/11/1136406/innovation-abounds-in-device-charging/,2026-05-11 13:00:00+00:00,Other
Labiotech,https://www.labiotech.eu/feed/,Inside CSL’s strategy to simplify a biotech giant,"Delve into the Australian biotech giant CSL's strategy to refocus a company built on complex modalities. The post Inside CSL’s strategy to simplify a biotech giant appeared first on Labiotech.eu . © Labiotech UG and Labiotech.eu. Unauthorized use and/or duplication of this material without express and written permission from this site’s author and/or owner is strictly prohibited. Excerpts and links may be used, provided that full and clear credit is given to Labiotech UG and Labiotech.eu with appropriate and specific direction to the original content.",https://www.labiotech.eu/top-pharma-strategy/csl-strategy/,2026-05-11 12:53:00+00:00,Biotech
Breaking Defense,https://breakingdefense.com/feed/,Raytheon awarded SeaRAM contract for Australian frigates,The contract covers the three Aussie frigates that will be built in Japan.,https://breakingdefense.com/2026/05/raytheon-awarded-searam-contract-for-australian-frigates/,2026-05-11 12:25:05+00:00,Other
MIT Technology Review,https://www.technologyreview.com/feed/,The Download: the hantavirus outbreak and Musk v. Altman week 2,"This is today&#8217;s edition of The Download, our weekday newsletter that provides a daily dose of what&#8217;s going on in the world of technology. Here’s what you need to know about the cruise ship hantavirus outbreak Last week, eight passengers aboard a Dutch-flagged cruise ship contracted a type of hantavirus transmitted by rats. Three have&#8230;",https://www.technologyreview.com/2026/05/11/1137031/the-download-hantavirus-outbreak-musk-altman-trial/,2026-05-11 12:10:00+00:00,Other
TechCrunch,https://techcrunch.com/feed/,Venmo’s biggest makeover in years comes at a very interesting time,"The timing is notable. PayPal, which owns Venmo, is restructuring to spin Venmo off as a stand-alone business unit — a move widely seen as laying the groundwork for a potential sale. Stripe has reportedly expressed interest in buying PayPal outright.",https://techcrunch.com/2026/05/11/venmos-biggest-makeover-in-years-comes-at-a-very-interesting-time/,2026-05-11 12:00:00+00:00,Other
TechCrunch,https://techcrunch.com/feed/,"Korea’s biggest manufacturers back Config, the TSMC of robot data","Instead of building robots themselves, the team is focused on a simpler goal — providing data that robots need to learn and operate. They believe that better data will be key to making robots more useful.",https://techcrunch.com/2026/05/11/koreas-biggest-manufacturers-back-config-the-tsmc-of-robot-data/,2026-05-11 10:58:00+00:00,Other
Defense News,https://www.defensenews.com/arc/outboundfeeds/rss/,Ukrainian drone strike on empty Baltic fuel depot prompts top-level resignation – in Latvia,"A Ukrainian official said Russia is spoofing Ukraine's drones, diverting them to strike nearby Baltic nations instead of targets in Russia.",https://www.defensenews.com/global/europe/2026/05/11/ukrainian-drone-strike-on-empty-baltic-fuel-depot-prompts-top-level-resignation-in-latvia/,2026-05-11 10:32:34+00:00,Defense
EU-Startups,https://www.eu-startups.com/feed/,Quantum software startup Algorithmiq raises €18 million and moves global HQ from Helsinki to Milan,"Algorithmiq, a quantum software company, has raised €18 million in funding and moved its global headquarters from Helsinki to Milan. The round was led by United Ventures and Italian institutional investor CDP Venture Capital, with continued participation from Inventure VC. This funding round brings Algorithmiq’s total funding to €36 million. The company claims this represents [&#8230;] The post Quantum software startup Algorithmiq raises €18 million and moves global HQ from Helsinki to Milan appeared first on EU-Startups .",https://www.eu-startups.com/2026/05/quantum-software-startup-algorithmiq-raises-e18-million-and-moves-global-hq-from-helsinki-to-milan/,2026-05-11 10:08:23+00:00,"Funding, Startups"
