source,feed_url,headline,summary,url,published_date,topics
SpaceNews,https://spacenews.com/feed/,Zenno Astronautics to relocate to the United States,"SAN FRANCISCO – Zenno Astronautics, a New Zealand startup focused on applying superconducting magnets for spacecraft attitude control and acceleration, plans to redomicile to the United States. “It is obvious [&#8230;] The post Zenno Astronautics to relocate to the United States appeared first on SpaceNews .",https://spacenews.com/zenno-astronautics-to-relocate-to-the-united-states/,2026-07-21 22:11:49+00:00,Startups
Satellite Today,https://www.satellitetoday.com/feed/,SpaceX Launches Northrop Grumman’s First Mission Robotic Vehicle,Northrop Grumman’s next-generation space vehicle for on-orbit refueling and satellite life extension is on its way to orbit after a SpaceX launch on Tuesday. SpaceX launched the MRV-MEP mission on [&#8230;] The post SpaceX Launches Northrop Grumman&#8217;s First Mission Robotic Vehicle appeared first on Via Satellite .,https://www.satellitetoday.com/launch/2026/07/21/spacex-launches-northrop-grummans-first-mission-robotic-vehicle/,2026-07-21 21:35:01+00:00,Space
SpaceNews,https://spacenews.com/feed/,SpaceX launches Northrop mission to extend the life of aging satellites,DARPA-backed vehicle will install propulsion pods on three commercial satellites in geostationary orbit The post SpaceX launches Northrop mission to extend the life of aging satellites appeared first on SpaceNews .,https://spacenews.com/spacex-launches-northrop-mission-to-extend-the-life-of-aging-satellites/,2026-07-21 21:26:50+00:00,Space
Breaking Defense,https://breakingdefense.com/feed/,"GCAP officially expands, and other news from day 2 at Farnborough",Plus we talk about why the Commerce Department sent representatives to the air show.,https://breakingdefense.com/2026/07/gcap-officially-expands-and-other-news-from-day-2-at-farnborough/,2026-07-21 20:55:00+00:00,Other
Satellite Today,https://www.satellitetoday.com/feed/,Arianespace Sets Date for Fourth Ariane 6 Launch This Year,"Arianespace has revealed details on what will be its fourth Ariane 6 launch this year. On August 27, it will look to launch the second Meteosat Third Generation Imager satellite, MTG-I2, [&#8230;] The post Arianespace Sets Date for Fourth Ariane 6 Launch This Year appeared first on Via Satellite .",https://www.satellitetoday.com/launch/2026/07/21/arianespace-sets-date-for-fourth-ariane-6-launch-this-year/,2026-07-21 20:48:11+00:00,Other
Satellite Today,https://www.satellitetoday.com/feed/,Poland Commits Nearly $750M to Europe’s IRIS² Constellation,"Poland has committed 656 million euro ($748 million) to Europe’s IRIS² constellation, which will fund nearly 10% of the constellation. Under the agreement signed Tuesday in Warsaw, Poland will fund [&#8230;] The post Poland Commits Nearly $750M to Europe’s IRIS² Constellation appeared first on Via Satellite .",https://www.satellitetoday.com/government-military/2026/07/21/poland-commits-nearly-750m-to-europes-iris%c2%b2-constellation/,2026-07-21 20:02:57+00:00,Space
SpaceNews,https://spacenews.com/feed/,Northrop adds to charges on Vulcan solid rocket motor program,Northrop Grumman took another charge for the solid rocket boosters it provides for the Vulcan Centaur and suggested updated motors might not be ready until the end of the year. The post Northrop adds to charges on Vulcan solid rocket motor program appeared first on SpaceNews .,https://spacenews.com/northrop-adds-to-charges-on-vulcan-solid-rocket-motor-program/,2026-07-21 19:40:51+00:00,Other
SpaceNews,https://spacenews.com/feed/,Commercial Space Federation (CSF) Welcomes Three New Associate Members,"Washington, D.C.— July 21, 2026 —The Commercial Space Federation (CSF) is pleased to welcome Overview Energy,&#160; Loft Orbital, and Star Catcher as new associate members — companies advancing space-based energy, [&#8230;] The post Commercial Space Federation (CSF) Welcomes Three New Associate Members appeared first on SpaceNews .",https://spacenews.com/commercial-space-federation-csf-welcomes-three-new-associate-members/,2026-07-21 19:00:00+00:00,Other
War on the Rocks,https://warontherocks.com/feed/,How Ukraine Put Russia on the Backfoot,"Ukraine&#8217;s expanding use of drones at all ranges has changed the war&#8217;s momentum. This episode examines how Kyiv is reaching deeper into Russian territory, disrupting operations and logistics as well as energy infrastructure. How is Russia adapting (or not)? Can these strikes produce lasting advantages on the battlefield? Will this force Russia to escalate? Mike Kofman and Dara Massicot join Ryan to discuss.This episode is brought to you by Booz Allen. Learn more at&#160;warontherocks.com/boozallen.Image: ArmyInform The post How Ukraine Put Russia on the Backfoot appeared first on War on the Rocks .",https://warontherocks.com/how-ukraine-put-russia-on-the-backfoot/,2026-07-21 18:43:04+00:00,Defense
Payload Space,https://payloadspace.com/feed/,FCC Eyes Wi-Fi and Bluetooth Bands for Satellites,The FCC announced that it will consider a proposal to allow unlicensed wireless devices to communicate directly with satellites. The post FCC Eyes Wi-Fi and Bluetooth Bands for Satellites appeared first on Payload .,https://payloadspace.com/fcc-eyes-wi-fi-and-bluetooth-bands-for-satellites/,2026-07-21 17:45:00+00:00,Space
War on the Rocks,https://warontherocks.com/feed/,How the War with Iran is Shaping Key U.S. Relations Beyond the Middle East,"The&#160;U.S. war with Iran has had political, economic, and military implications that spread far beyond the Middle East. We asked five experts to assess how the war with Iran has affected U.S. bilateral relations with key countries that illustrate some of the global ramifications: South Korea, India, Ukraine, France, and the United Kingdom.Read more below.&#160;&#160;Jenny Town Senior Fellow at the Stimson Center and the Director of 38 NorthSouth Korea has resisted aiding U.S. military operations to forcefully reopen the Strait of Hormuz, pledging other forms of political and logistical support instead. This has, at times, drawn&#160;harsh criticism&#160;from President&#160;Donald&#160;Trump. It has&#160;also The post How the War with Iran is Shaping Key U.S. Relations Beyond the Middle East appeared first on War on the Rocks .",https://warontherocks.com/how-the-war-with-iran-is-shaping-key-u-s-relations-beyond-the-middle-east/,2026-07-21 17:30:04+00:00,Defense
Defense News,https://www.defensenews.com/arc/outboundfeeds/rss/,New British prime minister gains early defense win with Canada fighter jet tie-up,"Canada has joined the GCAP fighter program as an observer, marking the first expansion beyond the founding members Britain, Italy and Japan.",https://www.defensenews.com/global/europe/2026/07/21/new-british-prime-minister-gains-early-defense-win-with-canada-fighter-jet-tie-up/,2026-07-21 16:45:09+00:00,Defense
Defense News,https://www.defensenews.com/arc/outboundfeeds/rss/,Iran warns Bulgaria against aiding US military operations,Iran’s foreign ministry spokesman warned Bulgaria on Tuesday against allowing the U.S. to use its territory for military operations against Iran.,https://www.defensenews.com/news/pentagon-congress/2026/07/21/iran-warns-bulgaria-against-aiding-us-military-operations/,2026-07-21 16:43:44+00:00,Defense
Defense News,https://www.defensenews.com/arc/outboundfeeds/rss/,"Boeing on track for 2028 Air Force One delivery, costs rise","Boeing remains on track to deliver two new Air Force One jets in 2028, but meeting that target will require additional spending.",https://www.defensenews.com/air/2026/07/21/boeing-on-track-for-2028-air-force-one-delivery-costs-rise/,2026-07-21 16:07:00+00:00,Defense
Defense News,https://www.defensenews.com/arc/outboundfeeds/rss/,Hanwha Philly Shipyard awarded $2 billion to build 2 missile-tracking vessels,The Hanwha Philly Shipyard was awarded $2 billion to build the missile-tracking vessels set to replace the aging Pacific Tracker and Pacific Collector.,https://www.defensenews.com/pentagon/2026/07/21/hanwha-philly-shipyard-awarded-2-billion-to-build-2-missile-tracking-vessels/,2026-07-21 15:14:41+00:00,Defense
EU-Startups,https://www.eu-startups.com/feed/,New Unicorn! Humanoid secures €133 million at €1.1 billion valuation to scale industrial robotics and physical AI,"Humanoid, an AI and robotics company building industrial humanoid robots, today announced a €133 million ($152 million) Series A financing at a €1.1 billion ($1.35 billion) post-money valuation &#8211; cementing its position as Europe&#8217;s newest unicorn. This funding brings the total amount raised to date to €236 million ($270 million). The round was led by [&#8230;] The post New Unicorn! Humanoid secures €133 million at €1.1 billion valuation to scale industrial robotics and physical AI appeared first on EU-Startups .",https://www.eu-startups.com/2026/07/new-unicorn-humanoid-secures-e133-million-at-e1-1-billion-valuation-to-scale-industrial-robotics-and-physical-ai/,2026-07-21 14:30:23+00:00,"Funding, Startups"
Defense News,https://www.defensenews.com/arc/outboundfeeds/rss/,Germany to study French cooperation offer on SAMP/T air-defense system,German government leaders will study an offer by French President Emmanuel Macron to cooperate on the French-Italian SAMP/T air defense system.,https://www.defensenews.com/global/europe/2026/07/21/germany-to-study-french-cooperation-offer-on-sampt-air-defense-system/,2026-07-21 13:51:34+00:00,"Defense, Science"
Defense News,https://www.defensenews.com/arc/outboundfeeds/rss/,How startups are reshaping the Pentagon’s drone industry,Experts say the Drone Dominance competition reflects a broader shift in how the Pentagon acquires military technology and cultivates defense startups.,https://www.defensenews.com/news/your-military/2026/07/21/how-startups-are-reshaping-the-pentagons-drone-industry/,2026-07-21 13:41:59+00:00,"Defense, Startups"
Defense News,https://www.defensenews.com/arc/outboundfeeds/rss/,Pentagon identifies soldier killed in controlled detonation of Iranian drone,"Sgt. Michael Emmanuel Swinton, 30, was killed Saturday during the controlled detonation of unexploded ordnance from a downed Iranian one-way attack drone.",https://www.defensenews.com/news/your-military/2026/07/21/pentagon-identifies-soldier-killed-in-controlled-detonation-of-iranian-drone/,2026-07-21 13:13:51+00:00,Defense
Labiotech,https://www.labiotech.eu/feed/,Roche’s new gene sequencer on the market: where do current players stand?,"Roche's AXELIOS 1 enters next generation DNA sequencing. Can it or rivals unseat Illumina's long-standing market dominance? The post Roche’s new gene sequencer on the market: where do current players stand? appeared first on Labiotech.eu . © Labiotech UG and Labiotech.eu. Unauthorized use and/or duplication of this material without express and written permission from this site’s author and/or owner is strictly prohibited. Excerpts and links may be used, provided that full and clear credit is given to Labiotech UG and Labiotech.eu with appropriate and specific direction to the original content.",https://www.labiotech.eu/in-depth/next-generation-dna-sequencing-market/,2026-07-21 13:00:00+00:00,Other
Payload Space,https://payloadspace.com/feed/,deltaVision Raises €10.2M to Build In-Orbit Refueling Tech,"deltaVision plans to use the new capital to fund two parallel expansion efforts: grow its manufacturing capacity, and research new capabilities. The post deltaVision Raises €10.2M to Build In-Orbit Refueling Tech appeared first on Payload .",https://payloadspace.com/deltavision-raises-e10-2m-to-build-in-orbit-refueling-tech/,2026-07-21 12:51:00+00:00,"Space, Funding"
Payload Space,https://payloadspace.com/feed/,UK Commits £62M into Domestic Space Capabilities,The UK government announced £62M ($83.3M) in new funds Monday to develop domestic satcom and space technologies. The post UK Commits £62M into Domestic Space Capabilities appeared first on Payload .,https://payloadspace.com/uk-commits-62m-into-domestic-space-capabilities/,2026-07-21 12:50:00+00:00,Other
Defense News,https://www.defensenews.com/arc/outboundfeeds/rss/,"Russia may use captured Ukrainian drones against Poland and Baltics, Warsaw warns","Russia has captured a large number of Ukrainian drones and may be planning to use them against NATO or to stage a false flag attack, Polish officials said.",https://www.defensenews.com/global/europe/2026/07/21/russia-may-use-captured-ukrainian-drones-against-poland-and-baltics-warsaw-warns/,2026-07-21 12:49:52+00:00,Defense
Science,https://www.science.org/rss/news_current.xml,Earth’s core may be far cooler than scientists thought,New measurements could help explain how the planet’s magnetic dynamo churned for billions of years,https://www.science.org/content/article/earth-s-core-may-be-far-cooler-scientists-thought,2026-07-21 12:30:00+00:00,Science
MIT Technology Review,https://www.technologyreview.com/feed/,"The Download: Chinese AI divides the White House, and a record copyright payout","This is today&#8217;s edition of The Download, our weekday newsletter that provides a daily dose of what&#8217;s going on in the world of technology. China’s AI models have Trump’s AI world at war with itself Last weekend, several current and former advisers to President Donald Trump on AI publicly lobbed insults at the country’s leading&#8230;",https://www.technologyreview.com/2026/07/21/1140685/the-download-chinese-ai-divides-white-house-anthropic-copyright-settlement/,2026-07-21 12:10:00+00:00,Other
SpaceNews,https://spacenews.com/feed/,"UK and Florida commit $400,000 to joint space projects","The British government and the Space Florida aerospace finance and development authority have each committed $200,000 to support joint research, innovation and commercialization projects. The post UK and Florida commit $400,000 to joint space projects appeared first on SpaceNews .",https://spacenews.com/uk-and-florida-commit-400000-to-joint-space-projects/,2026-07-21 12:00:00+00:00,Science
SpaceNews,https://spacenews.com/feed/,German component supplier deltaVision raises 10.2 million euros,"German spacecraft component developer deltaVision has raised 10.2 million euros ($11.6 million) to expand production of valves and related equipment, with a focus on enabling in-space refueling. The post German component supplier deltaVision raises 10.2 million euros appeared first on SpaceNews .",https://spacenews.com/german-component-supplier-deltavision-raises-10-2-million-euros/,2026-07-21 11:57:21+00:00,Funding
C4ISRNET,https://www.c4isrnet.com/arc/outboundfeeds/rss/,US Marine Corps turns to AI-powered Bullfrog as drone threats expand,Allen Control Systems announced Monday that the Marine Corps has chosen the Bullfrog autonomous weapon system to integrate into its airborne defenses.,https://www.c4isrnet.com/news/your-military/2026/07/21/us-marine-corps-turns-to-ai-powered-bullfrog-as-drone-threats-expand/,2026-07-21 11:30:00+00:00,Defense
SpaceNews,https://spacenews.com/feed/,Agile Space Industries Appoints new CTO and Board member,"Durango, Co – July 21, 2026 &#8211; Agile Space Industries today announced the appointment of Jake Mills as Chief Technology Officer (CTO) and Mark Pasquale as an independent member of [&#8230;] The post Agile Space Industries Appoints new CTO and Board member appeared first on SpaceNews .",https://spacenews.com/agile-space-industries-appoints-new-cto-and-board-member/,2026-07-21 11:00:00+00:00,Other
Defense News,https://www.defensenews.com/arc/outboundfeeds/rss/,"X-Bow out to tackle cost quandary with sub-$100,000 drone interceptor",X-Bow Systems is launching what it hopes will be a remedy to the ongoing conundrum of combating cheap drones with multimillion dollar interceptors.,https://www.defensenews.com/industry/techwatch/2026/07/21/x-bow-out-to-tackle-cost-quandary-with-sub-100000-drone-interceptor/,2026-07-21 10:56:33+00:00,Defense
MIT Technology Review,https://www.technologyreview.com/feed/,Advancing next-gen AI with materials science innovation,"The conversation about AI often centers on algorithms, computing power, or huge investments in new semiconductor fabrication plants and hyperscale data centers. But beneath each of these advances is another layer of innovation that makes them possible: advanced materials. Every new generation of AI technology demands more processing power, more memory, greater energy efficiency, and&#8230;",https://www.technologyreview.com/2026/07/21/1140602/advancing-next-gen-ai-with-materials-science-innovation/,2026-07-21 10:37:34+00:00,Other
SpaceNews,https://spacenews.com/feed/,KBR organizes defense technology business to pursue Golden Dome work,"Company points to digital engineering, space tracking and missile-defense experience The post KBR organizes defense technology business to pursue Golden Dome work appeared first on SpaceNews .",https://spacenews.com/kbr-organizes-defense-technology-business-to-pursue-golden-dome-work/,2026-07-21 10:00:00+00:00,Defense
Defense News,https://www.defensenews.com/arc/outboundfeeds/rss/,From depot to detonation: The case for a unified logistics picture,"""We have the technology for that comprehensive, near real-time common operating picture (COP), we just need to link it,"" writes LMI's Robert Yon.",https://www.defensenews.com/opinion/2026/07/21/from-depot-to-detonation-the-case-for-a-unified-logistics-picture/,2026-07-21 08:47:26+00:00,Other
