source,feed_url,headline,summary,url,published_date,topics
Satellite Today,https://www.satellitetoday.com/feed/,Rocket Lab Launches Responsive Victus Haze Mission for Space Force,"Rocket lab launched a responsive space mission for the U.S. Space Force on Friday from New Zealand, as part of the Tactically Responsive Space (TacRS) Victus Haze mission. Space Systems [&#8230;] The post Rocket Lab Launches Responsive Victus Haze Mission for Space Force appeared first on Via Satellite .",https://www.satellitetoday.com/government-military/2026/06/22/rocket-lab-launches-responsive-victus-haze-mission-for-space-force/,2026-06-22 21:29:56+00:00,Space
SpaceNews,https://spacenews.com/feed/,Rocket Lab launches satellite for U.S. Space Force Victus Haze responsive space exercise,The mission pairs Rocket Lab spacecraft with a True Anomaly vehicle in orbit to demonstrate rapid threat characterization and rendezvous operations The post Rocket Lab launches satellite for U.S. Space Force Victus Haze responsive space exercise appeared first on SpaceNews .,https://spacenews.com/rocket-lab-launches-satellite-for-u-s-space-force-victus-haze-responsive-space-exercise/,2026-06-22 20:58:41+00:00,Space
TechCrunch,https://techcrunch.com/feed/,The AI world is getting ‘loopy’,"The loop takes agentic AI a step further by authorizing a swarm of agents to work continuously in the background, endlessly.",https://techcrunch.com/2026/06/22/the-ai-world-is-getting-loopy/,2026-06-22 20:53:11+00:00,Other
Satellite Today,https://www.satellitetoday.com/feed/,Building a Global Framework for D2D With Skylo’s Mindel De La Torre,"Over just a few years, the ability to connect everyday cell phones to satellite has gone from a milestone tech demonstration to a feature that’s deployed in millions of phones. [&#8230;] The post Building a Global Framework for D2D With Skylo’s Mindel De La Torre appeared first on Via Satellite .",https://www.satellitetoday.com/podcast/2026/06/22/building-a-global-framework-for-d2d-with-skylos-mindel-de-la-torre/,2026-06-22 20:48:08+00:00,Other
TechCrunch,https://techcrunch.com/feed/,Microsoft and Chevron plan one of the largest gas-powered data center projects in US,"Microsoft inked a 20-year power purchase agreement with Chevron, locking in decades of carbon emissions from a new natural gas power plant.",https://techcrunch.com/2026/06/22/microsoft-and-chevron-plan-one-of-the-largest-gas-powered-data-center-projects-in-us/,2026-06-22 20:37:19+00:00,Other
Satellite Today,https://www.satellitetoday.com/feed/,EchoStar Swaps SATS Ticker for ECHO to Emphasize Business Shift,"EchoStar is changing its stock ticker from “SATS” to “ECHO” to emphasize the company’s shift into a global connectivity business. EchoStar announced the move on June 22. Starting June 24, [&#8230;] The post EchoStar Swaps SATS Ticker for ECHO to Emphasize Business Shift appeared first on Via Satellite .",https://www.satellitetoday.com/finance/2026/06/22/echostar-swaps-sats-ticker-for-echo-to-emphasize-business-shift/,2026-06-22 20:26:32+00:00,Other
Satellite Today,https://www.satellitetoday.com/feed/,Jio Evaluates a Sovereign LEO Constellation for India,"India’s largest telecom operator Jio Platforms is evaluating launching a sovereign Low-Earth Orbit (LEO) constellation for India. The company described a “dual approach” to satellite broadband, considering its own constellation [&#8230;] The post Jio Evaluates a Sovereign LEO Constellation for India appeared first on Via Satellite .",https://www.satellitetoday.com/connectivity/2026/06/22/jio-evaluates-a-sovereign-leo-constellation-for-india/,2026-06-22 20:25:31+00:00,Space
TechCrunch,https://techcrunch.com/feed/,"AI chipmaker Groq confirms $650M raise, re-staffs after Nvidia’s $20B not-acqui-hire deal","What does an AI company do after one of those not-acqui-hire deals? Groq raised money, is leaning into its neocloud business, and is hiring new execs.",https://techcrunch.com/2026/06/22/ai-chipmaker-groq-confirms-650m-raise-re-staffs-after-nvidias-20b-not-acqui-hire-deal/,2026-06-22 20:13:58+00:00,Funding
TechCrunch,https://techcrunch.com/feed/,"Nvidia wants to cut data center water use, but that’s not the same as fixing AI’s water problem",Nvidia announced a new cooling system that cuts water use inside the data center. But it does nothing to address AI's biggest water use — fossil fuel power plants.,https://techcrunch.com/2026/06/22/nvidia-wants-to-cut-data-center-water-use-but-thats-not-the-same-as-fixing-ais-water-problem/,2026-06-22 20:08:15+00:00,Other
Satellite Today,https://www.satellitetoday.com/feed/,MDA Space to Acquire Blue Canyon from Raytheon to Reach US Defense Market,MDA Space is acquiring spacecraft manufacturer Blue Canyon Technologies from Raytheon to give the company a direct position in the U.S. defense market. The acquisition will give the Canadian space [&#8230;] The post MDA Space to Acquire Blue Canyon from Raytheon to Reach US Defense Market appeared first on Via Satellite .,https://www.satellitetoday.com/manufacturing/2026/06/22/mda-space-to-acquire-blue-canyon-from-raytheon-to-reach-us-defense-market/,2026-06-22 19:58:25+00:00,"Space, Defense"
Satellite Today,https://www.satellitetoday.com/feed/,Former SES Exec John-Paul Hemingway to Lead Vast’s Satellite Business,SES’s former CCO John-Paul Hemingway has joined Vast to lead business development for Vast’s new satellite manufacturing business. Hemingway is now senior vice president of satellite business development and commercialization [&#8230;] The post Former SES Exec John-Paul Hemingway to Lead Vast’s Satellite Business appeared first on Via Satellite .,https://www.satellitetoday.com/people/2026/06/22/former-ses-exec-john-paul-hemingway-to-lead-vasts-satellite-business/,2026-06-22 19:53:26+00:00,Other
TechCrunch,https://techcrunch.com/feed/,"Tata Electronics, a major tech supplier to Apple and Tesla, confirms data breach",The incident comes as Tata Electronics expands its role in global technology supply chains.,https://techcrunch.com/2026/06/22/tata-electronics-a-major-tech-supplier-to-apple-and-tesla-confirms-data-breach/,2026-06-22 19:25:00+00:00,Other
Breaking Defense,https://breakingdefense.com/feed/,France and Germany commit to equal shareholding in KNDS as potential IPO nears,"Germany is seeking a 40 percent stake in the European land manufacturer, subject to approval by its budget committee.",https://breakingdefense.com/2026/06/france-and-germany-commit-to-equal-shareholding-in-knds-as-potential-ipo-nears/,2026-06-22 19:06:00+00:00,Other
TechCrunch,https://techcrunch.com/feed/,A new unpatchable flaw in Apple chips opens the door to an iPhone jailbreak,European offensive cybersecurity company Paradigm Shift released details of a flaw and a technique to exploit it that opens the door for hackers to unlock and break into older iPhones.,https://techcrunch.com/2026/06/22/a-new-unpatchable-flaw-in-apple-chips-opens-the-door-to-an-iphone-jailbreak/,2026-06-22 18:50:24+00:00,Other
TechCrunch,https://techcrunch.com/feed/,Google DeepMind bets $75M on AI’s future in Hollywood with A24 deal,Google DeepMind and A24 are teaming up to build AI filmmaking tools.,https://techcrunch.com/2026/06/22/google-deepmind-bets-75m-on-ais-future-in-hollywood-with-a24-deal/,2026-06-22 18:49:44+00:00,Other
Breaking Defense,https://breakingdefense.com/feed/,"Australia, Canada sign $1.75B agreement for Over the Horizon Radar system","This is the largest Australian defense export to date, Canberra said.",https://breakingdefense.com/2026/06/australia-canada-sign-1-75b-agreement-for-over-the-horizon-radar-system/,2026-06-22 18:38:00+00:00,Defense
Breaking Defense,https://breakingdefense.com/feed/,Capacity is the new capability,"[Sponsored] Production speed is combat power, and industry must meet today’s threats while accelerating and adapting capabilities to keep the edge.",https://breakingdefense.com/2026/06/capacity-is-the-new-capability/,2026-06-22 18:07:00+00:00,Other
TechCrunch,https://techcrunch.com/feed/,Anthropic says Claude may want to see your ID,"Claude's chatbot may ask to verify your age and identity ""in certain circumstances,"" such as with a passport or driver's license, according to a privacy policy change.",https://techcrunch.com/2026/06/22/anthropic-says-claude-may-want-to-see-your-id/,2026-06-22 18:05:13+00:00,AI
MIT Technology Review,https://www.technologyreview.com/feed/,Three things to watch amid Anthropic’s latest feud with the government,"This story originally appeared in The Algorithm, our weekly newsletter on AI. To get stories like this in your inbox first, sign up here. For those of you enjoying your summer unaware of Anthropic’s latest feud with the US government, here’s a recap: In April the company said it had built an AI model called Mythos&#8230;",https://www.technologyreview.com/2026/06/22/1139424/three-things-to-watch-amid-anthropics-latest-feud-with-the-government/,2026-06-22 18:00:00+00:00,AI
Breaking Defense,https://breakingdefense.com/feed/,EXCLUSIVE: Inside the secret struggles of the Air Force’s T-7 Red Hawk,"From a weather restriction to a &#8220;serious&#8221; airworthiness risk, the Air Force&#8217;s newest training jet faces far more issues than previously reported, an investigation by Breaking Defense found.",https://breakingdefense.com/2026/06/t7-red-hawk-air-force-trainer-secret-struggles-investigation/,2026-06-22 17:45:00+00:00,Defense
SpaceNews,https://spacenews.com/feed/,"Chinese spaceplane releases object into orbit, according to commercial space surveillance","China’s secretive spaceplane has released an object into orbit during its ongoing fourth mission, according to space surveillance firm LeoLabs. The post Chinese spaceplane releases object into orbit, according to commercial space surveillance appeared first on SpaceNews .",https://spacenews.com/chinese-spaceplane-releases-object-into-orbit-according-to-commercial-space-surveillance/,2026-06-22 17:42:59+00:00,Other
TechCrunch,https://techcrunch.com/feed/,Amazon is testing Alexa+ in India with Hindi support,Amazon is planning to increase the footprint of its new conversational AI assistant Alexa+ to India and is inviting users in the country to test out a Hindi-language version.,https://techcrunch.com/2026/06/22/amazon-is-testing-alexa-in-india-with-hindi-support/,2026-06-22 17:31:29+00:00,Other
Payload Space,https://payloadspace.com/feed/,A Faster Path to Orbit: How Hosted Payloads Are Changing Access to Space,"Historically, deploying a new capability in space required significant time, investment, and technical expertise. Companies often had little choice but to build nearly everything themselves—from spacecraft and payload integration to ground infrastructure and mission operations. Today, the space industry offers a different model: hosted payloads. “We’re seeing companies looking for the fastest, most economical way… The post A Faster Path to Orbit: How Hosted Payloads Are Changing Access to Space appeared first on Payload .",https://payloadspace.com/a-faster-path-to-orbit-how-hosted-payloads-are-changing-access-to-space/,2026-06-22 17:30:19+00:00,"Space, Funding"
Breaking Defense,https://breakingdefense.com/feed/,Army picks Anduril to lead Next Gen C2 common data layer baseline,The company had been prototyping the “full stack” with 4th Infantry Division over the last year.,https://breakingdefense.com/2026/06/army-picks-anduril-to-lead-next-gen-c2-common-data-layer-baseline/,2026-06-22 17:00:00+00:00,Defense
TechCrunch,https://techcrunch.com/feed/,"SpaceX inks compute deal with Reflection AI, an open source AI lab","Reflection AI will pay $150 million a month beginning July 1, 2026 through 2029 for immediate access to Nvidia's latest GB300 AI chips and supporting hardware across SpaceX's Colossus 2 data center near Memphis, Tennessee.",https://techcrunch.com/2026/06/22/spacex-inks-compute-deal-with-reflection-ai-an-open-source-ai-lab/,2026-06-22 16:51:29+00:00,Other
War on the Rocks,https://warontherocks.com/feed/,Is There a Place in Ukrainian Media for War Skeptics?,"Welcome to&#160;The Ukraine Compass, a weekly digest of Ukrainian commentary and analysis from across the political spectrum only for&#160;War on the Rocks&#160;members. Each Monday, we bring you a curated selection of articles from Ukrainian media offering insight into how Ukrainians themselves debate the issues shaping their country.American coverage often narrows the view to the battlefield &#8212; these pieces widen it, revealing the texture of daily life, politics, and public argument in a nation at war. The perspectives gathered here are varied, candid, and often surprising, together forming a more complete picture of Ukraine as it really is.Frontline and Strategy&#1062;&#1077;&#1085;&#1079;&#1086;&#1088;.&#1053;&#1045;&#1058; &#8212; The post Is There a Place in Ukrainian Media for War Skeptics? appeared first on War on the Rocks .",https://warontherocks.com/is-there-a-place-in-ukrainian-media-for-war-skeptics/,2026-06-22 16:00:53+00:00,Defense
Defense News,https://www.defensenews.com/arc/outboundfeeds/rss/,US Army tests autonomous boats during Philippine exercise,"Autonomous boats helped escort a U.S. Army vessel during a military exercise, in a demonstration of how uncrewed assets are changing maritime operations.",https://www.defensenews.com/news/your-military/2026/06/22/us-army-tests-autonomous-boats-during-philippine-exercise/,2026-06-22 16:00:31+00:00,Defense
Breaking Defense,https://breakingdefense.com/feed/,"South Korea’s Hanwha joins with Emirati firm, aiming to build K9 Howitzer in the UAE","“The agreement is part of Hanwha Aerospace’s strategy to strengthen its position in the Middle East, where it is pursuing local production, maintenance and technology partnerships as a route to regional customers,” Hanwha said in the statement.",https://breakingdefense.com/2026/06/south-koreas-hanwha-joins-with-emirati-firm-aiming-to-build-k9-howitzer-in-the-uae/,2026-06-22 15:39:56+00:00,Other
EU-Startups,https://www.eu-startups.com/feed/,"75,000 AI songs a day, but Europe’s music startups are looking somewhere smarter","Two years ago, a Sónar+D panel called &#8220;Generating Panic?&#8221; asked whether AI was about to overwhelm music. By April 2026, Deezer had a number: around 75,000 fully AI-generated tracks a day, about 44% of all the new music arriving on the platform. The panel asked, the data answered. Then you look at what people play. [&#8230;] The post 75,000 AI songs a day, but Europe’s music startups are looking somewhere smarter appeared first on EU-Startups .",https://www.eu-startups.com/2026/06/75000-ai-songs-a-day-but-europes-music-startups-are-looking-somewhere-smarter/,2026-06-22 15:24:48+00:00,Startups
TechCrunch,https://techcrunch.com/feed/,WhatsApp gets new chief as Meta taps India’s CRED founder Kunal Shah and invests $900M in startup,"WhatsApp gets a new boss, as Will Cathcart moves to a new role at Meta, while Shah steps down as CEO of Indian fintech giant CRED to replace Cathcart.",https://techcrunch.com/2026/06/22/whatsapp-gets-new-chief-as-meta-taps-indias-cred-founder-kunal-shah-and-invests-900m-in-startup/,2026-06-22 15:21:42+00:00,Startups
C4ISRNET,https://www.c4isrnet.com/arc/outboundfeeds/rss/,The unlikely role of Operation Epic Fury in a Mississippi AI data center lawsuit,"The lawsuit argues that the data centers are operating illegally and polluting surrounding areas, but the DOJ said they’re needed for national security.",https://www.c4isrnet.com/news/your-military/2026/06/22/the-unlikely-role-of-operation-epic-fury-in-a-mississippi-ai-data-center-lawsuit/,2026-06-22 15:08:06+00:00,Defense
Defense News,https://www.defensenews.com/arc/outboundfeeds/rss/,"Kyiv’s drone leverage moved the US. Moscow could be next, a top Ukrainian official says.","After years of needing Western weapons, Kyiv is approaching negotiations with battlefield tech the U.S. now wants — and a possible ceasefire looming.",https://www.defensenews.com/pentagon/2026/06/22/kyivs-drone-leverage-moved-the-us-moscow-could-be-next-a-top-ukrainian-official-says/,2026-06-22 15:06:54+00:00,Defense
Defense News,https://www.defensenews.com/arc/outboundfeeds/rss/,"US couldn’t repair battle-damaged ships in war with China, study finds","Battle-damaged U.S. warships could not be quickly repaired and returned to combat during a war with China, according to a new study by RAND.",https://www.defensenews.com/news/pentagon-congress/2026/06/22/us-couldnt-repair-battle-damaged-ships-in-war-with-china-study-finds/,2026-06-22 14:53:20+00:00,Science
EU-Startups,https://www.eu-startups.com/feed/,France’s Bionyra Pharma launches with €143 million Series A to advance inflammatory disease biologics,"Bionyra Pharma, a Paris and Boston-based clinical-stage biopharma company developing next-generation biologics for immune-mediated inflammatory diseases, today announced the company’s launch and its €143 million ($165 million) oversubscribed Series A financing The round is co-led by Jeito Capital and Sofinnova Partners. Arkin Bio, Sanofi Ventures, Sixty Degree Capital, Vives Partners and Apollo Health Ventures also [&#8230;] The post France&#8217;s Bionyra Pharma launches with €143 million Series A to advance inflammatory disease biologics appeared first on EU-Startups .",https://www.eu-startups.com/2026/06/frances-bionyra-pharma-launches-with-e143-million-series-a-to-advance-inflammatory-disease-biologics/,2026-06-22 14:22:22+00:00,"Funding, Startups"
TechCrunch,https://techcrunch.com/feed/,"Instagram looks to take on streaming services with longer-form, episodic and live formats for its TV app",Instagram is coming for streaming services like Netflix and Amazon Prime Video as it sets its ambitions for living room viewing.,https://techcrunch.com/2026/06/22/instagram-looks-to-take-on-streaming-services-with-longer-form-episodic-and-live-formats-for-its-tv-app/,2026-06-22 14:14:10+00:00,Other
TechCrunch,https://techcrunch.com/feed/,The founder conference built for growth: TechCrunch Founder Summit pass rates increase June 26,"Save up to $190 on your pass to TechCrunch Founder Summit 2026 by June 26, 11:59 p.m. PT. Designed for founders first on November 4 in Boston. Register today.",https://techcrunch.com/2026/06/22/the-founder-conference-built-for-growth-techcrunch-founder-summit-pass-rates-increase-june-26/,2026-06-22 14:00:00+00:00,Startups
TechCrunch,https://techcrunch.com/feed/,Lucid Motors’ new CEO cuts 18% of staff to ‘simplify the company’,"The company is also eliminating a production shift at its Arizona factory to align ""production plans with anticipated demand.""",https://techcrunch.com/2026/06/22/lucid-motors-new-ceo-cuts-18-of-staff-to-simplify-the-company/,2026-06-22 13:42:59+00:00,Other
TechCrunch,https://techcrunch.com/feed/,Seedcamp raises $320M for its new fund to expand its US footprint,"After 18 years of focusing on Europe, early-stage investor Seedcamp said that it has raised $320 million for its latest fund, which will see it expanding its presence in the United States.",https://techcrunch.com/2026/06/22/seedcamp-raises-320m-for-its-new-fund-to-expand-its-us-footprint/,2026-06-22 13:37:25+00:00,"Funding, Startups"
TechCrunch,https://techcrunch.com/feed/,Klue hack results in data breach at several cybersecurity firms,"Huntress, HackerOne, Jamf, Recorded Future, and Tanium are among the cybersecurity companies that had data stolen following an earlier breach at market research firm Klue.",https://techcrunch.com/2026/06/22/klue-hack-results-in-data-breach-at-several-cybersecurity-firms/,2026-06-22 13:36:08+00:00,Science
Breaking Defense,https://breakingdefense.com/feed/,Automation vs autonomy: What will shape the future of battlefield drones?,"[Sponsored] While humans must stay in the loop for kinetic decisions, empowering drones to operate autonomously is a force multiplier.",https://breakingdefense.com/2026/06/automation-vs-autonomy-what-will-shape-the-future-of-battlefield-drones/,2026-06-22 13:34:00+00:00,Defense
Payload Space,https://payloadspace.com/feed/,"Exclusive: Northwood Unveils New Antenna, Expanded Network Capacity","The new hardware comes amid Northwood’s rapid global expansion of its physical ground station footprint, and will allow the company to support more data downlinks over a wider range of frequencies. The post Exclusive: Northwood Unveils New Antenna, Expanded Network Capacity appeared first on Payload .",https://payloadspace.com/exclusive-northwood-unveils-new-antenna-expanded-network-capacity/,2026-06-22 13:01:00+00:00,Other
Labiotech,https://www.labiotech.eu/feed/,8 of the most expensive drugs in biopharma: Unraveling the costliest medications,"Find out what the eight most expensive drugs in the world currently are, as several gene therapies top the list. The post 8 of the most expensive drugs in biopharma: Unraveling the costliest medications appeared first on Labiotech.eu . © Labiotech UG and Labiotech.eu. Unauthorized use and/or duplication of this material without express and written permission from this site’s author and/or owner is strictly prohibited. Excerpts and links may be used, provided that full and clear credit is given to Labiotech UG and Labiotech.eu with appropriate and specific direction to the original content.",https://www.labiotech.eu/best-biotech/most-expensive-drugs-biopharma/,2026-06-22 13:00:00+00:00,Biotech
Payload Space,https://payloadspace.com/feed/,ElevationSpace Closes $40M Series B,"The Japanese satellite reentry startup raised a $40M Series B, bringing the company’s total amount raised to $63.5M. The post ElevationSpace Closes $40M Series B appeared first on Payload .",https://payloadspace.com/elevationspace-closes-40m-series-b/,2026-06-22 13:00:00+00:00,"Funding, Space"
SpaceNews,https://spacenews.com/feed/,"America is about to cede Africa’s space industry to China, and nobody’s talking about it.","If the Trump administration is serious about executing its “America First in Africa” policy and transforming American engagement on the continent, it needs to focus on sectors where it still [&#8230;] The post America is about to cede Africa&#8217;s space industry to China, and nobody&#8217;s talking about it. appeared first on SpaceNews .",https://spacenews.com/america-is-about-to-cede-africas-space-industry-to-china-and-nobodys-talking-about-it/,2026-06-22 13:00:00+00:00,Other
Breaking Defense,https://breakingdefense.com/feed/,Why Trump invoked the Defense Production Act now,"“It’s a way for us to communicate and leverage industry,” said Michael Cadenazzi, the assistant secretary of Defense for Industrial Base Policy.",https://breakingdefense.com/2026/06/why-trump-invoked-the-defense-production-act-now/,2026-06-22 12:36:00+00:00,Defense
Defense News,https://www.defensenews.com/arc/outboundfeeds/rss/,"Can China’s latest air-to-air missile take on its US equivalent? Definitely maybe, experts say.","The PL-16’s specs would let it chase large, slower-moving aircraft, one analyst said, though its effectiveness against smaller, faster planes is unclear.",https://www.defensenews.com/global/asia-pacific/2026/06/22/can-chinas-latest-air-to-air-missile-take-on-its-us-equivalent-definitely-maybe-experts-say/,2026-06-22 12:20:33+00:00,Defense
SpaceNews,https://spacenews.com/feed/,Astroscale raises funding to support growth strategy,"Satellite servicing company Astroscale is working to transition from technology demonstrations to a regular series of missions, bolstered by a recent capital infusion. The post Astroscale raises funding to support growth strategy appeared first on SpaceNews .",https://spacenews.com/astroscale-raises-funding-to-support-growth-strategy/,2026-06-22 12:13:11+00:00,Funding
MIT Technology Review,https://www.technologyreview.com/feed/,The Download: record-breaking subsea tunnels and flexible data centers,"This is today&#8217;s edition of The Download, our weekday newsletter that provides a daily dose of what&#8217;s going on in the world of technology. Inside the world’s deepest and longest subsea road tunnel —Niall Firth I’m currently around 1,000 feet beneath the North Sea, in a dark, dank cave. It smells weird. And I’m increasingly&#8230;",https://www.technologyreview.com/2026/06/22/1139385/the-download-rogfast-subsea-tunnel-flexible-data-centers/,2026-06-22 12:10:00+00:00,Other
EU-Startups,https://www.eu-startups.com/feed/,Unmanned cargo aircraft developer Acodyne secures €2.5 million for defence and offshore logistics,"Copenhagen-based DeepTech startup Acodyne has raised €2.5 million in pre-Seed funding to scale its unmanned cargo aircraft for heavy-lift logistics in defence, offshore and remote operations. The round is jointly led by Swedish defence VC Gungnir Capital and Danish PSV Hafnium with participation from EIFO, SAP9 Group and GreenUP IV Invest. &#8220;This round gives us [&#8230;] The post Unmanned cargo aircraft developer Acodyne secures €2.5 million for defence and offshore logistics appeared first on EU-Startups .",https://www.eu-startups.com/2026/06/unmanned-cargo-aircraft-developer-acodyne-secures-e2-5-million-for-defence-and-offshore-logistics/,2026-06-22 11:59:52+00:00,"Funding, Startups"
Breaking Defense,https://breakingdefense.com/feed/,War robots invade Eurosatory 2026 as interest grows in UGVs after use in Ukraine,"Ukrainian firms, especially, showed off combat-proven unmanned ground vehicles, but at least one experts isn&#8217;t convinced of a wider use-case, yet.",https://breakingdefense.com/2026/06/war-robots-invade-eurosatory-2026-as-interest-grows-in-ugvs-after-use-in-in-ukraine/,2026-06-22 11:36:32+00:00,Other
