source,feed_url,headline,summary,url,published_date,topics
Nature,https://www.nature.com/subjects/medical-research.rss,The future of robotic surgery in the age of artificial intelligence,,https://www.nature.com/articles/s41585-026-01153-8,2026-05-08 00:00:00+00:00,AI
Nature,https://www.nature.com/subjects/medical-research.rss,Macular thickness profile in an adult population using Spectralis spectral-domain optical coherence tomography,,https://www.nature.com/articles/s41598-026-52064-y,2026-05-08 00:00:00+00:00,Other
Nature,https://www.nature.com/subjects/medical-research.rss,Deep learning models for acute kidney injury prediction: multi-center external validation and evaluation under simulated continuous monitoring conditions,,https://www.nature.com/articles/s41746-026-02722-2,2026-05-08 00:00:00+00:00,AI
Nature,https://www.nature.com/subjects/medical-research.rss,Evaluation of image quality between hybrid iterative reconstruction and deep learning reconstruction in low dose abdominopelvic CT in low body mass index individuals,,https://www.nature.com/articles/s41598-026-52554-z,2026-05-08 00:00:00+00:00,AI
Nature,https://www.nature.com/subjects/medical-research.rss,Assessing maternal knowledge of neonatal danger signs in Egypt: a cross-sectional study,,https://www.nature.com/articles/s41598-026-50756-z,2026-05-08 00:00:00+00:00,Science
Nature,https://www.nature.com/subjects/medical-research.rss,Akkermansia muciniphila drives viscero-visceral crosstalk via 5-HT3aR-mediated sensitization of dichotomizing gut–bladder neurons,,https://www.nature.com/articles/s12276-026-01720-4,2026-05-08 00:00:00+00:00,Other
Nature,https://www.nature.com/subjects/medical-research.rss,Social jet lag and visual acuity decline in junior high students: a retrospective cohort study,,https://www.nature.com/articles/s41598-026-51107-8,2026-05-08 00:00:00+00:00,Science
Nature,https://www.nature.com/subjects/medical-research.rss,"Benchmarking large language models on persian surgical subspecialty board examinations: a comparative study of ChatGPT-4o, ChatGPT-5, and Gemini 2.5 Flash",,https://www.nature.com/articles/s41598-026-51934-9,2026-05-08 00:00:00+00:00,"Science, AI"
Nature,https://www.nature.com/subjects/medical-research.rss,"Effects of providing access to a cycling exergaming platform on cardiorespiratory fitness and cardiometabolic health in adolescents: a randomised, controlled trial",,https://www.nature.com/articles/s41598-026-48327-3,2026-05-08 00:00:00+00:00,Other
Nature,https://www.nature.com/subjects/medical-research.rss,A rare mutation (p.Ala264Thr) of GATA4 is responsible for atrial septal defect and pulmonary valve stenosis,,https://www.nature.com/articles/s41598-026-52332-x,2026-05-08 00:00:00+00:00,Other
Nature,https://www.nature.com/subjects/medical-research.rss,Infectious disease outcomes of NASA’s health stabilization program,,https://www.nature.com/articles/s41526-026-00593-1,2026-05-08 00:00:00+00:00,Other
Nature,https://www.nature.com/subjects/medical-research.rss,A community-based exercise intervention to reduce functional risk factors for injury among stroke survivors in South Korea: a pilot randomized controlled trial,,https://www.nature.com/articles/s41598-026-50927-y,2026-05-08 00:00:00+00:00,Other
Nature,https://www.nature.com/subjects/medical-research.rss,Clinical utility of the mini nutritional assessment short form in predicting stroke-associated pneumonia in acute stroke patients: a prospective cohort study,,https://www.nature.com/articles/s41598-026-50651-7,2026-05-08 00:00:00+00:00,Science
Defense News,https://www.defensenews.com/arc/outboundfeeds/rss/,US and Iran exchange fire as Trump says war will ‘be over quickly’,U.S. forces launched retaliatory strikes against Iranian military facilities Thursday after Iran fired missiles and drones at three U.S. Navy vessels.,https://www.defensenews.com/news/your-navy/2026/05/07/us-and-iran-exchange-fire-as-trump-says-war-will-be-over-quickly/,2026-05-07 23:49:00+00:00,Defense
TechCrunch,https://techcrunch.com/feed/,"Ramp in talks to hit $40B+ valuation, 6 months after reaching $32B",The company is reportedly in talks to raise another $750 million at a pre-money valuation of more than $40 billion. It last raised in November at $32 billion.,https://techcrunch.com/2026/05/07/ramp-in-talks-to-hit-40b-valuation-6-months-after-reaching-32b/,2026-05-07 23:11:43+00:00,Funding
TechCrunch,https://techcrunch.com/feed/,OpenAI launches new voice intelligence features in its API,"The new features could be handy for customer service systems, but OpenAI says they have applications that work across a variety of other fields, including education and creator platforms.",https://techcrunch.com/2026/05/07/openai-launches-new-voice-intelligence-features-in-its-api/,2026-05-07 22:24:50+00:00,AI
Satellite Today,https://www.satellitetoday.com/feed/,"Skyroot Secures $60M in Funding, Becoming India’s First Space ‘Unicorn’","Skyroot Aerospace, the Indian launch startup, has secured another $60 million in funding. The company is one of the rising stars in India’s space economy and becomes the nation&#8217;s first [&#8230;] The post Skyroot Secures $60M in Funding, Becoming India&#8217;s First Space &#8216;Unicorn&#8217; appeared first on Via Satellite .",https://www.satellitetoday.com/finance/2026/05/07/skyroot-secures-60m-in-funding-becoming-indias-first-space-unicorn/,2026-05-07 20:59:29+00:00,"Startups, Funding"
Satellite Today,https://www.satellitetoday.com/feed/,"HawkEye 360 Raises $416M, Pricing at High End for IPO","HawkEye 360 raised $416 million in its initial public offering (IPO) on Thursday, becoming the second space company to go public this year. The signals intelligence company began trading on [&#8230;] The post HawkEye 360 Raises $416M, Pricing at High End for IPO appeared first on Via Satellite .",https://www.satellitetoday.com/finance/2026/05/07/hawkeye-360-raises-416m-pricing-at-high-end-for-ipo/,2026-05-07 20:03:15+00:00,Funding
Satellite Today,https://www.satellitetoday.com/feed/,Spire Says New German Facility Can Produce Up to 100 Satellites Per Year,Spire has opened a new satellite manufacturing facility in Munich the company says has the capacity to produce up to 100 satellites per year. The facility is designed for end-to-end [&#8230;] The post Spire Says New German Facility Can Produce Up to 100 Satellites Per Year appeared first on Via Satellite .,https://www.satellitetoday.com/manufacturing/2026/05/07/spire-says-new-german-facility-can-produce-up-to-100-satellites-per-year/,2026-05-07 20:01:51+00:00,Space
Satellite Today,https://www.satellitetoday.com/feed/,"MDA Space Satellite Revenue Grows 40% in Q1, Greenley Says ‘No Change’ Due to Globalstar Deal","MDA Space posted 32% year-over-year revenue growth in the first quarter of 2026 and more than 40% growth for its satellite manufacturing business, driven by work for Telesat Lightspeed and [&#8230;] The post MDA Space Satellite Revenue Grows 40% in Q1, Greenley Says &#8216;No Change&#8217; Due to Globalstar Deal appeared first on Via Satellite .",https://www.satellitetoday.com/finance/2026/05/07/mda-space-satellite-revenue-grows-40-in-q1-greenley-says-no-change-due-to-globalstar-deal/,2026-05-07 19:51:57+00:00,Other
Breaking Defense,https://breakingdefense.com/feed/,Top Pentagon tech officials optimistic Mythos-style AI tools will improve cyber defense,"Mythos is just the first of a new generation of AIs that can patch vulnerable code at superhuman speed, said Pentagon CTO Emil Michael and Cyber Policy chief Katie Sutton, downplaying the uniqueness of Anthropic.",https://breakingdefense.com/2026/05/top-pentagon-tech-officials-optimistic-mythos-style-ai-tools-will-improve-cyber-defense/,2026-05-07 19:45:10+00:00,"Defense, AI"
Breaking Defense,https://breakingdefense.com/feed/,How does budget reconciliation work? Here’s everything you need to know.,Valerie Insinna outlines how Congress draws up a military spending plan for the year ahead.,https://breakingdefense.com/2026/05/how-reconciliation-could-affect-pentagon-funding/,2026-05-07 18:47:41+00:00,Defense
Breaking Defense,https://breakingdefense.com/feed/,Saab CEO optimistic Ukraine Gripen deal could be finalized this year,"A top Ukrainian official said Kyiv was &#8220;ready&#8221; for the big fighter jet deal, but Sweden&#8217;s defense minister suggested challenges remain.",https://breakingdefense.com/2026/05/saab-ceo-optimistic-ukraine-gripen-deal-could-be-finalized-this-year/,2026-05-07 18:07:16+00:00,Defense
Breaking Defense,https://breakingdefense.com/feed/,ASELSAN at SAHA 2026: Introducing next-generation multi-domain defense systems,"[Sponsored] Unveiled at SAHA 2026, ASELSAN’s latest portfolio reflects a layered and integrated defense architecture, bringing together electronic warfare, counter-UAV, airborne and naval capabilities within a unified operational framework.",https://breakingdefense.com/2026/05/aselsan-at-saha-2026-introducing-next-generation-multi-domain-defense-systems/,2026-05-07 18:03:18+00:00,Defense
Breaking Defense,https://breakingdefense.com/feed/,"The next Army chief won’t inherit a force, he’ll inherit an argument","The next Army chief needs to show that land power is still vital and relevant for modern warfare that&#8217;s heavily focused on drones, writes John G. Ferrari in this op-ed.",https://breakingdefense.com/2026/05/the-next-army-chief-wont-inherit-a-force-hell-inherit-an-argument/,2026-05-07 17:13:48+00:00,Defense
Defense News,https://www.defensenews.com/arc/outboundfeeds/rss/,Europe defense autonomy is in reach at €50 billion a year: German experts,"A new paper identifies “ten central capability gaps” Europe needs to plug to be able to act autonomously, without U.S. military assistance.",https://www.defensenews.com/global/europe/2026/05/07/europe-defense-autonomy-is-in-reach-at-50-billion-a-year-german-experts/,2026-05-07 16:46:42+00:00,"Defense, Science"
Defense News,https://www.defensenews.com/arc/outboundfeeds/rss/,A small town in Germany braces for end to decades of life with US troops,A picturesque Bavarian town has hosted U.S. forces since the end of WWII and could bear the brunt of the U.S. military's withdrawal from Germany.,https://www.defensenews.com/news/your-military/2026/05/07/a-small-town-in-germany-braces-for-end-to-decades-of-life-with-us-troops/,2026-05-07 16:42:30+00:00,Defense
Defense News,https://www.defensenews.com/arc/outboundfeeds/rss/,Pentagon turns to AI targeting to help troops shoot drones,"The technology can detect threats and distinguish them from non-threats, such as birds, faster than a human operator can.",https://www.defensenews.com/industry/2026/05/07/pentagon-turns-to-ai-targeting-to-help-troops-shoot-drones/,2026-05-07 15:28:25+00:00,Defense
Breaking Defense,https://breakingdefense.com/feed/,AI ‘explainability’ is a ‘major concern’ for National Reconnaissance Office: Director,Outgoing NRO Director Chris Scolese said the agency is expanding its work to allow analysts to understand how AI does its analysis.,https://breakingdefense.com/2026/05/ai-explainability-is-a-major-concern-for-national-reconnaissance-office-director/,2026-05-07 14:38:46+00:00,Other
Breaking Defense,https://breakingdefense.com/feed/,Driscoll reveals new plan to buy cheaper interceptors with Army-owned IP,"Army Secretary Dan Driscoll explained that the plan is for the Army to break down the interceptor into subsegments and buy them — and their IP — separately, allowing the Army sole ownership of the interceptor.",https://breakingdefense.com/2026/05/driscoll-reveals-new-plan-to-buy-cheaper-interceptors-with-army-owned-ip/,2026-05-07 13:56:35+00:00,Defense
Payload Space,https://payloadspace.com/feed/,South Korea Pushes to Commercialize Quantum Research,"The quantum age is upon us, and South Korea is angling for a seat at the table. The post South Korea Pushes to Commercialize Quantum Research appeared first on Payload .",https://payloadspace.com/south-korea-pushes-to-commercialize-quantum-research/,2026-05-07 12:53:17+00:00,Science
Labiotech,https://www.labiotech.eu/feed/,The rise of trispecific antibodies: Biopharma’s next big bet after bispecifics,"Discover the field of trispecific antibodies, which are currently generating strong interest across the biopharma industry. The post The rise of trispecific antibodies: Biopharma&#8217;s next big bet after bispecifics appeared first on Labiotech.eu . © Labiotech UG and Labiotech.eu. Unauthorized use and/or duplication of this material without express and written permission from this site’s author and/or owner is strictly prohibited. Excerpts and links may be used, provided that full and clear credit is given to Labiotech UG and Labiotech.eu with appropriate and specific direction to the original content.",https://www.labiotech.eu/in-depth/trispecific-antibodies-field-review/,2026-05-07 12:49:00+00:00,Biotech
Breaking Defense,https://breakingdefense.com/feed/,"Kongsberg Q1 orders more than double, company eyes US expansion","Across the last quarter, other key contracts included the firm’s joint selection along with Salt Ship Design to deliver a design concept for standardised vessels to the Royal Norwegian Navy.",https://breakingdefense.com/2026/05/kongsberg-q1-orders-more-than-double-eyes-us-expansion/,2026-05-07 12:11:33+00:00,Defense
MIT Technology Review,https://www.technologyreview.com/feed/,The Download: the tech reshaping IVF and the rise of balcony solar,"This is today&#8217;s edition of The Download, our weekday newsletter that provides a daily dose of what&#8217;s going on in the world of technology. What’s next for IVF IVF has brought millions of babies into the world over the last four decades. But the process can still be slow, painful, and expensive—and far from guaranteed&#8230;",https://www.technologyreview.com/2026/05/07/1136956/the-download-ivf-tech-balcony-solar/,2026-05-07 12:10:00+00:00,Other
Science,https://www.science.org/rss/news_current.xml,Ancient ice core could help explain mysterious shift in Earth’s ice ages,Record-setting Antarctic archive reveals sharp swings in carbon dioxide 1 million years ago,https://www.science.org/content/article/ancient-ice-core-could-help-explain-mysterious-shift-earth-s-ice-ages,2026-05-07 11:45:00+00:00,Other
Breaking Defense,https://breakingdefense.com/feed/,AI ‘blueprint’ coming soon to NGA to help ‘operationalize’ GEOINT,"In her first major speech since taking the reins at NGA, Lt. Gen. Michelle Bredenkamp also said the agency has stood up a new Rapid Capabilities Office to speed integration of innovative commercial tech.",https://breakingdefense.com/2026/05/ai-blueprint-coming-soon-to-nga-to-help-operationalize-geoint/,2026-05-07 11:30:00+00:00,Other
Science,https://www.science.org/rss/news_current.xml,Magic mushroom compound shows promise against cocaine addiction,Small study that prioritized Black and low-income participants yields “remarkable” results,https://www.science.org/content/article/magic-mushroom-compound-shows-promise-against-cocaine-addiction,2026-05-07 11:15:00+00:00,Science
EU-Startups,https://www.eu-startups.com/feed/,Tallinn’s Skeleton Technologies announces €33 million first close of pre-IPO round as it prepares for 2027 US IPO,"Skeleton Technologies, a Tallinn-based AI infrastructure and grid power systems provider, today announced the first close of a larger funding round at €33 million. This brings its total venture capital funding to €392 million in preparation for its planned initial public offering (IPO) in the United States in 2027. The new round expands Skeleton’s investor [&#8230;] The post Tallinn’s Skeleton Technologies announces €33 million first close of pre-IPO round as it prepares for 2027 US IPO appeared first on EU-Startups .",https://www.eu-startups.com/2026/05/tallinns-skeleton-technologies-announces-e33-million-first-close-of-pre-ipo-round-ahead-of-planned-2027-us-ipo/,2026-05-07 10:13:35+00:00,"Funding, Startups"
MIT Technology Review,https://www.technologyreview.com/feed/,The balcony solar boom is coming to the US,"Dozens of US states are considering legislation to allow people to install plug-in solar systems, often called balcony solar. These small arrays require little to no setup and could help cut emissions and power bills. Balcony solar is already popular in Europe, and proponents say that the systems could make solar power more accessible for&#8230;",https://www.technologyreview.com/2026/05/07/1136933/balcony-solar-boom/,2026-05-07 10:00:00+00:00,Other
Defense News,https://www.defensenews.com/arc/outboundfeeds/rss/,Dueling Victory Day ceasefires for war in Ukraine collapse almost immediately,Both sides had proclaimed a ceasefire surrounding the important celebration marking the Soviet Union’s contribution to victory over Nazi Germany.,https://www.defensenews.com/global/europe/2026/05/07/dueling-victory-day-ceasefires-for-war-in-ukraine-collapse-almost-immediately/,2026-05-07 09:18:05+00:00,Other
MIT Technology Review,https://www.technologyreview.com/feed/,What’s next for IVF,"MIT Technology Review’s What’s Next series looks across industries, trends, and technologies to give you a first look at the future. You can read the rest of them here. Forty-eight years ago this July, Louise Joy Brown became the world’s first person born with the help of in vitro fertilization. Millions more IVF babies have entered&#8230;",https://www.technologyreview.com/2026/05/07/1136946/whats-next-for-ivf-ai-robot-pgt-gene-editing/,2026-05-07 09:04:50+00:00,Other
Science,https://www.science.org/rss/news_current.xml,What to do with the passengers on the cruise ship hit by hantavirus?,"Past studies of Andes virus offer scant evidence on transmission risks, and have sparked debate",https://www.science.org/content/article/what-do-passengers-cruise-ship-hit-hantavirus,2026-05-07 08:10:00+00:00,Other
War on the Rocks,https://warontherocks.com/feed/,The Pentagon Needs a Playbook for Munitions Surge Production,"The Tomahawk Land Attack Missiles the U.S. military fired during Operation Epic Fury take months to put on contract and years to produce.Whether driven by U.S. military operations or support to partners, the challenge of quickly replenishing U.S. munitions is not new. Exquisite munitions often take an exquisite amount of time to manufacture and deliver. Defense officials, in turn, frequently want to compress that time as much as possible, seeking to restock fast and mitigate future risks.The Russo-Ukrainian War has illuminated the challenge of accomplishing this feat. It also offers lessons for how the U.S can accelerate munitions production timelines The post The Pentagon Needs a Playbook for Munitions Surge Production appeared first on War on the Rocks .",https://warontherocks.com/cogs-of-war/the-pentagon-needs-a-playbook-for-munitions-surge-production/,2026-05-07 08:00:13+00:00,Defense
EU-Startups,https://www.eu-startups.com/feed/,London-based CodeWords raises €7.6 million to help businesses run on AI autopilot,"CodeWords, a London-based AI agent platform that lets users run their business on autopilot, has raised a €7.6 million ($9 million) Seed round to fund the expansion of its go-to-market and engineering teams. The round was led by Visionaries, with participation from Firstminute Capital (which first backed the company at pre-Seed), Sequel, and Illusian, the [&#8230;] The post London-based CodeWords raises €7.6 million to help businesses run on AI autopilot appeared first on EU-Startups .",https://www.eu-startups.com/2026/05/london-based-codewords-raises-e7-6-million-to-help-businesses-run-on-ai-autopilot/,2026-05-07 07:58:46+00:00,"Funding, Startups"
Labiotech,https://www.labiotech.eu/feed/,Making labs smarter for scientific breakthroughs,"Today, we dive into the future of lab management with Ryan Cawood, CEO and co-founder of Lab Thread. The post Making labs smarter for scientific breakthroughs appeared first on Labiotech.eu . © Labiotech UG and Labiotech.eu. Unauthorized use and/or duplication of this material without express and written permission from this site’s author and/or owner is strictly prohibited. Excerpts and links may be used, provided that full and clear credit is given to Labiotech UG and Labiotech.eu with appropriate and specific direction to the original content.",https://www.labiotech.eu/podcast/making-labs-smarter-for-scientific-breakthroughs/,2026-05-07 07:52:57+00:00,Startups
War on the Rocks,https://warontherocks.com/feed/,What 300 Emails Say About Americans and the Army’s Direct Commission Program,"For nine months in 2024 and 2025, I had an additional duty &#8212; monitoring an inbox that connected potential direct commission candidates with the Army&#8217;s individual branches. I served on the Army Reserve&#8217;s senior leadership team, helping to stand up a brokerage between mid-career professionals and the decentralized branch pipelines that controlled direct commission slots.During that time, I personally reviewed over 300 inquiries from accomplished professionals &#8212; data scientists, logistics engineers, cyber specialists, and strategic communicators &#8212; all of whom wanted to serve their country in uniform. The experience taught me two main lessons. First, people either regret not serving The post What 300 Emails Say About Americans and the Army’s Direct Commission Program appeared first on War on the Rocks .",https://warontherocks.com/what-300-emails-say-about-americans-and-the-armys-direct-commission-program/,2026-05-07 07:30:52+00:00,"Defense, Science"
