source,feed_url,headline,summary,url,published_date,topics
EU-Startups,https://www.eu-startups.com/feed/,Dutch quantum startup Groove Quantum raises €16 million to advance scalable chip manufacturing,"Groove Quantum, a Delft-based quantum computing startup developing scalable germanium spin-qubit processors, has raised €16 million in combined funding and unveiled an 18-qubit semiconductor spin-qubit processor, which the company says is the largest of its kind ever built. The round includes €10 million in equity co-led by Innovation Industries and 55 North, with participation from [&#8230;] The post Dutch quantum startup Groove Quantum raises €16 million to advance scalable chip manufacturing appeared first on EU-Startups .",https://www.eu-startups.com/2026/04/dutch-quantum-startup-groove-quantum-raises-e16-million-to-advance-scalable-chip-manufacturing/,2026-04-30 10:03:52+00:00,"Funding, Startups"
EU-Startups,https://www.eu-startups.com/feed/,Rocsys raises €11.1 million and unveils world’s first multi-bay hands-free charging solution for robotaxi fleets,"Rocsys, a Rijswijk-based startup specialising in hands-free depot solutions for autonomous electric vehicles, has announced the Rocsys M1, the world’s first hands-free charging solution capable of serving multiple bays in robotaxi operations. The company has also announced a €11.1 million ($13 million) Series A extension led by Capricorn Partners, with participation from Scania Invest, Forward.One, [&#8230;] The post Rocsys raises €11.1 million and unveils world’s first multi-bay hands-free charging solution for robotaxi fleets appeared first on EU-Startups .",https://www.eu-startups.com/2026/04/rocsys-raises-e11-1-million-and-unveils-worlds-first-multi-bay-hands-free-charging-solution-for-robotaxi-fleets/,2026-04-30 08:47:06+00:00,"Startups, Funding"
Labiotech,https://www.labiotech.eu/feed/,How Epicrispr is leveraging CRISPR without cutting DNA,"This week we dive into the Beyond Biotech archive to bring you a discussion with Dr Stanley Qi, the founder of Epicrispr. The post How Epicrispr is leveraging CRISPR without cutting DNA appeared first on Labiotech.eu . © Labiotech UG and Labiotech.eu. Unauthorized use and/or duplication of this material without express and written permission from this site’s author and/or owner is strictly prohibited. Excerpts and links may be used, provided that full and clear credit is given to Labiotech UG and Labiotech.eu with appropriate and specific direction to the original content.",https://www.labiotech.eu/podcast/how-epic-bio-is-leveraging-crispr-without-cutting-dna/,2026-04-30 08:00:00+00:00,"Biotech, Startups"
EU-Startups,https://www.eu-startups.com/feed/,Swedish legal AI startup Legora raises €42 million extension to Series D – bringing total to over €500 million,"Stockholm&#8217;s Legora today announced a €42 million ($50 million) extension of its previously announced Series D financing, bringing the total round to €513 million ($600 million) in equity and valuing the company at €4.7 billion ($5.6 billion) post-money. The extension adds Atlassian and NVentures (NVIDIA’s venture capital arm) as corporate investors, alongside new financial investors, [&#8230;] The post Swedish legal AI startup Legora raises €42 million extension to Series D &#8211; bringing total to over €500 million appeared first on EU-Startups .",https://www.eu-startups.com/2026/04/swedish-legal-ai-startup-legora-raises-e42-million-extension-to-series-d-bringing-total-to-over-e500-million/,2026-04-30 07:53:46+00:00,"Funding, Startups"
War on the Rocks,https://warontherocks.com/feed/,Correcting Course in the Indo‑Pacific,"Last month, President Donald Trump hosted Japanese Prime Minister Sanae Takaichi for a visit that captured both the promise and the shortcomings of America&#8217;s Indo&#8209;Pacific strategy.In some ways, the meeting was a success: It produced a few commercial deals, reaffirmed the strength of the bilateral relationship, and &#8212; most importantly &#8212; demonstrated a visibly warm personal rapport between the two leaders (despite an awkward moment). But as has so often been the case during America&#8217;s fitful &#8220;pivot&#8221; to Asia over the past two decades, the visit was overshadowed by yet another conflict in the Middle East that is absorbing U.S. The post Correcting Course in the Indo‑Pacific appeared first on War on the Rocks .",https://warontherocks.com/correcting-course-in-the-indo-pacific/,2026-04-30 07:30:16+00:00,Other
Science,https://www.science.org/rss/news_current.xml,"Measles explodes in Bangladesh after vaccination breakdown, killing hundreds of children","Changes to government’s vaccine purchase system after 2024 revolution led to nationwide shortages, gaps in immunity",https://www.science.org/content/article/measles-explodes-bangladesh-after-vaccination-breakdown-killing-hundreds-children,2026-04-30 07:25:00+00:00,Biotech
War on the Rocks,https://warontherocks.com/feed/,Rethinking Corporate Risk and Alignment in an Era of Economic Statecraft,"Editor&#8217;s note: This article is the eighth in an 11-part series examining how the United States should organize, lead, and integrate economic statecraft into strategy, defense practice, and the broader national security ecosystem. This special series is brought to you by the Potomac Institute for Policy Studies&#160;and&#160;War on the Rocks. Prior installments can be found at the&#160;War by Other Ledgers&#160;page.In Sept. 2010, following a collision between a Chinese trawler and Japanese coast guard vessels near the Senkaku Islands, Chinese authorities halted shipments of rare earth minerals to Japan. The move disrupted supply chains for everything from consumer electronics to advanced The post Rethinking Corporate Risk and Alignment in an Era of Economic Statecraft appeared first on War on the Rocks .",https://warontherocks.com/rethinking-corporate-risk-and-alignment-in-an-era-of-economic-statecraft/,2026-04-30 07:00:42+00:00,Defense
EU-Startups,https://www.eu-startups.com/feed/,Swiss semiconductor startup Mosaic SoC raises €3.2 million to bring spatial intelligence to low-power devices,"Mosaic SoC, a Swiss semiconductor startup building dedicated perception chips that bring spatial intelligence to energy-constrained devices, has announced a €3.2 million ($3.8 million) pre-Seed round. The round was led by Founderful with participation from Kick Foundation. Last year, the company secured €162.4k (CHF 150k) from Venture Kick. “Spatial intelligence shouldn’t require an application-class processor [&#8230;] The post Swiss semiconductor startup Mosaic SoC raises €3.2 million to bring spatial intelligence to low-power devices appeared first on EU-Startups .",https://www.eu-startups.com/2026/04/swiss-semiconductor-startup-mosaic-soc-raises-e3-2-million-to-bring-spatial-intelligence-to-low-power-devices/,2026-04-30 06:45:16+00:00,"Startups, Funding"
War on the Rocks,https://warontherocks.com/feed/,The Trump Administration Hasn’t Forgotten America’s Backyard,"On Jan. 3, U.S. forces captured Venezuelan President Nicol&#225;s Maduro and his wife, and they are now imprisoned in the United States. That operation followed a buildup of U.S. military assets in the Caribbean and the launching of strikes against boats allegedly trafficking drugs. The latest National Security Strategy and National Defense Strategy emphasize the importance of the Western Hemisphere to U.S. policy. After Maduro&#8217;s capture, the Trump administration increasingly appeared to look toward regime change in Cuba. However, when U.S. and Israeli strikes against Iran began on Feb. 28, attention &#8212; and some military assets &#8212; shifted to the The post The Trump Administration Hasn’t Forgotten America’s Backyard appeared first on War on the Rocks .",https://warontherocks.com/the-trump-administration-hasnt-forgotten-americas-backyard/,2026-04-30 05:30:10+00:00,Defense
EU-Startups,https://www.eu-startups.com/feed/,"Earlybird VC closes €360 million Fund VIII, its largest yet, as it implements perpetual active ownership model","Berlin-based VC firm Earlybird VC has closed its eighth early-stage tech fund at €360 million. This marks the pan-European VC firm’s largest raise to date, as it maintains a steady fund cadence across market cycles. The firm asserts that it has consistently raised a new fund every three to four years, without fail, across both [&#8230;] The post Earlybird VC closes €360 million Fund VIII, its largest yet, as it implements perpetual active ownership model appeared first on EU-Startups .",https://www.eu-startups.com/2026/04/earlybird-vc-closes-e360-million-fund-viii-its-largest-yet-as-it-implements-perpetual-active-ownership-model/,2026-04-30 05:17:35+00:00,"Startups, Funding"
Science,https://www.science.org/rss/news_current.xml,Tiny probes make sense of abnormal bursts in the epileptic brain,“Spikes” hijack neurons involved in cognition—and can be predicted up to 1 second in advance,https://www.science.org/content/article/tiny-probes-make-sense-abnormal-bursts-epileptic-brain,2026-04-30 02:25:00+00:00,Other
Science,https://www.science.org/rss/news_current.xml,AI helps create bacterium that’s partially missing a universal amino acid,Advance could suggest new ways to synthesize proteins with bespoke functions in medicine and biotechnology,https://www.science.org/content/article/ai-helps-create-bacterium-s-partially-missing-universal-amino-acid,2026-04-30 02:00:00+00:00,Biotech
Science,https://www.science.org/rss/news_current.xml,AI is starting to beat doctors at making correct diagnoses,"Large language model excels at clinical decisions, even in fast pace of a simulated ER",https://www.science.org/content/article/ai-starting-beat-doctors-making-correct-diagnoses,2026-04-30 02:00:00+00:00,AI
Science,https://www.science.org/rss/news_current.xml,Deepfakes are everywhere. The godfather of digital forensics is fighting back,"Hany Farid, who's spent his career building tools to detect fake images, is facing his biggest challenge yet: AI",https://www.science.org/content/article/deepfakes-are-everywhere-godfather-digital-forensics-fighting-back,2026-04-30 02:00:00+00:00,Other
Science,https://www.science.org/rss/news_current.xml,"After outcry, European funder reverses abrupt rule change restricting resubmissions",Decision from the European Research Council comes after more than 1000 scientists signed open letter decrying plans,https://www.science.org/content/article/after-outcry-european-funder-reverses-abrupt-rule-change-restricting-resubmissions,2026-04-30 01:05:00+00:00,Science
Defense News,https://www.defensenews.com/arc/outboundfeeds/rss/,US Navy to extend service life of amphibious assault ship USS Wasp by 5 years,The service completed a study of Wasp-class amphibious assault ships and is currently conducting another on amphibious dock landing ships.,https://www.defensenews.com/news/your-navy/2026/04/30/us-navy-to-extend-service-life-of-amphibious-assault-ship-uss-wasp-by-5-years/,2026-04-30 00:03:37+00:00,"Defense, Science"
Nature,https://www.nature.com/subjects/medical-research.rss,Deep-learning based quantitative evaluation of postoperative atelectasis following right upper lobectomy,,https://www.nature.com/articles/s41746-026-02683-6,2026-04-30 00:00:00+00:00,Other
Nature,https://www.nature.com/subjects/medical-research.rss,Epidemiology of road traffic accident-related head injuries: a multicenter retrospective cohort study,,https://www.nature.com/articles/s41598-026-50839-x,2026-04-30 00:00:00+00:00,Science
Nature,https://www.nature.com/subjects/medical-research.rss,Hydroxysafflor yellow A attenuatesovariectomy induced bone loss andpromotes osteogenesis via PI3K/AKT activation in an in vitro BMSC model,,https://www.nature.com/articles/s41598-026-51480-4,2026-04-30 00:00:00+00:00,Other
Nature,https://www.nature.com/subjects/medical-research.rss,Systematic review and meta-analysis of stroke blood biomarker data highlights need for more translational research methods,,https://www.nature.com/articles/s41467-026-71329-8,2026-04-30 00:00:00+00:00,Science
Nature,https://www.nature.com/subjects/medical-research.rss,Machine learning based retrospective cohort study to predict mortality risk in Chinese patients undergoing extracorporeal membrane oxygenation,,https://www.nature.com/articles/s41598-026-46338-8,2026-04-30 00:00:00+00:00,"Science, AI"
Nature,https://www.nature.com/subjects/medical-research.rss,Comparative evaluation of nine insulin resistance indices for 10-year coronary artery disease risk prediction in non-diabetic adults,,https://www.nature.com/articles/s41598-026-51393-2,2026-04-30 00:00:00+00:00,Other
Nature,https://www.nature.com/subjects/medical-research.rss,Toxicological evaluation of Lagerstroemia speciosa (L.) Martyn and Lagerstroemia tomentosa C.Presl extracts using a liver organ-on-a-chip system,,https://www.nature.com/articles/s41598-026-44626-x,2026-04-30 00:00:00+00:00,Other
Nature,https://www.nature.com/subjects/medical-research.rss,Prevalence of depressive symptoms and associated factors among older adults residing in long-term care facilities: a cross-sectional study,,https://www.nature.com/articles/s41598-026-51037-5,2026-04-30 00:00:00+00:00,Science
Nature,https://www.nature.com/subjects/medical-research.rss,"Factors affecting patients’ trust in physicians in the cases of prescribing invasive interventions among musculoskeletal patients referring to clinics in Shiraz, 2023: a discrete choice experiment",,https://www.nature.com/articles/s41598-026-45906-2,2026-04-30 00:00:00+00:00,Science
Nature,https://www.nature.com/subjects/medical-research.rss,Reinforcement learning improves LLM accuracy and reasoning in disease classification from radiology reports,,https://www.nature.com/articles/s41746-026-02685-4,2026-04-30 00:00:00+00:00,AI
Nature,https://www.nature.com/subjects/medical-research.rss,Empowering surgeons with integrated synthetic data: solutions for mastering complex clinical scenarios,,https://www.nature.com/articles/s41746-026-02660-z,2026-04-30 00:00:00+00:00,Other
Nature,https://www.nature.com/subjects/medical-research.rss,Genome-wide cross-trait analysis reveals shared genetic architecture between inflammatory bowel disease and ankylosing spondylitis,,https://www.nature.com/articles/s41598-026-51117-6,2026-04-30 00:00:00+00:00,Other
Nature,https://www.nature.com/subjects/medical-research.rss,Association of revised morphological uterus sonographic assessment (MUSA) features of adenomyosis and IVF outcomes,,https://www.nature.com/articles/s41598-026-50999-w,2026-04-30 00:00:00+00:00,Other
Nature,https://www.nature.com/subjects/medical-research.rss,Comparative effectiveness of different home-based pulmonary rehabilitation models in patients with COPD: a systematic review and network meta-analysis,,https://www.nature.com/articles/s41533-026-00513-6,2026-04-30 00:00:00+00:00,Other
Nature,https://www.nature.com/subjects/medical-research.rss,A transformer-graph neural network framework for cyber twin-driven personalized respiratory monitoring,,https://www.nature.com/articles/s41598-026-49994-y,2026-04-30 00:00:00+00:00,Other
Nature,https://www.nature.com/subjects/medical-research.rss,Association between adverse childhood experiences and cardiovascular disease risk in cardiovascular kidney metabolic syndrome stages 0 to 3,,https://www.nature.com/articles/s41598-026-50188-9,2026-04-30 00:00:00+00:00,Other
Nature,https://www.nature.com/subjects/medical-research.rss,"Handball small-sided games and running-based high-intensity interval training similarly improve sprint, change-of-direction, and repeated-sprint performance in untrained young adults",,https://www.nature.com/articles/s41598-026-50926-z,2026-04-30 00:00:00+00:00,Other
Nature,https://www.nature.com/subjects/medical-research.rss,Healthcare professionals’ trust in health authorities throughout COVID-19: a social media analysis,,https://www.nature.com/articles/s41598-026-50565-4,2026-04-30 00:00:00+00:00,Other
Nature,https://www.nature.com/subjects/medical-research.rss,The effect of eccentric exercise-induced delayed onset neck muscle soreness on force steadiness and the spatial distribution of neck extensor muscle activity,,https://www.nature.com/articles/s41598-026-49353-x,2026-04-30 00:00:00+00:00,Other
Nature,https://www.nature.com/subjects/medical-research.rss,Evaluating model generalizability for suicide attempt risk prediction: traditional machine vs deep learning,,https://www.nature.com/articles/s44184-026-00209-2,2026-04-30 00:00:00+00:00,AI
Nature,https://www.nature.com/subjects/medical-research.rss,Health outcomes in older adults with COPD: the role of clinical and psychosocial factors in post-acute geriatric rehabilitation,,https://www.nature.com/articles/s41533-026-00517-2,2026-04-30 00:00:00+00:00,Other
Satellite Today,https://www.satellitetoday.com/feed/,EarthDaily CEO Don Osborne Previews Upcoming Launch in Thursday Morning Conversation,"EarthDaily Analytics is at a key inflection point as it approaches a launch of six satellites later this quarter, which will allow the company to enter commercial service later this [&#8230;] The post EarthDaily CEO Don Osborne Previews Upcoming Launch in Thursday Morning Conversation appeared first on Via Satellite .",https://www.satellitetoday.com/partner-content/2026/04/29/earthdaily-ceo-don-osborne-previews-upcoming-launch-in-thursday-morning-conversation/,2026-04-29 21:58:57+00:00,Space
Breaking Defense,https://breakingdefense.com/feed/,Key takeaways from Hegseth’s day in front of the House,What to know about Pete Hegseth&#8217;s appearance in front of the House Armed Services Committee.,https://breakingdefense.com/2026/04/key-takeaways-from-hegseths-day-in-front-of-the-house/,2026-04-29 21:42:41+00:00,Other
Satellite Today,https://www.satellitetoday.com/feed/,Department of Air Force Plans Initiative to Hire AI Talent,The Department of the Air Force (DAF) in the U.S. has unveiled plans to tap into top AI talent. This has direct implications to the government’s space strategy as the [&#8230;] The post Department of Air Force Plans Initiative to Hire AI Talent appeared first on Via Satellite .,https://www.satellitetoday.com/government-military/2026/04/29/department-of-air-force-plans-initiative-to-hire-ai-talent/,2026-04-29 21:36:21+00:00,Defense
Defense News,https://www.defensenews.com/arc/outboundfeeds/rss/,Don’t call it a ‘quagmire’: defense secretary refuses to speculate on length of Iran war,The questions over the war’s future come as a 60-day deadline approaches Thursday under the War Powers Act.,https://www.defensenews.com/news/pentagon-congress/2026/04/29/dont-call-it-a-quagmire-defense-secretary-refuses-to-speculate-on-length-of-iran-war/,2026-04-29 20:46:48+00:00,Defense
Defense News,https://www.defensenews.com/arc/outboundfeeds/rss/,Trump says he discussed a Ukraine ceasefire with Putin,"Trump said he suggested ""a little bit of a ceasefire"" in the war in Ukraine during his phone call Wednesday with the Russian leader.",https://www.defensenews.com/news/pentagon-congress/2026/04/29/trump-says-he-discussed-a-ukraine-ceasefire-with-putin/,2026-04-29 20:05:12+00:00,Other
Breaking Defense,https://breakingdefense.com/feed/,Space Force awards first contracts for satellite threat warning radar payloads,Space RCO is already looking to start a follow-on effort to build smaller threat warning sensors for a wider set of Space Force birds.,https://breakingdefense.com/2026/04/space-force-awards-first-contracts-for-satellite-threat-warning-radar-payloads/,2026-04-29 19:51:36+00:00,Other
Defense News,https://www.defensenews.com/arc/outboundfeeds/rss/,"Iran war has cost $25 billion so far, Pentagon official says","Acting comptroller Jules Hurst III, testifying before the House Armed Services Committee, said that the bulk of the figure has been devoted to ordnance.",https://www.defensenews.com/news/pentagon-congress/2026/04/29/iran-war-has-cost-25-billion-so-far-pentagon-official-says/,2026-04-29 19:13:24+00:00,Defense
Satellite Today,https://www.satellitetoday.com/feed/,Canada Cancels WildFireSat Constellation Contract With Spire,"Canada has canceled its contract with Spire Global to build a constellation of wildfire-monitoring satellites called WildFireSat. Yet the government remains committed to the space-based wildfire monitoring program, and looks [&#8230;] The post Canada Cancels WildFireSat Constellation Contract With Spire appeared first on Via Satellite .",https://www.satellitetoday.com/government-military/2026/04/29/canada-cancels-wildfiresat-constellation-contract-with-spire/,2026-04-29 19:08:20+00:00,Space
Satellite Today,https://www.satellitetoday.com/feed/,"SpaceX Launches Final ViaSat-3 Satellite, Completing Trio of GEO Satellites","SpaceX launched the final ViaSat-3 satellite on Wednesday morning to complete Viasat’s trio of high-capacity Geostationary Orbit (GEO) satellites. The heavy-lift mission launched on a Falcon Heavy from the Kennedy [&#8230;] The post SpaceX Launches Final ViaSat-3 Satellite, Completing Trio of GEO Satellites appeared first on Via Satellite .",https://www.satellitetoday.com/launch/2026/04/29/spacex-launches-final-viasat-3-satellite-completing-trio-of-geo-satellites/,2026-04-29 19:05:56+00:00,Space
Breaking Defense,https://breakingdefense.com/feed/,Pentagon leaders place $25 billion price tag on Operation Epic Fury,Members of the House Armed Services Committee also pressed Defense Secretary Pete Hegseth on the recent firing of Army and Navy leaders.,https://breakingdefense.com/2026/04/pentagon-leaders-place-25-billon-price-tag-on-operation-epic-fury/,2026-04-29 18:55:28+00:00,Defense
Breaking Defense,https://breakingdefense.com/feed/,Marines to field light loitering munition to operational units in ‘June timeframe’: Official,Currently OFP-L systems from three manufacturers are being tested by units at Dugway Proving Grounds outside of Salt Lake City.,https://breakingdefense.com/2026/04/marines-to-field-light-loitering-munition-to-operational-units-in-june-timeframe-official/,2026-04-29 18:43:15+00:00,Defense
Breaking Defense,https://breakingdefense.com/feed/,SPACECOM’s FY27 spending boost wish list? Empty.,US Space Command&#8217;s plan to ask for no additional FY27 funds follows a similar move by US Indo-Pacific Command.,https://breakingdefense.com/2026/04/spacecoms-fy27-spending-boost-wish-list-empty/,2026-04-29 18:32:39+00:00,Other
Satellite Today,https://www.satellitetoday.com/feed/,Orbcomm Completes $460M Refinancing to Fund Growth,"Orbcomm has closed a $460 million refinancing that the company says will support growth initiatives and large-scale customer deployments and expand its platform. As part of the package announced Wednesday, [&#8230;] The post Orbcomm Completes $460M Refinancing to Fund Growth appeared first on Via Satellite .",https://www.satellitetoday.com/finance/2026/04/29/orbcomm-completes-460m-refinancing-to-fund-growth/,2026-04-29 18:28:21+00:00,Other
War on the Rocks,https://warontherocks.com/feed/,Human Geography: The Strategic Edge in a Complex World,"In 2024, Judd Devermont wrote, &#8220;Human Geography Is Mission-Critical,&#8221; where he argued that the United States should focus on behaviors and attitudes informed by human geography to craft better strategy. Two years later, we asked Judd to revisit his arguments.&#160;Image:&#160;Samuel Lamptey&#160;via Wikimedia CommonsIn your 2024 article, you argued that the United States needed to focus its attention on behaviors and attitudes informed by human geography to craft strategy that adequately&#160;navigates a more complex world and threat environment. Two years later, has the United States utilized human geography more as an indicator for foreign policy decisions? Can you give some examples The post Human Geography: The Strategic Edge in a Complex World appeared first on War on the Rocks .",https://warontherocks.com/human-geography-the-strategic-edge-in-a-complex-world/,2026-04-29 17:30:58+00:00,Other
Defense News,https://www.defensenews.com/arc/outboundfeeds/rss/,"Safran, MBDA see delivery of French rocket artillery in 2029 as feasible",The companies said Thundart is fully designed and produced in France.,https://www.defensenews.com/global/europe/2026/04/29/safran-mbda-see-delivery-of-french-rocket-artillery-in-2029-as-feasible/,2026-04-29 16:50:47+00:00,Defense
Defense News,https://www.defensenews.com/arc/outboundfeeds/rss/,Brain function evaluations to be part of Marine health records,"By September, Marines will be screened for blast exposure and overpressure during their periodic health assessments, a Pentagon official said.",https://www.defensenews.com/news/your-marine-corps/2026/04/29/brain-function-evaluations-to-be-part-of-marine-health-records/,2026-04-29 16:41:57+00:00,Defense
Satellite Today,https://www.satellitetoday.com/feed/,"UPCOMING: Designing Secure Satellite Systems with FIPS 140-3, CNSA 2.0, and PQC","Meeting evolving security requirements like CNSA 2.0 and FIPS 140-3 is becoming a critical challenge for satellite systems, especially when deployments must remain secure for decades with limited ability to [&#8230;] The post UPCOMING: Designing Secure Satellite Systems with FIPS 140-3, CNSA 2.0, and PQC appeared first on Via Satellite .",https://www.satellitetoday.com/webinar/technology-webcast-series/2026/04/29/upcoming-designing-secure-satellite-systems-with-fips-140-3-cnsa-2-0-and-pqc/,2026-04-29 16:35:41+00:00,Other
