source,feed_url,headline,summary,url,published_date,topics
Phys.org,https://phys.org/rss-feed/,Researchers reveal m6A epigenetic modification controls arbovirus infection and transmission,"Arthropod-borne viruses (arboviruses), such as dengue and Zika viruses, transmit widely across the globe, posing threats to human health and biosecurity. They spread through the bites of arthropod vectors, moving between insects and vertebrate hosts. To sustain their transmission cycle, these viruses must alternately infect both mosquito vectors and vertebrate hosts.",https://phys.org/news/2026-03-reveal-m6a-epigenetic-modification-arbovirus.html,2026-03-23 21:20:03+00:00,Science
Phys.org,https://phys.org/rss-feed/,"Roll-call votes may understate polarization in Congress, study finds","For decades, scholars have estimated the ideology of members of Congress by analyzing roll-call votes, recorded tallies of each member's ""yea-or-nay"" on legislation. But a new study from the University of Chicago's Harris School of Public Policy finds this method is likely skewed by ""protest voting""—suggesting that polarization in Congress may be even greater, and started even earlier, than researchers thought.",https://phys.org/news/2026-03-votes-understate-polarization-congress.html,2026-03-23 21:10:01+00:00,Science
Breaking Defense,https://breakingdefense.com/feed/,Space Force anticipates first Kronos C2 contracts in April,"While Kronos is moving forward, the other major part of the C2 upgrade, ATLAS, has not reached full viability, according to the most recent report by DOT&#038;E.",https://breakingdefense.com/2026/03/space-force-anticipates-first-kronos-c2-contracts-in-april/,2026-03-23 21:08:27+00:00,Other
TechCrunch,https://techcrunch.com/feed/,Someone has publicly leaked an exploit kit that can hack millions of iPhones,"Leaked ""DarkSword"" exploits published to GitHub allow hackers and cybercriminals to target iPhone users running old versions of iOS with spyware, according to cybersecurity researchers.",https://techcrunch.com/2026/03/23/someone-has-publicly-leaked-an-exploit-kit-that-can-hack-millions-of-iphones/,2026-03-23 20:42:41+00:00,Science
Breaking Defense,https://breakingdefense.com/feed/,"As Fury production starts, Anduril pledging a different production approach at Arsenal-1","Anduril’s new Arsenal-1 facility in Ohio will be producing its Fury, Roadrunner and Barracuda products, along with a classified platform, by the end of 2026.",https://breakingdefense.com/2026/03/as-fury-production-starts-anduril-pledging-a-different-production-approach-at-arsenal-1/,2026-03-23 20:39:56+00:00,Other
SpaceNews,https://spacenews.com/feed/,Amazon Leo targets faster deployment cadence as deadline pressure mounts,"Amazon vowed to double the annual launch rate for its low Earth orbit broadband constellation to more than 20 missions, hinging largely on rockets yet to prove themselves at scale. The post Amazon Leo targets faster deployment cadence as deadline pressure mounts appeared first on SpaceNews .",https://spacenews.com/amazon-leo-targets-faster-deployment-cadence-as-deadline-pressure-mounts/,2026-03-23 20:39:35+00:00,Space
TechCrunch,https://techcrunch.com/feed/,Zipline snaps up another $200M to fuel its drone delivery expansion,"The funding adds to a previous round, announced in January, that valued the drone startup at $7.6 billion.",https://techcrunch.com/2026/03/23/zipline-snaps-up-another-200m-to-fuel-its-drone-delivery-expansion/,2026-03-23 20:37:52+00:00,"Startups, Funding"
TechCrunch,https://techcrunch.com/feed/,"Bernie Sanders’ AI ‘gotcha’ video flops, but the memes are great","Sen. Bernie Sanders thinks he's tricked Claude into revealing the AI industry's secrets, but he really just exposed how agreeable chatbots can become.",https://techcrunch.com/2026/03/23/bernie-sanders-ai-gotcha-video-flops-but-the-memes-are-great/,2026-03-23 20:15:59+00:00,Other
Defense News,https://www.defensenews.com/arc/outboundfeeds/rss/,A web of sensors: How the US spots missiles and drones from Iran,"If a missile is launched from Iran toward a U.S. military base in the region, how do service members know in time to stay safe?",https://www.defensenews.com/opinion/commentary/2026/03/23/a-web-of-sensors-how-the-us-spots-missiles-and-drones-from-iran/,2026-03-23 19:27:52+00:00,Defense
Satellite Today,https://www.satellitetoday.com/feed/,Seraphim CEO: Space Investment is at a ‘Pivotal Time’,"Seraphim Space CEO Mark Boggett kickstarted SATELLITE 2026 with a keynote that painted an optimistic picture for the space investment environment, calling it a “pivotal time” for the industry. Space... The post Seraphim CEO: Space Investment is at a &#8216;Pivotal Time&#8217; appeared first on Via Satellite .",https://www.satellitetoday.com/satshow-2026/2026/03/23/seraphim-ceo-space-investment-is-at-a-pivotal-time/,2026-03-23 19:22:37+00:00,Funding
TechCrunch,https://techcrunch.com/feed/,Russian authorities block paywall removal site Archive.today,"A notice on the popular paywall-bypass website Archive.today said that access is blocked ""by decision of [Russian] public authorities.""",https://techcrunch.com/2026/03/23/russian-authorities-block-paywall-removal-site-archive-today/,2026-03-23 19:08:45+00:00,Other
Satellite Today,https://www.satellitetoday.com/feed/,Space Compass Purchases First Optical Data Relay Satellite From Swissto12,"Space Compass ordered the first satellite in their planned Geostationary Orbit (GEO) optical data relay constellation from Swissto12, the companies said in a joint statement on Monday. Japanese telecommunications firms... The post Space Compass Purchases First Optical Data Relay Satellite From Swissto12 appeared first on Via Satellite .",https://www.satellitetoday.com/manufacturing/2026/03/23/space-compass-purchases-first-optical-data-relay-satellite-from-swissto12/,2026-03-23 19:02:24+00:00,Space
Satellite Today,https://www.satellitetoday.com/feed/,"Kymeta Advances Multi-Band, Multi-Orbit Antenna Toward 2027 Release","Kymeta is working toward releasing the first prototypes this year of its multi-band, multi-orbit single aperture user terminal in development. Called the KuKa 8 Series, Kymeta says it is the... The post Kymeta Advances Multi-Band, Multi-Orbit Antenna Toward 2027 Release appeared first on Via Satellite .",https://www.satellitetoday.com/technology/2026/03/23/kymeta-advances-multi-band-multi-orbit-antenna-toward-2027-release/,2026-03-23 19:00:17+00:00,Space
SpaceNews,https://spacenews.com/feed/,Parsons unveils new satellite antenna aimed at military market,Hybrid antenna developed by Parsons and Raven Defense combines a six-meter parabolic dish with an electronically steered phased-array feed The post Parsons unveils new satellite antenna aimed at military market appeared first on SpaceNews .,https://spacenews.com/parsons-unveils-new-satellite-antenna-aimed-at-military-market/,2026-03-23 19:00:00+00:00,Defense
Breaking Defense,https://breakingdefense.com/feed/,Space Force’s two new cyber squadrons to defend space launch operations,"“Our adversaries [&#8230;] are constantly looking for ways to deny, disrupt or destroy our ability to launch,&#8221; Maj. Torius Davis said.",https://breakingdefense.com/2026/03/space-forces-two-new-cyber-squadrons-to-defend-space-launch-operations/,2026-03-23 18:48:11+00:00,Other
Defense News,https://www.defensenews.com/arc/outboundfeeds/rss/,US and UK teaming up to destroy underwater drones,America and Britain are joining forces to tackle the threat of underwater drones to ports and other critical infrastructure.,https://www.defensenews.com/naval/2026/03/23/us-and-uk-teaming-up-to-destroy-underwater-drones/,2026-03-23 18:41:44+00:00,Other
TechCrunch,https://techcrunch.com/feed/,Bipartisan bill seeks to ban sports betting on Kalshi and Polymarket,"Since FanDuel and DraftKings are subject to state-by-state gambling laws, rather than federal law, they would not be impacted by the bill.",https://techcrunch.com/2026/03/23/bipartisan-bill-seeks-to-ban-sports-betting-on-kalshi-and-polymarket/,2026-03-23 18:31:53+00:00,Other
TechCrunch,https://techcrunch.com/feed/,Vibe-coding startup Lovable is on the hunt for acquisitions,Lovable's founder said the fast-growing vibe-coding startup is looking for startups and teams to join its company.,https://techcrunch.com/2026/03/23/vibe-coding-startup-lovable-is-on-the-hunt-for-acquisitions/,2026-03-23 18:22:04+00:00,Startups
Satellite Today,https://www.satellitetoday.com/feed/,Interview With MPG Business Development Manager Dave Rawlinson at SATShow Week,"As government and commercial customers are facing accelerating pacing threats MPG is working to deliver at scale in a time of unprecedented need. In this video interview, Dave Rawlinson, MPG... The post Interview With MPG Business Development Manager Dave Rawlinson at SATShow Week appeared first on Via Satellite .",https://www.satellitetoday.com/satshow-2026/2026/03/23/interview-with-mpg-business-development-manager-dave-rawlinson-at-satshow-week/,2026-03-23 18:18:18+00:00,Other
TechCrunch,https://techcrunch.com/feed/,"Apple sets June date for WWDC 2026, teasing ‘AI advancements’",Apple will host its next Worldwide Developers Conference the week of June 8. The company is expected to announce major updates to Siri with advanced AI capabilities.,https://techcrunch.com/2026/03/23/apple-wwdc-june-8-12-ai-advancements-siri-developers-conference/,2026-03-23 18:00:45+00:00,Other
TechCrunch,https://techcrunch.com/feed/,DoorDash introduces relief payments for drivers as the Iran-US war drives up gas prices,"Gas is one of the largest expenses for delivery drivers. With prices continuing to surge, DoorDash is offering a lifeline to Dashers with a new relief program.",https://techcrunch.com/2026/03/23/doordash-introduces-relief-payments-for-drivers-as-the-iran-us-war-drives-up-gas-prices/,2026-03-23 17:48:50+00:00,Other
SpaceNews,https://spacenews.com/feed/,Sovereign demand and institutional capital reshape space economy,"Large infrastructure funds are “carefully looking” into entering the space sector, Seraphim Space CEO Mark Boggett said March 23, giving early-stage investors more confidence to back ambitious startups that may later need billions of dollars to scale. The post Sovereign demand and institutional capital reshape space economy appeared first on SpaceNews .",https://spacenews.com/sovereign-demand-and-institutional-capital-reshape-space-economy/,2026-03-23 17:29:38+00:00,"Startups, Funding"
Breaking Defense,https://breakingdefense.com/feed/,"Army receives first autonomous-ready, optionally piloted Black Hawk",The H-60Mx Black Hawk has been in the works for over a decade and derived from DARPA&#8217;s ALIAS program.,https://breakingdefense.com/2026/03/army-receives-first-autonomous-ready-optionally-piloted-black-hawk/,2026-03-23 17:25:19+00:00,Defense
Defense News,https://www.defensenews.com/arc/outboundfeeds/rss/,The US Army is already ditching its most powerful laser weapon yet,The U.S. Army’s 300 kilowatt Indirect Fire Protection Capability-High Energy Laser system won't transition to a program of record.,https://www.defensenews.com/industry/techwatch/2026/03/23/the-us-army-is-already-ditching-its-most-powerful-laser-weapon-yet/,2026-03-23 17:14:19+00:00,Defense
Breaking Defense,https://breakingdefense.com/feed/,Trump admin’s comments could undermine case against Anthropic in court: Experts,"“Anthropic’s got a strong case, stronger than it should … primarily because the President’s made ‘admissions against interest’” on social media, attorney Sean Timmons told Breaking Defense.",https://breakingdefense.com/2026/03/trump-admins-public-comments-could-undermine-case-against-anthropic-in-court-experts/,2026-03-23 16:53:54+00:00,"Defense, AI"
TechCrunch,https://techcrunch.com/feed/,"Leonid Radvinsky, the owner of OnlyFans, has passed away",OnlyFans owner Leonid Radvinsky has passed away at the age of 43 after a battle with cancer.,https://techcrunch.com/2026/03/23/leonid-radvinsky-the-owner-of-onlyfans-has-passed-away/,2026-03-23 16:32:17+00:00,Other
MIT Technology Review,https://www.technologyreview.com/feed/,The hardest question to answer about AI-fueled delusions,"This story originally appeared in The Algorithm, our weekly newsletter on AI. To get stories like this in your inbox first, sign up here. I was originally going to write this week’s newsletter about AI and Iran, particularly the news we broke last Tuesday that the Pentagon is making plans for AI companies to train on&#8230;",https://www.technologyreview.com/2026/03/23/1134527/the-hardest-question-to-answer-about-ai-fueled-delusions/,2026-03-23 16:31:20+00:00,Defense
Breaking Defense,https://breakingdefense.com/feed/,"Lockheed Martin Australia, Rheinmetall exploring HIMARS sustainment Down Under","Though the tie-up isn&#8217;t complete, if the deal happens Lockheed would see work done on its HIMARS at a Rheinmetall center in Queensland.",https://breakingdefense.com/2026/03/lockheed-martin-australia-rheinmetall-exploring-himars-sustainment-down-under/,2026-03-23 16:00:52+00:00,Other
TechCrunch,https://techcrunch.com/feed/,Littlebird raises $11M for its AI-assisted ‘recall’ tool that reads your computer screen,"Littlebird is building an AI that reads your screen in real time to capture context, answer questions, and automate tasks, without relying on screenshots.",https://techcrunch.com/2026/03/23/littlebird-raises-11m-to-capture-context-from-your-computer-so-you-can-query-your-data/,2026-03-23 16:00:00+00:00,Funding
TechCrunch,https://techcrunch.com/feed/,Startup Gimlet Labs is solving the AI inference bottleneck in a surprisingly elegant way,"Gimlet Labs just raised an $80 million Series A for tech that lets AI run across NVIDIA, AMD, Intel, ARM, Cerebras and d-Matrix chips, simultaneously.",https://techcrunch.com/2026/03/23/startup-gimlet-labs-is-solving-the-ai-inference-bottleneck-in-a-surprisingly-elegant-way/,2026-03-23 16:00:00+00:00,"Funding, Startups"
Satellite Today,https://www.satellitetoday.com/feed/,"China’s Space Development is Outpacing Expectations and Gaining Momentum, Space Force Official Says","China’s space asset developments are coming fast and furious as China drives toward the goal of becoming a major space power, outpacing Russia and causing more focused analysis by U.S.... The post China’s Space Development is Outpacing Expectations and Gaining Momentum, Space Force Official Says appeared first on Via Satellite .",https://www.satellitetoday.com/government-military/2026/03/23/chinas-space-development-is-outpacing-expectations-and-gaining-momentum-space-force-official-says/,2026-03-23 15:44:52+00:00,Other
TechCrunch,https://techcrunch.com/feed/,Grab to buy Foodpanda Taiwan from Delivery Hero for $600 million,"Grab will acquire Delivery Hero’s Foodpanda business in Taiwan for $600 million, expanding beyond Southeast Asia and setting up a closer challenge to Uber Eats in a tightly contested market.",https://techcrunch.com/2026/03/23/grab-to-buy-foodpanda-taiwan-from-delivery-hero-for-600-million/,2026-03-23 15:41:40+00:00,Other
SpaceNews,https://spacenews.com/feed/,Arianespace to launch Katalyst servicing spacecraft,Katalyst Space Technologies will launch a geosynchronous orbit servicing spacecraft on an Ariane 6 in 2027. The post Arianespace to launch Katalyst servicing spacecraft appeared first on SpaceNews .,https://spacenews.com/arianespace-to-launch-katalyst-servicing-spacecraft/,2026-03-23 15:30:00+00:00,Space
TechCrunch,https://techcrunch.com/feed/,Elizabeth Warren calls Pentagon’s decision to bar Anthropic ‘retaliation’,"In a letter to Defense Secretary Pete Hegseth, Senator Elizabeth Warren (D-MA) equated the DOD's decision to label Anthropic a ""supply-chain risk"" as retaliation, arguing that the Pentagon could simply have terminated its contract with the AI lab.",https://techcrunch.com/2026/03/23/elizabeth-warren-anthropic-pentagon-defense-supply-chain-risk-retaliation/,2026-03-23 15:22:57+00:00,"AI, Defense"
Defense News,https://www.defensenews.com/arc/outboundfeeds/rss/,Poland eyes benefits of joining GCAP sixth-generation fighter project,"Polish officials said they have discussed the project with Italian and Japanese stakeholders, but it's unclear if there have been formal government talks.",https://www.defensenews.com/global/europe/2026/03/23/poland-eyes-benefits-of-joining-gcap-sixth-generation-fighter-project/,2026-03-23 15:21:29+00:00,Other
TechCrunch,https://techcrunch.com/feed/,FBI says Iranian hackers are using Telegram to steal data in malware attacks,"Hackers working for Iran’s government are using Telegram in hacking operations that use malware to target dissidents, opposition groups, and journalists who oppose its regime, according to the FBI.",https://techcrunch.com/2026/03/23/fbi-says-iranian-hackers-are-using-telegram-to-steal-data-in-malware-attacks/,2026-03-23 15:18:30+00:00,Other
SpaceNews,https://spacenews.com/feed/,York Space rides defense demand as procurement changes cloud outlook,The company points to backlog and commercial wins as it navigates transition in Space Development Agency-led programs The post York Space rides defense demand as procurement changes cloud outlook appeared first on SpaceNews .,https://spacenews.com/york-space-rides-defense-demand-as-procurement-changes-cloud-outlook/,2026-03-23 14:00:00+00:00,Defense
Labiotech,https://www.labiotech.eu/feed/,The six biotech companies in Portugal you should know about in 2026,"We take a look at six biotech companies in Portugal, which is home to a biotech ecosystem that is rapidly growing. The post The six biotech companies in Portugal you should know about in 2026 appeared first on Labiotech.eu . © Labiotech UG and Labiotech.eu. Unauthorized use and/or duplication of this material without express and written permission from this site’s author and/or owner is strictly prohibited. Excerpts and links may be used, provided that full and clear credit is given to Labiotech UG and Labiotech.eu with appropriate and specific direction to the original content.",https://www.labiotech.eu/best-biotech/biotech-portugal-companies/,2026-03-23 14:00:00+00:00,Biotech
Defense News,https://www.defensenews.com/arc/outboundfeeds/rss/,"Patriot missile involved in Bahrain blast likely US-operated, analysis finds","The pre-dawn explosion injured dozens of civilians, including children, and tore through homes in U.S.-ally Bahrain 10 days into the war.",https://www.defensenews.com/flashpoints/2026/03/23/patriot-missile-involved-in-bahrain-blast-likely-us-operated-analysis-finds/,2026-03-23 13:21:18+00:00,Defense
C4ISRNET,https://www.c4isrnet.com/arc/outboundfeeds/rss/,Dutch armed forces to add drone operators to combat brigades,"The Dutch military will expand that capability “significantly” by deploying 1,000 to 1,200 personnel specifically for drone and counter-drone operations.",https://www.c4isrnet.com/global/europe/2026/03/23/dutch-armed-forces-to-add-drone-operators-to-combat-brigades/,2026-03-23 13:08:46+00:00,Defense
Payload Space,https://payloadspace.com/feed/,Contrivian Launches New Product Bundling Amazon Leo & Starlink,Customers looking for satellite connectivity are often forced to choose between one provider or another. Those days are over. The post Contrivian Launches New Product Bundling Amazon Leo &#038; Starlink appeared first on Payload .,https://payloadspace.com/contrivian-launches-new-product-bundling-amazon-leo-starlink/,2026-03-23 13:00:00+00:00,Space
SpaceNews,https://spacenews.com/feed/,"The software behind Artemis, Gateway and America’s defense in space deserves its own strategy","When we talk about national space infrastructure, we talk about rockets, launch pads and ground stations. We invest billions in the vehicles that carry astronauts to the moon and the telescopes that peer to the edge of the universe. But we rarely talk about the software that makes all of it work. That is a [&#8230;] The post The software behind Artemis, Gateway and America&#8217;s defense in space deserves its own strategy appeared first on SpaceNews .",https://spacenews.com/the-software-behind-artemis-gateway-and-americas-defense-in-space-deserves-its-own-strategy/,2026-03-23 13:00:00+00:00,Defense
MIT Technology Review,https://www.technologyreview.com/feed/,"The Download: animal welfare gets AGI-pilled, and the White House unveils its AI policy","This is today&#8217;s edition of The Download, our weekday newsletter that provides a daily dose of what&#8217;s going on in the world of technology. The Bay Area’s animal welfare movement wants to recruit AI&#160; In early February, animal welfare advocates and AI researchers arrived in stocking feet at Mox, a scrappy, shoes-free coworking space in&#8230;",https://www.technologyreview.com/2026/03/23/1134509/the-download-animal-welfare-agi-pilled-white-house-unveils-ai-policy/,2026-03-23 12:17:33+00:00,Science
Breaking Defense,https://breakingdefense.com/feed/,Space Force to overhaul legacy ground-based missile defense radar systems,"The sweeping new update plan will include development of a single computerized brain for all eight radar, as well as modernized front end antennas to improve detection of smaller, faster missiles, an SSC spokesperson said.",https://breakingdefense.com/2026/03/space-force-to-overhaul-legacy-ground-based-missile-defense-radar-systems/,2026-03-23 11:42:00+00:00,Defense
C4ISRNET,https://www.c4isrnet.com/arc/outboundfeeds/rss/,"US-made naval drone with active warhead washes up in northern Turkey, gets blown up","The vessel, identified as an AEGIR-W variant, came aground on a beach in the Yüceler neighborhood of Ünye district in Ordu province.",https://www.c4isrnet.com/global/europe/2026/03/23/us-made-naval-drone-with-active-warhead-washes-up-in-northern-turkey-gets-blown-up/,2026-03-23 10:54:30+00:00,Defense
SpaceNews,https://spacenews.com/feed/,Lunar lander developers say they are ready to meet anticipated increased NASA demand,Two lunar lander companies say they’re ready to meet NASA’s plans for a major increase in the cadence of landings but offered few details about how they would do so. The post Lunar lander developers say they are ready to meet anticipated increased NASA demand appeared first on SpaceNews .,https://spacenews.com/lunar-lander-developers-say-they-are-ready-to-meet-anticipated-increased-nasa-demand/,2026-03-23 09:40:29+00:00,Other
MIT Technology Review,https://www.technologyreview.com/feed/,The Bay Area’s animal welfare movement wants to recruit AI,"In early February, animal welfare advocates and AI researchers gathered in stocking feet at Mox, a scrappy, shoes-free coworking space in San Francisco. Yellow and red canopies billowed overhead, Persian rugs blanketed the floor, and mosaic lamps glowed beside potted plants.&#160; In the common area, a wildlife advocate spoke passionately to a crowd lounging in&#8230;",https://www.technologyreview.com/2026/03/23/1134491/the-bay-areas-animal-welfare-movement-wants-to-recruit-ai/,2026-03-23 09:00:00+00:00,Science
War on the Rocks,https://warontherocks.com/feed/,The Battlefield is the Next Betting Market,"When the United States and Israel struck Iran&#8217;s nuclear facilities in June last year, the operation caught many observers off guard &#8212; the planning was tightly concealed. By contrast, when Operation Epic Fury started in the early hours of Feb. 28, much of the world was staying up refreshing their screens, waiting for it to begin. Open source analysts tracked the usual indicators of escalation: satellite imagery, repositioning of carrier strike groups, and cryptic statements from officials. Intelligence agencies monitored missile deployments, while journalists quoted inside sources. Energy markets reacted to every rumor.&#160;&#160;Amid this flood of signals, one stood out: The post The Battlefield is the Next Betting Market appeared first on War on the Rocks .",https://warontherocks.com/2026/03/the-battlefield-is-the-next-betting-market/,2026-03-23 07:30:53+00:00,Defense
War on the Rocks,https://warontherocks.com/feed/,"Trump’s Visit to China Won’t Fix Much, If It Even Happens","President Donald Trump&#8217;s suggestion that he would likely delay his planned state visit to Beijing by &#8220;a month or so&#8221; to focus on the war with Iran underscores the fragility of the U.S.-Chinese truce that has held since October. Expectations of a U.S.-Chinese thaw had resurfaced in recent months as both sides worked toward a summit, reduced tariffs and carried out a series of good-faith measures like delaying implementation of export controls. But Trump&#8217;s March 15 call for China to help reopen the Strait of Hormuz before his state visit illustrated how quickly external events can reshape the bilateral agenda.Both The post Trump’s Visit to China Won’t Fix Much, If It Even Happens appeared first on War on the Rocks .",https://warontherocks.com/2026/03/trumps-visit-to-china-wont-fix-much-if-it-even-happens/,2026-03-23 07:15:00+00:00,Other
SpaceNews,https://spacenews.com/feed/,Swissto12 to build small optical relay GEO satellite for Space Compass,"Swissto12, the Switzerland-based small geostationary satellite specialist, has signed a contract to build the first optical relay spacecraft using its washing machine-sized HummingSat platform. The post Swissto12 to build small optical relay GEO satellite for Space Compass appeared first on SpaceNews .",https://spacenews.com/swissto12-to-build-small-optical-relay-geo-satellite-for-space-compass/,2026-03-23 04:01:00+00:00,Space
Science,https://www.science.org/rss/news_current.xml,"Neanderthals survived on a knife’s edge for 350,000 years","A pair of studies illuminates these humans’ long, hardscrabble existence",https://www.science.org/content/article/neanderthals-survived-knife-s-edge-350-000-years,2026-03-23 03:00:00+00:00,Other
