source,feed_url,headline,summary,url,published_date,topics
Phys.org,https://phys.org/rss-feed/,Einstein Probe detects mysterious X-ray transient that doesn't fit any known class,Astronomers have reported the discovery of an unusual X-ray transient detected by the Einstein Probe that does not fit any known class of cosmic explosions. The paper presenting its multiwavelength analysis was published in the journal Monthly Notices of the Royal Astronomical Society on June 13.,https://phys.org/news/2026-06-einstein-probe-mysterious-ray-transient.html,2026-06-23 08:40:02+00:00,Science
EU-Startups,https://www.eu-startups.com/feed/,French observability startup Tsuga lands €30 million to expand AI agent platform,"Tsuga, a Paris-based innovator in AI-Native Resilient Observability, today announced it has raised €30 million ($35 million) in a Series A funding round to scale its GTM motion and accelerate the rollout of their AI agent platform. The round is led by existing investor Singular, with participation from General Catalyst alongside new investors DST Global [&#8230;] The post French observability startup Tsuga lands €30 million to expand AI agent platform appeared first on EU-Startups .",https://www.eu-startups.com/2026/06/french-observability-startup-tsuga-lands-e30-million-to-expand-ai-agent-platform/,2026-06-23 08:10:58+00:00,"Funding, Startups"
War on the Rocks,https://warontherocks.com/feed/,"A Claim to Lead, a Hesitation to Act: Germany’s New Military Strategy","In the public perception, it seems like a big deal for Germany to publish a military strategy for the first time. But let me pour a little cold water on that. A form of military strategy has always existed. Where today we have a National Security Strategy paired with a military strategy and Plan for the Armed Forces, the past offered the White Paper, Defence Policy Guidelines, and the Bundeswehr concept, which spelled out the armed forces&#8217; structure in more concrete terms. Yet even the new military strategy, released in late April, reads more as analysis than as a clear The post A Claim to Lead, a Hesitation to Act: Germany’s New Military Strategy appeared first on War on the Rocks .",https://warontherocks.com/a-claim-to-lead-a-hesitation-to-act-germanys-new-military-strategy/,2026-06-23 07:30:38+00:00,"Defense, Science"
Phys.org,https://phys.org/rss-feed/,Australia has already spent more than $100 million dealing with Varroa mite. Here's what we can do next,"The honeybee mite, Varroa destructor, finally breached Australia's biosecurity defenses four years ago, and is here to stay. Even more concerning, our standard treatments—such as specialized pesticides—are already failing.",https://phys.org/news/2026-06-australia-spent-million-varroa-mite.html,2026-06-23 03:40:01+00:00,Other
Phys.org,https://phys.org/rss-feed/,Childhood experiences of LGBTQ+ stigma can harm romantic relationships decades later,"Childhood rejection, discrimination and bullying can affect your well-being as an adult. If your friends, family or community pushed you away because of your sexuality or gender, these childhood experiences of prejudice can also affect your future relationships.",https://phys.org/news/2026-06-childhood-lgbtq-stigma-romantic-relationships.html,2026-06-23 03:00:01+00:00,Other
Phys.org,https://phys.org/rss-feed/,AI tools may reshape higher education by automating marking and personalizing feedback,"The evolution of higher education in the digital era has attracted global attention, and Prof. S. Joe Qin, president and Wai Kee Kau Chair Professor of Data Science at Lingnan University, published a paper titled ""AI for education: The digital transformation of a liberal arts institution – implementation at Lingnan University"" in the journal Computers and Education: Artificial Intelligence.",https://phys.org/news/2026-06-ai-tools-reshape-higher-automating.html,2026-06-23 02:40:06+00:00,"Science, AI"
Phys.org,https://phys.org/rss-feed/,Estonian-Swedish grammar challenges established theories,A new doctoral thesis from the University of Gothenburg shows that a unique grammatical construction found in Estonia-Swedish dialects contradicts established assumptions about what is possible in Germanic languages.,https://phys.org/news/2026-06-estonia-swedish-grammar-theories.html,2026-06-23 02:00:01+00:00,Other
SpaceNews,https://spacenews.com/feed/,NASA and Boeing still uncertain about when Starliner will return to flight,"NASA’s safety advisers say that while the agency and Boeing make progress in addressing problems with the CST-100 Starliner, it could be up to a year before it flies again. The post NASA and Boeing still uncertain about when Starliner will return to flight appeared first on SpaceNews .",https://spacenews.com/nasa-and-boeing-still-uncertain-about-when-starliner-will-return-to-flight/,2026-06-23 01:48:42+00:00,Other
Phys.org,https://phys.org/rss-feed/,"First quantum biosensor can detect rapid, invisible changes in cells","In the development of diseases such as muscular dystrophy, cancer, Ebola and dengue, numerous chemical reactions take place within and between cells that contribute to disease progression. These changes can occur in less than the blink of an eye—within microseconds or faster—making them difficult to analyze. Quantum sensing offers a way to monitor these changes, helping researchers determine when, where and how rapid biological processes occur.",https://phys.org/news/2026-06-quantum-biosensor-rapid-invisible-cells.html,2026-06-23 01:40:02+00:00,Science
TechCrunch,https://techcrunch.com/feed/,The running list: major tech layoffs in 2026 where employers cited AI,A running look — in reverse chronological order — at the bigger tech companies that have announced significant layoffs this year with AI as a stated factor.,https://techcrunch.com/2026/06/22/the-running-list-major-tech-layoffs-in-2026-where-employers-cited-ai/,2026-06-23 01:27:55+00:00,Other
Phys.org,https://phys.org/rss-feed/,Social inequality can harm the foundations of society,"Can economic inequality threaten liberal societies? This question lies at the heart of the POLAR project led by Markus Gangl, a sociologist at Goethe University Frankfurt. Several publications examining different aspects of the issue shed light on how trust in democracy, belief in meritocracy and perceptions of equal opportunity are changing.",https://phys.org/news/2026-06-social-inequality-foundations-society.html,2026-06-23 01:00:01+00:00,Other
Phys.org,https://phys.org/rss-feed/,Scientists design a clay that can prevent fruits and vegetables from rotting too quickly,"Avocados from Chile, bananas from Costa Rica, tomatoes from southern Spain, mangoes from Brazil. A large share of the fruit and vegetables we eat have traveled across the globe before they reach store shelves here at home. But many millions of tons are lost every year before they get that far.",https://phys.org/news/2026-06-scientists-clay-fruits-vegetables-quickly.html,2026-06-23 00:40:02+00:00,Science
Phys.org,https://phys.org/rss-feed/,"What shapes young lives most? Everyday wins, relationships and school outrank crises","Which major life events matter to young people? A study by the University of Zurich (UZH) shows that adolescents and young adults primarily cite positive, everyday developmental steps as formative events, for example, school and apprenticeships, friendships, first relationships, travel, and moving out of their parents' home. UZH researchers evaluated open-ended written responses from 1,442 participants in a long-term study. Each participant was surveyed at ages 15, 17, 20 and 24.",https://phys.org/news/2026-06-young-everyday-relationships-school-outrank.html,2026-06-23 00:20:01+00:00,Science
Defense News,https://www.defensenews.com/arc/outboundfeeds/rss/,"US Marines in Okinawa receive first MADIS, NMESIS platforms",The delivery marks the service’s latest integration of modernized defenses in the increasingly contested Indo-Pacific.,https://www.defensenews.com/industry/techwatch/2026/06/23/us-marines-in-okinawa-receive-first-madis-nmesis-platforms/,2026-06-23 00:18:41+00:00,Other
TechCrunch,https://techcrunch.com/feed/,OpenAI launches new initiative to help find and patch open source bugs,OpenAI is using AI to help the open source community better protect itself.,https://techcrunch.com/2026/06/22/openai-launches-new-initiative-to-help-find-and-patch-open-source-bugs/,2026-06-23 00:11:31+00:00,AI
Nature,https://www.nature.com/subjects/biotechnology.rss,"Phenolic profiling, synergistic antibacterial and antioxidant potentials of various honey combinations: in vitro and in silico study",,https://www.nature.com/articles/s41598-026-57418-0,2026-06-23 00:00:00+00:00,Science
Nature,https://www.nature.com/subjects/biotechnology.rss,Microwave-accelerated heating in preparation of pectin nanoparticles cross-linked with Mg2+: process optimization and lyophilized product characterization,,https://www.nature.com/articles/s41598-026-59221-3,2026-06-23 00:00:00+00:00,Other
Nature,https://www.nature.com/subjects/biotechnology.rss,Synergistic genomic design and thermal processing mitigate anti-nutritional constraints to enhance the nutritional efficacy of diploid potatoes,,https://www.nature.com/articles/s41538-026-00958-6,2026-06-23 00:00:00+00:00,Other
Nature,https://www.nature.com/subjects/biotechnology.rss,pH-responsive delivery of hydrophobic anticancer drugs using boron and nitrogen Co-doped carbon dots as fluorescent nanocarriers,,https://www.nature.com/articles/s41598-026-59204-4,2026-06-23 00:00:00+00:00,Other
Nature,https://www.nature.com/subjects/biotechnology.rss,"Green synthesis, one-pot reaction, biological evaluation, and molecular docking studies of new pyrazolo[3,4-d]tetrazolo[1,5-a]pyrimidine derivatives",,https://www.nature.com/articles/s41598-026-54555-4,2026-06-23 00:00:00+00:00,Other
Nature,https://www.nature.com/subjects/biotechnology.rss,β-lactamase-mediated hydrolysis of cloxacillin increases tolerance in Escherichia coli,,https://www.nature.com/articles/s44259-026-00241-4,2026-06-23 00:00:00+00:00,Other
Nature,https://www.nature.com/subjects/biotechnology.rss,Enhanced cytotoxic activity and pH-responsive drug delivery of quinalizarin-conjugated gold nanoparticles in non-small cell lung cancer,,https://www.nature.com/articles/s41598-026-49914-0,2026-06-23 00:00:00+00:00,Other
Nature,https://www.nature.com/subjects/biotechnology.rss,Nematicidal potential of Carissa carandas seed extract against Meloidogyne incognita and identification of its bioactive compounds,,https://www.nature.com/articles/s41598-026-58454-6,2026-06-23 00:00:00+00:00,Other
Nature,https://www.nature.com/subjects/biotechnology.rss,Suppressor tRNA-mediated conditionally replicating live vaccine effectively protects pigs against Seneca Valley virus challenge,,https://www.nature.com/articles/s41541-026-01507-8,2026-06-23 00:00:00+00:00,Biotech
Phys.org,https://phys.org/rss-feed/,"Mosquito-borne viruses avoid killing hosts by limiting protein output, study reveals","The increase in mosquito-borne virus infections is a growing public health concern. Diseases traditionally confined to tropical or subtropical regions, like dengue or West Nile virus, are expanding their geographic scope. Europe is no longer an exception, and autochthonous infections have already been recorded in Spain.",https://phys.org/news/2026-06-mosquito-borne-viruses-hosts-limiting.html,2026-06-22 23:50:01+00:00,Science
Phys.org,https://phys.org/rss-feed/,Leaf-based fluorescence test speeds search for plant gene-editing targets,"Gene editing of plant DNA has the potential to produce crops with increased performance and resilience, but it can take a long time to achieve these gains. To shorten this process, scientists often use screening tools to determine where and how edits to the plant genome can be most effective.",https://phys.org/news/2026-06-leaf-based-fluorescence-gene.html,2026-06-22 23:40:03+00:00,Science
Phys.org,https://phys.org/rss-feed/,Making sense of Mars' tiny moon Phobos,"Mars' innermost moon, Phobos, has long puzzled planetary scientists, who have continually debated whether it's a captured asteroid or formed from debris after a giant impactor struck the Martian surface. The key to solving the mystery mainly rests with a better understanding of Phobos' internal structure, which unfortunately remains a ""known unknown.""",https://phys.org/news/2026-06-mars-tiny-moon-phobos.html,2026-06-22 23:40:01+00:00,Science
Phys.org,https://phys.org/rss-feed/,Women negotiate as effectively as men—but leave people happier,"Men and women achieve similar economic outcomes in negotiations, but female negotiators foster stronger interpersonal relationships, which lead in turn to greater satisfaction with the result and a greater desire to negotiate with that woman again in the future.",https://phys.org/news/2026-06-women-effectively-men-people-happier.html,2026-06-22 23:30:01+00:00,Other
Phys.org,https://phys.org/rss-feed/,Nanotube-based thermoelectrics open a new pathway to waste-heat energy conversion,"Whenever someone asks ChatGPT a question, heat is generated somewhere in the server room—a data center. When an electric vehicle battery generates heat during operation, the heat must be managed continuously. Manufacturing processes also generate large amounts of waste heat, much of which is simply released into the atmosphere. But what if we could convert this waste heat back into electricity? Recently, a research team in Korea brought this possibility one step closer to reality.",https://phys.org/news/2026-06-nanotube-based-thermoelectrics-pathway-energy.html,2026-06-22 23:20:01+00:00,Science
Breaking Defense,https://breakingdefense.com/feed/,Executive order jumpstarts Pentagon’s quantum sensor projects,"Two executive orders signed today direct the Defense Department to field three new types of quantum sensors by 2028, assist the Energy Department in building a quantum supercomputer, and advise other agencies on defeating quantum hackers.",https://breakingdefense.com/2026/06/executive-order-jumpstarts-pentagons-quantum-sensor-projects/,2026-06-22 23:14:17+00:00,Defense
Phys.org,https://phys.org/rss-feed/,Insects exhibit evidence of a daily body clock for humidity,"In a novel experiment at the University of Cincinnati, researchers recently isolated kissing bugs, fruit flies, mosquitoes and spider beetles in a climate- and light-controlled environment and found that they responded predictably to cycles of humidity in the same way they do to temperature and daylight. After the humidity cue was removed, the insects continued to respond to the cyclical fluctuations of humidity and dryness established in the experiment. The study is published in the journal npj Biological Timing and Sleep.",https://phys.org/news/2026-06-insects-evidence-daily-body-clock.html,2026-06-22 23:10:01+00:00,Science
Phys.org,https://phys.org/rss-feed/,Seal pups and seabird chicks are suffering in extreme weather. How can we protect them?,"Extreme weather is becoming the new normal, disrupting human communities across the globe.",https://phys.org/news/2026-06-pups-seabird-chicks-extreme-weather.html,2026-06-22 23:00:03+00:00,Other
TechCrunch,https://techcrunch.com/feed/,Tesla pushes back on Autopilot narrative after fatal Texas crash,"Whether the Autopilot system was truly active, overridden, or malfunctioning likely won't be resolved until investigators finish combing through the vehicle's data logs.",https://techcrunch.com/2026/06/22/tesla-pushes-back-on-autopilot-narrative-after-fatal-texas-crash/,2026-06-22 22:59:57+00:00,Other
Phys.org,https://phys.org/rss-feed/,"Artificial light is keeping reef fish awake, and the effects may ripple across coral reefs","Artificial light spilling into coastal waters from cities, ports, roads and hotels is disrupting sleep in coral reef fish and is associated with changes in markers linked to brain health, according to a new study from Bar-Ilan University. The paper, published in Current Biology, shows that even low levels of nighttime illumination can significantly alter the behavior and physiology of reef fish. Fish exposed to artificial light slept less, showed more fragmented sleep, became more aggressive and fed at unusual hours, effectively behaving as if night had turned into day.",https://phys.org/news/2026-06-artificial-reef-fish-effects-ripple.html,2026-06-22 22:50:01+00:00,Science
TechCrunch,https://techcrunch.com/feed/,"Shareholders sue Uber’s board over sexual assaults, other incidents","The lawsuit, led by a Detroit pension fund, alleges Uber's board and management has cut too many compliance corners, resulting in thousands of lawsuits.",https://techcrunch.com/2026/06/22/shareholders-sue-ubers-board-over-sexual-assaults-other-incidents/,2026-06-22 22:43:12+00:00,Other
Phys.org,https://phys.org/rss-feed/,"EU risks a crisis if it fails to halt pollinator loss, researchers warn","A new white paper from eight major EU-funded pollinator projects warns that the resilience of Europe's vital societal functions and food security are at stake if the EU fails to halt and reverse wild pollinator declines and support managed pollinators. Behind the report is an interdisciplinary team of 135 leading researchers with expertise ranging from ecosystem ecology, pollinator ecology, ecological economics, social science, environmental history, behavioral psychology, political science and environmental law.",https://phys.org/news/2026-06-eu-crisis-halt-pollinator-loss.html,2026-06-22 22:40:03+00:00,Science
Phys.org,https://phys.org/rss-feed/,"California has lost more than half of its coastal sand dunes, first-ever assessment reveals","A study conducted by UC Santa Barbara researchers and collaborators has found that California has lost more than half of its coastal dune systems. The researchers' assessment—the first of its kind for the California coast—estimates that 60% of dune systems that existed from 1850 have been lost, due to a combination of urban development, land-use changes and erosion.",https://phys.org/news/2026-06-california-lost-coastal-sand-dunes.html,2026-06-22 22:40:01+00:00,Science
Phys.org,https://phys.org/rss-feed/,Bird-derived gene tool inserts plant DNA 30 times more efficiently than CRISPR,"In a rapidly changing climate landscape, the plants we rely on for food, textiles and more face a multitude of challenges, including rising temperatures, drought and disease. Caltech's Gözde Demirer, the Clare Boothe Luce Assistant Professor of Chemical Engineering, uses genetic engineering tools to make crops more resilient to such threats and enhance plant health. Now, she and a team of Caltech researchers have found a new solution to an old problem in an unlikely source: the zebra finch.",https://phys.org/news/2026-06-bird-derived-gene-tool-inserts.html,2026-06-22 22:30:06+00:00,"Biotech, Science"
Phys.org,https://phys.org/rss-feed/,"Chaotic polymer vibrations may unlock stronger, flexible thermal insulators","University of Massachusetts Amherst researchers have demonstrated a possible new avenue for developing flame-retardant and generally low-conductivity (low-heat-transfer) plastics that retain the benefits of being strong and flexible by limiting the accessibility of heat-carrying vibrational channels in the material. This new design framework has promising applications, including lightweight thermal insulation materials for spacesuits, thermal protection components for spacecraft, and advanced building materials that reduce heating and cooling losses. The study is published in the journal Materials Horizons.",https://phys.org/news/2026-06-chaotic-polymer-vibrations-stronger-flexible.html,2026-06-22 22:30:01+00:00,Science
Phys.org,https://phys.org/rss-feed/,Experiment upends beliefs on how electrons actually behave in warm dense matter,"Researchers at European XFEL, Helmholtz-Zentrum Dresden-Rossendorf (HZDR), Rostock University and other collaborating institutions have used high-precision experiments to demonstrate that the most widely used models for the behavior of electrons in warm dense matter are inaccurate. Warm dense matter is challenging to study, but also is of key importance for a plethora of research, including the investigation of planetary interiors, materials science and laser fusion experiments. The study is published in Physical Review Letters.",https://phys.org/news/2026-06-upends-beliefs-electrons-dense.html,2026-06-22 22:20:06+00:00,Science
Phys.org,https://phys.org/rss-feed/,Cats age like humans—could studying their brains reveal healthy aging secrets?,"Domestic cats age in remarkably similar ways to humans and show comparable age-related patterns of brain deterioration, according to an international collaboration among the University of Bath in the U.K., Auburn University College of Veterinary Medicine in the U.S. and École Nationale Vétérinaire de Toulouse in France.",https://phys.org/news/2026-06-cats-age-humans-brains-reveal.html,2026-06-22 22:10:03+00:00,Other
Phys.org,https://phys.org/rss-feed/,How solar wind forecasting will help define heliosphere's boundaries,Southwest Research Institute (SwRI) scientists are using a solar wind forecasting method combined with analytic and numerical heliosphere models to find out where the first plasma boundary of the outer heliosphere lies as NASA's New Horizons spacecraft hurtles toward this mysterious region of space.,https://phys.org/news/2026-06-solar-heliosphere-boundaries.html,2026-06-22 22:10:01+00:00,Science
Phys.org,https://phys.org/rss-feed/,Protein-tagging technology maps a hidden communication network between organs,"The body's organs are in constant communication. Fat tissue tells the liver when to store or release energy, the immune system signals localized inflammation, and thousands of proteins carry these messages to organs throughout the body. But while scientists have long known these conversations exist, they have struggled to identify exactly which cells are sending which messages.",https://phys.org/news/2026-06-protein-tagging-technology-hidden-communication.html,2026-06-22 22:00:07+00:00,Science
Phys.org,https://phys.org/rss-feed/,"The climate crisis threatens river microbial biodiversity, study shows","Aquatic fungi are microorganisms that play a key role in the ecological balance of rivers. They help decompose organic matter, degrade contaminants and are part of the nutrient and energy cycle in freshwater ecosystems. Despite their ecological importance, a study published in the journal Freshwater Biology warns that the biodiversity and biological functions of these microorganisms in these natural environments are at risk due to rising temperatures, prolonged dry periods and the loss of riparian vegetation caused by climate change.",https://phys.org/news/2026-06-climate-crisis-threatens-river-microbial.html,2026-06-22 22:00:02+00:00,Science
Phys.org,https://phys.org/rss-feed/,Corrected Pantheon+ analysis of supernovae challenges accelerating universe claim,"Research led by the Tata Institute of Fundamental Research, Mumbai, along with Professor Subir Sarkar from the University of Oxford, questions the widely accepted argument that the expansion rate of the universe is accelerating and that this is driven by ""dark energy"" arising from the quantum vacuum. Their letter has been published in Monthly Notices of the Royal Astronomical Society.",https://phys.org/news/2026-06-pantheon-analysis-supernovae-universe.html,2026-06-22 21:50:03+00:00,Science
Phys.org,https://phys.org/rss-feed/,How cyanobacteria developed photosynthetic membranes over the course of evolution,"A new study provides the first insights into how thylakoid membranes—the internal compartments where oxygen-producing photosynthesis takes place—emerged during evolution. By comparing the genomes of cyanobacteria with and without thylakoids, the researchers identified proteins that may have contributed to their formation. The work is published in the journal New Phytologist.",https://phys.org/news/2026-06-cyanobacteria-photosynthetic-membranes-evolution.html,2026-06-22 21:50:01+00:00,Science
Phys.org,https://phys.org/rss-feed/,"Podcasts move stocks but fail to beat market, analysis of 25,000 episodes shows","Investment podcasts can prompt investors to take action. However, they do not provide a reliable return advantage. This is shown in a new working paper by Prof. Dr. Marten Laudi of Kühne Logistics University (KLU) and Janik Ole Wecks of the University of Bremen. Using more than 25,000 episodes, the study examines how podcast content about publicly traded companies and stocks correlates with trading activity, price movements and investment returns.",https://phys.org/news/2026-06-podcasts-stocks-analysis-episodes.html,2026-06-22 21:40:06+00:00,"Science, Funding"
Phys.org,https://phys.org/rss-feed/,Feeding data to AI to speed up drug discovery,"Developing new medicines can require thousands of chemistry experiments to identify the right recipe for a safe, effective and ideally affordable drug.",https://phys.org/news/2026-06-ai-drug-discovery.html,2026-06-22 21:40:03+00:00,"Biotech, Science"
SpaceNews,https://spacenews.com/feed/,Trump executive order directs NASA to plan quantum space applications,"The White House has issued an executive order aiming to unify and accelerate U.S. development of quantum technologies, including space systems that could enable next-generation navigation, sensing and secure communications. The post Trump executive order directs NASA to plan quantum space applications appeared first on SpaceNews .",https://spacenews.com/trump-signs-executive-order-to-accelerate-quantum-space-infrastructure/,2026-06-22 21:37:08+00:00,Other
