source,feed_url,headline,summary,url,published_date,topics
EU-Startups,https://www.eu-startups.com/feed/,"Factorial raises €129 million, reaching €2.1 billion valuation to become on of Europe’s most valuable scale-ups","Spanish HRTech unicorn Factorial is today announcing the closing of a €129 million ($150 million) Series D funding round, propelling their valuation to €2.1 billion ($2.5 billion) and positioning them as one of the top 20 most valuable scale-ups in the EU. The round was led by General Catalyst, making its its first equity investment [&#8230;] The post Factorial raises €129 million, reaching €2.1 billion valuation to become on of Europe&#8217;s most valuable scale-ups appeared first on EU-Startups .",https://www.eu-startups.com/2026/06/factorial-raises-e129-million-reaching-e2-1-billion-valuation-to-become-on-of-europes-most-valuable-scale-ups/,2026-06-03 09:12:13+00:00,"Funding, Startups"
EU-Startups,https://www.eu-startups.com/feed/,Reinventing food waste: 10 European startups creating value from leftovers,"European startups are rethinking what happens to food once it leaves the traditional supply chain. What was once seen mainly as waste, from surplus groceries and restaurant stock to side-streams such as spent yeast, broccoli stems, and industrial by-products, is increasingly being turned into more affordable food options, alternative ingredients, animal feed, and even fertilisers. [&#8230;] The post Reinventing food waste: 10 European startups creating value from leftovers appeared first on EU-Startups .",https://www.eu-startups.com/2026/06/reinventing-food-waste-10-european-startups-creating-value-from-leftovers/,2026-06-03 08:30:04+00:00,Startups
Science,https://www.science.org/rss/news_current.xml,"NIH scientists criminally charged for bringing monkeypox virus into US, although samples ‘inactivated’",Defendants plead not guilty but could face up to 5 years prison for alleged “smuggling” and “conspiracy”,https://www.science.org/content/article/nih-scientists-criminally-charged-bringing-monkeypox-virus-us-although-samples,2026-06-03 08:05:34+00:00,Science
Labiotech,https://www.labiotech.eu/feed/,Surge in M&As driven by patent expirations,"We look at how rising acquisitions in the life science industry are being driven by patent cliffs. The post Surge in M&amp;As driven by patent expirations appeared first on Labiotech.eu . © Labiotech UG and Labiotech.eu. Unauthorized use and/or duplication of this material without express and written permission from this site’s author and/or owner is strictly prohibited. Excerpts and links may be used, provided that full and clear credit is given to Labiotech UG and Labiotech.eu with appropriate and specific direction to the original content.",https://www.labiotech.eu/trends-news/surge-in-mas-driven-by-patent-expirations/,2026-06-03 08:03:29+00:00,Other
EU-Startups,https://www.eu-startups.com/feed/,CEA-Leti and CNRS spin-off Quobly raises €115 million to industrialise silicon-based quantum computers,"Quobly, a Grenoble-based quantum computing company, today announced the closing of a €115 million Series A financing to accelerate the industrialisation of its silicon-based quantum computers and launch its first commercial product by the end of 2026. The round was led by Bpifrance, SEALSQ and STMicroelectronics, with participation from the European Innovation Council (EIC), Blast, [&#8230;] The post CEA-Leti and CNRS spin-off Quobly raises €115 million to industrialise silicon-based quantum computers appeared first on EU-Startups .",https://www.eu-startups.com/2026/06/cea-leti-and-cnrs-spin-off-quobly-raises-e115-million-to-industrialise-silicon-based-quantum-computers/,2026-06-03 07:37:10+00:00,"Funding, Startups"
War on the Rocks,https://warontherocks.com/feed/,The Rain in Spain Falls Harder on Ukraine: Rethinking the Spanish Civil War Analogy,"In 2023, the NATO Baltic Defense College in Tartu, Estonia devoted its entire annual conference to the Interwar Period (1919 to 1939), a theme repeated at subsequent conferences sponsored by national militaries and academic societies throughout the United States and Europe. Western scholars and foreign policy analysts, provoked by Russia&#8217;s 2022 invasion of Ukraine, seem persuaded that we are living at the close of another interwar era &#8212; one in which an egotistical European power shatters a decades-long continental truce, established and upheld by an international rules-based order, by invading a smaller neighbor ostensibly to defend threatened national minorities. A The post The Rain in Spain Falls Harder on Ukraine: Rethinking the Spanish Civil War Analogy appeared first on War on the Rocks .",https://warontherocks.com/the-rain-in-spain-falls-harder-on-ukraine-rethinking-the-spanish-civil-war-analogy/,2026-06-03 07:30:21+00:00,Defense
Nature,https://www.nature.com/nature.rss,Cell-type-resolved genetic variation shapes inflammatory bowel disease risk,"Nature, Published online: 03 June 2026; doi:10.1038/s41586-026-10627-z Single-cell mapping of cis-expression quantitative trait loci in inflammatory bowel disease revealed distal, enhancer-enriched variants detected at the cell-type level more frequently co-localize with genome-wide association study loci than those identified at the tissue level.",https://www.nature.com/articles/s41586-026-10627-z,2026-06-03 00:00:00+00:00,Science
Nature,https://www.nature.com/nature.rss,Nuclear shell structure governs short-range nucleon pairing,"Nature, Published online: 03 June 2026; doi:10.1038/s41586-026-10616-2 The scattering of high-energy electrons from three different nuclei demonstrated that short-range-correlated pairing depends far more on the specific quantum orbitals occupied by nucleons than predicted by theoretical models.",https://www.nature.com/articles/s41586-026-10616-2,2026-06-03 00:00:00+00:00,Science
Nature,https://www.nature.com/nature.rss,Enamel nanocrystal misorientation increased with meat-eating and agriculture,"Nature, Published online: 03 June 2026; doi:10.1038/s41586-026-10583-8 An analysis of enamel nanocrystal misorientation in primate and human teeth across three major dietary shifts in human evolution shows that misorientation increased with harder diets, suggesting that misorientation contributes to enamel’s resilience.",https://www.nature.com/articles/s41586-026-10583-8,2026-06-03 00:00:00+00:00,Science
Nature,https://www.nature.com/nature.rss,Microsoft upgrades controversial quantum chip — researchers are still sceptical,"Nature, Published online: 03 June 2026; doi:10.1038/d41586-026-01788-y The tech giant says it will make ‘topological’ quantum computers that can be scaled up faster than competing technologies.",https://www.nature.com/articles/d41586-026-01788-y,2026-06-03 00:00:00+00:00,Science
Nature,https://www.nature.com/nature.rss,How a rush for minerals is causing deforestation in tropical regions,"Nature, Published online: 03 June 2026; doi:10.1038/d41586-026-01582-w An analysis of the extent to which mining caused deforestation between 2001 and 2020 in areas near mines in sub-Saharan Africa could help conservation efforts.",https://www.nature.com/articles/d41586-026-01582-w,2026-06-03 00:00:00+00:00,Science
Nature,https://www.nature.com/nature.rss,What a royal bedchamber provides the queen bee,"Nature, Published online: 03 June 2026; doi:10.1038/d41586-026-01580-y When considering what shapes animal development, factors such as genetics come to mind. For a queen bee, however, her special wax home also has a role.",https://www.nature.com/articles/d41586-026-01580-y,2026-06-03 00:00:00+00:00,Science
Nature,https://www.nature.com/nature.rss,A maize gene that coordinates flowering aids drought resistance,"Nature, Published online: 03 June 2026; doi:10.1038/d41586-026-01745-9 The synchronous flowering of male and female flower clusters in maize is crucial, but drought disrupts this synchrony, leading to considerable yield losses. A gene called SAUR72 is shown to preserve flowering synchrony in drought conditions, offering a potential strategy for breeding drought-resilient maize varieties.",https://www.nature.com/articles/d41586-026-01745-9,2026-06-03 00:00:00+00:00,Science
Nature,https://www.nature.com/nature.rss,‘Transformative’ CAR-T therapy allows three people to receive kidney transplants,"Nature, Published online: 03 June 2026; doi:10.1038/d41586-026-01761-9 They had ‘highly sensitized’ immune systems that usually reject donated organs, leaving them with few options for survival.",https://www.nature.com/articles/d41586-026-01761-9,2026-06-03 00:00:00+00:00,Science
Nature,https://www.nature.com/nature.rss,Centromeric footprints preserve telomere integrity in ALT cancers,"Nature, Published online: 03 June 2026; doi:10.1038/s41586-026-10598-1 Centromeric DNA repeat insertions and CENP-A chromatin assembly are identified as genomic signatures that preserve telomere integrity in ALT cancer cells.",https://www.nature.com/articles/s41586-026-10598-1,2026-06-03 00:00:00+00:00,Science
Nature,https://www.nature.com/nature.rss,Jupiter observations reveal a simple scaling law for particle acceleration,"Nature, Published online: 03 June 2026; doi:10.1038/d41586-026-01412-z Supersonic shocks in the vicinity of Jupiter suggest that transient plasma structures could govern the acceleration of particles travelling through space.",https://www.nature.com/articles/d41586-026-01412-z,2026-06-03 00:00:00+00:00,Science
Nature,https://www.nature.com/nature.rss,Recovery of plastic from mixed waste boosts recycling rates but affects quality,"Nature, Published online: 03 June 2026; doi:10.1038/d41586-026-01759-3 Recovering plastic packaging from mixed domestic waste, as well as collecting plastic waste already sorted by households, increases recycling volumes but raises contamination and safety risks. Policies that support the sorting of plastics from mixed waste at central facilities should have strict quality standards and investment in advanced purification systems to ensure safe recycling outcomes.",https://www.nature.com/articles/d41586-026-01759-3,2026-06-03 00:00:00+00:00,"Funding, Science"
Nature,https://www.nature.com/nature.rss,High-pulse-energy integrated mode-locked laser using a Mamyshev oscillator,"Nature, Published online: 03 June 2026; doi:10.1038/s41586-026-10517-4 A Mamyshev oscillator mode-locked laser compactly integrated on a photonic-chip delivers nanojoule, femtosecond pulses.",https://www.nature.com/articles/s41586-026-10517-4,2026-06-03 00:00:00+00:00,Science
Nature,https://www.nature.com/nature.rss,Why a synthetic human genome is still worth building,"Nature, Published online: 03 June 2026; doi:10.1038/d41586-026-01725-z A decade on from the launch of an ambitious project, it’s time to revisit the reasons for constructing a human genome from scratch.",https://www.nature.com/articles/d41586-026-01725-z,2026-06-03 00:00:00+00:00,Science
Nature,https://www.nature.com/nature.rss,Editorial Expression of Concern: Functional proteomic identification of DNA replication proteins by induced proteolysis in vivo,"Nature, Published online: 03 June 2026; doi:10.1038/s41586-026-10727-w Editorial Expression of Concern: Functional proteomic identification of DNA replication proteins by induced proteolysis in vivo",https://www.nature.com/articles/s41586-026-10727-w,2026-06-03 00:00:00+00:00,Science
Nature,https://www.nature.com/nature.rss,Book of Cron Job,"Nature, Published online: 03 June 2026; doi:10.1038/d41586-026-01716-0 Code of conduct.",https://www.nature.com/articles/d41586-026-01716-0,2026-06-03 00:00:00+00:00,Science
Nature,https://www.nature.com/nature.rss,LASER couples damage sensing to ESCRT assembly for lysosome repair,"Nature, Published online: 03 June 2026; doi:10.1038/s41586-026-10604-6 ATG8 conjugation on damaged lysosomes triggers rapid assembly of a protein complex containing TFG, which directs lysosomal membrane repair by recruiting ESCRT proteins to sites of damage.",https://www.nature.com/articles/s41586-026-10604-6,2026-06-03 00:00:00+00:00,Science
Nature,https://www.nature.com/nature.rss,Cooperation conflicts with equality when allocating public goods,"Nature, Published online: 03 June 2026; doi:10.1038/s41586-026-10550-3 Uniform sharing of public goods can boost cooperation in social networks, but often concentrates benefits among well-connected individuals, creating inequality despite greater collective success.",https://www.nature.com/articles/s41586-026-10550-3,2026-06-03 00:00:00+00:00,Science
Nature,https://www.nature.com/nature.rss,Mechanophore cross-linking enhances ballistic energy dissipation of polymers,"Nature, Published online: 03 June 2026; doi:10.1038/s41586-026-10557-w Embedding a small fraction of force-sensitive mechanophores as cross-links into common polymers enhances ballistic energy dissipation.",https://www.nature.com/articles/s41586-026-10557-w,2026-06-03 00:00:00+00:00,Science
Nature,https://www.nature.com/nature.rss,Queen cell architecture shapes honey bee queen development,"Nature, Published online: 03 June 2026; doi:10.1038/s41586-026-10534-3 Worker bee construction behaviour actively engineers a physicochemical niche that is crucial for queen development in honey bees.",https://www.nature.com/articles/s41586-026-10534-3,2026-06-03 00:00:00+00:00,Science
Nature,https://www.nature.com/nature.rss,AI in science recruitment: friend or foe? Join our free webinar,"Nature, Published online: 03 June 2026; doi:10.1038/d41586-026-01774-4 Discover the strengths, limitations and risks associated with using artificial intelligence in your science job applications.",https://www.nature.com/articles/d41586-026-01774-4,2026-06-03 00:00:00+00:00,"Science, AI"
Nature,https://www.nature.com/nature.rss,Teosinte alleles enhance nitrogen assimilation and seed protein in maize,"Nature, Published online: 03 June 2026; doi:10.1038/s41586-026-10575-8 Teosinte alleles enhance nitrogen assimilation and seed protein without lowering crop yield when expressed in modern maize, providing a powerful strategy for crop improvement to meet future population demands.",https://www.nature.com/articles/s41586-026-10575-8,2026-06-03 00:00:00+00:00,Science
Nature,https://www.nature.com/nature.rss,High-fidelity modular skeletons authenticate a Cambrian origin for Bryozoa,"Nature, Published online: 03 June 2026; doi:10.1038/s41586-026-10590-9 Exquisite early Cambrian fossils of Protomelission gatehousei and Dayingomelission hexaclitia preserve soft-tissue anatomy and skeletal microstructure, confirming that these taxa are definitively bryozoans and indicating a deeper origin for the Bryozoa than was first apparent.",https://www.nature.com/articles/s41586-026-10590-9,2026-06-03 00:00:00+00:00,Science
Nature,https://www.nature.com/nature.rss,Can an army of babies and dogs rescue psychology from its reproducibility crisis?,"Nature, Published online: 03 June 2026; doi:10.1038/d41586-026-01727-x Labs are teaming up to run a host of huge projects that aim to bring rigour to cognitive science.",https://www.nature.com/articles/d41586-026-01727-x,2026-06-03 00:00:00+00:00,"Science, Defense"
Nature,https://www.nature.com/nature.rss,Commensal-derived acetylcholine enhances mucosal immune education,"Nature, Published online: 03 June 2026; doi:10.1038/s41586-026-10592-7 A diet–microbiome–host axis strengthens mucosal immune defences and reinforces host–microbiota mutualism.",https://www.nature.com/articles/s41586-026-10592-7,2026-06-03 00:00:00+00:00,Science
Nature,https://www.nature.com/nature.rss,Chiral superfluorescence from perovskite superlattices at room temperature,"Nature, Published online: 03 June 2026; doi:10.1038/s41586-026-10637-x Chiral perovskite superlattices exhibit room-temperature circularly polarized superfluorescence, with emission intensity and polarization controllable by weak magnetic fields.",https://www.nature.com/articles/s41586-026-10637-x,2026-06-03 00:00:00+00:00,Science
Nature,https://www.nature.com/nature.rss,Your phone can use tiny skin-colour changes to measure your heart rate,"Nature, Published online: 03 June 2026; doi:10.1038/d41586-026-01793-1 Passive heart-rate monitoring during regular phone use could provide early warning of health issues — plus, testing Richard Feynman’s solution to the ‘restaurant dilemma’ problem.",https://www.nature.com/articles/d41586-026-01793-1,2026-06-03 00:00:00+00:00,Science
Nature,https://www.nature.com/nature.rss,Analysis of trade-offs of post-sorting plastic packaging,"Nature, Published online: 03 June 2026; doi:10.1038/s41586-026-10606-4 An analysis of post-sorting plastic packaging shows that target polymer purity is similar across source-separation and post-sorting pathways, but post-sorted plastics contain more contaminants that need to be removed before recyclate production.",https://www.nature.com/articles/s41586-026-10606-4,2026-06-03 00:00:00+00:00,Science
Nature,https://www.nature.com/nature.rss,Plastoglobules compartmentalize nitrogen assimilation in maize,"Nature, Published online: 03 June 2026; doi:10.1038/s41586-026-10610-8 Chloroplast plastoglobules act as nitrogen-assimilation hubs in maize, with key enzymes enhancing nitrogen-use efficiency and offering new strategies for developing high-yield, sustainable crops.",https://www.nature.com/articles/s41586-026-10610-8,2026-06-03 00:00:00+00:00,Science
Nature,https://www.nature.com/nature.rss,How good are ‘AI doctors’ — and will they take over medicine?,"Nature, Published online: 03 June 2026; doi:10.1038/d41586-026-01691-6 Nature talks to specialists about whether people might soon be diagnosed by artificial-intelligence systems.",https://www.nature.com/articles/d41586-026-01691-6,2026-06-03 00:00:00+00:00,Science
Nature,https://www.nature.com/nature.rss,Spermine is an endogenous iron chelator that inhibits ferroptosis,"Nature, Published online: 03 June 2026; doi:10.1038/s41586-026-10597-2 A non-canonical metabolic route for spermine synthesis mediated by ALDH18A1 limits iron availability and lipid peroxidation in hepatocellular carcinoma.",https://www.nature.com/articles/s41586-026-10597-2,2026-06-03 00:00:00+00:00,Science
Nature,https://www.nature.com/nature.rss,Cold-induced peptide signalling secures pollen resilience and crop yield,"Nature, Published online: 03 June 2026; doi:10.1038/s41586-026-10603-7 A small-peptide signalling axis involving RGF family members controls resilience to cold stress in tomatoes and rice; modulating this pathway prevents cold-induced yield losses.",https://www.nature.com/articles/s41586-026-10603-7,2026-06-03 00:00:00+00:00,Science
Nature,https://www.nature.com/nature.rss,Mining triggers extensive additional deforestation in sub-Saharan Africa,"Nature, Published online: 03 June 2026; doi:10.1038/s41586-026-10551-2 Extensive mining activity leads to large-scale deforestation of dense tropical forests across sub-Saharan Africa, driven particularly by key energy transition minerals such as cobalt.",https://www.nature.com/articles/s41586-026-10551-2,2026-06-03 00:00:00+00:00,Science
Nature,https://www.nature.com/nature.rss,Acquired genetic and cell-state changes in IDH-mutant glioma progression,"Nature, Published online: 03 June 2026; doi:10.1038/s41586-026-10612-6 Longitudinal transcriptomic, chromatin and genomic analyses of the two types of IDH-mutant glioma reveal in detail how disease progression is influenced by interdependent genetic, epigenetic and microenvironmental factors.",https://www.nature.com/articles/s41586-026-10612-6,2026-06-03 00:00:00+00:00,Science
Nature,https://www.nature.com/nature.rss,Relativistic electron acceleration at the bow shock of Jupiter and beyond,"Nature, Published online: 03 June 2026; doi:10.1038/s41586-026-10473-z NASA’s Juno observations show relativistic electron acceleration at the bow shock of Jupiter and establish a universal scaling law linking shock size to maximum cosmic ray energy.",https://www.nature.com/articles/s41586-026-10473-z,2026-06-03 00:00:00+00:00,Science
Nature,https://www.nature.com/nature.rss,Earth’s east–west albedo symmetry,"Nature, Published online: 03 June 2026; doi:10.1038/s41586-026-10624-2 Analysis of a 25-year satellite record shows that Earth has a persistent east–west albedo symmetry split at 27° E, with clear-sky albedo, cloud radiative effect and open-ocean fraction exhibiting a triple symmetry around this meridian.",https://www.nature.com/articles/s41586-026-10624-2,2026-06-03 00:00:00+00:00,Science
Nature,https://www.nature.com/nature.rss,A natural depsipeptide antibiotic binds the E-site of the bacterial ribosome,"Nature, Published online: 03 June 2026; doi:10.1038/s41586-026-10589-2 Improved fractionation strategies can identify antibiotics with previously unseen scaffolds and mechanisms, exemplified by manikomycin from Streptomyces rimosus, which acts by targeting the E-site of the bacterial large ribosomal subunit.",https://www.nature.com/articles/s41586-026-10589-2,2026-06-03 00:00:00+00:00,Science
Nature,https://www.nature.com/nature.rss,The size of tropical vegetation gross primary production,"Nature, Published online: 03 June 2026; doi:10.1038/s41586-026-10562-z The size of tropical vegetation gross primary production",https://www.nature.com/articles/s41586-026-10562-z,2026-06-03 00:00:00+00:00,Science
Nature,https://www.nature.com/nature.rss,Reply to: The size of tropical vegetation gross primary production,"Nature, Published online: 03 June 2026; doi:10.1038/s41586-026-10561-0 Reply to: The size of tropical vegetation gross primary production",https://www.nature.com/articles/s41586-026-10561-0,2026-06-03 00:00:00+00:00,Science
Defense News,https://www.defensenews.com/arc/outboundfeeds/rss/,The US military wants to showcase battle-ready laser weapons by 2028,"A directed energy demonstration is expected to occur during the summer of 2028, as part of a series of planned Golden Dome-related events.",https://www.defensenews.com/industry/techwatch/2026/06/02/the-us-military-wants-to-showcase-battle-ready-laser-weapons-by-2028/,2026-06-02 23:46:29+00:00,Defense
SpaceNews,https://spacenews.com/feed/,"NRO nominee says commercial space, AI are reshaping spy satellite agency","In a confirmation hearing, Roger Mason said clear government demand signals are needed as private investment transforms the space intelligence market The post NRO nominee says commercial space, AI are reshaping spy satellite agency appeared first on SpaceNews .",https://spacenews.com/nro-nominee-says-commercial-space-ai-are-reshaping-spy-satellite-agency/,2026-06-02 22:22:44+00:00,Funding
Breaking Defense,https://breakingdefense.com/feed/,How AI is shaping the future of geospatial intelligence,"From AI adoption and explainability to new commercial satellite contracts, Breaking Defense’s latest eBook brings together reporting from GEOINT 2026 on how intelligence leaders are shaping the future of space-based geospatial intelligence.",https://breakingdefense.com/2026/06/how-ai-is-shaping-the-future-of-geospatial-intelligence/,2026-06-02 21:33:19+00:00,Defense
Breaking Defense,https://breakingdefense.com/feed/,Trump executive order on AI gives central role to NSA,The EO creates a “voluntary framework” for AI developers to give the government early access to their latest tech.,https://breakingdefense.com/2026/06/trump-executive-order-on-ai-gives-central-role-to-nsa/,2026-06-02 21:25:35+00:00,Other
Payload Space,https://payloadspace.com/feed/,Blue Origin Commits to Return to Flight This Year,"After assessing the damage to the launch pad and the surrounding infrastructure, Blue Origin CEO Dave Limp posted on X that Blue Origin “will fly again before the end of this year.” The post Blue Origin Commits to Return to Flight This Year appeared first on Payload .",https://payloadspace.com/blue-origin-commits-to-return-to-flight-this-year/,2026-06-02 20:39:20+00:00,Other
C4ISRNET,https://www.c4isrnet.com/arc/outboundfeeds/rss/,"Hackers compromised a senior Space Force official’s Instagram, posting anti-American content",Chief Master Sergeant of the Space Force John Bentivegna’s Instagram was controlled by hackers who posted stories and images on Sunday.,https://www.c4isrnet.com/news/your-military/2026/06/02/hackers-compromised-a-senior-space-force-officials-instagram-posting-anti-american-content/,2026-06-02 20:30:50+00:00,Other
Satellite Today,https://www.satellitetoday.com/feed/,Impulse Space Raises Another Massive Funding Round in $500M Series D,"Impulse Space has raised another massive funding round, of $500 million in Series D funding announced on Tuesday. 137 Ventures and Banner VC led the round. The company says this [&#8230;] The post Impulse Space Raises Another Massive Funding Round in $500M Series D appeared first on Via Satellite .",https://www.satellitetoday.com/finance/2026/06/02/impulse-space-raises-another-massive-funding-round-in-500m-series-d/,2026-06-02 19:34:21+00:00,Funding
Satellite Today,https://www.satellitetoday.com/feed/,Iceye U.S. Appoints ASRC Federal Exec Ann Stevens as CEO,"Iceye’s U.S. subsidiary has appointed Ann Stevens to the role of CEO, as Eric Jensen who held the position, takes the role of COO of Iceye. Stevens joins Iceye US [&#8230;] The post Iceye U.S. Appoints ASRC Federal Exec Ann Stevens as CEO appeared first on Via Satellite .",https://www.satellitetoday.com/people/2026/06/02/iceye-u-s-appoints-asrc-federal-exec-ann-stevens-as-ceo/,2026-06-02 19:28:54+00:00,Other
