source,feed_url,headline,summary,url,published_date,topics
Satellite Today,https://www.satellitetoday.com/feed/,MDA Space to Supply Antennas to BAE Systems for Epoch 2 Missile Warning Constellation,"BAE Systems has tapped MDA Space as a supplier for the Epoch 2 missile warning constellation for the U.S. Space Force. Under a subcontract announced Tuesday, MDA Space will design [&#8230;] The post MDA Space to Supply Antennas to BAE Systems for Epoch 2 Missile Warning Constellation appeared first on Via Satellite .",https://www.satellitetoday.com/government-military/2026/06/02/mda-space-to-supply-antennas-to-bae-systems-for-epoch-2-missile-warning-constellation/,2026-06-02 19:24:25+00:00,"Space, Defense"
Satellite Today,https://www.satellitetoday.com/feed/,Juniper Research Expects Massive Spike in Direct-to-Cell Subscribers,"There could be over 130 million active monthly direct-to-cell (D2C) users by 2031, according to a new report from Juniper Research, &#8220;Direct to Cell Market 2026 – 2031.&#8221; Juniper estimates [&#8230;] The post Juniper Research Expects Massive Spike in Direct-to-Cell Subscribers appeared first on Via Satellite .",https://www.satellitetoday.com/connectivity/2026/06/02/juniper-research-expects-massive-spike-in-direct-to-cell-subscribers/,2026-06-02 19:14:06+00:00,Science
Breaking Defense,https://breakingdefense.com/feed/,"AI makes it easy to expose holes in Army’s unified network, official says","New AI capabilities are &#8220;lowering the barrier of entry&#8221; to exploit vulnerabilities, according to the Army&#8217;s chief data officer.",https://breakingdefense.com/2026/06/ai-makes-it-easy-to-expose-holes-in-armys-unified-network-official-says/,2026-06-02 18:45:00+00:00,Defense
Breaking Defense,https://breakingdefense.com/feed/,How defensive cyber responds to hockey-stick growth of AI-driven threats,"[Sponsored] Artificial intelligence is reshaping adversarial cyber operations at machine speed, requiring defenders to increase operational tempo while imposing pain and cost.",https://breakingdefense.com/2026/06/how-defensive-cyber-responds-to-hockey-stick-growth-of-ai-driven-threats/,2026-06-02 18:20:54+00:00,AI
War on the Rocks,https://warontherocks.com/feed/,Does the Quad Still Matter?,"On May 26, India hosted a formal meeting of the foreign ministers of the Quad &#8212; comprising the United States, Australia, India, and Japan. Since its initial creation in 2007 and revival in 2017, foreign policy analysts have debated the usefulness of the organization, which was designed as a group of democratic states that could work together to counter growing Chinese power and influence. Under the second Trump administration, some analysts have expressed growing pessimism about the group&#8217;s effectiveness, given the president&#8217;s apparent lack of interest in attending a meeting with heads of state. Nonetheless, U.S. Secretary of State Marco The post Does the Quad Still Matter? appeared first on War on the Rocks .",https://warontherocks.com/does-the-quad-still-matter/,2026-06-02 18:00:12+00:00,Other
Breaking Defense,https://breakingdefense.com/feed/,Rheinmetall locks in wide-ranging $6.6 billion weapons package with Romania,Romania is due to become the second Lynx operator on NATO&#8217;s eastern flank after Hungary&#8217;s 2020 order of 218 vehicles.,https://breakingdefense.com/2026/06/rheinmetall-locks-in-wide-ranging-6-6-billion-weapons-package-with-romania/,2026-06-02 17:50:23+00:00,Defense
Payload Space,https://payloadspace.com/feed/,"NDAA Would Cut SDA, RCO Offices","The House’s annual defense authorization bill would eliminate the two offices within the Pentagon designed to speed up space acquisition. The post NDAA Would Cut SDA, RCO Offices appeared first on Payload .",https://payloadspace.com/ndaa-would-cut-sda-rco-offices/,2026-06-02 17:45:00+00:00,Defense
Defense News,https://www.defensenews.com/arc/outboundfeeds/rss/,"Future presence of US troops in Lithuania is ‘under review,’ says minister","U.S. troops presently stationed in the country are now leaving as expected, but the next scheduled group is not arriving, the defense minister said.",https://www.defensenews.com/news/your-military/2026/06/02/future-presence-of-us-troops-in-lithuania-is-under-review-says-minister/,2026-06-02 17:38:51+00:00,Defense
Breaking Defense,https://breakingdefense.com/feed/,DoD CIO implores industry to put a greater focus on ‘foundational cybersecurity’,"“Compliance does not equal security. It did not when I was in industry, and it does not from my seat where I am today,&#8221; DoD CIO Kirsten Davie said.",https://breakingdefense.com/2026/06/dod-cio-implores-industry-to-put-a-greater-focus-on-foundational-cybersecurity/,2026-06-02 16:30:00+00:00,Other
Breaking Defense,https://breakingdefense.com/feed/,Israel’s defense exports reach record $19 billion in 2025,"“[M]issile, rocket, and air defense systems continued to lead in 2025, accounting for over a quarter (29%) of total deal volume,” the Israeli Ministry of Defense announced today.",https://breakingdefense.com/2026/06/israels-defense-exports-reach-record-19-billion-in-2025/,2026-06-02 15:36:00+00:00,Defense
Defense News,https://www.defensenews.com/arc/outboundfeeds/rss/,Celebrating 40 years of Defense News,"Since 1986, Defense News has been the authoritative voice for the world's defense decision-makers.",https://www.defensenews.com/home/2026/06/02/celebrating-40-years-of-defense-news/,2026-06-02 15:26:26+00:00,Defense
Defense News,https://www.defensenews.com/arc/outboundfeeds/rss/,France restricts Israeli presence at Europe’s biggest defense show,The restrictions come amid strained relations between Paris and Jerusalem over Israel’s military operations in Lebanon.,https://www.defensenews.com/global/europe/2026/06/02/france-restricts-israeli-presence-at-europes-biggest-defense-show/,2026-06-02 15:25:27+00:00,Defense
SpaceNews,https://spacenews.com/feed/,"Global SSA Market to Reach $61B as Governments Prioritize Space Security, Resilience, and Orbital Safety","Paris, France – May 2026 – The 2nd edition of Novaspace’s Space Situational Awareness (SSA) report points to a pivotal decade ahead, with cumulative global spending projected to reach $61 [&#8230;] The post Global SSA Market to Reach $61B as Governments Prioritize Space Security, Resilience, and Orbital Safety appeared first on SpaceNews .",https://spacenews.com/global-ssa-market-to-reach-61b-as-governments-prioritize-space-security-resilience-and-orbital-safety/,2026-06-02 15:11:48+00:00,Other
Breaking Defense,https://breakingdefense.com/feed/,How long will it take to replenish the US military’s munitions stockpiles?,"This week on The Break Out, we look at how long it might take to restock thousands of US munitions used against Iran.",https://breakingdefense.com/2026/06/how-long-will-it-take-to-replenish-the-us-militarys-munitions-stockpiles/,2026-06-02 15:03:00+00:00,Defense
Defense News,https://www.defensenews.com/arc/outboundfeeds/rss/,"US, NATO allies to launch scaled-back Baltic Sea drills",Officials say the smaller footprint reflects operational realities rather than waning commitment.,https://www.defensenews.com/global/europe/2026/06/02/us-nato-allies-to-launch-scaled-back-baltic-sea-drills/,2026-06-02 14:51:22+00:00,Defense
C4ISRNET,https://www.c4isrnet.com/arc/outboundfeeds/rss/,US Navy selects companies for at-sea MUSV prototype testing,The U.S. Navy announced on Friday that it had selected seven companies to compete to secure the service’s Medium Unmanned Surface Vessel contract.,https://www.c4isrnet.com/news/your-navy/2026/06/02/us-navy-selects-companies-for-at-sea-musv-prototype-testing/,2026-06-02 14:45:07+00:00,Defense
Satellite Today,https://www.satellitetoday.com/feed/,Are Orbital Data Centers the Next Frontier of AI Infrastructure?,"The race to put computing infrastructure in orbit is accelerating as hyperscalers across cloud, AI, and space compete to see who will emerge winners in what many believe will fuel [&#8230;] The post Are Orbital Data Centers the Next Frontier of AI Infrastructure? appeared first on Via Satellite .",https://www.satellitetoday.com/technology/2026/06/02/are-orbital-data-centers-the-next-frontier-of-ai-infrastructure/,2026-06-02 14:03:05+00:00,Space
Satellite Today,https://www.satellitetoday.com/feed/,Sighting the Dark Fleet: Hyperspectral’s Role in Securing Safer Seas,"The date is April 10. Iran has closed the Strait of Hormuz in retaliation to strikes by the U.S. and Israel, triggering a regional war. An infamous very large crude [&#8230;] The post Sighting the Dark Fleet: Hyperspectral’s Role in Securing Safer Seas appeared first on Via Satellite .",https://www.satellitetoday.com/imagery-and-sensing/2026/06/02/sighting-the-dark-fleet-hyperspectrals-role-in-securing-safer-seas/,2026-06-02 13:51:48+00:00,Other
SpaceNews,https://spacenews.com/feed/,The importance of determining an equilibrium state for space traffic management,The rapid expansion of human and robotic activity in low Earth orbit makes critically important the need to implement effective space traffic management (STM). This will be one of the [&#8230;] The post The importance of determining an equilibrium state for space traffic management appeared first on SpaceNews .,https://spacenews.com/the-importance-of-determining-an-equilibrium-state-for-space-traffic-management/,2026-06-02 13:00:00+00:00,Other
Labiotech,https://www.labiotech.eu/feed/,The biggest biotech funding rounds in May 2026,"Isomorphic Labs, Apogee Therapeutics, and Avalo Therapeutics bagged the biggest biotech funding rounds overall in May 2026. The post The biggest biotech funding rounds in May 2026 appeared first on Labiotech.eu . © Labiotech UG and Labiotech.eu. Unauthorized use and/or duplication of this material without express and written permission from this site’s author and/or owner is strictly prohibited. Excerpts and links may be used, provided that full and clear credit is given to Labiotech UG and Labiotech.eu with appropriate and specific direction to the original content.",https://www.labiotech.eu/in-depth/biotech-funding-rounds-may-2026/,2026-06-02 13:00:00+00:00,"Biotech, Funding"
Payload Space,https://payloadspace.com/feed/,Northrop Grumman Taps Apex for Golden Dome SBI Collab,Northrop Grumman is on track to deliver on-orbit missile defense capabilities with Apex in 2027. The post Northrop Grumman Taps Apex for Golden Dome SBI Collab appeared first on Payload .,https://payloadspace.com/northrop-grumman-taps-apex-for-golden-dome-sbi-collab/,2026-06-02 12:33:53+00:00,"Space, Defense"
Payload Space,https://payloadspace.com/feed/,Voyager Will Acquire Astrobotic,"“With Astrobotic, Voyager is now a lunar platform that will have capability at every infrastructure layer needed to put Americans on the lunar surface and keep them there.” The post Voyager Will Acquire Astrobotic appeared first on Payload .",https://payloadspace.com/voyager-will-acquire-astrobotic/,2026-06-02 12:32:12+00:00,Space
SpaceNews,https://spacenews.com/feed/,UK explores Vast space station mission for astronaut with physical disability,The U.K. government is exploring sending British astronaut John McFall to Vast’s planned Haven-1 space station in a mission it says could make him the first person with a physical disability to live in orbit. The post UK explores Vast space station mission for astronaut with physical disability appeared first on SpaceNews .,https://spacenews.com/uk-explores-vast-space-station-mission-for-astronaut-with-physical-disability/,2026-06-02 12:25:40+00:00,Space
Payload Space,https://payloadspace.com/feed/,Impulse Space Closes $500M Series D,"“Often in a fundraise like this, there’s some narrative of, ‘Okay, well, now we move into this new line of business, or now we go build the factory in Ohio,’” President and COO Eric Romo told Payload. “There’s none of that here. This is really about, ‘We need more of the same. We need to continue on the same trajectory we’re on.’” The post Impulse Space Closes $500M Series D appeared first on Payload .",https://payloadspace.com/impulse-space-closes-500m-series-d/,2026-06-02 12:15:16+00:00,Other
SpaceNews,https://spacenews.com/feed/,Impulse Space raises $500 million,Impulse Space has raised $500 million to expand production of orbital transfer vehicles and other spacecraft to support growing commercial and government demand. The post Impulse Space raises $500 million appeared first on SpaceNews .,https://spacenews.com/impulse-space-raises-500-million/,2026-06-02 12:11:05+00:00,"Space, Funding"
MIT Technology Review,https://www.technologyreview.com/feed/,The Download: AI can run your admin department now,"This is today&#8217;s edition of The Download, our weekday newsletter that provides a daily dose of what&#8217;s going on in the world of technology. How small businesses can leverage AI From accounting to design to market research and product development, there’s a staggering breadth of skills needed to run a business. Large companies can hire&#8230;",https://www.technologyreview.com/2026/06/02/1138277/the-download-ai-tips-small-businesses-admin/,2026-06-02 12:10:00+00:00,Science
SpaceNews,https://spacenews.com/feed/,Voyager to acquire lunar lander developer Astrobotic,"Voyager Technologies will acquire Astrobotic, a company developing lunar landers and reusable suborbital vehicles, in a deal worth up to $300 million. The post Voyager to acquire lunar lander developer Astrobotic appeared first on SpaceNews .",https://spacenews.com/voyager-to-acquire-lunar-lander-developer-astrobotic/,2026-06-02 11:54:21+00:00,Other
MIT Technology Review,https://www.technologyreview.com/feed/,Rehumanizing global health care with agentic AI,"The global health care sector is under increasing strain.&#160; Decades of chronic underinvestment and constraints in recruitment have coincided with a surge in demand for services for aging populations. Gaps in provision are already taking a toll, with fragmented access to care and high rates of stress and burnout among staff. And it’s getting worse.&#8230;",https://www.technologyreview.com/2026/06/02/1137827/rehumanizing-global-health-care-with-agentic-ai/,2026-06-02 11:23:34+00:00,Other
SpaceNews,https://spacenews.com/feed/,Researchers call for regulations to protect low Earth orbit environment,"BOULDER, Colorado — Researchers are calling for increased attention and better protection against the rising introduction of exotic materials into Earth’s atmosphere from satellite and space hardware re-entry, especially in [&#8230;] The post Researchers call for regulations to protect low Earth orbit environment appeared first on SpaceNews .",https://spacenews.com/researchers-call-for-regulations-to-protect-low-earth-orbit-environment/,2026-06-02 11:00:00+00:00,"Space, Science"
Defense News,https://www.defensenews.com/arc/outboundfeeds/rss/,"US may consider placing nukes in Poland, Baltic States, report says","While the discussions were ongoing, an agreement to expand U.S. nuclear hosting was not imminent, an unnamed source told the FT.",https://www.defensenews.com/global/europe/2026/06/02/us-may-consider-placing-nukes-in-poland-baltic-states-report-says/,2026-06-02 09:55:55+00:00,Other
Defense News,https://www.defensenews.com/arc/outboundfeeds/rss/,NATO in Hormuz is not mission creep,"""For much of the last three decades, NATO has operated on the assumption that allied security cannot be defined solely by geography.""",https://www.defensenews.com/opinion/2026/06/02/nato-in-hormuz-is-not-mission-creep/,2026-06-02 09:40:04+00:00,Defense
