source,feed_url,headline,summary,url,published_date,topics
Breaking Defense,https://breakingdefense.com/feed/,European next-gen GCAP fighter program pushes ahead with $6.1 billion contract,"After the collapse of rival European fighter program FCAS, the new infusion means GCAP&#8217;s future &#8220;has never been more assured,&#8221; a program official said.",https://breakingdefense.com/2026/07/european-next-gen-gcap-fighter-program-pushes-ahead-with-6-1-billion-contract/,2026-07-06 12:48:29+00:00,Other
Defense News,https://www.defensenews.com/arc/outboundfeeds/rss/,NATO summit host Turkey sees its alliance clout rising amid war raging nearby,Government leaders hope to show off the country's burgeoning defense industry at the alliance event.,https://www.defensenews.com/global/europe/2026/07/06/nato-summit-host-turkey-sees-its-alliance-clout-rising-amid-war-raging-nearby/,2026-07-06 12:31:33+00:00,Defense
SpaceNews,https://spacenews.com/feed/,"Connected Aircraft Fleet Set to Exceed 70,000 by 2035","Paris, France &#124; May 2026 – Novaspace’s latest In-Flight Connectivity report points to sustained, long-term growth in the In-Flight Connectivity (IFC) market, with connected aircraft numbers to exceed 70,000 by 2035. Simultaneously, IFC penetration is expected to rise from 48% [&#8230;] The post Connected Aircraft Fleet Set to Exceed 70,000 by 2035 appeared first on SpaceNews .",https://spacenews.com/connected-aircraft-fleet-set-to-exceed-70000-by-2035/,2026-07-06 12:00:00+00:00,Other
EU-Startups,https://www.eu-startups.com/feed/,From cash deposits to everyday rewards: London-based Stoa raises €2.1 million,"UK FinTech startup Stoa has raised €2.1 million ($2.4 million) in pre-Seed funding to accelerate the growth of its cash management platform, which enables consumers and businesses to unlock upfront lifestyle and business value from idle cash deposits. The round was co-led by Bespokeist Partners and Ingenii Capital, with participation from Force Over Mass Capital [&#8230;] The post From cash deposits to everyday rewards: London-based Stoa raises €2.1 million appeared first on EU-Startups .",https://www.eu-startups.com/2026/07/360944/,2026-07-06 11:35:35+00:00,"Funding, Startups"
Defense News,https://www.defensenews.com/arc/outboundfeeds/rss/,"Indonesia drops KF-21 co-production plans, eying stock warplanes instead",Officials in Jakarta are also considering fighter options other than the South Korean-made jets.,https://www.defensenews.com/global/asia-pacific/2026/07/06/indonesia-drops-kf-21-co-production-plans-eying-stock-warplanes-instead/,2026-07-06 11:26:04+00:00,Other
EU-Startups,https://www.eu-startups.com/feed/,UK startup Worldmodeldata raises €8 million to turn video games into training data for physical AI,"Worldmodeldata, a Cambridge-based startup building a database of video game-generated training data for next-generation AI, has raised €8 million (£7 million) in Seed funding as it emerges from stealth. The round was led by Iona Star Capital. Rhea Loucas, Founder and CEO, says: “World models represent a fundamental paradigm shift in AI, but progress like [&#8230;] The post UK startup Worldmodeldata raises €8 million to turn video games into training data for physical AI appeared first on EU-Startups .",https://www.eu-startups.com/2026/07/uk-startup-worldmodeldata-raises-e8-million-to-turn-video-games-into-training-data-for-physical-ai/,2026-07-06 10:55:33+00:00,"Startups, Funding"
SpaceNews,https://spacenews.com/feed/,"Centre for Space Futures, Novaspace and SpaceTech Gulf Sign Agreement to Develop Global Space Capability Mapping Dashboard","Riyadh, Saudi Arabia – June, 2026 The Centre for Space Futures (CSF), together with leading international partners including Novaspace, and SpaceTech Gulf, have signed a Memorandum of Cooperation (MoC) to [&#8230;] The post Centre for Space Futures, Novaspace and SpaceTech Gulf Sign Agreement to Develop Global Space Capability Mapping Dashboard appeared first on SpaceNews .",https://spacenews.com/centre-for-space-futures-novaspace-and-spacetech-gulf-sign-agreement-to-develop-global-space-capability-mapping-dashboard/,2026-07-06 10:00:00+00:00,Other
EU-Startups,https://www.eu-startups.com/feed/,Quantum security: The clock is already running,"There’s a particular kind of risk that keeps me up at night: the kind we don’t feel day to day because it’s easy to label it &#8220;later&#8220;. Quantum computing, the technology that harnesses the laws of quantum mechanics to solve problems too complex for classical computers, has lived in that folder for years. I’m convinced we’re [&#8230;] The post Quantum security: The clock is already running appeared first on EU-Startups .",https://www.eu-startups.com/2026/07/quantum-security-the-clock-is-already-running/,2026-07-06 09:53:18+00:00,Startups
EU-Startups,https://www.eu-startups.com/feed/,Finland’s CurifyLabs raises €12 million to expand 3D printing-based medicine compounding,"CurifyLabs, a Helsinki-based HealthTech company transforming how personalised medicines are made, today announced the closing of a €12 million ($14 million) Series A round to expand U.S. operations, strengthen supply chain infrastructure, enhance customer support, and accelerate product innovation. The round was co-led by Sandwater and HealthCap, with participation from Tesi (Finnish Industry Investment Ltd.) [&#8230;] The post Finland&#8217;s CurifyLabs raises €12 million to expand 3D printing-based medicine compounding appeared first on EU-Startups .",https://www.eu-startups.com/2026/07/finlands-curifylabs-raises-e12-million-to-expand-3d-printing-based-medicine-compounding/,2026-07-06 09:16:41+00:00,"Funding, Startups"
SpaceNews,https://spacenews.com/feed/,"Tianwen-2 arrives at asteroid Kamo’oalewa, first image revealed","HELSINKI — China’s Tianwen-2 sample return spacecraft has arrived at Kamoʻoalewa, revealing the near Earth asteroid to be a small, elongated rocky body. Tianwen-2 launched May 29, 2025, and traveled [&#8230;] The post Tianwen-2 arrives at asteroid Kamo&#8217;oalewa, first image revealed appeared first on SpaceNews .",https://spacenews.com/tianwen-2-arrives-at-asteroid-kamooalewa-first-image-revealed/,2026-07-06 09:14:36+00:00,Other
MIT Technology Review,https://www.technologyreview.com/feed/,South Korea’s hottest new bachelors are chip workers,"Baek, a 35-year-old manager at the South Korean semiconductor titan SK Hynix, was enrolled in Sunoo, a matchmaking company based in Seoul, a year ago. In a move typical of anxious South Korean parents, his mother signed him up, hoping to find a good wife for her son. Lately, says Baek (who asked to be&#8230;",https://www.technologyreview.com/2026/07/06/1140000/south-korea-bachelors-samsung-skhynix-chip-workers/,2026-07-06 09:00:00+00:00,Other
TechCrunch,https://techcrunch.com/feed/,"Smart glasses maker Even Realities hits $1B valuation with $150M funding led by Meituan, Tencent","Even Realities, an ex-Apple team building camera-free smart glasses, raised $150 million from Meituan and Tencent at a $1 billion valuation.",https://techcrunch.com/2026/07/06/smart-glasses-maker-even-realities-hits-1b-valuation-with-150m-funding-led-by-meituan-tencent/,2026-07-06 09:00:00+00:00,Funding
War on the Rocks,https://warontherocks.com/feed/,A Catholic Security Scholar’s Case for Responsible Military AI,"What do you do when two identities that make up your deepest self find themselves on opposite sides of a moral and spiritual battlefield?I am Catholic. I have been one for over 20 years since I made the life-altering decision to join a friend for Mass one day. My faith became a spiritual and ethical foundation at a time I sorely needed it, so much so that for a time, I contemplated entering the priesthood, which replaced my previous career goal of entering the CIA. I eventually realized that teaching was my true calling and decided to pursue that path The post A Catholic Security Scholar’s Case for Responsible Military AI appeared first on War on the Rocks .",https://warontherocks.com/a-catholic-security-scholars-case-for-responsible-military-ai/,2026-07-06 07:30:48+00:00,Defense
TechCrunch,https://techcrunch.com/feed/,"This humanoid robotics company is going public, but its CEO isn’t promising a robot in your home anytime soon","While other humanoid startups chase sky-high valuations, Agility Robotics is betting its future on execution — and a SPAC.",https://techcrunch.com/2026/07/05/this-humanoid-robotics-company-is-going-public-but-its-ceo-isnt-promising-a-robot-in-your-home-anytime-soon/,2026-07-06 06:05:29+00:00,Startups
Science,https://www.science.org/rss/news_current.xml,Philosophers call for their journals to require conflict of interest disclosures,A new petition urges greater transparency amid growing ties to AI and other companies,https://www.science.org/content/article/philosophers-call-their-journals-require-conflict-interest-disclosures,2026-07-06 04:20:00+00:00,Other
Payload Space,https://payloadspace.com/feed/,The Biggest Fundraises of H1 2026,"This is a case where a rising rocket lifts all payloads, around the world. The post The Biggest Fundraises of H1 2026 appeared first on Payload .",https://payloadspace.com/the-biggest-fundraises-of-h1-2026/,2026-07-06 02:42:12+00:00,Space
SpaceNews,https://spacenews.com/feed/,NASA and Small Business Administration partner on funding key space technologies,NASA is partnering with the U.S. Small Business Administration (SBA) on an effort to attract capital to invest in companies producing critical space components. The post NASA and Small Business Administration partner on funding key space technologies appeared first on SpaceNews .,https://spacenews.com/nasa-and-small-business-administration-partner-on-funding-key-space-technologies/,2026-07-06 01:43:42+00:00,Funding
Nature,https://www.nature.com/subjects/medical-research.rss,Enhanced angiogenetic and proliferative effects of remote ischemic conditioning following esophageal resection and anastomosis in a rat model,,https://www.nature.com/articles/s41598-026-61062-z,2026-07-06 00:00:00+00:00,Other
Nature,https://www.nature.com/subjects/medical-research.rss,Author Correction: Fasting ghrelin as mediator between obesity and depressive symptoms: a pre-registered study,,https://www.nature.com/articles/s44184-026-00225-2,2026-07-06 00:00:00+00:00,Science
Nature,https://www.nature.com/subjects/medical-research.rss,Caregiver-reported barriers and facilitators in home-based aural habilitation for children with hearing impairment in Malaysia,,https://www.nature.com/articles/s41598-026-60868-1,2026-07-06 00:00:00+00:00,Other
Nature,https://www.nature.com/subjects/medical-research.rss,Involvement of the IL-27/p38 MAPK/PGC-1α pathway in sleeve gastrectomy-induced metabolic improvement,,https://www.nature.com/articles/s41598-026-61394-w,2026-07-06 00:00:00+00:00,Other
Nature,https://www.nature.com/subjects/medical-research.rss,Polysubstance use: delay discounting in relationship to remission,,https://www.nature.com/articles/s41598-026-56226-w,2026-07-06 00:00:00+00:00,Other
Nature,https://www.nature.com/subjects/medical-research.rss,Generation MASLD: a precision medicine framework for young-onset metabolic dysfunction-associated steatotic liver disease,,https://www.nature.com/articles/s44355-026-00070-2,2026-07-06 00:00:00+00:00,Biotech
Nature,https://www.nature.com/subjects/medical-research.rss,"A novel scoring system based on post-radiotherapy changes in pain, performance status, and adverse events to stratify survival in bone metastases",,https://www.nature.com/articles/s41598-026-61175-5,2026-07-06 00:00:00+00:00,Other
Nature,https://www.nature.com/subjects/medical-research.rss,Robust unsupervised medical image registration using a recursive deformable pyramid network,,https://www.nature.com/articles/s41598-026-59155-w,2026-07-06 00:00:00+00:00,Other
Nature,https://www.nature.com/subjects/medical-research.rss,Effect of 3D‑printed customized base designs on the mechanical retention and bonding strength of metal brackets,,https://www.nature.com/articles/s41598-026-59472-0,2026-07-06 00:00:00+00:00,Other
Nature,https://www.nature.com/subjects/medical-research.rss,Effect of early skin-to-skin contact after vaginal birth on neonatal stress and day-5 bilirubin levels: a randomized trial,,https://www.nature.com/articles/s41598-026-60971-3,2026-07-06 00:00:00+00:00,Other
Nature,https://www.nature.com/subjects/medical-research.rss,Development and validation of a nomogram for predicting vitamin B1 deficiency in critically ill patients: a bi-center prospective cohort study,,https://www.nature.com/articles/s41598-026-60615-6,2026-07-06 00:00:00+00:00,Science
Nature,https://www.nature.com/subjects/medical-research.rss,The immunogenicity of pneumococcal conjugate vaccinations in patients with asplenia and hyposplenia: a systematic review,,https://www.nature.com/articles/s41541-026-01514-9,2026-07-06 00:00:00+00:00,Other
Nature,https://www.nature.com/subjects/medical-research.rss,Digital health interventions for HIV-related sexual risk behaviors: a systematic review and network meta-analysis,,https://www.nature.com/articles/s41746-026-02966-y,2026-07-06 00:00:00+00:00,MedTech
Nature,https://www.nature.com/subjects/medical-research.rss,Granzyme K CD8⁺ T cells with tissue-resident features promote intestinal inflammation in patients with Crohn’s disease,,https://www.nature.com/articles/s12276-026-01763-7,2026-07-06 00:00:00+00:00,Other
Nature,https://www.nature.com/subjects/medical-research.rss,Prevalence of clinically significant posttraumatic stress symptoms in adult patients with hematological malignancies: a systematic review and meta-analysis,,https://www.nature.com/articles/s41598-026-60995-9,2026-07-06 00:00:00+00:00,Other
TechCrunch,https://techcrunch.com/feed/,Uber’s European expansion plans may have hit a speed bump,"Back in February, Uber announced ambitious plans to launch in seven new European markets in 2026 — but now five of those launches are reportedly on hold.",https://techcrunch.com/2026/07/05/ubers-european-expansion-plans-may-have-hit-a-speed-bump/,2026-07-05 21:35:17+00:00,Other
TechCrunch,https://techcrunch.com/feed/,"Trump memecoin investors lost $3.8 billion, analysis finds","Nearly 1 million people have lost a total of $3.8 billion after buying President Donald Trump’s $TRUMP memecoin, while Trump made $636 million.",https://techcrunch.com/2026/07/05/trump-memecoin-investors-lost-3-8-billion-analysis-finds/,2026-07-05 20:29:05+00:00,Funding
TechCrunch,https://techcrunch.com/feed/,Amazon will stop accepting new customers for Mechanical Turk,These may be the last days of Amazon’s Mechanical Turk.,https://techcrunch.com/2026/07/05/amazon-will-stop-accepting-new-customers-for-mechanical-turk/,2026-07-05 17:43:36+00:00,Other
SpaceNews,https://spacenews.com/feed/,Airbus to build Aeolus-2 wind-monitoring satellite,The European Space Agency has selected Airbus Defence and Space to start work on the successor to a wind-monitoring satellite. The post Airbus to build Aeolus-2 wind-monitoring satellite appeared first on SpaceNews .,https://spacenews.com/airbus-to-build-aeolus-2-wind-monitoring-satellite/,2026-07-05 15:17:47+00:00,Defense
