source,feed_url,headline,summary,url,published_date,topics
War on the Rocks,https://warontherocks.com/feed/,America Needs an Off-Ramp Between Doing Nothing and Shutting AI Down,"For 18 days in June, two of America&#8217;s most capable AI models went dark worldwide, not for technical or business reasons, but because the U.S. government ordered it. On June 12, 2026, the Commerce Department informed Anthropic that its Fable 5 and Mythos 5 models could no longer be provided to any foreign person without a license, and the company concluded that compliance meant shutting the models down for everyone. Public access to Fable 5 was restored on June 30.The United States doesn&#8217;t have a trusted, standardized process for evaluating the security risks of frontier AI models or proportionate remedies The post America Needs an Off-Ramp Between Doing Nothing and Shutting AI Down appeared first on War on the Rocks .",https://warontherocks.com/cogs-of-war/america-needs-an-off-ramp-between-doing-nothing-and-shutting-ai-down/,2026-07-23 08:00:26+00:00,AI
EU-Startups,https://www.eu-startups.com/feed/,Nernst Electric raises €1.7 million to scale on-site oxygen generation technology for aquaculture and heavy industry,"Nernst Electric, an Irish startup developing on-site oxygen generation for fish farms, has raised a €1.7 million ($2 million) Seed investment from Hatch Blue&#8217;s Blue Revolution Fund. Hatch Blue is a Cork-based investment firm specialising in aquaculture. Nernst first joined the Hatch Blue portfolio in July 2025, receiving pre-Seed funding from Hatch Accelerator Fund II [&#8230;] The post Nernst Electric raises €1.7 million to scale on-site oxygen generation technology for aquaculture and heavy industry appeared first on EU-Startups .",https://www.eu-startups.com/2026/07/irelands-nernst-electric-raises-e1-7-million-to-advance-on-site-oxygen-generation-technology-for-aquaculture-and-heavy-industry/,2026-07-23 07:53:47+00:00,"Funding, Startups"
War on the Rocks,https://warontherocks.com/feed/,The King of Cool: Mobile Refrigeration and the Remaking of Global Logistics,"Editor&#8217;s note: This is the fifth article in a limited series celebrating American defense technologies born from wartime and their effects on broader national security, politics, and society. This series will run for several weeks to commemorate America&#8217;s 250th anniversary, and winners will be selected by a reader vote undertaken through our newsletter later this summer. Prior installments can be found at the&#160;Arsenal of Innovation&#160;page.Have you ever wondered how the United States transitioned from only having local fresh produce to an abundance of perishable goods available year-round across the country, even during the off-season? Today, almost $3 trillion (roughly 2.7 The post The King of Cool: Mobile Refrigeration and the Remaking of Global Logistics appeared first on War on the Rocks .",https://warontherocks.com/cogs-of-war/the-king-of-cool-mobile-refrigeration-and-the-remaking-of-global-logistics/,2026-07-23 07:45:53+00:00,Defense
War on the Rocks,https://warontherocks.com/feed/,The Importance of the Invasion of Sicily,"On July 10, 1943, the Allied invasion of Sicily &#8212; codenamed Operation Husky &#8212; put more assault troops ashore on its first day than the Normandy landings would 11 months later. Despite the scale of these amphibious and vertical assaults on the Mediterranean&#8217;s largest island, the images most carry of this campaign come from a movie: Patton. In the 1970 film, U.S. Lt. Gen. George S. Patton wins the race to Messina and waits, smirking, as British Lt. Gen. Bernard Montgomery&#8217;s column rolls in late. The scene is an invention that reduces the campaign to a duel between two generals&#8217; The post The Importance of the Invasion of Sicily appeared first on War on the Rocks .",https://warontherocks.com/the-importance-of-the-invasion-of-sicily/,2026-07-23 07:30:48+00:00,Other
TechCrunch,https://techcrunch.com/feed/,ServiceNow bets $40 million on Indian banking software specialist to expand its financial services push,ServiceNow's investment gives BusinessNext a strategic partner to expand its AI-powered banking software globally.,https://techcrunch.com/2026/07/22/servicenow-bets-40m-on-indian-firm-businessnext-at-700m-valuation-to-deepen-banking-ai-push/,2026-07-23 06:09:13+00:00,Funding
EU-Startups,https://www.eu-startups.com/feed/,YC-backed telli raises €13.1 million to build AI for B2C customer operations,"telli, a Berlin-based startup building AI that runs customer-facing operations for B2C companies, today announced a €13.1 million ($15 million) Seed round, bringing its total funding to more than €16.1 million ($18.5 million). The round was led by redalpine, with participation from strategic investors, Mutschler and key angels, alongside existing backers Cherry Ventures and Y [&#8230;] The post YC-backed telli raises €13.1 million to build AI for B2C customer operations appeared first on EU-Startups .",https://www.eu-startups.com/2026/07/yc-backed-telli-raises-e13-1-million-to-build-ai-for-b2c-customer-operations/,2026-07-23 06:05:02+00:00,"Funding, Startups"
Phys.org,https://phys.org/rss-feed/,"Orcas filmed ramming one of the world's heaviest fish so hard it explodes, possibly for fun","Orcas are known to be smart and ruthless hunters. They've been observed hunting a variety of prey, with some species, such as whales, larger than themselves. They use a wide range of strategies to hunt and kill prey, but now, in the Gulf of California, researchers have observed one that hasn't been described before.",https://phys.org/news/2026-07-orcas-ramming-world-heaviest-fish.html,2026-07-23 04:00:01+00:00,Science
Phys.org,https://phys.org/rss-feed/,Study of incarcerated women in Chile finds different outcomes after release,"A new study of incarcerated women in Chile reveals that women respond to imprisonment in very different ways: While most experienced little change in their involvement in crime after release, those with higher levels of past criminal involvement transitioned toward less offending. Access to employment or training played a role in their lower levels of offending following release.",https://phys.org/news/2026-07-incarcerated-women-chile-outcomes.html,2026-07-23 03:40:01+00:00,Science
Phys.org,https://phys.org/rss-feed/,Millennial minimalism: Living in a less material world,"Consumer behavior accounts for almost two-thirds of global greenhouse gas emissions. Research published in the International Journal of Business Excellence argues that reducing absolute consumption, rather than simply making it greener, needs to be a priority in environmental policy.",https://phys.org/news/2026-07-millennial-minimalism-material-world.html,2026-07-23 02:00:01+00:00,Science
Phys.org,https://phys.org/rss-feed/,Extreme heat wave grips Tunisia as wide power cuts fuel frustration,"In Tunisia, long power outages across the country have added to the strain of an intense heat wave, with temperatures as high as 49°C (120°F), leaving many fearing for their livelihoods.",https://phys.org/news/2026-07-extreme-tunisia-wide-power-fuel.html,2026-07-23 00:20:01+00:00,Other
Nature,https://www.nature.com/nature.rss,Could small-team science be dying out?,"Nature, Published online: 23 July 2026; doi:10.1038/d41586-026-02174-4 The proportion of one- and two-author papers in the Nature Index is shrinking rapidly, as science done by big teams continues to surge.",https://www.nature.com/articles/d41586-026-02174-4,2026-07-23 00:00:00+00:00,Science
Nature,https://www.nature.com/nature.rss,Breathalyser can tell if you are burning fat from a single exhale,"Nature, Published online: 23 July 2026; doi:10.1038/d41586-026-02295-w The compact device can measure when the body is in ketosis and could help people to manage weight loss.",https://www.nature.com/articles/d41586-026-02295-w,2026-07-23 00:00:00+00:00,Science
TechCrunch,https://techcrunch.com/feed/,"After shocking quarter, IBM insists that AI isn’t killing the mainframe","After IBM's stock crashed last week on warnings of poor mainframe sales, the CEO explained that AI wrecked corporate hardware budget, temporarily.",https://techcrunch.com/2026/07/22/after-shocking-quarter-ibm-insists-that-ai-isnt-killing-the-mainframe/,2026-07-22 23:47:54+00:00,Other
Phys.org,https://phys.org/rss-feed/,Genome tool places large genetic sequences precisely in rice and tobacco without DNA breaks,"Researchers at King Abdullah University of Science and Technology (KAUST) have developed a new way to add large pieces of genetic information to plants, overcoming a challenge that has limited plant biotechnology for decades. The advance could help scientists build more complex traits into plants in the future, supporting research into areas such as crop resilience, sustainable agriculture, biotechnology and the use of plants as scalable platforms for producing therapeutics and biologics.",https://phys.org/news/2026-07-genome-tool-large-genetic-sequences.html,2026-07-22 23:40:01+00:00,"Science, Biotech"
Phys.org,https://phys.org/rss-feed/,"A longer, hotter reality surrounds marine heat waves, research reveals","Anyone who has boiled a pot of water understands that it takes both time and energy to raise the temperature, so it may come as a surprise to learn that scientists have long treated marine heat waves (MHWs) as isolated events. New research led by William & Mary's VIMS & Batten School is challenging that narrative by providing a framework to characterize an ecosystem's cumulative heat exposure from MHWs and the extended periods of warm water that precede and follow them.",https://phys.org/news/2026-07-longer-hotter-reality-marine-reveals.html,2026-07-22 23:20:04+00:00,"Science, Funding"
Phys.org,https://phys.org/rss-feed/,Marine animals first colonized empty seashells about 470 million years ago,"An international study led by researchers from the University of Tartu shows that approximately 470 million years ago, a significant ecological change took place in the world's oceans: For the first time, the interiors of empty mollusk shells began to be used as habitats. This marked the emergence of a new ecological niche and was a crucial step in the development of a marine ecosystem similar to today's.",https://phys.org/news/2026-07-marine-animals-colonized-seashells-million.html,2026-07-22 23:00:03+00:00,Science
Phys.org,https://phys.org/rss-feed/,Quantum internet leaves the lab with first real-world entanglement over busy telecom fiber,Quantum information is notoriously fragile. Internet traffic is anything but. Yet Northwestern University scientists have demonstrated they can peacefully coexist inside the same fiber-optic cable.,https://phys.org/news/2026-07-quantum-internet-lab-real-world.html,2026-07-22 22:40:01+00:00,Science
Phys.org,https://phys.org/rss-feed/,Light-driven chemistry method could create antiviral compound libraries 10 to 100 times larger within weeks,"As the world faces new and often untreatable viral threats, Simon Fraser University researchers have found a way to cut years off the time it takes to discover antiviral drugs. The new research enables scientists to quickly create large libraries of nucleoside analogs (NAs), compounds that mimic the building blocks of DNA and RNA and are widely used to treat cancer and viral infections such as HIV and hepatitis.",https://phys.org/news/2026-07-driven-chemistry-method-antiviral-compound.html,2026-07-22 22:20:01+00:00,Science
Breaking Defense,https://breakingdefense.com/feed/,The sights of the Farnborough Airshow Day 3,Aerial demonstrations captivated attendees during day 3 of the Farnborough International Airshow.,https://breakingdefense.com/2026/07/the-sights-of-the-farnborough-airshow-day-3/,2026-07-22 22:07:10+00:00,Other
TechCrunch,https://techcrunch.com/feed/,Google justifies its massive AI spending with a booming cloud business,"Google's cloud business is thriving, as companies adopting its AI and AI infrastructure services help the tech giant to report record profits.",https://techcrunch.com/2026/07/22/google-justifies-its-massive-ai-spending-with-a-booming-cloud-business/,2026-07-22 22:01:52+00:00,Other
Phys.org,https://phys.org/rss-feed/,"Water-surface vortices drive tiny rotors without electricity, magnets or chemicals","Reliably generating controlled miniature rotations has long been a challenge: Chemical propulsion systems wear out, and methods that use electric or magnetic fields require complex setups. A team from KIT's Institute of Microstructure Technology (IMT) and the Suzhou Institute of Nano-tech and Nano-bionics (SINANO) at the Chinese Academy of Sciences has now demonstrated that flow at a water surface alone is sufficient to rotate a floating object in a fixed direction. Their research is published in the journal Science Advances.",https://phys.org/news/2026-07-surface-vortices-tiny-rotors-electricity.html,2026-07-22 22:00:01+00:00,Science
Breaking Defense,https://breakingdefense.com/feed/,"A new, British CCA enters the fray at the Farnborough airshow",Breaking Defense brings you the latest from Day 3 at Farnborough.,https://breakingdefense.com/2026/07/a-new-british-cca-enters-the-fray-at-the-farnborough-airshow/,2026-07-22 21:43:47+00:00,Defense
Phys.org,https://phys.org/rss-feed/,"Even a slight overproduction of tubulin can tip the balance of cellular health, study shows","For cells to function properly, they must produce the right amount of each protein. It is a delicate balance: Both too little and too much can compromise essential cellular functions. A team from the University of Geneva (UNIGE) has now shown that even a modest excess of tubulin—the protein that assembles into microtubules, the cell's internal scaffolding—is enough to disrupt tissue architecture and reduce cell viability. Published in Nature Communications, the study demonstrates that the quantity of a protein is just as important as its function.",https://phys.org/news/2026-07-slight-overproduction-tubulin-cellular-health.html,2026-07-22 21:40:04+00:00,Science
Phys.org,https://phys.org/rss-feed/,Reusable magnetic invention removes microplastics plus some PFAS from water,"Microplastics are an increasing global concern, with growing evidence of their presence in water systems. RMIT University researchers have developed a water treatment material that rapidly removes micro- and nanoplastics and some PFAS (per- and polyfluoroalkyl substances), bringing the technology closer to real-world use. The invention builds on the team's 2022 breakthrough in microplastics removal, extending its performance to much smaller particles and more complex wastewater.",https://phys.org/news/2026-07-reusable-magnetic-microplastics-pfas.html,2026-07-22 21:20:02+00:00,Science
SpaceNews,https://spacenews.com/feed/,China’s Shijian-31 satellite is sweeping GEO using a unique orbit,"HELSINKI — A classified satellite launched by China in June is operating in a creative orbit, giving it a unique vantage point over the geostationary belt. Shijian-31 launched on a [&#8230;] The post China’s Shijian-31 satellite is sweeping GEO using a unique orbit appeared first on SpaceNews .",https://spacenews.com/chinas-shijian-31-satellite-is-sweeping-geo-using-a-unique-orbit/,2026-07-22 21:13:08+00:00,Space
Breaking Defense,https://breakingdefense.com/feed/,House passes 2027 NDAA while measure remains stalled in the Senate,"“[There are] provisions in this bill that some folks disagree with, but understand that this is just a single step in a long process,” House Armed Services Committee Chairman Mike Rogers, R-Ala., said on the chamber floor today.",https://breakingdefense.com/2026/07/house-passes-2027-ndaa-while-measure-remains-stalled-in-the-senate/,2026-07-22 21:07:47+00:00,Other
Phys.org,https://phys.org/rss-feed/,"Shifting weather patterns drive 55% of Europe's summer drought trend, study finds","In a new study, researchers at Leipzig University have identified a major cause of the unusually severe summer soil drying and rising temperatures across Europe. They found that much of the trend can be attributed to changes in atmospheric circulation patterns—that is, shifts in the weather regimes that typically occur over Europe. These changes account for around 55% of the observed summer drought trend. Specifically, more frequent and persistent high-pressure systems have brought drier conditions and reduced rainfall.",https://phys.org/news/2026-07-shifting-weather-patterns-europe-summer.html,2026-07-22 21:00:05+00:00,Science
Phys.org,https://phys.org/rss-feed/,Plasma design rules show how to preserve attosecond flashes for observing electrons,"Researchers at Skoltech, together with a colleague from the Shanghai Institute of Optics and Fine Mechanics of the Chinese Academy of Sciences, working within the joint SIOM–Skoltech laboratory, have determined how to select the thickness and density of a plasma target so that a pulse passing through it retains its attosecond duration and high intensity. The results will help improve the design of plasma-based sources of ultraviolet and X-ray radiation used to study ultrafast processes in matter.",https://phys.org/news/2026-07-plasma-attosecond-electrons.html,2026-07-22 21:00:01+00:00,Science
TechCrunch,https://techcrunch.com/feed/,Treasury threatens sanctions after White House claims Moonshot distilled Anthropic’s Fable,The episode has also intensified a broader debate in Washington over the influx of Chinese open models.,https://techcrunch.com/2026/07/22/treasury-threatens-sanctions-after-white-house-claims-moonshot-distilled-anthropics-fable/,2026-07-22 20:49:03+00:00,AI
TechCrunch,https://techcrunch.com/feed/,"Tesla spending skyrockets as Cybercab, Semi, Megapack production timeline slips",Tesla's 26% boost in revenue wasn't enough to offset rising operating expenses and capital expenditures as it pushes to launch a new generation of products.,https://techcrunch.com/2026/07/22/tesla-spending-skyrockets-as-cybercab-semi-megapack-production-timeline-slips/,2026-07-22 20:43:38+00:00,Other
Phys.org,https://phys.org/rss-feed/,Neural networks unlock larger quantum simulations with lower computational costs,"In recent years, research using artificial intelligence to predict material properties has advanced rapidly. Neural network quantum Monte Carlo methods have attracted attention as highly accurate simulation techniques. However, their extremely high computational cost has limited their application to small molecular systems. This study introduces a new computational method that overcomes this limitation.",https://phys.org/news/2026-07-neural-networks-larger-quantum-simulations.html,2026-07-22 20:40:07+00:00,"Science, AI"
Phys.org,https://phys.org/rss-feed/,Detecting the body's magnetic fields with a low-power Ramsey-based magnetometer,"Our bodies generate extremely weak magnetic fields as electric currents flow through the heart, brain and other tissues. These signals are used in magnetocardiography and magnetoencephalography to assess heart function and brain activity, respectively. These fields can be detected at room temperature using diamond sensors containing nitrogen-vacancy (NV) centers, in which a carbon atom is replaced by a nitrogen atom adjacent to an empty lattice site.",https://phys.org/news/2026-07-body-magnetic-fields-power-ramsey.html,2026-07-22 20:40:06+00:00,Other
TechCrunch,https://techcrunch.com/feed/,Social media addiction lawsuit against Meta is dropped,"A closely watched social media addiction lawsuit that had been set to go to trial next week has been dropped after the plaintiff voluntarily dismissed his claims against Meta, leaving none of the major tech companies facing trial in the case.",https://techcrunch.com/2026/07/22/social-media-addiction-lawsuit-against-meta-is-dropped/,2026-07-22 20:36:41+00:00,Other
Phys.org,https://phys.org/rss-feed/,Crowd reactions influence whether people receive controversial political messages positively or negatively,"Positive crowd reactions like applause and laughter can make controversial political messages more acceptable to viewers, according to new research by psychologist Dr. Carl Senior at Aston University. The research suggests that how broadcasters and content creators use applause, laughter and booing can subtly shape public perceptions of populist figures and divisive issues like immigration.",https://phys.org/news/2026-07-crowd-reactions-people-controversial-political.html,2026-07-22 20:20:05+00:00,Science
Phys.org,https://phys.org/rss-feed/,AI and quantum chemistry combine to identify efficient blue OLED materials,"Organic light-emitting diodes (OLEDs) have become a standard in modern devices with incredible contrast and sleek designs. While initially an expensive luxury, OLEDs are gradually becoming more financially accessible as the technology improves. Now, researchers at the Institute of Transformative Bio-Molecules (WPI-ITbM) at Nagoya University and the Institute for Advanced Study at Kyushu University have combined quantum chemistry with machine learning to identify new materials for blue OLEDs for incorporation in next-generation ultra-high-definition displays. Their research was published in Angewandte Chemie on July 21, 2026.",https://phys.org/news/2026-07-ai-quantum-chemistry-combine-efficient.html,2026-07-22 20:20:01+00:00,"Science, AI"
Satellite Today,https://www.satellitetoday.com/feed/,FCC Approves a New C-Band Auction,"The FCC voted to approve another C-band auction on Wednesday, which will see satellite operators clear 160 megahertz of the upper C-band. This C-band auction looks to build on the [&#8230;] The post FCC Approves a New C-Band Auction appeared first on Via Satellite .",https://www.satellitetoday.com/government-military/2026/07/22/fcc-approves-a-new-c-band-auction/,2026-07-22 20:12:43+00:00,Other
Satellite Today,https://www.satellitetoday.com/feed/,Lite Coms Wins $22M Contract to Support Operational Readiness,Lite Coms has recieved a $22 million contract from an unnamed government and defense customer to provide satellite communications to support operational readiness. Lite Coms is an integrator and manufacturer [&#8230;] The post Lite Coms Wins $22M Contract to Support Operational Readiness appeared first on Via Satellite .,https://www.satellitetoday.com/technology/2026/07/22/lite-coms-wins-22m-contract-to-support-operational-readiness/,2026-07-22 20:09:54+00:00,Defense
Satellite Today,https://www.satellitetoday.com/feed/,"FCC Overhauls Satellite Licensing, Adopts ‘Assembly Line’ Approach","The FCC approved an overhaul of its space and earth station licensing process on Wednesday to create what it calls a “licensing assembly line.” The order passed on Wednesday discards [&#8230;] The post FCC Overhauls Satellite Licensing, Adopts ‘Assembly Line’ Approach appeared first on Via Satellite .",https://www.satellitetoday.com/government-military/2026/07/22/fcc-overhauls-satellite-licensing-adopts-assembly-line-approach/,2026-07-22 20:05:04+00:00,Other
Phys.org,https://phys.org/rss-feed/,Why river management is so crucial to protecting one of world's most important wetlands,"A major new study led by Swansea University has shown that upstream river management, rather than local rainfall, is the primary driver of one of the world's most important wetlands. According to the research published in Scientific Reports, which analyzed more than two decades of satellite observations, the future of Iraq's Mesopotamian Marshes depends far more on the water flowing from the Tigris and Euphrates rivers than on rainfall.",https://phys.org/news/2026-07-river-crucial-world-important-wetlands.html,2026-07-22 20:00:03+00:00,Science
Phys.org,https://phys.org/rss-feed/,Creating the largest-ever database on floating ocean plastic using smart cameras,"The first five years (2019–2024) of operations of The Ocean Cleanup's Automated Debris Imaging System (ADIS) have been reviewed, and the findings have been published in Environmental Research Communications. In addition to reviewing the technology's performance, the study covers the initial 14,500 km2 of global ocean surface scanned for plastic debris and the more than 20,000 large floating objects it helped identify.",https://phys.org/news/2026-07-largest-database-ocean-plastic-smart.html,2026-07-22 20:00:01+00:00,"Science, MedTech"
Satellite Today,https://www.satellitetoday.com/feed/,Iridium Reports 4% Revenue Growth in Q2 Amid Rocket Lab Acquisition Deal,"Iridium grew revenue and subscribers in the second quarter, while the company is in the midst of a deal to be acquired by Rocket Lab. The satellite operator reported $225.2 [&#8230;] The post Iridium Reports 4% Revenue Growth in Q2 Amid Rocket Lab Acquisition Deal appeared first on Via Satellite .",https://www.satellitetoday.com/finance/2026/07/22/iridium-reports-4-revenue-growth-in-q2-amid-rocket-lab-acquisition-deal/,2026-07-22 19:58:17+00:00,Space
TechCrunch,https://techcrunch.com/feed/,SoundCloud acquires decentralized music platform Nina Protocol months after its shutdown,"SoundCloud has acquired decentralized music platform Nina Protocol, months after the startup announced it would shut down. The deal brings Nina’s artists, editorial archive, and music discovery tools to SoundCloud as the company continues expanding its platform for independent musicians.",https://techcrunch.com/2026/07/22/soundcloud-acquires-decentralized-music-platform-nina-protocol-months-after-its-shutdown/,2026-07-22 19:42:56+00:00,"Startups, Science"
