source,feed_url,headline,summary,url,published_date,topics
Science,https://www.science.org/rss/news_current.xml,Scientists ID ‘corkscrew killer’ behind gruesome seal deaths,"Bizarre injuries were not caused by sharks or boat propellers, but a more surprising culprit",https://www.science.org/content/article/scientists-id-corkscrew-killer-behind-gruesome-seal-deaths,2026-05-11 09:30:00+00:00,Science
Breaking Defense,https://breakingdefense.com/feed/,"Latvian defense minister resigns, following lagging response to drone incursions","Military drone detection systems failed to identify an incoming aircraft, and mobile warnings were not sent to residents’ phones until approximately an hour after it had already crashed.",https://breakingdefense.com/2026/05/latvian-defense-minister-resigns-following-lagging-response-to-drone-incursions/,2026-05-11 09:14:13+00:00,Defense
War on the Rocks,https://warontherocks.com/feed/,"Ankara’s Crossroads: Rearmament, Risk, and the Prospect of War with Israel","Talk of war in the Middle East abounds on social media, but not just about the one with Iran. A small, but significant, portion of this chatter relates to a conflict that has not begun. For more than a year now, pundits and politicians have warned of a potential clash between Israel and Turkey. Driving this hypothetical confrontation are a series of issues related to Syria, the Palestinian territories, and regional security as a whole. In December 2025, Israeli Prime Minister Benjamin Netanyahu indirectly charged Ankara with wanting to reestablish Ottoman imperial rule over the Levant. To that, he declared, The post Ankara’s Crossroads: Rearmament, Risk, and the Prospect of War with Israel appeared first on War on the Rocks .",https://warontherocks.com/ankaras-crossroads-rearmament-risk-and-the-prospect-of-war-with-israel/,2026-05-11 07:30:56+00:00,Other
War on the Rocks,https://warontherocks.com/feed/,"Conflict, CASEVAC, and the Golden Hour in the Age of Persistent Surveillance","Editor&#8217;s Note: This article contains frank descriptions of battlefield conditions, including accounts of soldiers dying by suicide following injury.&#160;Western battlefield casualty evacuation doctrine is built on assumptions forged during the &#8220;Global War on Terror.&#8221; Central among these is the belief that the wounded can be rapidly moved from the point of injury to progressively higher levels of medical care within a defined timeframe, commonly referred to as the &#8220;golden hour.&#8221; The concept itself originated in civilian trauma medicine decades prior, generally attributed to Dr. R. Adams Cowley of Baltimore&#8217;s Shock Trauma Institute in 1975. In 2009, Secretary of Defense Robert The post Conflict, CASEVAC, and the Golden Hour in the Age of Persistent Surveillance appeared first on War on the Rocks .",https://warontherocks.com/conflict-casevac-and-the-golden-hour-in-the-age-of-persistent-surveillance/,2026-05-11 07:15:54+00:00,Defense
Breaking Defense,https://breakingdefense.com/feed/,"EDGE CEO talks company’s role in Iran conflict, plus future partnerships",EDGE Managing Director and CEO Hamad Al Marar sat down with Breaking Defense to discuss UAV technology and future endeavors for the company.,https://breakingdefense.com/2026/05/edge-ceo-talks-companys-role-in-iran-conflict-plus-future-partnerships/,2026-05-11 04:55:00+00:00,Defense
Nature,https://www.nature.com/subjects/medical-research.rss,Transcriptional landscape of pulmonary artery endothelium reveals subpopulation- and disease-specific remodeling signatures,,https://www.nature.com/articles/s42003-026-10204-0,2026-05-11 00:00:00+00:00,Other
Nature,https://www.nature.com/subjects/medical-research.rss,Workload and personnel allocation in pharmacy departments of public hospitals in China: a current state study,,https://www.nature.com/articles/s41598-026-51124-7,2026-05-11 00:00:00+00:00,Science
Nature,https://www.nature.com/subjects/medical-research.rss,"A double-blinded, placebo-controlled field trial of an OspA-based oral reservoir targeted vaccine against Borrelia burgdorferi",,https://www.nature.com/articles/s41541-026-01440-w,2026-05-11 00:00:00+00:00,Biotech
Nature,https://www.nature.com/subjects/medical-research.rss,Multidimensional balance assessment and machine learning gait stability prediction in elderly women,,https://www.nature.com/articles/s41598-026-52352-7,2026-05-11 00:00:00+00:00,AI
Nature,https://www.nature.com/subjects/medical-research.rss,An exploratory study of multi-channel CNN for early detection of lung cancer from longitudinal healthcare records,,https://www.nature.com/articles/s41598-026-52173-8,2026-05-11 00:00:00+00:00,Science
Nature,https://www.nature.com/subjects/medical-research.rss,The impact of emergency quality improvement program on the prognosis of patients with acute ST-segment elevation myocardial infarction in Taiwan,,https://www.nature.com/articles/s41598-026-52428-4,2026-05-11 00:00:00+00:00,Other
Nature,https://www.nature.com/subjects/medical-research.rss,Single-cell transcriptomics highlights macrophage-driven regulation of EndMT and repair in injured muscle,,https://www.nature.com/articles/s42003-026-10194-z,2026-05-11 00:00:00+00:00,Other
Nature,https://www.nature.com/subjects/medical-research.rss,"Triple-tracer PET (18F-FDG, 68Ga-DOTANOC, 68Ga-FAPI) maps inter- and intra-lesional heterogeneity in metastatic high-grade neuroendocrine neoplasms",,https://www.nature.com/articles/s41598-026-51131-8,2026-05-11 00:00:00+00:00,Other
Nature,https://www.nature.com/subjects/medical-research.rss,Application of resting-state EEG theta /alpha power ratio analysis for diagnosing amnestic mild cognitive impairment,,https://www.nature.com/articles/s41598-026-46950-8,2026-05-11 00:00:00+00:00,Other
Nature,https://www.nature.com/subjects/medical-research.rss,The effect of night shift work on daytime sleepiness and physiological health among pediatric nurses in Northern Ghana: a cross-sectional survey,,https://www.nature.com/articles/s41598-026-52977-8,2026-05-11 00:00:00+00:00,Other
Nature,https://www.nature.com/subjects/medical-research.rss,Key donor corneal factors governing successful expansion of human corneal endothelial cells,,https://www.nature.com/articles/s41598-026-52213-3,2026-05-11 00:00:00+00:00,Other
Nature,https://www.nature.com/subjects/medical-research.rss,Increased prevalence of hearing loss and tinnitus in patients with retinal vein occlusion,,https://www.nature.com/articles/s41598-026-52784-1,2026-05-11 00:00:00+00:00,Other
Nature,https://www.nature.com/subjects/medical-research.rss,Targeted therapies for myocardial infarction based on COPD-related extracellular vesicles,,https://www.nature.com/articles/s41598-026-50402-8,2026-05-11 00:00:00+00:00,Other
Nature,https://www.nature.com/subjects/medical-research.rss,"Timing of food intake, chrononutritional behavior patterns, and risk of metabolic syndrome in the French NutriNet-Santé cohort",,https://www.nature.com/articles/s41598-026-51459-1,2026-05-11 00:00:00+00:00,Other
Nature,https://www.nature.com/subjects/medical-research.rss,In vivo evaluation of synthetic cannabinoid JWH-018 derivatives as potential new psychoactive substances,,https://www.nature.com/articles/s41598-026-51639-z,2026-05-11 00:00:00+00:00,Other
Nature,https://www.nature.com/subjects/medical-research.rss,Correction: Comparative effectiveness of varying hyperbaric oxygen protocols in the treatment of acute central retinal artery occlusion,,https://www.nature.com/articles/s41433-026-04492-3,2026-05-11 00:00:00+00:00,Other
Nature,https://www.nature.com/subjects/medical-research.rss,Characteristics of the upper trapezius muscle in patients with chronic shoulder impingement syndrome: a comparative study,,https://www.nature.com/articles/s41598-026-46757-7,2026-05-11 00:00:00+00:00,Science
Nature,https://www.nature.com/subjects/medical-research.rss,Effects of secretome derived from resveratrol treated mesenchymal stem cell on cornea wound: an organ culture study,,https://www.nature.com/articles/s41598-026-51588-7,2026-05-11 00:00:00+00:00,Science
Nature,https://www.nature.com/subjects/medical-research.rss,Music therapy integrated virtual reality education for preoperative anxiety in gynecological surgery,,https://www.nature.com/articles/s41598-026-51676-8,2026-05-11 00:00:00+00:00,Other
Nature,https://www.nature.com/subjects/medical-research.rss,Brepocitinib shows promise for dermatomyositis,,https://www.nature.com/articles/s41584-026-01383-5,2026-05-11 00:00:00+00:00,Other
Nature,https://www.nature.com/subjects/medical-research.rss,Sexual function after Anchorsure repair of sacrospinous ligament suspension in patients with pelvic organ prolapse: a prospective multicenter study,,https://www.nature.com/articles/s41598-026-52719-w,2026-05-11 00:00:00+00:00,Science
Nature,https://www.nature.com/subjects/medical-research.rss,Objective quantification of motion-induced dizziness using a proof-of-concept multimodal wearable platform,,https://www.nature.com/articles/s41598-026-52443-5,2026-05-11 00:00:00+00:00,MedTech
Nature,https://www.nature.com/subjects/medical-research.rss,Evaluation of lactic acid as a novel fixative for histological and neuroanatomical applications,,https://www.nature.com/articles/s41598-026-51513-y,2026-05-11 00:00:00+00:00,Other
Nature,https://www.nature.com/subjects/medical-research.rss,Prevalence and determinants of human papillomavirus vaccine hesitancy among parents of young girls in Morocco,,https://www.nature.com/articles/s41598-026-52998-3,2026-05-11 00:00:00+00:00,Biotech
TechCrunch,https://techcrunch.com/feed/,Get ready for the whisper-filled office of the future,How will work setups change if we spend more and more time talking to our computers?,https://techcrunch.com/2026/05/10/get-ready-for-the-whisper-filled-office-of-the-future/,2026-05-10 21:15:30+00:00,Other
TechCrunch,https://techcrunch.com/feed/,Anthropic says ‘evil’ portrayals of AI were responsible for Claude’s blackmail attempts,"Fictional portrayals of artificial intelligence can have a real effect on AI models, according to Anthropic.",https://techcrunch.com/2026/05/10/anthropic-says-evil-portrayals-of-ai-were-responsible-for-claudes-blackmail-attempts/,2026-05-10 20:40:41+00:00,AI
TechCrunch,https://techcrunch.com/feed/,Uber has always wanted to be more than a ride; now it has reason to hurry,"The company has been trying to embed itself inside the AV industry — as a data provider, an investor, and a distribution platform — but the consumer-facing bet may be just as important.",https://techcrunch.com/2026/05/10/uber-has-always-wanted-to-be-more-than-a-ride-now-it-has-reason-to-hurry/,2026-05-10 18:08:54+00:00,Funding
TechCrunch,https://techcrunch.com/feed/,TechCrunch Mobility: Lime’s IPO gamble,"Welcome back to TechCrunch Mobility, your hub for the future of transportation and now, more than ever, how AI is playing a part.",https://techcrunch.com/2026/05/10/techcrunch-mobility-limes-ipo-gamble/,2026-05-10 16:05:00+00:00,Other
TechCrunch,https://techcrunch.com/feed/,We’re feeling cynical about xAI’s big deal with Anthropic,"On the latest episode of the Equity podcast, we discussed what xAI's deal with Anthropic might mean for parent company SpaceX.",https://techcrunch.com/2026/05/10/were-feeling-cynical-about-xais-big-deal-with-anthropic/,2026-05-10 15:34:25+00:00,AI
TechCrunch,https://techcrunch.com/feed/,The hottest place for startups to strike a deal? The F1 paddock,F1 Grands Prix have emerged as a new place to see and be seen if you are a founder or investor.,https://techcrunch.com/2026/05/10/the-hottest-place-for-startups-to-strike-a-deal-the-f1-paddock/,2026-05-10 15:13:07+00:00,"Startups, Funding"
