source,feed_url,headline,summary,url,published_date,topics
Phys.org,https://phys.org/rss-feed/,TikTok algorithm showed a pro-Republican bias during the last US presidential election,"TikTok's algorithm did not treat Democrats and Republicans equally during the 2024 US presidential election. According to a paper published in Nature, its recommendation system showed a Republican-leaning skew in three states. The journal's editors have also published a Research Briefing in the same issue covering the study.",https://phys.org/news/2026-05-tiktok-algorithm-pro-republican-bias.html,2026-05-08 14:50:01+00:00,Science
TechCrunch,https://techcrunch.com/feed/,Truecaller slashes 70 jobs amid declining ad sales,"Truecaller's ad revenue declined by 44%, leading to the layoffs.",https://techcrunch.com/2026/05/08/truecaller-slashes-70-jobs-amid-declining-ad-sales/,2026-05-08 14:41:53+00:00,Other
TechCrunch,https://techcrunch.com/feed/,Live only at TechCrunch Disrupt 2026: Why most founders are already behind on raising a Series A in 2027,"Learn what it takes to build a Series A in 2027 from top VCs at TechCrunch Disrupt 2026, taking place at San Francisco’s Moscone West on October 13-15. Register today to hear this session live on the Builders Stage.",https://techcrunch.com/2026/05/08/live-only-at-techcrunch-disrupt-2026-why-most-founders-are-already-behind-on-raising-a-series-a-in-2027/,2026-05-08 14:30:00+00:00,"Startups, Funding"
Phys.org,https://phys.org/rss-feed/,New task-setting study shows that male bumblebees are more active and adaptable,"Male bumblebees are more active and flexible in behavior than female bees, new University of Chester–led research has found, after creating tasks to analyze how the insects explore, recognize colors and learn to earn rewards. The study by researchers from the University of Chester in collaboration with Toyota Motor Manufacturing UK Ltd (Deeside), Newcastle University and the University of Sheffield has highlighted how the different roles of female workers and male drones shape their behavior and ability to change in new surroundings.",https://phys.org/news/2026-05-task-male-bumblebees.html,2026-05-08 14:20:01+00:00,Science
Defense News,https://www.defensenews.com/arc/outboundfeeds/rss/,The US Marine Corps is looking for a few good robots to build airfields,"For Marines who have toiled over assembling airfields in austere environments, relief may be on the way.",https://www.defensenews.com/news/your-military/2026/05/08/the-us-marine-corps-is-looking-for-a-few-good-robots-to-build-airfields/,2026-05-08 14:13:43+00:00,Other
Breaking Defense,https://breakingdefense.com/feed/,"Havelsan unveils Barkan 3 unmanned ground vehicle, to be part of autonomous swarm","The Turkish defense firm also revealed an AI-enabled combat management system, part of what an exec said was an effort to integrate AI into the company&#8217;s &#8220;digital troops concept.&#8221;",https://breakingdefense.com/2026/05/havelsan-unveils-barkan-3-unmanned-ground-vehicle-to-be-part-of-autonomous-swarm/,2026-05-08 14:06:07+00:00,Defense
TechCrunch,https://techcrunch.com/feed/,Last 24 hours to get 50% off a second pass to TechCrunch Disrupt 2026,"Last day to buy one pass and get a second one at 50% off to TechCrunch Disrupt 2026. Bring a partner, co-founder, or colleague at half off. Register now.",https://techcrunch.com/2026/05/08/last-24-hours-to-get-50-off-a-second-pass-to-techcrunch-disrupt-2026/,2026-05-08 14:00:00+00:00,Startups
Defense News,https://www.defensenews.com/arc/outboundfeeds/rss/,India to build strategic outpost near key shipping lane in Indo-Pacific,"“This is what I call the Hormuz Strait effect,"" one analyst said, referring to the collapse of shipping through the vital waterway due to war.",https://www.defensenews.com/global/asia-pacific/2026/05/08/india-to-build-strategic-outpost-near-key-shipping-lane-in-indo-pacific/,2026-05-08 13:59:48+00:00,Other
Phys.org,https://phys.org/rss-feed/,Nanoscale design channels hybrid light–vibration waves to carry heat more efficiently,Your phone warms up after a 20-minute FaceTime call. Your laptop hums loudly while editing a large video file. Heat is a by-product of modern electronics—from everyday gadgets to the high-resolution screens and processors that power electric vehicles.,https://phys.org/news/2026-05-nanoscale-channels-hybrid-lightvibration-efficiently.html,2026-05-08 13:40:13+00:00,Other
Phys.org,https://phys.org/rss-feed/,How a strange fruit fly became a bloodthirsty underwater hunter,"A carnivorous fruit fly living in bubbling African streams may sound like a fever dream. However, with the help of DNA analysis of a pinned insect from a museum in Zurich, researchers have managed to draw an evolutionary map of a mysterious species that has not been seen since 1981.",https://phys.org/news/2026-05-strange-fruit-fly-bloodthirsty-underwater.html,2026-05-08 13:40:12+00:00,Science
TechCrunch,https://techcrunch.com/feed/,"Lime, the Uber-backed micromobility company, files for IPO","After years of hints and preparation, Lime plans to enter the public markets. The company intends to list on ​Nasdaq under the ticker symbol ""LIME."" Lime did not share terms of the offering.",https://techcrunch.com/2026/05/08/lime-the-uber-backed-micromobility-company-files-for-ipo/,2026-05-08 13:21:34+00:00,Other
Phys.org,https://phys.org/rss-feed/,What makes some couples bounce back from stress so quickly? New clues emerge from cortisol and partner behavior,"How partners respond to stress may be as important as the stress itself, according to two new Canadian studies of lesbian, gay, bisexual, transgender and nonbinary couples. Known collectively as sexual and gender diverse (SGD) couples, these partners recover more efficiently from acute stress and display more engaged and coordinated support behaviors than cisgender heterosexual couples, the Université de Montréal studies found.",https://phys.org/news/2026-05-couples-stress-quickly-clues-emerge.html,2026-05-08 13:20:06+00:00,Other
Phys.org,https://phys.org/rss-feed/,"One fifth of flowering plant evolutionary history is at risk of extinction, experts warn","In a new study published in the journal Science, researchers from the Royal Botanic Gardens, Kew, ZSL (Zoological Society of London) and their international collaborators including Boise State University present the first global assessment of risk to the angiosperm (flowering plants) tree of life, warning that more than a fifth of all angiosperm evolutionary history is at risk of extinction.",https://phys.org/news/2026-05-evolutionary-history-extinction-experts.html,2026-05-08 13:20:01+00:00,Science
Phys.org,https://phys.org/rss-feed/,"Nearly 3,000 peer-reviewed medical papers have fake citations, AI-assisted audit finds","A new Columbia University School of Nursing AI-assisted audit reveals nearly 3,000 peer-reviewed medical papers have fake citations that do not exist in scientific databases. The results highlight an alarming trend in academic publishing as the use of AI grows.",https://phys.org/news/2026-05-peer-medical-papers-fake-citations.html,2026-05-08 13:00:03+00:00,Other
TechCrunch,https://techcrunch.com/feed/,The biggest US power grid is under strain from AI — and no one is happy,PJM Interconnection — which oversees the grid for some of the densest data center developments on Earth — wants to overhaul itself. Not everyone thinks it's up to the task.,https://techcrunch.com/2026/05/08/the-biggest-u-s-power-grid-is-under-strain-from-ai-and-no-one-is-happy/,2026-05-08 13:00:00+00:00,Other
Breaking Defense,https://breakingdefense.com/feed/,"Rheinmetall Q1 sales jump 8% year on year, as naval business era begins with promise","“The technology group’s order books remain at record levels,” said the Dusseldorf-based firm as it also predicted &#8220;significant growth acceleration&#8221; for Q2.",https://breakingdefense.com/2026/05/rheinmetall-q1-sales-jump-8-percent-year-on-year-as-naval-business-era-begins-with-promise/,2026-05-08 12:55:22+00:00,Other
TechCrunch,https://techcrunch.com/feed/,Airbnb says AI now writes 60% of its new code,Airbnb also said its customer support AI bot now handles 40% of issues without escalating to a human agent.,https://techcrunch.com/2026/05/08/airbnb-says-ai-now-writes-60-of-its-new-code/,2026-05-08 12:49:16+00:00,Other
Breaking Defense,https://breakingdefense.com/feed/,Munitions at risk? Inside the Pentagon’s $350B gamble,"Congress has teed up a second reconciliation bill with immigration enforcement money, but future reconciliation funds for defense remain nebulous.",https://breakingdefense.com/2026/05/heres-whats-at-risk-if-the-pentagons-350b-reconciliation-gambit-fails/,2026-05-08 12:45:00+00:00,Defense
Payload Space,https://payloadspace.com/feed/,"Lunar Outpost Closes $30M Series B, Unveils New Rover","The fundraise highlights the huge demand from investors looking to capitalize on NASA’s new vision for the US presence on the Moon. The post Lunar Outpost Closes $30M Series B, Unveils New Rover appeared first on Payload .",https://payloadspace.com/lunar-outpost-closes-30m-series-b-unveils-new-rover/,2026-05-08 12:31:11+00:00,"Funding, Space"
Science,https://www.science.org/rss/news_current.xml,Fiber optic cables can eavesdrop on nearby conversations,Cables used to detect earthquakes can also capture the faint vibrations of speech,https://www.science.org/content/article/fiber-optic-cables-can-eavesdrop-nearby-conversations,2026-05-08 12:22:00+00:00,Other
Payload Space,https://payloadspace.com/feed/,Rocket Lab To Acquire Motiv Space Systems,"Rocket Lab will acquire space robotics company Motiv Space Systems. The acquisition, announced Thursday evening in conjunction with Rocket Lab’s Q1 earnings, will achieve two goals: Motiv is expected to be rebranded as Rocket Lab Robotics when the acquisition closes, which is scheduled for Q2. Other news: Rocket Lab announced a few other pieces of… The post Rocket Lab To Acquire Motiv Space Systems appeared first on Payload .",https://payloadspace.com/rocket-lab-to-acquire-motiv-space-systems/,2026-05-08 12:19:15+00:00,Space
MIT Technology Review,https://www.technologyreview.com/feed/,The Download: AI malaise and babymaking tech,"This is today&#8217;s edition of The Download, our weekday newsletter that provides a daily dose of what&#8217;s going on in the world of technology. We’ve entered the era of AI malaise AI is spreading everywhere, and it is not going away. But what will it do? What effect will it have on our society? Will&#8230;",https://www.technologyreview.com/2026/05/08/1136985/the-download-ai-malaise-babymaking-ivf-tech/,2026-05-08 12:10:00+00:00,Other
Payload Space,https://payloadspace.com/feed/,HawkEye 360 Raises $416M in IPO,The VA-based company priced its 16M shares at $26 per share—at the top of the $24-$26 range shared in the company’s S-1 filing on May 1. The post HawkEye 360 Raises $416M in IPO appeared first on Payload .,https://payloadspace.com/hawkeye-360-raises-416m-in-ipo/,2026-05-08 11:54:44+00:00,Funding
Labiotech,https://www.labiotech.eu/feed/,The biggest biotech funding rounds in April 2026,"Kailera Therapeutics, Nektar Therapeutics, and Hemab Therapeutics bagged the biggest biotech funding rounds overall in April 2026. The post The biggest biotech funding rounds in April 2026 appeared first on Labiotech.eu . © Labiotech UG and Labiotech.eu. Unauthorized use and/or duplication of this material without express and written permission from this site’s author and/or owner is strictly prohibited. Excerpts and links may be used, provided that full and clear credit is given to Labiotech UG and Labiotech.eu with appropriate and specific direction to the original content.",https://www.labiotech.eu/in-depth/biotech-funding-rounds-april-2026/,2026-05-08 11:39:03+00:00,"Biotech, Funding"
Defense News,https://www.defensenews.com/arc/outboundfeeds/rss/,Turkey touts propellant breakthrough for Yıldırımhan long-range ballistic missile,The Turkish government has been working on hypersonic technologies and liquid-propellant propulsion systems for nearly a decade.,https://www.defensenews.com/global/europe/2026/05/08/turkey-touts-propellant-breakthrough-for-yildirimhan-long-range-ballistic-missile/,2026-05-08 11:14:37+00:00,"Defense, Science"
EU-Startups,https://www.eu-startups.com/feed/,Copenhagen’s Reel raises €15 million to make renewable energy predictable for businesses and profitable for producers,"Reel, a Copenhagen-based electricity supplier and trader accelerating the energy transition, has raised €15 million in Series A funding to refine its products, grow its portfolio and build a commercial team in Germany. The round was led by Future Energy Ventures, with participation from UVC Partners, Transition, The Footprint Firm, and angel investors. Jon Sigvert, [&#8230;] The post Copenhagen’s Reel raises €15 million to make renewable energy predictable for businesses and profitable for producers appeared first on EU-Startups .",https://www.eu-startups.com/2026/05/copenhagens-reel-raises-e15-million-to-make-renewable-energy-predictable-for-businesses-and-profitable-for-producers/,2026-05-08 11:12:52+00:00,"Funding, Startups"
EU-Startups,https://www.eu-startups.com/feed/,London’s Kohort raises €6 million Series A to build AI user acquisition agents for mobile game studios,"Kohort, a London-based mobile gaming analytics, forecasting, and UA optimisation company, has closed its €5.9 million ($7 million) Series A funding round to build user acquisition (UA) agents for mobile game studios. The round was led by The Raine Group (Raine), a New York-based global merchant bank with an integrated focus on both advisory and [&#8230;] The post London’s Kohort raises €6 million Series A to build AI user acquisition agents for mobile game studios appeared first on EU-Startups .",https://www.eu-startups.com/2026/05/londons-kohort-raises-e6-million-series-a-to-build-ai-user-acquisition-agents-for-mobile-game-studios/,2026-05-08 09:47:04+00:00,"Funding, Startups"
MIT Technology Review,https://www.technologyreview.com/feed/,Here’s how technology transformed babymaking,"Technology is changing the way we make babies. The pioneering work of the scientists who invented IVF led to the birth of the first “test tube baby” in 1978. We’ve come a long, long way since then. This week, I’ve been working on a piece about the cutting edge of IVF technologies and what’s coming&#8230;",https://www.technologyreview.com/2026/05/08/1136974/heres-how-technology-transformed-babymaking-ivf/,2026-05-08 09:00:00+00:00,Science
EU-Startups,https://www.eu-startups.com/feed/,Delft-based FrostByte secures a cool €1.3 million to scale cryogenic electronics for quantum computing,"FrostByte, a Delft-based startup developing cryogenic electronics solutions for quantum technologies, has raised €1.3 million in funding from InnovationQuarter Capital, Graduate Ventures, Paeonia Group, UNIIQ and an angel investor. With this investment, Graduate Ventures reaches a milestone, marking its 80th investment The company plans to use this capital to further expand its team, scale production [&#8230;] The post Delft-based FrostByte secures a cool €1.3 million to scale cryogenic electronics for quantum computing appeared first on EU-Startups .",https://www.eu-startups.com/2026/05/delft-based-frostbyte-secures-a-cool-e1-3-million-to-scale-cryogenic-electronics-for-quantum-computing/,2026-05-08 07:56:17+00:00,"Funding, Startups"
War on the Rocks,https://warontherocks.com/feed/,"As Adversaries Integrate, U.S. Partners Bypass Washington","The drones hitting Gulf Arab states daily since the United States and Israel launched large-scale military operations against Iran in February are not merely Iranian. They are originally Iranian, yes. But these designs and production processes were improved and refined by Russia through years of battlefield testing against Ukrainian defenses. So, they were returned to Tehran from Moscow. Confronted with a threat that Ukraine has spent four years learning to counter, the United States found itself in unfamiliar territory. It was one of 11 countries requesting Ukrainian counter-drone assistance to defend against Iran&#8217;s attacks, despite the American president&#8217;s assertion that The post As Adversaries Integrate, U.S. Partners Bypass Washington appeared first on War on the Rocks .",https://warontherocks.com/as-adversaries-integrate-u-s-partners-bypass-washington/,2026-05-08 07:30:53+00:00,Defense
War on the Rocks,https://warontherocks.com/feed/,Could Russia Follow the “Hormuz Playbook” in the Baltic and Black Seas?,"On the eve of the U.S.-Israeli strikes on Iran, 56 tankers sailed through the Strait of Hormuz. Two days later, Lloyd&#8217;s List, the maritime industry&#8217;s journal of record, counted just seven tankers and a single gas carrier &#8212; all small and three of them shadow-fleet vessels &#8212; with hundreds more drifting in the Gulf of Oman. One of the world&#8217;s most important maritime chokepoints had not been mined, blockaded, or seized by a navy. Rather, it had been priced shut by a handful of drone strikes and the insurance market.Within two days of the first U.S.-Israeli strikes on Feb. 28, The post Could Russia Follow the “Hormuz Playbook” in the Baltic and Black Seas? appeared first on War on the Rocks .",https://warontherocks.com/could-russia-follow-the-hormuz-playbook-in-the-baltic-and-black-seas/,2026-05-08 07:15:22+00:00,"Defense, Science"
EU-Startups,https://www.eu-startups.com/feed/,UK semiconductor startup Quinas Technology secures investment approval from Malta Government Venture Capital,"Quinas Technology, a London-based DeepTech semiconductor startup developing memory technologies for AI, data centres, edge computing and advanced digital systems, has secured investment approval from Malta Government Venture Capital (MGVC). On 7 May 2026, the MGVC approved the investment under its co-investment framework to support the growth of the UK-based company. The funding, the amount [&#8230;] The post UK semiconductor startup Quinas Technology secures investment approval from Malta Government Venture Capital appeared first on EU-Startups .",https://www.eu-startups.com/2026/05/uk-semiconductor-startup-quinas-technology-secures-investment-approval-from-malta-government-venture-capital/,2026-05-08 06:15:20+00:00,"Startups, Funding"
Payload Space,https://payloadspace.com/feed/,SatVu Positions Thermal Imaging as the Missing EO Layer,SatVu is officially back in business. The post SatVu Positions Thermal Imaging as the Missing EO Layer appeared first on Payload .,https://payloadspace.com/satvu-positions-thermal-imaging-as-the-missing-eo-layer/,2026-05-08 06:15:00+00:00,MedTech
TechCrunch,https://techcrunch.com/feed/,"The fax machine is the bottleneck in US healthcare, and VCs are starting to notice","Like many AI companies automating work that humans currently do, Basata will eventually face a harder question about where the line is between augmenting workers and displacing them. For now, the founders say the administrative staff they work with aren't worried about that; they're more worried about drowning.",https://techcrunch.com/2026/05/07/the-back-office-problem-that-explains-why-specialists-never-call-you-back/,2026-05-08 04:42:29+00:00,Startups
Science,https://www.science.org/rss/news_current.xml,Trump administration cuts CDC’s key role in global program to stop HIV,"State Department would send PEPFAR money directly to countries, which could then pay fees to health agency for help",https://www.science.org/content/article/trump-administration-cuts-cdc-s-key-role-global-program-stop-hiv,2026-05-08 03:55:00+00:00,Other
Science,https://www.science.org/rss/news_current.xml,Computer scientist to lead storied DOE lab through ‘exciting and threatening’ AI revolution,Katherine Yelick will become director of the Department of Energy’s Lawrence Berkeley National Laboratory on 1 July,https://www.science.org/content/article/computer-scientist-lead-storied-doe-lab-through-exciting-and-threatening-ai-revolution,2026-05-08 03:01:00+00:00,Science
Science,https://www.science.org/rss/news_current.xml,"As researchers aim for universal AI disclosure guidelines, the devil is in the details",Integrity conference attendees debated when and how authors should declare AI use in papers,https://www.science.org/content/article/researchers-aim-universal-ai-disclosure-guidelines-devil-details,2026-05-08 01:10:00+00:00,Science
Defense News,https://www.defensenews.com/arc/outboundfeeds/rss/,"As the US Army adds drones to formations, here’s how one base trains its operators",Fort Stewart soldiers are figuring out how to train on unmanned systems after the base stood up the Marne Unmanned Center of Excellence.,https://www.defensenews.com/news/your-military/2026/05/08/as-the-us-army-adds-drones-to-formations-heres-how-one-base-trains-its-operators/,2026-05-08 00:04:09+00:00,Defense
Nature,https://www.nature.com/subjects/medical-research.rss,"Efsubaglutide alfa added to metformin improves glycaemia with β-cell functional responses in type 2 diabetes: a randomised, double-blind, placebo-controlled, two-stage adaptive phase 2b/3 trial (SUPER 2)",,https://www.nature.com/articles/s41467-026-72574-7,2026-05-08 00:00:00+00:00,Other
Nature,https://www.nature.com/subjects/medical-research.rss,"Quality, reliability, and treatment misinformation risk of epilepsy content on Chinese short-video platforms TikTok (Douyin) and Bilibili: a cross-sectional analysis",,https://www.nature.com/articles/s41598-026-52532-5,2026-05-08 00:00:00+00:00,Other
Nature,https://www.nature.com/subjects/medical-research.rss,A cross-sectional study on the quality of IgA nephropathy videos on short video platforms,,https://www.nature.com/articles/s41598-026-52584-7,2026-05-08 00:00:00+00:00,Science
Nature,https://www.nature.com/subjects/medical-research.rss,CD38⁺ endothelial remodeling marks spatially patterned vasculopathy in rapidly advancing periodontitis and peri-implantitis,,https://www.nature.com/articles/s41467-026-72452-2,2026-05-08 00:00:00+00:00,Other
Nature,https://www.nature.com/subjects/medical-research.rss,"Maternal RSV vaccination generates high-affinity antibodies that efficiently transfer to infants, providing enhanced passive immunity",,https://www.nature.com/articles/s41467-026-72659-3,2026-05-08 00:00:00+00:00,Other
Nature,https://www.nature.com/subjects/medical-research.rss,Combination of dysfunctional beliefs about sleep and excessive daytime sleepiness as a psychobehavioral characteristic of comorbid insomnia and sleep apnea,,https://www.nature.com/articles/s41598-026-50792-9,2026-05-08 00:00:00+00:00,Other
Nature,https://www.nature.com/subjects/medical-research.rss,Simultaneous PET/fMRI distinguishes the separate and synergistic effects of T2DM and MCI on cerebral glucose metabolism and fALFF,,https://www.nature.com/articles/s41598-026-51990-1,2026-05-08 00:00:00+00:00,Other
Nature,https://www.nature.com/subjects/medical-research.rss,Comparative analysis of wearable-derived gait features with intrinsic risk indicators for fall risk prediction in older adults,,https://www.nature.com/articles/s41598-026-51776-5,2026-05-08 00:00:00+00:00,MedTech
Nature,https://www.nature.com/subjects/medical-research.rss,Association of serum Wnt1-inducible signaling pathway protein 1 (WISP1) levels with osteoarthritis and obesity-related inflammation in obese adults,,https://www.nature.com/articles/s41598-026-52502-x,2026-05-08 00:00:00+00:00,Other
Nature,https://www.nature.com/subjects/medical-research.rss,Prenatal maternal antibiotic use increases the risk of childhood eczema: a systematic review and meta-analysis,,https://www.nature.com/articles/s41598-026-51441-x,2026-05-08 00:00:00+00:00,Other
Nature,https://www.nature.com/subjects/medical-research.rss,The effects of tissue flossing on neuromuscular activation in patients with chronic ankle instability: a randomized controlled trial,,https://www.nature.com/articles/s41598-026-50154-5,2026-05-08 00:00:00+00:00,Other
Nature,https://www.nature.com/subjects/medical-research.rss,Sex-stratified associations of TyG index and HOMA-IR changes with incident type 2 diabetes,,https://www.nature.com/articles/s41598-026-52072-y,2026-05-08 00:00:00+00:00,Other
Nature,https://www.nature.com/subjects/medical-research.rss,Framework for artificial intelligence implementation research in healthcare: synthesizing current evidence on barriers and facilitators,,https://www.nature.com/articles/s41746-026-02705-3,2026-05-08 00:00:00+00:00,"Science, AI"
Nature,https://www.nature.com/subjects/medical-research.rss,Sequential versus upfront oxaliplatin-based therapy in metastatic colorectal cancer: long-term outcomes of a randomized phase 3 trial,,https://www.nature.com/articles/s43856-026-01633-3,2026-05-08 00:00:00+00:00,Other
Nature,https://www.nature.com/subjects/medical-research.rss,Outcomes and mortality predictors after tracheostomy in intensive care unit patients with infectious diseases: A 5-year retrospective cohort study from Brazil,,https://www.nature.com/articles/s41598-026-51458-2,2026-05-08 00:00:00+00:00,Science
Nature,https://www.nature.com/subjects/medical-research.rss,Real-world evidence of the impact of polypharmacy on mortality and recovery after hip fracture in elderly patients,,https://www.nature.com/articles/s41598-026-52300-5,2026-05-08 00:00:00+00:00,Other
Nature,https://www.nature.com/subjects/medical-research.rss,"Comparative efficacy of zinc oxide nanoparticles, MSC-derived microvesicles, and platelet-rich fibrin in rabbit tendon regeneration",,https://www.nature.com/articles/s41598-026-46509-7,2026-05-08 00:00:00+00:00,Other
