source,feed_url,headline,summary,url,published_date,topics
Phys.org,https://phys.org/rss-feed/,CRISPR-Cas coordinates a layered bacterial defense network in innate immunity,All cellular life—from humans to bacteria—possesses two layers of immunity: innate and adaptive. Scientists have long understood how these two types of immunity work together in higher organisms but not in the microbial world.,https://phys.org/news/2026-07-crispr-cas-layered-bacterial-defense.html,2026-07-22 19:40:06+00:00,"Biotech, Science"
Phys.org,https://phys.org/rss-feed/,Q&A: Listening with light—an innovative new technology for studying the seafloor,The seafloor plays an important ecological and societal role. Understanding the processes that shape this environment will help guide conservation policy and decision-making about underwater infrastructure and geohazards.,https://phys.org/news/2026-07-qa-technology-seafloor.html,2026-07-22 19:40:01+00:00,Other
Breaking Defense,https://breakingdefense.com/feed/,Army partners with industry to alleviate Abrams engine supply chain woes,The Army organized what it called a &#8220;hackathon&#8221; to find new vendors that could help with the supply of 166 critical components causing readiness issues for the tank&#8217;s engine.,https://breakingdefense.com/2026/07/army-partners-with-industry-to-alleviate-abrams-engine-supply-chain-woes/,2026-07-22 19:36:45+00:00,Defense
Defense News,https://www.defensenews.com/arc/outboundfeeds/rss/,US Navy moving forward on West Coast dock for aircraft carriers,The U.S. Navy is moving forward with plans to build a new dock for aircraft carriers on the West Coast.,https://www.defensenews.com/news/your-military/2026/07/22/us-navy-moving-forward-on-west-coast-dock-for-aircraft-carriers/,2026-07-22 19:26:26+00:00,Defense
Phys.org,https://phys.org/rss-feed/,First ever reported cryo-EM visualization of E. coli TGT structure,"The enzyme tRNA-guanine transglycosylase (TGT) chemically modifies transfer RNA (tRNA) and plays a key role in how disease-causing bacteria control the production of proteins needed to cause infection. E. coli TGT is nearly identical to the one found in Shigella, which causes the intestinal infection shigellosis. Traditionally, scientists have used E. coli TGT as a primary model to understand how TGT works; however, they have struggled to visualize the atomic structure of E. coli TGT because the protein is difficult to crystallize, limiting their ability to learn more about the enzyme.",https://phys.org/news/2026-07-cryo-em-visualization-coli-tgt.html,2026-07-22 19:20:05+00:00,Science
Phys.org,https://phys.org/rss-feed/,Are penalties in the US airline industry a deterrent or a 'price?',"Many people drive more carefully for a while after receiving a traffic fine. But do large corporations, such as airlines, also change their behavior when they face financial penalties? We examine this question by studying penalties imposed in the United States for lengthy tarmac delays.",https://phys.org/news/2026-07-penalties-airline-industry-deterrent-price.html,2026-07-22 19:20:03+00:00,Other
Phys.org,https://phys.org/rss-feed/,New optical method follows single proteins as they shift shape,"Researchers at the University of Twente have developed an optical method that follows the shape changes of a single protein in liquid without attaching anything to it. It reads the protein's structure from its own molecular vibrations, free from the labels or tags that other techniques rely on. The method could help researchers study how proteins respond to drugs, toxins and other biomolecules. The paper is published in the journal ACS Nano.",https://phys.org/news/2026-07-optical-method-proteins-shift.html,2026-07-22 19:20:01+00:00,Science
TechCrunch,https://techcrunch.com/feed/,How OpenAI’s human mistake led to the AI-powered hack on Hugging Face,"OpenAI made a mistake setting up what it called a “highly isolated” testing environment and sandbox. According to cybersecurity experts, that human mistake is what made the AI-powered attack on Hugging Face possible.",https://techcrunch.com/2026/07/22/how-an-openais-human-mistake-led-to-the-ai-powered-hack-on-hugging-face/,2026-07-22 19:11:46+00:00,AI
Phys.org,https://phys.org/rss-feed/,Physics-based AI could boost biomedical imaging and autonomous vehicle sensors,"A research team led by UCLA and the University of Rochester has demonstrated a promising evolution of an imaging system designed to capture details within ""complex media,"" which scatter light, from depicting structures inside body tissue to seeing obstacles through heavy fog. The system uses physics-based machine learning to improve an existing imaging technique.",https://phys.org/news/2026-07-physics-based-ai-boost-biomedical.html,2026-07-22 19:00:08+00:00,"MedTech, Science"
Phys.org,https://phys.org/rss-feed/,Molecular model for semiconductor surfaces developed,"Semiconductor surfaces can generally be studied only with considerable experimental effort, for example, in an ultrahigh vacuum. To more easily gain new insights into their properties and the possibilities for targeted modification, scientists at Heidelberg University have developed a molecular model for the so-called ""buckled dimer"" using synthetic and computational chemistry methods.",https://phys.org/news/2026-07-molecular-semiconductor-surfaces.html,2026-07-22 19:00:06+00:00,Science
Phys.org,https://phys.org/rss-feed/,More connections can deepen polarization when social ties remain weak,"Social networks, intended to bring people together, can actually increase polarization, new research finds, because while the links in the network may be plentiful, they're probably weak. A research team including Cornell sociologist Michael Macy has found that while the growing number of international contacts enabled by modern communications technologies may indeed contribute to greater polarization, as shown in previous studies, the underlying mechanism does not necessarily depend on an increase in close friendships. Instead, weaker social ties appear to play a more significant role, as they are more likely to foster hierarchical structures shaped by social status.",https://phys.org/news/2026-07-deepen-polarization-social-weak.html,2026-07-22 18:54:28+00:00,Science
TechCrunch,https://techcrunch.com/feed/,"Travis Kalanick’s robotics company raises $1.7B, led by a16z","Uber is also investing in Travis Kalanick's company Atoms, which has made gauzy claims about using industrial AI to modernize the world.",https://techcrunch.com/2026/07/22/travis-kalanicks-robotics-company-raises-1-7b-led-by-a16z/,2026-07-22 18:50:44+00:00,Funding
Breaking Defense,https://breakingdefense.com/feed/,Boeing mulls building ‘many’ Ghost Bat production hubs overseas,"The US airframer also announced that Hensoldt has been added to its German MQ-28 supplier base, in support of a bid to land Berlin’s CCA requirement.",https://breakingdefense.com/2026/07/boeing-mulls-building-many-ghost-bat-production-hubs-overseas/,2026-07-22 18:49:23+00:00,Other
Phys.org,https://phys.org/rss-feed/,Chemists develop a molecular platform for the selective control of oxygen reaction pathways,"Controlling how oxygen reacts is important for improving technologies such as batteries, fuel cells and environmentally sustainable chemical processes. A research team led by professor Seung Jun Hwang from KAIST's Department of Chemistry has developed a molecular system capable of directing oxygen activation along a selected electron-transfer pathway.",https://phys.org/news/2026-07-chemists-molecular-platform-oxygen-reaction.html,2026-07-22 18:40:07+00:00,Science
Phys.org,https://phys.org/rss-feed/,"France recorded 5,700 more deaths than usual during its historic June heat wave","France recorded at least 5,700 more deaths than usual during a historic heat wave last month, the public health agency said Wednesday, sharply increasing its estimates of the feared toll from record-shattering temperatures.",https://phys.org/news/2026-07-france-deaths-usual-historic-june.html,2026-07-22 18:40:05+00:00,Other
SpaceNews,https://spacenews.com/feed/,FCC approves sweeping space reforms while clearing more C-band for 5G,"The FCC voted July 22 to push satellite operators out of more C-band spectrum for a 5G auction next year, while approving a licensing overhaul aimed at accelerating the commercial space economy. The post FCC approves sweeping space reforms while clearing more C-band for 5G appeared first on SpaceNews .",https://spacenews.com/fcc-approves-sweeping-space-reforms-while-clearing-more-c-band-for-5g/,2026-07-22 18:31:36+00:00,Other
Breaking Defense,https://breakingdefense.com/feed/,FCC approves satellite spectrum license streamlining,"By reducing regulatory burdens, the FCC &#8220;is taking a critical step in allowing for continued American innovation and space superiority,&#8221; according to the Commercial Space Federation.",https://breakingdefense.com/2026/07/fcc-approves-satellite-spectrum-license-streamlining/,2026-07-22 18:23:00+00:00,Other
TechCrunch,https://techcrunch.com/feed/,Science Corporation’s vision-restoring chip wins EU approval,"""The thing that the space needs is a company making $100 million a year of revenue,"" Science Corp. CEO Max Hodak said.",https://techcrunch.com/2026/07/22/science-corporations-vision-restoring-chip-wins-eu-approval/,2026-07-22 18:18:02+00:00,Other
TechCrunch,https://techcrunch.com/feed/,Yope raises $12.3M to build a private social network without algorithms or ads,"Yope, a fast-growing social app focused on private groups of friends and family, has raised $12.3 million in seed funding. Instead of chasing creators and algorithmic feeds, the startup is betting that the future of social networking lies in small, private communities powered by messaging, photo sharing, and AI features designed to strengthen real-world relationships.",https://techcrunch.com/2026/07/22/yope-raises-12-3m-to-build-a-private-social-network-without-algorithms-or-ads/,2026-07-22 18:13:58+00:00,"Funding, Startups"
TechCrunch,https://techcrunch.com/feed/,Menlo Ventures’ Matt Murphy explains why Anthropic is winning (and it’s not the model),"Anthropic&#160;leaped to&#160;a&#160;$47 billion&#160;revenue run rate&#160;by May,&#160;compared to&#160;$9 billion&#160;in 2025.&#160;It’s&#160;the kind of growth that&#160;Menlo Ventures&#8217;&#160;Matt Murphy&#160;says&#160;he&#8217;s&#160;never seen in 25 years of investing, not in the internet wave, not in mobile, not in the first cloud boom. Menlo led Anthropic&#8217;s $500M Series D, and Murphy has had a front-row seat as the company went from a pre-revenue, [&#8230;]",https://techcrunch.com/video/menlo-ventures-matt-murphy-explains-why-anthropic-is-winning-and-its-not-the-model/,2026-07-22 18:02:57+00:00,AI
TechCrunch,https://techcrunch.com/feed/,Monday.com lays off hundreds to focus on AI,"The company said it is reducing its headcount by 20%, or about 630 staff, to ""support a leaner, more focused operating model"" as it focuses on its AI Work Platform.",https://techcrunch.com/2026/07/22/monday-com-lays-off-hundreds-to-focuses-on-ai/,2026-07-22 17:54:14+00:00,Other
Breaking Defense,https://breakingdefense.com/feed/,Ukraine’s Skyfall unveils new drone interceptor to strike Russian Shaheds faster,"The Skyfall spokesman added that the key feature setting this latest interceptor variant apart is its speed, which can reach 370km/h, a significant improvement over the previous 310km/h maximum.",https://breakingdefense.com/2026/07/ukraines-skyfall-unveils-new-drone-interceptor-to-strike-russian-shaheds-faster/,2026-07-22 17:53:40+00:00,Defense
Defense News,https://www.defensenews.com/arc/outboundfeeds/rss/,Who is Mykhailo Drapatyi? ‘The Flying BMP’ who now leads Ukraine’s military,"Zelenskyy names reform-minded Drapatyi as new commander-in-chief, replacing Syrsyki to bend to the largest protests of the war over the firing of Fedorov.",https://www.defensenews.com/global/europe/2026/07/22/who-is-mykhailo-drapatyi-the-flying-bmp-who-now-leads-ukraines-military/,2026-07-22 17:35:54+00:00,Defense
Breaking Defense,https://breakingdefense.com/feed/,Extra $11 billion to fund huge leap in Space Force launches,"The service now expects 170 NSSL Phase 3 Lane 1 launches between 2025-2034, up from 60.",https://breakingdefense.com/2026/07/extra-11-billion-to-fund-huge-leap-in-space-force-launches/,2026-07-22 17:11:00+00:00,Other
TechCrunch,https://techcrunch.com/feed/,Google is making it easier to switch from iPhone to Android,The new feature lets users wirelessly transfer more data types from an iPhone without needing to download a separate app.,https://techcrunch.com/2026/07/22/google-is-making-it-easier-to-switch-from-iphone-to-android/,2026-07-22 17:08:03+00:00,Other
TechCrunch,https://techcrunch.com/feed/,"Arcee, a US open source AI lab, says Chinese models are not inherently dangerous","As Chinese AI models grow in capability and popularity among U.S. companies, the arguing over what should be done about them has reached a fever pitch.",https://techcrunch.com/2026/07/22/arcee-a-us-open-source-ai-lab-says-chinese-models-are-not-inherently-dangerous/,2026-07-22 16:24:08+00:00,Other
TechCrunch,https://techcrunch.com/feed/,Substack’s new tool tells you who’s been writing their newsletters with AI,"Substack is giving readers a way to estimate how much of a newsletter was written by AI, signaling a broader shift toward transparency around AI-assisted content.",https://techcrunch.com/2026/07/22/substacks-new-tool-tells-you-whos-been-writing-their-newsletters-with-ai/,2026-07-22 16:23:09+00:00,Other
TechCrunch,https://techcrunch.com/feed/,OpenAI’s AI spending spree has ballooned to $750B,OpenAI will spend the equivalent of Sweden's GDP on infrastructure through 2030.,https://techcrunch.com/2026/07/22/openais-ai-spending-spree-has-ballooned-to-750b/,2026-07-22 16:13:30+00:00,AI
Defense News,https://www.defensenews.com/arc/outboundfeeds/rss/,Boeing’s MQ-28 Ghost Bat makes Farnborough Airshow debut,"Boeing's MQ-28 Ghost Bat recently became the first collaborative combat aircraft to participate in a multinational, joint operational exercise.",https://www.defensenews.com/industry/techwatch/2026/07/22/boeings-mq-28-ghost-bat-makes-farnborough-airshow-debut/,2026-07-22 15:44:10+00:00,Other
TechCrunch,https://techcrunch.com/feed/,"If you pay a hacker’s ransom, chances are that they’ll come back for more",The long-held understanding among security researchers and network defenders is that it's impossible to negotiate in good faith with an extortion racket because there's no incentive for the other side to actually walk away.,https://techcrunch.com/2026/07/22/if-you-pay-a-hackers-ransom-chances-are-that-theyll-come-back-for-more/,2026-07-22 15:29:41+00:00,Science
Breaking Defense,https://breakingdefense.com/feed/,Turkish Aerospace CEO: US cleared KAAN fighter engines for export,"“The rest is standard procedures. So we can say yes, we have the export license for the engine. We will work with GE folks to get the engines in time, and since it is for the serial production, which is at least two and a half years away, we will have no issue receiving those engines in time to support our serial production for Turkish Airforce,” Mehmet Demiroglu told reporters.",https://breakingdefense.com/2026/07/turkish-aerospace-ceo-us-cleared-kaan-fighter-engines-for-export/,2026-07-22 15:01:53+00:00,Other
Breaking Defense,https://breakingdefense.com/feed/,"At Farnborough, US lawmakers tap the brakes on reconciliation",What&#8217;s the status of the Pentagon&#8217;s reconciliation spending request in Congress? Some lawmakers shared their perspective this week while visiting a high-profile airshow in the UK.,https://breakingdefense.com/2026/07/at-farnborough-us-lawmakers-tap-the-brakes-on-reconciliation/,2026-07-22 14:29:43+00:00,Defense
SpaceNews,https://spacenews.com/feed/,Vast establishes division for national security projects,Commercial space station and spacecraft developer Vast has established a new division intended to support work in national security space. The post Vast establishes division for national security projects appeared first on SpaceNews .,https://spacenews.com/vast-establishes-division-for-national-security-projects/,2026-07-22 14:03:37+00:00,"Space, Defense"
Breaking Defense,https://breakingdefense.com/feed/,Collaborative Combat Aircraft need to be more than a flying weapons magazine,"[Sponsored] Capabilities, cost and autonomy are top of mind concerns for developing effective unmanned aircraft.",https://breakingdefense.com/2026/07/collaborative-combat-aircraft-need-these-systems-to-be-more-than-a-flying-weapons-magazine/,2026-07-22 14:00:40+00:00,Other
TechCrunch,https://techcrunch.com/feed/,Cascade raises $3.5M to help construction firms find and win projects,"a16z Speedrun, Ada Ventures, and Snowball VC have invested in Cascade's $3.5 million seed round.",https://techcrunch.com/2026/07/22/cascade-raises-3-5m-to-help-construction-firms-find-and-win-projects/,2026-07-22 13:28:36+00:00,Funding
Defense News,https://www.defensenews.com/arc/outboundfeeds/rss/,UK’s BAE enters uncrewed fighter competition with ‘Brontanax’,"BAE Systems revealed a new unmanned fighter jet on Wednesday, boosting Britain’s entry into one of the defense industry’s hottest markets.",https://www.defensenews.com/global/europe/2026/07/22/uks-bae-enters-uncrewed-fighter-competition-with-brontanax/,2026-07-22 13:28:20+00:00,Defense
TechCrunch,https://techcrunch.com/feed/,The browser wars aren’t about search anymore — here are the best alternatives to Chrome and Safari,We’ve compiled an overview of some of the top alternative browsers available today aiming to challenge Chrome and Safari.,https://techcrunch.com/2026/07/22/as-the-browser-wars-heat-up-here-are-the-hottest-alternatives-to-chrome-and-safari-in-2026/,2026-07-22 13:20:35+00:00,Other
EU-Startups,https://www.eu-startups.com/feed/,"From Star Wars to King Arthur: 10 European startups with names drawn from fiction, folklore and religion","Choosing a startup name is difficult. It needs to be memorable, available as a domain and sufficiently distinctive to survive an investor’s overflowing inbox &#8211; so its no surprise to see references to famous fiction such as Dune, Start Wars and even The Matrix. The obvious and most famous example is Palantir, named after the [&#8230;] The post From Star Wars to King Arthur: 10 European startups with names drawn from fiction, folklore and religion appeared first on EU-Startups .",https://www.eu-startups.com/2026/07/from-star-wars-to-king-arthur-10-european-startups-with-names-drawn-from-fiction-folklore-and-religion/,2026-07-22 13:00:25+00:00,"Startups, Funding"
SpaceNews,https://spacenews.com/feed/,The strategic competition with China: winning the multi-domain race,"History demonstrates military innovation continually rewrites the rules of combat, reshaping warfare and rendering strategies from past conflicts obsolete. The introduction of repeating rifles transformed infantry combat during the 19th [&#8230;] The post The strategic competition with China: winning the multi-domain race appeared first on SpaceNews .",https://spacenews.com/the-strategic-competition-with-china-winning-the-multi-domain-race/,2026-07-22 13:00:00+00:00,Defense
Labiotech,https://www.labiotech.eu/feed/,Is an HIV cure possible? The future of HIV therapy,"Delve into the field of HIV treatment development. Since the virus was discovered, treatments have improved, but are we close to a cure? The post Is an HIV cure possible? The future of HIV therapy appeared first on Labiotech.eu . © Labiotech UG and Labiotech.eu. Unauthorized use and/or duplication of this material without express and written permission from this site’s author and/or owner is strictly prohibited. Excerpts and links may be used, provided that full and clear credit is given to Labiotech UG and Labiotech.eu with appropriate and specific direction to the original content.",https://www.labiotech.eu/in-depth/hiv-cure-research/,2026-07-22 12:53:31+00:00,Other
Payload Space,https://payloadspace.com/feed/,The UK Scraps the Department in Charge of UKSA,"As the UK touted its aerospace achievements at the Farnborough Air Show, new Prime Minister Andy Burnham saw the perfect opportunity to scrap the department responsible. The post The UK Scraps the Department in Charge of UKSA appeared first on Payload .",https://payloadspace.com/the-uk-scraps-the-department-in-charge-of-uksa/,2026-07-22 12:52:00+00:00,Other
Payload Space,https://payloadspace.com/feed/,The UK and Space Florida Launch Joint Fund,The new fund supports projects with at least one partner headquartered in each region. The post The UK and Space Florida Launch Joint Fund appeared first on Payload .,https://payloadspace.com/the-uk-and-space-florida-launch-joint-fund/,2026-07-22 12:51:00+00:00,Other
Payload Space,https://payloadspace.com/feed/,Breaking Down the $686B Space Economy,"The global space economy totaled a record $686B in 2025, according to the Space Foundation. The post Breaking Down the $686B Space Economy appeared first on Payload .",https://payloadspace.com/breaking-down-the-686b-space-economy/,2026-07-22 12:50:00+00:00,Other
MIT Technology Review,https://www.technologyreview.com/feed/,The Download: NASA’s new space telescope and OpenAI’s autonomous hacker,"This is today&#8217;s edition of The Download, our weekday newsletter that provides a daily dose of what&#8217;s going on in the world of technology. Shape-shifting mirrors on NASA’s new space telescope could unveil Jupiters like our own When NASA’s Nancy Grace Roman Space Telescope launches, as early as the end of next month, it will&#8230;",https://www.technologyreview.com/2026/07/22/1140717/the-download-nasa-space-telescope-openai-hugging-face-hack/,2026-07-22 12:10:00+00:00,AI
SpaceNews,https://spacenews.com/feed/,Relativity Space to expand Terran R production in Florida,Relativity Space struck a deal with Space Florida to build manufacturing and test facilities for its Terran R rocket on Florida’s Space Coast. The post Relativity Space to expand Terran R production in Florida appeared first on SpaceNews .,https://spacenews.com/relativity-space-to-expand-terran-r-production-in-florida/,2026-07-22 11:58:49+00:00,Other
EU-Startups,https://www.eu-startups.com/feed/,Spanish energy startup Catalyxx picks Portugal for €120 million bio-based chemicals plant,"Seville&#8217;s Catalyxx, a bio-based chemicals company transforming bioethanol into alternatives to fossil-derived industrial chemicals, has selected Sines, Portugal, as the location for its €120 million commercial-scale production facility. The development is being financed through a combination of private investment and public funding. Catalyxx was recently awarded €20 million by the Circular Bio-based Europe Joint Undertaking, [&#8230;] The post Spanish energy startup Catalyxx picks Portugal for €120 million bio-based chemicals plant appeared first on EU-Startups .",https://www.eu-startups.com/2026/07/spanish-energy-startup-catalyxx-picks-portugal-for-e120-million-bio-based-chemicals-plant/,2026-07-22 11:45:37+00:00,"Startups, Funding"
Defense News,https://www.defensenews.com/arc/outboundfeeds/rss/,"Unfazed by Iran’s threats, Bulgaria moves to aid U.S. military operations",A Bulgarian parliamentary committee has approved a U.S. request to let American forces use a local air base to support the U.S. war against Iran.,https://www.defensenews.com/global/europe/2026/07/22/unfazed-by-irans-threats-bulgaria-moves-to-aid-us-military-operations/,2026-07-22 11:21:27+00:00,Defense
EU-Startups,https://www.eu-startups.com/feed/,Zürich-based Immitra Bio secures €2.58 million to scale its scalable in-vivo genetic medicine platform,"Immitra Bio, a Zürich-based genetic medicine platform bringing scalability and commercial viability to gene editing therapies, has announced the completion of an upsized €2.58 million (CHF 2.4 million) pre-Seed financing round. Venture capital and private investors contributed €2.42 million (CHF 2.25 million), while an additional €161.8k (CHF 150k) was obtained through non-dilutive funding sources. The [&#8230;] The post Zürich-based Immitra Bio secures €2.58 million to scale its scalable in-vivo genetic medicine platform appeared first on EU-Startups .",https://www.eu-startups.com/2026/07/zurich-based-immitra-bio-secures-e2-58-million-to-scale-its-scalable-in-vivo-genetic-medicine-platform/,2026-07-22 11:20:57+00:00,"Funding, Startups"
Science,https://www.science.org/rss/news_current.xml,Contagious fish cancer overruns New England lake,"Catfish melanomas are the first example of a transmissible cancer in fish, genetic studies reveal",https://www.science.org/content/article/contagious-fish-cancer-overruns-new-england-lake,2026-07-22 11:00:00+00:00,Other
EU-Startups,https://www.eu-startups.com/feed/,Europe’s energy reckoning is turning into its biggest opportunity,"There is an old saying that the best time to plant a tree was twenty years ago. The second best time is today. European energy has its own version of that story. The first real opportunity came roughly a decade ago, when the cost of solar power and batteries began to fall sharply and clean-energy [&#8230;] The post Europe’s energy reckoning is turning into its biggest opportunity appeared first on EU-Startups .",https://www.eu-startups.com/2026/07/europes-energy-reckoning-is-turning-into-its-biggest-opportunity/,2026-07-22 10:57:42+00:00,Startups
